B07TWSY81M,"Hama Album photo livre Scrapbooking Enfants et Adultes (pour 30 photos 15x15 cm, Dim. 18x18 cm, 30 pages blanches, Parfait pour un cadeau unique et toutes les occasions) Multicolore",Hama,"41,97 €","-49,57 %","-67,69 %",6,"-40,00 %","-66,67 %","41,97 €","-49,57 %","-69,76 %","19,61 €","-40,03 %","-68,42 %",6,"-40,00 %","-68,42 %",,,
B0BL18HRQF,"Hama Support Téléphone Voiture Easy Snap (pour Smartphones d’Une Largeur de 5,5 à 8,5 cm, Support à Ventouse, pivotable 360°) Noir",Hama,"41,64 €","66,63 %","100,00 %",2,"100,00 %","100,00 %","41,64 €","66,63 %","100,00 %","29,67 €","99,80 %","99,80 %",2,"100,00 %","100,00 %",,,
B0CWL46NF2,"Black Rock Coque pour Samsung S24, Portefeuille The Classic [Housse de Protection avec Rangement pour Carte] [Etui à Rabat] - Noir","Black Rock","41,64 €",,,2,,,"41,64 €",,,"34,56 €",,,2,,,,,
B00RWY5ZD4,"Hama Répartiteur triple pour prise allume-cigare (12 V, avec USB, avec écran LED) Noir",Hama,"41,64 €","100,00 %",,2,"100,00 %",,"41,64 €","100,00 %",,"29,48 €","100,00 %",,2,"100,00 %",,,,
B0D6CTWQR2,"Hama ""Extreme Protect Sac à dos pour Ordinateur Portable jusqu'à 16,2"" - Technologie D3O®, Résistant aux Chocs, Sac Hydrofuge pour Voyage, Affaires, Travail, Cours - Noir",Hama,"41,38 €",,,1,,,"41,38 €",,,"41,10 €",,,1,,,,,
B08SFDDNWD,"Hama Câble USB C 0,75m Garantie 30ANS (USB C vers USB, Câble de Charge Rapide 3A, Cable iphone 16/15, Samsung S22/S21/S20/S10) Noir",Hama,"41,28 €",,"243,43 %",4,,"300,00 %","41,28 €",,"243,43 %","31,57 €",,"300,63 %",4,,"300,00 %",,,
B0071BIZG2,"Hama Support mural TV Fixe (Pour diagonale d’écran de 81 à 165cm (32"" à 65""), pour un maximum de 30 kg, VESA jusqu'à 400 x 400, 3 étoiles) Noir",Hama,"41,13 €","-37,01 %","-67,93 %",2,"-50,00 %","-71,43 %","41,13 €","-37,01 %","-67,93 %","23,08 €","-50,00 %","-71,43 %",2,"-50,00 %","-71,43 %",,,
B0000AISCG,"Hama Cadre photo en plastique Sevilla (taille du Cadre de 21 x 29,7 cm (DIN 4) avec bordure de 9 mm x 17 mm, pour une photo de 15 x 20 cm) Blanc",Hama,"40,64 €","-45,27 %","-84,56 %",6,"-45,45 %","-86,36 %","40,64 €","-49,07 %","-84,56 %","21,00 €","-57,00 %","-88,27 %",6,"-50,00 %","-86,36 %",,,"-100,00 %"
B07JX89WGL,"Plaque de fixation d’appareil photo/caméscope pour trépied ""Star 75""",Hama,"40,36 €",,"53,93 %",4,,"33,33 %","40,36 €",,"53,93 %","22,32 €",,"33,33 %",4,,"33,33 %",,,
B08BFPTVPR,"Hama Album photo à spirale ""Romance"" à personnaliser (Album Photo de Mariage ou naissance bébé, Livre d'or ou cadeau, 28 x 24 cm, 40 pages, Motif cœur, Titre Love, 80 photos 10 x 15 cm) Beige/blanc",Hama,"39,96 €","-69,02 %","-90,71 %",6,"-60,00 %","-90,32 %","39,96 €","-69,02 %","-90,71 %","27,80 €","-59,95 %","-90,26 %",6,"-60,00 %","-90,32 %",,,
B009OUPITK,"Hama Lampes LED de sécurité à pince (à 2 LED, ampoule rouge, fonctionnement sur piles, voyant fixe et clignotant, idéal pour les joggeurs, les écoliers, les cyclistes, ensemble 2 pièces) Rouge/Noir",Hama,"39,96 €",,"-62,50 %",3,,"-62,50 %","39,96 €",,"-62,50 %","16,35 €",,"-72,57 %",3,,"-62,50 %",,,
B0BL1R3S16,"Hama Câble iPhone (Câble Lightning Certifié MFI, Câble Chargeur iPhone USB/Lightning, 1.5m, Refléchissant, Idéal Apple iPad/iPhone 14 13 12 11 Pro Max Plus mini SE XS Max XR X 8 7) Bleu",Hama,"39,45 €",,"-9,62 %",2,,"0,00 %","39,45 €",,"-9,62 %","30,32 €",,"0,13 %",2,,"0,00 %",,,
B09GLDXKYK,"Hama Coque iPhone 13 Pro Compatible MagSafe MagCase Finest Feel Pro pour Apple (Etui magnétique pour Recharge à Induction, Housse Protection Chocs Rayures et saletés, en TPU Mate Soyeuse) Vert",Hama,"39,21 €",,"-7,70 %",2,,"0,00 %","39,21 €",,"-7,70 %","30,70 €",,"0,33 %",2,,"0,00 %",,,
B01NCQUYWP,"Répartiteur d’antenne AM/FM DAB SMB(f)",Hama,"39,00 €","-27,29 %","-34,22 %",1,"-50,00 %","-50,00 %","39,00 €","-27,29 %","-34,22 %","23,81 €","-50,00 %","-50,00 %",1,"-50,00 %","-50,00 %",1,,
B0C5JNKVSD,"Hama Hub USB/lect. Cartes, 5 Ports, 3X USB-A, SD, microSD, avec Adaptateur. USB-A, Garantie 10 Ans, Gris",HAMA,"38,98 €","55,98 %",,2,"100,00 %",,"38,98 €","55,98 %",,"36,20 €","100,00 %",,2,"100,00 %",,,,
B004IYLMHE,"Hama Clé USB 2.0 ""Rotate, 8 GB (10 MB/s, Flashpen Rotate) Noir/Argenté",Hama,"38,94 €",,"-47,72 %",7,,"-30,00 %","38,94 €",,"-47,72 %","22,00 €",,"-26,67 %",7,,"-30,00 %",,,
B0000AIRRP,"Hama Cadre photo ""Clip-Fixe"" (sans bordure, 40 x 60 cm, Anti-Reflex) Blanc",Hama,"38,73 €","-88,00 %",,3,"-88,00 %",,"51,64 €","-83,33 %",,"30,32 €","-82,93 %",,4,"-83,33 %",,2,"0,00 %",
B0187XDXPA,"Hama Casque Essential HS 300"" avec Microphone (Ultra-léger, Oreillettes rembourrées, Casque stéréo, chaîne stéréo, réglage du Volume sur Le câble, Longueur de câble de 2 m, Prise Jack 3,5 mm) Noir",Hama,"38,52 €","-47,44 %","35,49 %",3,"-50,00 %","50,00 %","51,01 €","-16,10 %","79,42 %","32,16 €","-19,96 %","100,00 %",4,"-20,00 %","100,00 %",2,,
B002G146DI,"Hama Pochettes autoadhésives (pour cartes mémoire, pour cartes SD, paquet de 5, autocollantes) Blanc/Transparent",Hama,"38,47 €","77,77 %","159,23 %",5,"25,00 %","150,00 %","38,47 €","77,77 %","159,23 %","19,35 €","25,00 %","150,00 %",5,"25,00 %","150,00 %",,,
B00005KHSU,"Hama Filtre UV (anti-UV et protection, compensation 4X, traitement antireflet, pour objectifs d'appareils photo 46 mm, O-Haze, traité) Noir",Hama,"37,70 €","128,48 %","14,24 %",5,"150,00 %","25,00 %","37,70 €","128,48 %","14,24 %","41,00 €","150,00 %","-2,38 %",5,"150,00 %","25,00 %",,,
B096YJRM5F,"Hama Clavier et Souris sans Fil Cortino (Pack Kit Clavier Souris sans Fil 2.4GHz, Dongle USB, Souris Optique 1000DPI, Clavier AZERTY, Pavé Numérique, pour PC, Laptop) Noir",Hama,"37,68 €",,,2,,,"37,68 €",,,"30,22 €",,,2,,,,,
B000EOMQM2,"Hama Trépied photo/vidéo ""Star 75"" (Trépied d'entrée de gamme léger, tête à trois voies, 42-125 cm, 3D) Champagne",Hama,"37,47 €","-83,86 %","-61,59 %",2,"-84,62 %","-60,00 %","37,47 €","-83,86 %","-61,59 %","21,48 €","-84,63 %","-60,04 %",2,"-84,62 %","-60,00 %",,,"-100,00 %"
B002L4O6RG,"Hama Etui de protection photo/vidéo semi-rigide ""Colour Style"" (60L, EVA, sacoche avec coque, anti-choc, pour le voyage, appareil petit format, ultra-compact, compact, MP3, MP4, iPod) Noir",Hama,"37,47 €",,"200,00 %",3,,"200,00 %","37,47 €",,"200,00 %","25,53 €",,"200,00 %",3,,"200,00 %",,,
B007WAYQRY,"Hama Tapis de Souris (1 pièce, Taille de 22,3 cm x 18,3 cm x 0,6 cm, en EVA/Jersey) Couleur aléatoire Parmi Bleu/Rouge",Hama,"37,26 €","200,00 %","-72,31 %",18,"200,00 %","-72,31 %","37,26 €","200,00 %","-71,43 %","27,18 €","200,00 %","-71,43 %",18,"200,00 %","-71,43 %",1,,
B00006JCZK,"Hama Filtre UV (Anti-UV Et Protection, Compensation 2X, Traitement Antireflet, pour Objectifs D'appareils Photo 62 Mm, O-Haze, Traité) Noir",Hama,"37,10 €","-82,76 %","-89,05 %",5,"-82,76 %","-87,18 %","37,10 €","-82,76 %","-89,34 %","38,15 €","-82,86 %","-87,55 %",5,"-82,76 %","-87,50 %",,"-100,00 %","-100,00 %"
B0D6CSFF15,"Hama Coque pour iPhone 15 ""Extreme Protect [Housse Anti-jaunissement] [Etui D3O®] [Coque Robuste] - Transparent",Hama,"36,64 €",,,2,,,"36,64 €",,,"33,56 €",,,2,,,,,
B0000AISFJ,"Hama Cadre photo en plastique Sevilla (taille du Cadre de 15 x 20 cm avec bordure de 9 mm x 17 mm, pour une photo de 10 x 15 cm) Blanc",Hama,"36,13 €","78,16 %","-41,39 %",5,"25,00 %","-54,55 %","36,13 €","78,16 %","-41,39 %","19,65 €","25,00 %","-54,55 %",5,"25,00 %","-54,55 %",,,
B0002W6B90,"Hama Interrupteur pour véhicules (Interrupteur de voiture, rond, 10 A, 12 V, interrupteur à bascule) Noir",Hama,"35,94 €","-81,02 %","-82,26 %",5,"-82,14 %","-82,76 %","35,94 €","-81,02 %","-83,35 %","14,50 €","-82,47 %","-87,19 %",5,"-82,14 %","-83,87 %",,,"-100,00 %"
B00006IVSZ,"Hama Pochette ""Pare-soleil"" (pour véhicule, pour 12 CD/DVD/Blu-Ray) Noir",Hama,"35,90 €","291,92 %","291,92 %",3,"200,00 %","200,00 %","26,74 €","191,92 %","191,92 %","10,28 €","100,00 %","100,00 %",2,"100,00 %","100,00 %",,,
B0002W5W8Q,"Hama Pochettes de protection (pour CD/DVD/Blu-Ray, design étroit, pochette en plastique, lot de 100) Transparent",Hama,"35,55 €","-20,93 %","-84,87 %",2,"-33,33 %","-88,24 %","35,55 €","-20,93 %","-84,87 %","19,38 €","-33,33 %","-88,24 %",2,"-33,33 %","-88,24 %",,,"-100,00 %"
B00005KHSV,"Hama Filtre UV (390 (O-Haze) HTMC Ø 86 mm) Noir",Hama,"35,50 €",,,1,,,"35,50 €",,,"35,50 €",,,1,,,,,
B08YS2336Y,"Hama Arezzo Coque pour Kindle WiFi/Paperwhite & Kobo Touch/Glo - Housse Fermeture Magnétique, Doublure Intérieure Douce - Noir",Hama,"35,32 €","0,00 %","76,51 %",4,"0,00 %","100,00 %","35,32 €","0,00 %","76,51 %","44,08 €","0,00 %","56,53 %",4,"0,00 %","100,00 %",,,"-100,00 %"
B005DJKGO8,"Hama Album, Rose, 22 x 22,5",Hama,"35,15 €","-43,40 %","-96,57 %",3,"-40,00 %","-97,56 %","35,15 €","-43,40 %","-96,62 %","16,20 €","-40,00 %","-97,60 %",3,"-40,00 %","-97,60 %",,"-100,00 %",
B01LGPGDWQ,"Hama Sacoche Vélo Porte-Bagage Arrière (Sac porte bagage de vélo 3 pièces, Sacoche de Siège Arrière Vélo 40L, Bande réfléchissantes, Habillage pluie, Sac bike life VTT Outdoor Voyage Sport) Noir",Hama,"34,99 €",,"7,73 %",1,,"0,00 %","34,99 €",,"7,73 %","25,94 €",,"47,55 %",1,,"0,00 %",,,
B09RQY25LH,"Hama Adaptateur Bluetooth 5.0 (Dongle Bluetooth USB, Clé Bluetooth Plug&Play pour PC, Casque, Souris, Manette, Clavier, Imprimantes, Smartphone, Tablette, Compatible avec Windows 10/8.1/7) Noir",Hama,"34,98 €","50,00 %","50,00 %",3,"50,00 %","50,00 %","34,98 €","50,00 %","50,00 %","31,61 €","50,09 %","50,17 %",3,"50,00 %","50,00 %",1,,
B0CCSCH57P,"Hama Prise Connectée WiFi Matter (Prise WiFi Alexa/Google, App Control, 16A 3680W, Aucun Hub requis, Programmez & Controlez Vos appareils à Distance) Blanc",Hama,"34,98 €","140,91 %",,2,"100,00 %",,"34,98 €","140,91 %",,"18,49 €","100,76 %",,2,"100,00 %",,,,
B0B59QYN7N,"Hama Adaptateur Secteur 2 Compartiments 2 Prises Euro, Pack de 2 Adaptateurs, Blanc",HAMA,"34,93 €",,,7,,,"34,93 €",,,"22,33 €",,,7,,,,,
B08KDQPM7M,"Hama Support de Tablette pour trépied Pro (Adaptateur Tête de trépied pour iPad Pro 9,7, Samsung Galaxy Tab, Note 10/10+, Google Pixel, Pas de vis 1/4"", Griffe Cold Shoe) Noir",Hama,"34,74 €","-75,35 %","-57,86 %",3,"-75,00 %","-50,00 %","34,74 €","-75,35 %","-57,86 %","30,26 €","-74,97 %","-50,02 %",3,"-75,00 %","-50,00 %",,,
B000KZ75H6,"Hama Cadre photo en plastique Sevilla (taille du Cadre de 70 x 100 cm avec bordure de 13 mm x 20 mm, pour une photo de 50 x 70 cm) Noir",Hama,"34,57 €","-80,00 %","-85,28 %",1,"-80,00 %","-83,33 %","34,57 €","-80,00 %","-87,17 %","21,45 €","-80,00 %","-83,46 %",1,"-80,00 %","-85,71 %",,"-100,00 %","-100,00 %"
B0002W5WB8,"Hama Pochettes de protection (pour CD/DVD/Blu-Ray, design étroit, pochette en plastique, lot de 50) Transparent",Hama,"33,79 €","-76,88 %","-51,16 %",3,"-76,92 %","-50,00 %","33,79 €","-76,88 %","-63,48 %","14,52 €","-76,92 %","-62,50 %",3,"-76,92 %","-62,50 %",4,,"300,00 %"
B0BL1TKNJN,"Hama Chargeur Rapide iPhone 20W (Chargeur USB-C Rapide, Certifié Apple MFI, Cable USB C vers Lightning 1m Inclus, Chargeur Mini Compact, Chargeur PD) Blanc",Hama,"33,60 €",,,1,,,"33,60 €",,,"24,59 €",,,1,,,,,
B08YH1GVC9,"THOMSON Ecouteurs Bluetooth sans Fil (Ecouteurs Bluetooth Stéréo, TWS, Micro, Station de Charge, IPX4, Ecouteurs Intra-Auriculaire, Grande Autonomie, Port Micro USB, Controle Vocale+Tactile) Noir",Thomson,"33,32 €","0,00 %",,1,"0,00 %",,"33,32 €","0,00 %",,"28,53 €","0,39 %",,1,"0,00 %",,,,
B0BL1VLC7R,"Hama Chargeur USB Multiport 34W avec Interrupteur M/A (6 Ports USB-A, Bloc Chargeur Secteur Multi-USB, Hub Prise d'alimentation USB, Temoin LED) Noir",Hama,"33,32 €","-43,82 %",,1,"-50,00 %",,"33,32 €","-43,82 %",,"25,88 €","-50,00 %",,1,"-50,00 %",,,,
B0000AIS8P,"Hama Cadre photo en plastique ""Décor Sevilla"" (taille du Cadre de 21 x 29,7 cm (DIN 4) avec bordure de 9 mm x 17 mm, pour une photo de 15 x 20 cm) Argent Mat",Hama,"33,28 €","4,10 %","-31,37 %",6,"-25,00 %","20,00 %","33,28 €","4,10 %","-31,37 %","21,63 €","-34,53 %","4,75 %",6,"-25,00 %","20,00 %",,,"-100,00 %"
B08YRZ5231,"Hama Adaptateur USB vers USB-C (Fiche USB A mâle vers USB C Femelle, Connecteur PC, Ordinateur Portable, MacBook, Tablette avec câble USB-C ou hub USB-C, Convertisseur USB, 5 Gbit/s) Noir",Hama,"33,28 €","11,60 %","34,30 %",4,"0,00 %","0,00 %","33,28 €","11,60 %","34,30 %","15,20 €","-33,33 %","-33,45 %",4,"0,00 %","0,00 %",,,"-100,00 %"
B0BL1C6KGC,"Hama Support Téléphone Voiture Magnet (Support téléphone pour Voiture aimanté, pivotable 360°, Fixation par Ruban adhésif 3M, Inclus 2 plaques métaliques) Noir",Hama,"32,73 €","9,17 %",,2,"0,00 %",,"32,73 €","9,17 %",,"23,68 €","-0,92 %",,2,"0,00 %",,,,
B0CP83KZZJ,"THOMSON Ecouteurs Filaire USB-C pour iPhone 15 / Samsung (écouteurs Intra-Auriculaires filaires avec Micro, Cable 1.2m, Multi Contrôle, Compatible Siri et Google Assistant) Blanc",Thomson,"32,48 €",,,2,,,"32,48 €",,,"22,00 €",,,2,,,,,
B0BL1TNR1M,"Hama Câble iPhone USB-A Lightning (Câble de charge/transfert de données/Data, USB-A 2.0 mâle vers Lightning, 1m, Certifié MFI, 480 MBit/s, iPad/iPhone 13/12/11/XS/XR/X/8/7/7+/6s/6/5/SE2020) Blanc",Hama,"31,79 €","-67,21 %","-57,58 %",2,"-75,00 %","-66,67 %","31,79 €","-67,21 %","-57,58 %","18,22 €","-74,93 %","-66,56 %",2,"-75,00 %","-66,67 %",,"-100,00 %","-100,00 %"
B0D5QWQ9JT,"Hama Coque pour iPhone 13 ""Daily Protect [Housse de Protection avec Rangement Carte] [Etui à Rabat] - Noir",Hama,"31,64 €",,,2,,,"15,82 €",,,"14,20 €",,,1,,,,,
B00006JCOK,"Hama Support mural tubulaire pour fixation de parabole/antenne en aluminium",Hama,"31,64 €","1,54 %","-71,64 %",1,"0,00 %","-75,00 %","31,64 €","1,54 %","-71,64 %","21,83 €","-9,91 %","-77,48 %",1,"0,00 %","-75,00 %",,,
B081S4YTDT,"Tige pour Selfie Funstand 57"", avec déclench. à dist. Bluetooth, Noir",Hama,"31,50 €","-44,07 %","-62,08 %",2,"-50,00 %","-50,00 %","31,50 €","-44,07 %","-62,08 %","34,40 €","-50,09 %","-50,04 %",2,"-50,00 %","-50,00 %",,"-100,00 %","-100,00 %"
B0CP8584TW,"Black Rock Coque pour iPhone 15 ""360° Glass Double Face, Antichoc [Etui Housse 360 Degrés] [Coque iPhone Compatible Charge sans Fil] - Noir Carbon","Black Rock","31,24 €",,,1,,,"31,24 €",,,"20,74 €",,,1,,,,,
B07CGR879T,"Thomson Télécommande de Rechange ROC1128LG (Télécommande de Remplacement pour Les téléviseurs LG, prête à l'emploi, adaptative, Mode Simple, Touches Lumineuses, Infrarouge) Noir",Thomson,"31,17 €",,"98,28 %",2,,"100,00 %","31,17 €",,"98,28 %","27,82 €",,"100,87 %",2,,"100,00 %",,,
B0CYNMJ86M,"Hama 45W Chargeur USB C Rapide Compatible iPhone, Samsung, MacBook - [Technologie GaN, PD + QC 3.0] [Recharge Optimisée] [1 Port USB C] Blanc",Hama,"30,82 €",,,1,,,"30,82 €",,,"19,30 €",,,1,,,,,
B0BL1CFWRT,"Hama Ecouteurs Lightning Glow (Ecouteurs Intra-Auriculaires filaires, Micro et Contrôle du Volume, Ecouteurs pour iPhone, Certifiés MFi, Compatibles Apple iPhone iPad iPod) Blanc",Hama,"30,82 €","-64,29 %",,1,"-66,67 %",,"30,82 €","-64,29 %",,"22,01 €","-66,67 %",,1,"-66,67 %",,1,,
B00005QFA6,"Hama Bague d'adaptation (en métal, pour monter un Filtre de 58 mm sur un Objectif de 52 mm) Noir",Hama,"30,51 €",,,3,,,"30,51 €",,,"27,33 €",,,3,,,3,,
B01LRD3YUG,"Black Rock Coque 'Air' (pour Apple iPhone 6S/7/8 Plus, protection parfaite, design mince, en polycarbonate, polyurethane termoplastique (PUT)) Noir","Black Rock","30,45 €",,,3,,,"30,45 €",,,"35,77 €",,,3,,,2,,
B000JFVCK8,"Hama Adaptateur secteur (prise de voyage pour : Amérique, apon, Canada, Brésil, Thaïlande, ... adapté aux apparails avec fiche Euro) Blanc",Hama,"30,43 €","219,64 %","-34,67 %",3,"200,00 %","-50,00 %","30,43 €","219,64 %","-34,67 %","7,77 €","200,00 %","-50,00 %",3,"200,00 %","-50,00 %",,,
B009GVKQ5I,"Hama Multiprise 5 Prises 16A avec Interrupteur (Rallonge multiprises 1.4m, Bloc 5 Prises Type F Schuko, 3500W Max, Idéal Bureau PC luminaires, Atelier, Meuble TV, Garage) Blanc",Hama,"29,97 €",,"192,68 %",3,,"50,00 %","29,97 €",,"192,68 %","16,47 €",,"50,00 %",3,,"50,00 %",,,
B084HZN6S4,"Hama Album Photo ""Fine Art"" (format 24 x 17 cm, 36 pages blanches, sans spirale) Sable",Hama,"29,96 €","-42,86 %","-50,41 %",4,"-42,86 %","-63,64 %","29,96 €","-42,86 %","-50,41 %","22,92 €","-42,86 %","-63,64 %",4,"-42,86 %","-63,64 %",,,"-100,00 %"
B08NCYZ4BV,"Hama Câble Antenne TV Coudé Garantie 10ans (Cable Coaxial TV, M/F, 2x coudé 90°, 3m, triple blindage 90db, Anneau Ferrite, Cable Coaxial Satellite, Connexion TV vers Fiche TV Murale ou Décodeur) Blanc",Hama,"29,96 €","-71,42 %",,3,"-75,00 %",,"38,28 €","-60,34 %",,"27,04 €","-63,64 %",,4,"-63,64 %",,1,"0,00 %",
B00G3BMZDA,"Xavax Minuteur de cuisine ""Countdown"" (avec minuterie et fonction chronomètre, fixation via un aimant, une pince, un support ou un support, à piles, numérique) Noir/Blanc",xavax,"29,96 €","-85,71 %","-70,19 %",4,"-85,71 %","-50,00 %","29,96 €","-85,71 %","-70,19 %","22,76 €","-85,71 %","-50,00 %",4,"-85,71 %","-50,00 %",,,
B01DNVQYYI,"Hama Bloc Multiprises (10 prises, 2 interrupteurs et protection contre surtensions, prises tournées à 45°,longueur de câble de 2 m) Bleu Glace/Noir",Hama,"29,95 €","0,60 %","7,27 %",1,"0,00 %","0,00 %","29,95 €","0,60 %","7,27 %","19,32 €","0,00 %","0,00 %",1,"0,00 %","0,00 %",,,
B009X8SFSY,"Hama ""Fine Art"" Spiral Album, 24 x 17 cm, 50 Photos, azure",Hama,"29,90 €","1,39 %","-65,77 %",4,"33,33 %","-71,43 %","29,90 €","1,39 %","-65,77 %","15,72 €","33,33 %","-71,43 %",4,"33,33 %","-71,43 %",,,
B09W5XN9RQ,"Hama HS-USB300 V2 Casque Micro - Casque USB, Microphone Intégré, Léger, Télécommande Intégrée, Fonction Mute - Noir",Hama,"29,56 €",,"-63,47 %",1,,"-66,67 %","29,56 €",,"-63,47 %","17,35 €",,"-70,11 %",1,,"-66,67 %",,,
B07FK69BRW,"Thomson Antenne Intérieure Tige ANT1438 (pour la réception Radio numérique (Dab/Dab+) Ainsi Que pour l’Amplification des signaux, Active, Performance 25) Noir",Thomson,"29,52 €","-55,70 %","-92,21 %",1,"-50,00 %","-91,67 %","29,52 €","-55,70 %","-92,21 %","21,32 €","-45,85 %","-91,53 %",1,"-50,00 %","-91,67 %",,,"-100,00 %"
B000HWYAL6,"Hama Support universel (pour véhicule, support, pour vitre/grille de ventilation) Noir",Hama,"29,50 €","61,20 %",,2,"100,00 %",,"29,50 €","61,20 %",,"19,96 €","100,00 %",,2,"100,00 %",,,,
B0BL1TSV73,"Hama Chargeur Rapide iPhone 38W (Chargeur USB-C Rapide, Chargeur Qualcomm Quick Charge 3.0, Mini Compact, Chargeur PD Secteur, 1 Port USB-C PD + 1 Port USB- A QC) Blanc",Hama,"29,16 €","-78,04 %",,1,"-80,00 %",,"29,16 €","-81,99 %",,"22,12 €","-83,28 %",,1,"-83,33 %",,1,,
B08YS3GKHM,"Hama Adaptateur vidéo, fiche VGA - Port DVI, Full-HD 1080p, Métal, Garantie 10 Ans, Noir",HAMA,"29,10 €",,,5,,,"23,28 €",,,"26,40 €",,,4,,,,,
B08YS23H1S,"Hama Adaptateur vidéo, fiche VGA + USB - f. Femelle HDMI, Full-HD 1080p, Métal, Garantie 10 Ans, Noir",HAMA,"28,83 €",,,1,,,"28,83 €",,,"22,88 €",,,1,,,,,
B009X8SEOO,"Hama ""Fine Art"" Spiral Album, 24 x 17 cm, 50 Photos, kiwi",Hama,"28,60 €","26,94 %","358,33 %",3,"50,00 %","200,00 %","28,60 €","26,94 %","358,33 %","11,79 €","50,00 %","200,00 %",3,"50,00 %","200,00 %",1,,
B085WJZTD6,"Hama Station météo Touch Noir",Hama,"28,57 €",,"-51,62 %",1,,"-50,00 %","28,57 €",,"-3,15 %","22,39 €",,"0,00 %",1,,"0,00 %",,,
B07RJNVVN6,"Hama Horloge Murale 25cm (Horloge Murale Ronde et Moderne, Pendule sans tic tac à Quartz, Fonction Hygromètre & Thermomètre, sur Piles, idéal Salon, Cuisine, Bureau, Chambre à Coucher) Blanc/Noir",Hama,"28,32 €","0,00 %",,2,"0,00 %",,"28,32 €","0,00 %",,"20,22 €","0,00 %",,2,"0,00 %",,,,
B00006IVX3,"Hama Câble réseau (RJ11, modulaire, connecteurs mâles 6p4c, 3m) Blanc",Hama,"28,22 €","146,03 %","57,13 %",7,"133,33 %","133,33 %","28,22 €","146,03 %","57,13 %","14,56 €","110,10 %","133,33 %",7,"133,33 %","133,33 %",1,,
B0000AHIH7,"Hama Cadre pour portrait, acrylique, format vertical, 9cm x 13cm",Hama,"28,06 €","-37,96 %",,3,"-70,00 %",,"28,06 €","-50,76 %",,"4,27 €","-76,65 %",,3,"-76,92 %",,,,
B004ZLVL12,"Hama Filtre gris ""Vario"" (ND2-400, coated, 58 mm) Noir",Hama,"28,02 €",,,1,,,"28,02 €",,,"35,97 €",,,1,,,,,
B079NH8MDY,"Hama Lot de Protections de joysticks 8 en 1' pour Nintendo Switch, muticol.",Hama,"28,01 €","50,43 %","-48,84 %",3,"50,00 %","-50,00 %","28,01 €","50,43 %","-48,84 %","12,79 €","49,59 %","-50,00 %",3,"50,00 %","-50,00 %",,,
B08SDYGB7X,"Hama Hub USB, 4 Ports, USB 3.2 Gen1, 5 Gbit/s, avec Adaptateur USB-C, Métal, Noir",HAMA,"27,76 €",,,2,,,"27,76 €",,,"28,14 €",,,2,,,,,
B0BQWSBTK1,"Hama Plafonnier LED Connecté Glitzer (Lampe de Plafond 27x27cm, Wifi sans Hub, 18W, 2000LM, Lumière réglable 2700-6500K, Commande vocale Alexa, Assistant Google, Siri Shortcuts, iOS et Android)",Hama,"27,63 €",,,1,,,"27,63 €",,,"31,00 €",,,1,,,,,
B0CYN6KNF2,"Hama Performance 20 - Batterie Externe [Power Bank 20 000mAh] [Batterie Portable USB C Fast Charge] Compatible avec Les iPhones Samsung et Bien Plus - Gris Anthracite",Hama,"27,49 €","-60,36 %",,1,"-50,00 %",,"27,49 €","-60,36 %",,"22,95 €","-50,02 %",,1,"-50,00 %",,,,
B0BZDVMDYG,"Hama Enceinte Bluetooth Pocket 3.0"" (Mini Enceinte sans Fil Portable Légère, Basses intenses, Style Tendance, Étanche Eau et Poussière IP67, Autonomie 14h, USB-C, Prise Jack, 3.5W) Blanc",Hama,"27,41 €",,,1,,,"27,41 €",,,"20,94 €",,,1,,,,,
B08BFMYCJ2,"Hama Album photo Jumbo ""Romance"" à personnaliser (Album Photo Livre de Mariage ou naissance bébé, Livre d'or ou cadeau, 22,5x22 cm, 100 pages, Motif cœur, Titre Love, 200 photos 10x15 cm) Beige/Blanc",Hama,"27,39 €","-55,51 %","-50,17 %",2,"-50,00 %","-50,00 %","27,39 €","-55,51 %","-36,76 %","14,02 €","-50,00 %","-33,33 %",2,"-50,00 %","-33,33 %",,,
B005DJXZSC,"Hama Album Photo Singo (Album minimax, 13 x 16,5 cm, 100 Pages, pour 100 Photos au Format 10 x 15 cm) Rose",Hama,"27,33 €","-18,54 %","-78,16 %",3,"-40,00 %","-87,50 %","27,33 €","-18,54 %","-78,16 %","8,91 €","-40,00 %","-87,50 %",3,"-40,00 %","-87,50 %",,,
B08B1NCNDQ,"Hama 65W Chargeur Rapide Universel pour PC Portable 15-19V - [8 Adaptateurs] [Protection Contre la surchauffe & sur-tensions] Noir",Hama,"27,32 €","-7,20 %",,1,"0,00 %",,"27,32 €","-7,20 %",,"25,56 €","0,00 %",,1,"0,00 %",,,,
B07NH3MBZC,"Ampoule LED, E14, 330lm remp. 30W, amp. réfl. R50, bl. chd., 2 p.",Hama,"27,21 €","-65,01 %","16,33 %",1,"-80,00 %","0,00 %","27,21 €","-70,51 %","16,33 %","12,18 €","-83,11 %","1,58 %",1,"-83,33 %","0,00 %",,,
B0BXPLPKZD,"Hama Classeur à négatifs (4 anneaux, niveau de remplissage 39 mm, feuilles rectangulaires, album à négatifs d'une pellicule photo) Rose",Hama,"26,83 €","100,52 %","222,48 %",2,"100,00 %","100,00 %","26,83 €","100,52 %","222,48 %","12,30 €","100,00 %","100,00 %",2,"100,00 %","100,00 %",,,
B0BL1R4C93,"Hama Câble USB-C de charge et transfert de données Reflective (USB-A 2.0 mâle vers USB-C mâle, câble blindé, anti-torsion, Fiche Aluminium plaqué or, Gaine nylon tressé robuste, 1.5 m) Rouge",Hama,"26,82 €","-49,72 %","-48,89 %",2,"-50,00 %","-33,33 %","12,10 €","-77,32 %","-76,94 %","6,98 €","-75,00 %","-77,74 %",1,"-75,00 %","-66,67 %",,,
B00005KHTD,"Hama Filtre Polarisant Circulaire 67mm, Traité Double Couche par Face, Monture Métalique Noir Epaisseur 6mm",Hama,"26,72 €","-72,19 %",,1,"-75,00 %",,"26,72 €","-72,19 %",,"23,50 €","-75,00 %",,1,"-75,00 %",,,,
B08SDVY3V6,"Hama Câble HDMI (Cable HMDI ultra haute vitesse, Certifié, Mâle-Mâle, Ultra HD, 8K@60 Hz /4K@120Hz, 2.0m, Garantie 30ans, résolution 7680x4320pixels, EARC supportant les formats audio) Gris Noir",Hama,"26,66 €","36,79 %","-35,53 %",1,"0,00 %","-50,00 %","26,66 €","36,79 %","-35,53 %","12,22 €","0,00 %","-66,02 %",1,"0,00 %","-50,00 %",1,,
B00AJJJMLU,"Hama 116200 Nettoyeur de Lentille Laser DVD ""Deluxe"", Bleu, 1,3 cm*22,5 cm*15,0 cm",Hama,"26,64 €","-31,22 %","-74,58 %",2,"-33,33 %","-75,00 %","26,64 €","-31,22 %","-70,88 %","14,00 €","-33,33 %","-71,43 %",2,"-33,33 %","-71,43 %",1,,"0,00 %"
B0BXPLS7Z1,"Hama Classeur à négatifs (4 anneaux, niveau de remplissage 39 mm, feuilles rectangulaires, album à négatifs d'une pellicule photo) Bleu",Hama,"26,62 €","96,89 %","-68,03 %",2,"100,00 %","-71,43 %","26,62 €","96,89 %","-68,03 %","12,30 €","100,00 %","-71,43 %",2,"100,00 %","-71,43 %",,,
B00IZA0RPU,"Thomson Support Mural TV WAB156 (VESA jusqu'à 400x400, Inclinable, pour Une Diagonale d´écran de 58 à 142 cm (de 23"" à 56"")) Noir",Thomson,"26,58 €",,"-80,15 %",1,,"-80,00 %","26,58 €",,"-75,00 %","18,84 €",,"-73,31 %",1,,"-75,00 %",,,"-100,00 %"
B00006JAOU,"Hama Fusibles en verre (fusible voiture, 60A, , AGU, 10 x 38mm, plaqué or, 2 pièces) Or/Transparent",Hama,"26,19 €",,"135,10 %",4,,"100,00 %","26,19 €",,"135,10 %","7,04 €",,"100,00 %",4,,"100,00 %",1,,
