Programme=[Retail],Aperçu du distributeur.=[Fabrication],Afficher par=[ASIN],Pays=[FR],Entreprises=[~ Hama EURL (FR)],Local=[fr_FR],Devise=[EUR],Intervalle des rapports=[Trimestre],Champ de vision.=[01/01/2025 - 31/03/2025],Rapport mis à jour=[04/04/2025]
ASIN,"Nom du produit",Marque,"Chiffre d’affaires basé sur les commandes","Revenus basés sur les commandes – Période antérieure (%)","Revenus basés sur les commandes – Même période l'année dernière (%)","Unités commandées","Unités commandées – Période antérieure (%)","Unités commandées – Même période l'année dernière (%)","Chiffre d’affaires basé sur les expéditions","Revenus basés sur les expéditions – Période antérieure (%)","Revenus basés sur les expéditions – Même période l'année dernière (%)","COGS expédié","COGS expédié – Période antérieure (%)","COGS expédié – Même période l'année dernière (%)","Unités expédiées","Unités expédiées – Période antérieure (%)","Unités expédiées – Même période l'année dernière (%)","Retours client","Retours du client – Période antérieure (%)","Retours du client – Même période l'année dernière (%)"
B00005QFCJ,"Hama Adaptateur Cassette VHS-C/VHS (Convertisseur Vidéo VHS C vers VHS, Cassette Adaptatrice Motorisée pour magnétoscope, 6 Mm, Non Compatible 8mm/MiniDV/Hi8) Noir",Hama,"39 817,07 €","23,25 %","30,34 %",1 598,"29,81 %","51,61 %","39 990,51 €","24,67 %","30,60 %","32 865,96 €","31,48 %","51,75 %",1 605,"31,56 %","51,84 %",208,"184,93 %","49,64 %"
B00D2S92L0,"Xavax Hama Boîte de transport pour un gâteau (boîte rond, Ø 31,5 x 8cm, avec diviseur, capote et compartiments, partie de service et gâteau de gâteau) Anthracite/Transparent",xavax,"13 505,17 €","-14,74 %","120,09 %",968,"-14,34 %","135,52 %","13 556,61 €","-13,95 %","116,95 %","6 983,58 €","-13,35 %","131,35 %",974,"-13,35 %","131,35 %",34,"36,00 %","36,00 %"
B00006JAXW,"Hama Plateau Universel Hama Rond (40 cm, Taille XL, Poids supporté 100 kg (idéal pour TV, Enceintes, écrans, appareils de Cuisine) Noir",Hama,"9 916,49 €","94,34 %","41,52 %",394,"96,02 %","35,40 %","9 997,91 €","99,11 %","44,67 %","4 712,39 €","100,51 %","3,45 %",397,"100,51 %","38,33 %",12,"20,00 %","-14,29 %"
B0764LMPBN,"Hama Multiprise avec Interrupteur 10 Prises 16A (Rallonge multiprises 3m, Bloc 10 Prises Type F Schuko, 3500W Max, Idéal Bureau PC luminaires, Atelier, Meuble TV, Garage) Noir",Hama,"8 343,93 €","-16,92 %","-32,60 %",488,"-18,39 %","-31,36 %","8 455,04 €","-16,36 %","-33,95 %","5 128,20 €","-17,50 %","-32,78 %",495,"-17,77 %","-32,84 %",8,"-60,00 %","-90,12 %"
B00006JAQ7,"Hama 007103 - Ruban photo transparent, Blanc, 1000 pièces (2 paquets de 500 pièces)",Hama,"7 586,41 €","280,27 %","127,31 %",2 166,"442,86 %","134,16 %","7 407,93 €","275,01 %","117,58 %","6 064,61 €","422,87 %","91,62 %",2 110,"434,18 %","122,81 %",12,,"200,00 %"
B01N6NQ73J,"Thomson Casque TV avec câble extra long (Casque d'écoute ajustable et rembouré, Cordon 8m, Idéal pour regarder la télé, écouter la musique, contrôle du volume, prise jack 3,5mm+adaptat. 6,35mm) Noir",Thomson,"6 832,08 €","-36,85 %","-56,50 %",418,"-41,78 %","-61,55 %","6 829,95 €","-36,69 %","-56,86 %","4 603,92 €","-41,97 %","-60,64 %",419,"-41,48 %","-61,80 %",43,"19,44 %","-34,85 %"
B0BNLLF6YV,"Hama iTuner Hi-FI DIT2105SBTX Dab+ Bluetooth (Tuner Internet Radio FM Dab, Tuner HiFi, Radio numérique, RX/TX, WiFi, Spotify Connect, Amazon Music, App UNDOCK, Port USB, télécommande) Noir",Hama,"5 778,57 €","-6,89 %","13,12 %",29,"-9,38 %","20,83 %","5 778,57 €","-9,78 %","23,16 %","5 834,18 €","-11,97 %","16,85 %",29,"-12,12 %","31,82 %",3,"-25,00 %",
B07GLF5SMF,"Hama Album Photo ""Fine Art"" (format 30 x 30 cm, 100 pages noires, sans spirale) Noir",Hama,"5 719,40 €","25,84 %","-5,21 %",266,"29,13 %","-26,92 %","5 840,76 €","28,51 %","-4,49 %","2 726,59 €","33,28 %","-25,93 %",273,"33,17 %","-25,61 %",10,"233,33 %","-47,37 %"
B08GS8FVB5,"Hama Destructeur de Documents Basic S6 (Broyeur de Documents, Sécurité P-2, 6 Feuilles, Corbeille 8L, Découpe en Bandes 6mm, 70 DB, M/A Auto, Idéal Bureau & Maison) Noir",Hama,"5 669,29 €","33,24 %","74,70 %",220,"28,65 %","77,42 %","5 715,25 €","35,79 %","73,20 %","4 072,59 €","31,91 %","56,22 %",222,"31,36 %","76,19 %",12,"200,00 %","33,33 %"
B00005YVIU,"Hama Distributeurs Coins photo (1000 coins, autocollants, distributeur pratique, sans acide, sans solvant, adapté albums, permet un archivage fiable, scrapbooking) Transparent",Hama,"5 661,85 €","261,63 %","2 397,95 %",1 651,"475,26 %","4 617,14 %","5 505,79 €","256,96 %","2 391,98 %","4 654,26 €","465,93 %","3 844,96 %",1 601,"465,72 %","4 608,82 %",10,"233,33 %",
B01N2RIZMU,"Xavax Socle universel ""Gigant"" (60 x 60 cm, augmentation de 50 cm, socle stable avec compartiment inférieur, pieds réglables en hauteur, socle pour lave-linge/sèche-linge) Blanc",xavax,"4 646,80 €","24,34 %","-2,58 %",35,"25,00 %","-2,78 %","4 779,30 €","32,59 %","-2,51 %","3 398,76 €","33,33 %","-2,16 %",36,"33,33 %","-2,70 %",2,"0,00 %",
B0009V6Q30,"Hama Boîtier Slim (pour CD et disques Blu-ray, ultra mince, avec une feuille pour la couverture, lot de 25) Transparent/Bleu/Orange/Vert/Rouge/Violet",Hama,"4 425,58 €","11,96 %","-35,28 %",442,"-6,95 %","-35,00 %","4 355,65 €","7,92 %","-34,97 %","3 519,15 €","-10,31 %","-46,99 %",435,"-10,31 %","-34,68 %",9,"-18,18 %","-59,09 %"
B0000AISCF,"Hama Cadre photo en plastique Sevilla (taille du Cadre de 21 x 29,7 cm (DIN 4) avec bordure de 9 mm x 17 mm, pour une photo de 15 x 20 cm) Noir",Hama,"4 211,68 €","72,65 %","-0,45 %",831,"89,73 %","26,10 %","4 196,71 €","69,51 %","-2,87 %","2 813,38 €","66,40 %","5,21 %",828,"86,91 %","22,30 %",18,"1 700,00 %","63,64 %"
B00006IVA8,"Hama Cassette de Nettoyage VHS pour MAGNETOSCOPE (Nettoyeur de tête vidéo lecteurs VHS/S-VHS/VHS-C/S-VHS-C, Liquide de Nettoyage Inclus, Nettoyant de Têtes Vidéo - K7 Nettoyage VHS) Noir",Hama,"4 189,68 €","26 350,00 %","26 722,54 %",529,"26 350,00 %","52 800,00 %","4 078,80 €",,"26 012,68 %","4 686,50 €",,"41 336,78 %",515,,"51 400,00 %",6,,
B08GRRDVN9,"Hama Destructeur de Documents Mini S6 (Broyeur Documents 6 Feuilles 80g, Destructeur Papier, Déchiqueteur sécurité P1, 72 DB, M/A Auto, Fonction Retour, s'adapte sur des Corbeilles à Papier) Noir",Hama,"4 172,77 €","62,72 %","-15,30 %",171,"69,31 %","-26,92 %","4 147,00 €","61,71 %","-15,48 %","2 622,88 €","68,56 %","-26,95 %",170,"68,32 %","-27,04 %",6,"50,00 %","-64,71 %"
B07BGLLS26,"Chiffons pour écrans, 100 pièces, dans un distributeur",Hama,"3 667,20 €","170,48 %",,567,"160,09 %",,"3 558,04 €","162,51 %",,"2 232,68 €","152,50 %",,550,"152,29 %",,2,"100,00 %",
B00005QFAY,"Hama Étuis à négatifs, Papier Cristal, 7 Bandes de 6 négatifs, 24x36cm, 100 pièces",Hama,"3 658,13 €","-10,50 %","42,14 %",147,"-14,53 %","27,83 %","3 574,99 €","-14,34 %","38,02 %","2 253,68 €","-18,85 %","26,23 %",143,"-18,29 %","23,28 %",5,,"400,00 %"
B07CLVR52S,"Hama Album photo enfant ""Batzi"" (taille de l'album de 19 x 25 cm, format pour 200 photos 10 x 15 cm, avec 100 pages, papier stratifié, insertion latérale des photos, ours debout) Marron",Hama,"3 594,28 €","-15,46 %","7,47 %",360,"0,00 %","26,32 %","3 585,08 €","-15,68 %","9,31 %","2 288,11 €","-0,57 %","32,22 %",358,"-0,56 %","28,78 %",2,"-71,43 %","-75,00 %"
B00006IVA9,"Hama CD de nettoyage (pour tête de lecture laser, pour éliminer la poussière dans les lecteurs de CD, CD de nettoyage au laser) Blanc/Bleu/Rouge",Hama,"3 577,96 €","-2,64 %","-18,19 %",385,"-3,99 %","-10,05 %","3 613,85 €","-1,17 %","-19,19 %","2 049,90 €","-2,62 %","-11,40 %",389,"-2,51 %","-11,19 %",3,"0,00 %","-82,35 %"
B00006J4EP,"Hama Boîtier standard (pour CD et disques Blu-Ray, Étui protecteur pour CD, paquet de 10) Noir/Transparent",Hama,"3 558,52 €","-63,84 %","-69,83 %",475,"-63,88 %","-56,62 %","3 805,69 €","-61,12 %","-68,18 %","1 910,86 €","-61,11 %","-65,38 %",508,"-61,16 %","-54,72 %",2,"-84,62 %","-88,24 %"
B00A44OC0G,"Hama Barre Multiprise 6 Prises avec Interrupteur Et Sécurité Enfant Cble Blanc 5 M",Hama,"3 553,44 €","-49,80 %","-34,54 %",216,"-48,69 %","-37,03 %","3 489,80 €","-51,94 %","-36,18 %","2 230,24 €","-50,90 %","-38,78 %",212,"-50,93 %","-38,73 %",5,"-37,50 %","-58,33 %"
B00SL6I2WI,"Hama Album Photo Jumbo ""Fine Art"" (Album 30x30cm, 50 feuilles/100 pages blanches, pour coller 400 Photos de 10x15 cm, Look livre sans spirale, Couverture personnalisable, Idée cadeau) Noir",Hama,"3 516,21 €","-20,55 %","-66,21 %",210,"-25,53 %","-70,38 %","3 563,03 €","-19,57 %","-65,25 %","1 726,28 €","-24,67 %","-71,97 %",213,"-24,47 %","-69,57 %",4,"-69,23 %","-85,19 %"
B00006JAMU,"Hama Étuis à négatifs, polypropylène, 7 bandes de 6 négatifs, 24x36cm, 25 pièces",Hama,"3 341,48 €","41,75 %","46,71 %",236,"63,89 %","48,43 %","3 368,12 €","44,52 %","49,18 %","2 439,12 €","67,80 %","50,40 %",238,"67,61 %","50,63 %",2,"-33,33 %","-50,00 %"
B00CRB69MI,"Hama Support de télécommande Major (pour 4 télécommandes au maximum, également pour rangement de lunettes, smartphones, contrôleurs, clés USB, porte-télécommande) Noir",Hama,"3 304,10 €","-53,95 %","-10,04 %",224,"-57,97 %","-17,65 %","3 360,74 €","-52,88 %","-9,67 %","2 277,72 €","-56,98 %","-25,94 %",228,"-56,98 %","-17,09 %",6,"20,00 %","50,00 %"
B0009V8WNW,"Hama Pochettes de Protection (en Papier pour CD/DVD/Blu-Ray, verrouillables, Lot de 100) Blanc/Transparent",Hama,"3 163,71 €","-7,86 %","61,93 %",499,"-7,76 %","158,55 %","3 119,21 €","-9,85 %","54,21 %","1 483,99 €","-10,19 %","144,11 %",489,"-10,28 %","144,50 %",4,"-20,00 %",
B00005YVGK,"Pochettes pour 20 Diapositives encadrées de Format 5x5 cm, 25 pièces",Hama,"3 128,75 €","18,39 %","-27,02 %",177,"-12,81 %","-48,99 %","3 128,75 €","15,67 %","-24,62 %","1 373,03 €","-14,86 %","-61,26 %",177,"-14,90 %","-47,32 %",2,"-50,00 %",
B0002W5WBS,"Hama Boîtier Slim (pour CD et disques Blu-Ray, Ultra Mince, avec Une Feuille pour la Couverture, Lot de 50) Noir/Transparent",Hama,"3 099,78 €","-8,17 %","12,27 %",130,"-10,34 %","21,50 %","3 099,78 €","-8,17 %","11,27 %","1 625,00 €","-10,34 %","20,37 %",130,"-10,34 %","20,37 %",2,,"0,00 %"
B00006JDEX,"Hama Plateau Universel Hama Rond (32 cm, Taille L, Poids supporté 80 kg (idéal pour TV, Enceintes, écrans, appareils de Cuisine) Noir",Hama,"3 095,94 €","54,62 %","-44,12 %",166,"46,90 %","-51,60 %","3 077,73 €","52,14 %","-44,05 %","1 532,50 €","43,12 %","-63,39 %",165,"44,74 %","-51,61 %",4,"-20,00 %","-73,33 %"
B00005UPC8,"Hama Boîtier standard double (pour CD et disques Blu-Ray, Étui protecteur pour CD, paquet de 10) Transparent",Hama,"3 056,94 €","19,53 %","166,18 %",306,"19,53 %","260,00 %","3 026,97 €","16,09 %","165,88 %","2 026,54 €","15,68 %","256,89 %",303,"16,09 %","260,71 %",8,"14,29 %",
B01K47GW46,"Hama Album photo Jumbo ""La Fleur"" 30 x 30 cm (livre photo de 100 pages blanches, album photos souvenirs pour 400 photos au format 10x15 cm, à personnaliser- à coller, Idée Cadeau, motif Feuilles) Noir",Hama,"2 825,13 €","51,75 %","37,79 %",231,"71,11 %","66,19 %","2 805,69 €","50,62 %","36,84 %","1 600,13 €","69,59 %","64,68 %",229,"69,63 %","64,75 %",3,"200,00 %","50,00 %"
B0002W5WE0,"Hama Boîtier Slim Double (pour DVD, Convient également aux CD et disques Blu-Ray, Ultra Mince, avec Une Feuille pour la Couverture, Lot de 25) Noir/Transparent",Hama,"2 595,23 €","11,37 %","95,08 %",166,"8,50 %","133,80 %","2 619,71 €","15,02 %","88,66 %","1 845,70 €","11,20 %","126,40 %",167,"11,33 %","125,68 %",4,"300,00 %","0,00 %"
B09MQQM1ZJ,"Xavax Socle machine à laver avec étagère (Support Sèche Linge Lave Linge,Réhausseur de Machines, Base universelle avec Pieds Réglables en hauteur, charge 150 kg) Blanc",Xavax,"2 531,05 €","-17,98 %","-77,39 %",28,"-17,65 %","-83,23 %","2 531,05 €","-17,98 %","-76,64 %","1 459,40 €","-17,45 %","-82,69 %",28,"-17,65 %","-82,72 %",,"-100,00 %","-100,00 %"
B003PFBLOQ,"Hama Horloge murale ""PP-245"" (radio-pilotée DCF, Pendule sans Tic Tac, Numérique, à led, sans fil, avec des piles, Format 24h, Calendrier, Jour, Thermomètre 0°C à +50°C, pause murale ou bureau) Plastique, Noir",Hama,"2 428,63 €","-45,92 %","-67,07 %",85,"-52,78 %","-69,53 %","2 360,87 €","-47,67 %","-67,88 %","1 487,24 €","-54,20 %","-70,07 %",83,"-54,14 %","-70,14 %",4,"-20,00 %","-50,00 %"
B0013IPAJY,"Hama Kit de Nettoyage et de réparation pour CD/DVD (25 ML de pâte de réparation, 45 ML de Liquide nettoyant, 1 Coque de Nettoyage, 5 Chiffons, 8 pièces) Blanc/Bleu/Rouge/Noir",Hama,"2 424,32 €","13 301,44 %","7,34 %",115,"11 400,00 %","7,48 %","2 403,55 €",,"2,38 %","1 645,02 €",,"2,70 %",114,,"2,70 %",4,,"-42,86 %"
B0002W5WEU,"Hama Boîtier Slim (pour DVD, Convient également aux CD et disques Blu-Ray, Ultra Mince, avec Une Feuille pour la Couverture, Lot de 25) Noir/Transparent",Hama,"2 320,72 €","-47,23 %","-40,67 %",159,"-45,17 %","-31,76 %","2 292,60 €","-47,80 %","-42,84 %","1 636,79 €","-46,24 %","-35,02 %",156,"-46,21 %","-35,00 %",5,"-50,00 %","-37,50 %"
B000EORX52,"Hama Boîtier Slim (pour CD et disques Blu-Ray, Ultra Mince, avec Une Feuille pour la Couverture, Lot de 25) Transparent",Hama,"2 280,47 €","13,61 %","16,11 %",156,"13,04 %","5,41 %","2 347,07 €","20,94 %","17,12 %","1 677,08 €","21,29 %","6,90 %",161,"21,05 %","6,62 %",5,"150,00 %","0,00 %"
B08SDTHMQB,"Hama Album Photo bébé ""Our Baby"" personnalisable Scrapbooking (Album photo naissance, baptême, Cadeau d'anniversaire enfant, Style Mémo, 22,5 x 22 cm, 100 Pages, Max. 200 Photos 10x15 cm) Multicolore",Hama,"2 176,26 €","190,86 %","416,73 %",249,"196,43 %","555,26 %","2 150,04 €","168,53 %","393,83 %","1 355,40 €","172,95 %","425,88 %",246,"173,33 %","530,77 %",1,"0,00 %","-50,00 %"
B00006JABA,"Hama Adhésif Cinekett (pour films Super 8, 100 pièces, S8, 1 piste audio libre) Blanc/Rouge",Hama,"2 063,04 €","37,57 %","12,08 %",114,"37,35 %","9,62 %","2 009,67 €","34,05 %","11,37 %","1 330,05 €","33,71 %","8,85 %",111,"33,73 %","8,82 %",3,,"200,00 %"
B00AJKQ4YC,"Hama 2 Pieds Enceintes Universels (Supports Haut-Parleur, Hauteur réglable Max. 123 cm, antidérapant, Charge Max. 5 kg/Pied, câbles cachés, Haut-parleurs Hi-FI/Stéréo/Home Cinema) Noir",Hama,"2 006,69 €","-36,25 %","-53,27 %",31,"-39,22 %","-58,11 %","2 070,43 €","-34,10 %","-51,14 %","1 280,96 €","-37,25 %","-56,16 %",32,"-37,25 %","-56,16 %",4,"100,00 %","0,00 %"
B0002W5WBI,"Hama Boîtier Slim (pour CD et disques Blu-Ray, Ultra Mince, avec Une Feuille pour la Couverture, Lot de 100) Noir/Transparent",Hama,"1 986,82 €","-6,38 %","-20,75 %",58,"-12,12 %","-13,43 %","1 952,42 €","-14,38 %","-22,13 %","1 520,76 €","-18,57 %","-14,93 %",57,"-18,57 %","-14,93 %",3,"200,00 %",
B0CNRZ9GWN,"Hama Boîte pour câbles Maxi (Boite Rangement pour Cables chargeurs et multiprises, boitier Cache câbles 40x15,5x13,5cm, Pieds en Caoutchouc) Blanc",Hama,"1 983,78 €","-20,04 %","65,61 %",100,"-27,54 %","75,44 %","1 808,87 €","-26,47 %","55,86 %","1 246,89 €","-35,04 %","61,82 %",89,"-35,04 %","61,82 %",7,"250,00 %",
B07CKR6PKL,"Hama Album photo enfant ""Batzi"" (taille de l'album de 19 x 25 cm, format pour 200 photos 10 x 15 cm, avec 100 pages, papier stratifié, insertion latérale des photos, ours assis) Marron",Hama,"1 958,34 €","60,87 %","-45,45 %",193,"127,06 %","-44,06 %","1 964,15 €","61,48 %","-46,60 %","1 233,27 €","127,06 %","-44,33 %",193,"127,06 %","-45,63 %",,"-100,00 %","-100,00 %"
B07T63BHGL,"Hama Album photo ""Hello Panda"" (pour 200 photos au format 10 x 15 cm, petit album de taille 22,5 x 22 cm, 100 pages blanches, panda, avec emplacement pour CD, élégant) Turquoise/Noir/Blanc",Hama,"1 926,29 €","65,44 %","33,35 %",188,"100,00 %","66,37 %","1 917,13 €","64,65 %","30,50 %","1 293,56 €","99,01 %","62,65 %",187,"98,94 %","62,61 %",3,,"-40,00 %"
B000N8UX88,"Hama Trépied Appareil Photo Star 20""",Hama,"1 886,92 €","293,47 %","493,00 %",315,"288,89 %","687,50 %","1 905,80 €","333,98 %","498,93 %","1 107,36 €","338,42 %","700,17 %",320,"338,36 %","700,00 %",3,"200,00 %",
B000VRFBM4,"Hama Album Photo ""Fine Art"" (format 36 x 32 cm, 50 pages noires, à spirale) Noir",Hama,"1 873,93 €","-25,33 %","28,81 %",109,"-26,85 %","9,00 %","1 873,93 €","-25,80 %","30,41 %","878,13 €","-27,34 %","10,25 %",109,"-27,33 %","10,10 %",4,"300,00 %",
B06XB2Y8KR,"Hama Album traditionnel ""Lazise"" (taille de l'album de 22,5 x 22 cm, pour 200 photos au format 10 cm x 15 cm, 100 pages, avec pochette CD, élégant) Blanc/Noir/Rose",Hama,"1 859,77 €","184,23 %","138,36 %",208,"264,91 %","166,67 %","1 824,81 €","169,40 %","130,95 %","1 137,36 €","246,48 %","162,52 %",204,"245,76 %","161,54 %",2,"0,00 %","100,00 %"
B079PN72PJ,"Hama Souris Optique sans Fil Riano (Souris Gauche sans Fil, avec récepteur Nano USB, Vertical, 800-1600 dpi, Interrupteur de Marche/arrêt, 3 Boutons, 2,4 GHz) Noir",Hama,"1 837,08 €","15,79 %","15,28 %",125,"16,82 %","20,19 %","1 853,26 €","17,09 %","14,26 %","1 262,95 €","17,21 %","18,04 %",126,"17,76 %","18,87 %",2,"-33,33 %","-50,00 %"
B07SZ3FCZH,"Hama Album photo mémo ""Forest"" (pour 200 photos au format 10 x 15 cm, album traditionnel enfant de 22,5 x 22 cm, 100 pages blanches, animaux, élégant, emplacement CD) Marron/Beige/Vert/Orange/Jaune",Hama,"1 816,23 €","-42,20 %","-37,52 %",144,"-41,70 %","-30,43 %","1 770,43 €","-44,51 %","-41,64 %","719,47 €","-43,91 %","-48,24 %",139,"-44,62 %","-35,65 %",6,"20,00 %","50,00 %"
B0032DAL6U,"Hama Album photo ''Catania'' (taille 22 x 22 cm pour 200 photos au format 10 x 15 cm, 100 pages, papier stratifié, thématique mariage/vacances, emplacement pour CD, personnalisable) Gris",Hama,"1 811,03 €","166,27 %","-63,22 %",186,"272,00 %","-61,49 %","1 778,23 €","166,54 %","-64,80 %","904,54 €","271,47 %","-63,31 %",182,"271,43 %","-63,38 %",2,,"0,00 %"
B000EBFN70,"Hama Trépied Appareil Photo Vidéo 106.5cm Star 5"" avec Sac de Transport (Trépied Télescopique Aluminium 4 éléments, Tête 3 Voies 3D, Niveaux à Bulles intégrés, Attache Rapide) Beige",Hama,"1 771,31 €","91,34 %","-7,50 %",126,"88,06 %","-7,35 %","1 756,88 €","86,93 %","-9,58 %","1 354,76 €","82,92 %","-9,89 %",125,"83,82 %","-9,42 %",7,"16,67 %","16,67 %"
B00G3BMWQA,"Xavax Minuteur à œuf (avec fonction minuterie, sablier, en acier inoxydable) Argent",xavax,"1 725,43 €","-13,34 %","22 936,45 %",242,"-9,36 %","24 100,00 %","1 725,43 €","-13,99 %","22 936,45 %","1 219,46 €","2,33 %","27 427,31 %",242,"-10,04 %","24 100,00 %",3,"-57,14 %",
B0BNLNC6KX,"Hama iTuner Hi-FI DIT2105SBTX Dab+ Bluetooth (Tuner Internet Radio FM Dab, Tuner HiFi, Radio numérique, RX/TX, WiFi, Spotify Connect, Amazon Music, App UNDOCK, Port USB, télécommande) Argenté",Hama,"1 723,34 €","-0,39 %","60,41 %",8,"0,00 %","60,00 %","1 938,01 €","27,89 %","80,39 %","1 836,00 €","28,57 %","75,86 %",9,"28,57 %","80,00 %",1,"0,00 %","0,00 %"
B000EORX5W,"Hama 00033833 Pochette, Noir (pour 120 CD/DVD/Blu-ray, classeur de rangement, gain de place pour le bureau, le salon et la maison, étuis de transport)",Hama,"1 723,26 €","14,92 %","-69,84 %",99,"15,12 %","-70,27 %","1 687,26 €","11,20 %","-70,29 %","863,59 €","11,41 %","-70,75 %",97,"11,49 %","-70,69 %",2,"-33,33 %","-75,00 %"
B000V8QPQ4,"hama hama Câble d'antenne, prise coaxiale 75 db - prise coaxiale 10,0 m",Hama,"1 720,55 €","90,50 %","70,89 %",187,"96,84 %","98,94 %","1 744,29 €","97,69 %","72,51 %","771,40 €","106,52 %","100,00 %",190,"106,52 %","100,00 %",4,"100,00 %","33,33 %"
B071VWLNZB,"Hama 00137234 Alimentation pour PC",Hama,"1 555,44 €","16,16 %","29,16 %",88,"15,79 %","25,71 %","1 605,42 €","22,77 %","37,58 %","942,76 €","22,97 %","37,25 %",91,"22,97 %","35,82 %",5,"150,00 %","25,00 %"
B0C5JQPC2P,"Classeur avec mécanisme à 4 anneaux, larg. 70 mm, avec étui, noir/gris",Hama,"1 520,56 €","144,12 %","1 560,00 %",83,"144,12 %","1 560,00 %","1 520,56 €","137,14 %","1 560,00 %","979,40 €","137,14 %","1 560,00 %",83,"137,14 %","1 560,00 %",2,"-33,33 %",
B0083M13TY,"Hama Cadre photo en plastique Sevilla (taille du Cadre de 29,7 x 42 cm (DIN A3) avec bordure de 9 mm x 17 mm, pour une photo de 18 x 24 cm, verre en polystyrène) Noir",Hama,"1 506,48 €","136,08 %","-70,46 %",145,"168,52 %","-68,88 %","1 466,52 €","124,74 %","-71,13 %","804,26 €","148,05 %","-73,90 %",141,"156,36 %","-69,55 %",6,,"-40,00 %"
B00005QFB0,"Hama Étuis à négatifs, papier cristal, 7 bandes de 6 négatifs, 24x36cm, 25 pièces",Hama,"1 472,03 €","-1,13 %","-13,31 %",147,"-3,29 %","-14,53 %","1 444,08 €","-3,60 %","-15,57 %","769,95 €","-5,28 %","-16,67 %",145,"-5,23 %","-16,67 %",4,,"100,00 %"
B000BGFJI6,"Hama Carte mémoire Photo (SD pour Photo/Classe 4, 2 GB - 10 MB/s) Bleu",Hama,"1 463,79 €","173,16 %","-0,54 %",187,"117,44 %","-4,59 %","1 445,47 €","165,26 %","-1,79 %","946,00 €","107,09 %","2,89 %",185,"112,64 %","-5,61 %",,,"-100,00 %"
B08SFPD9F2,"Hama Station météo sans fil interieur exterieur Meteotime (centre de prévision météorologique, Horloge radio pilotée DCF, Sonde sans fil, Thermomètre, Hygromètre, Alarme, Reveil, rétro éclairage) noir",Hama,"1 405,70 €","-25,97 %","64,24 %",25,"-24,24 %","66,67 %","1 405,70 €","-25,97 %","64,24 %","1 181,33 €","-24,24 %","50,73 %",25,"-24,24 %","66,67 %",8,"300,00 %","100,00 %"
B00006JA17,"Hama Étuis à négatifs, Papier Cristal, 4 Bandes de 3 négatifs, 6X7 cm pour 3 negatif et jusqu'a 6 X 9 cm pour 2 negatif, 100 pièces",Hama,"1 396,16 €","-4,30 %","-17,21 %",66,"-2,94 %","-18,52 %","1 375,34 €","-9,73 %","-18,45 %","1 020,87 €","-8,45 %","-19,45 %",65,"-8,45 %","-19,75 %",4,,
B093WSK4SC,"Hama Radio Internet Dab/Dab+ 'DR200BT' (Radio numérique FM/Dab/Dab+ Portable, Haut Parleur Bluetooth Rechargeable USB-C, Ecran Couleur, Entrée AUX, Minuteur, 30 Présélections, 8h d'écoute) Noir",Hama,"1 388,34 €","-53,38 %","746,60 %",33,"-51,47 %","1 000,00 %","1 436,73 €","-52,33 %","776,11 %","1 173,00 €","-50,72 %","554,58 %",34,"-50,72 %","1 033,33 %",7,"0,00 %",
B08YRY2LQJ,"Hama Câble Jack 3.5 Male Male (Câble Auxiliaire Stéréo Jack 3.5mm, Cable Audio Garantie 10ans, 1.5m, compatible iPhone, iPod, iPad, Voiture, Casque, Autoradio, Smartphones, MP3) Noir",Hama,"1 384,84 €","368,87 %",,382,"438,03 %",,"1 341,68 €","354,25 %",,"1 697,17 €","420,78 %",,369,"419,72 %",,3,,
B00RLNCZ52,"Hama Album photo ""Moni"" (pour 200 photos au format 10 x 15 cm, album photo bébé de 100 pages blanches, ciel, élégant, pour filles, enfants, bébés) Rose, petit album de taille 22,5 x 22,5 cm",Hama,"1 379,03 €","39,08 %","-3,75 %",110,"42,86 %","-1,79 %","1 379,03 €","39,08 %","-3,75 %","675,40 €","42,86 %","-1,37 %",110,"42,86 %","-1,79 %",1,"-50,00 %","-66,67 %"
B0BXPLLW89,"Hama Classeur à négatifs (4 anneaux, niveau de remplissage 39 mm, feuilles rectangulaires, album à négatifs d'une pellicule photo, housse de protection) Noir",Hama,"1 290,48 €","6,51 %","171,67 %",139,"-4,14 %","167,31 %","1 267,24 €","3,18 %","176,46 %","842,55 €","-6,80 %","174,00 %",137,"-6,80 %","174,00 %",1,,
B001F4ZWDK,"Hama Pochettes en polypropylène pour CD/DVD, paquet de 75, Transparent",Hama,"1 281,36 €","48,24 %","43,21 %",145,"62,92 %","79,01 %","1 278,14 €","45,89 %","42,85 %","673,45 €","62,23 %","79,21 %",144,"60,00 %","77,78 %",8,"700,00 %",
B01K47HIEY,"Hama Album photo ""Skies"" (album grand format, 22,5 x 22 cm, 100 pages, pour 200 photos au format 10 x 15 cm) Gris",Hama,"1 246,15 €","75,05 %","64,39 %",116,"78,46 %","84,13 %","1 255,77 €","78,82 %","52,34 %","634,76 €","84,01 %","72,94 %",117,"82,81 %","64,79 %",,"-100,00 %","-100,00 %"
B08YS1PZWL,"Hama Adaptateur Jack 6.35 vers 3.5 Garantie 10 Ans (Adaptateur Audio 6.35mm Mâle vers 3.5mm Femelle, Stéréo, Prise Casque, Audio Connecteur Stéréo pour Mélangeur Audio/Piano électrique/Clavier) Noir",Hama,"1 241,51 €","-38,94 %","-78,78 %",271,"-37,99 %","-88,41 %","1 276,61 €","-37,21 %","-78,81 %","498,60 €","-37,18 %","-90,89 %",277,"-36,61 %","-88,52 %",3,"-57,14 %","-93,62 %"
