B082WQS12G,"Hama Ampoule LED, E27, 1521lm rempl. 100W, amp. à incandes., BLC CHD, régl.",Hama,,,"-100,00 %",,,"-100,00 %",,,"-100,00 %",,,"-100,00 %",,,"-100,00 %",,,
B0CNRNVF1Y,"Hama Montre connectée GPS Intégré 8900"" (Montre Sport, écran AMOLED 1,32"", Fonction Prise d’appels, contrôle Vocal Alexa, altimètre barométrique, IP68), dorée",Hama,,"-100,00 %",,,"-100,00 %",,,"-100,00 %",,,"-100,00 %",,,"-100,00 %",,,"-100,00 %",
B0BG5F6PK3,"Hama Montre Connectée Fit Watch 6910 (GPS Montre Sport Etanche IP68 Montre Fitness 14 Sports, Montre Multifonctions Compatible Google Fit Apple Health Strava) Noir",Hama,,"-100,00 %","-100,00 %",,"-100,00 %","-100,00 %",,"-100,00 %","-100,00 %",,"-100,00 %","-100,00 %",,"-100,00 %","-100,00 %",,,"-100,00 %"
B00CKIQCBG,"Hama Multiprise 3 Prises 16A avec Interrupteur (Rallonge multiprises 3m, Bloc 3 prises Type F Schuko, Idéal Bureau PC luminaires, Atelier, Meuble TV, Garage )Noir",Hama,,,"-100,00 %",,,"-100,00 %",,,"-100,00 %",,,"-100,00 %",,,"-100,00 %",,,
B01LZXLX9Z,"Pêle-mêle de cadres photo pr portrt, 2 en 10 x 15 cm, 1 en 10 x 10 cm",Hama,,"-100,00 %","-100,00 %",,"-100,00 %","-100,00 %",,"-100,00 %","-100,00 %",,"-100,00 %","-100,00 %",,"-100,00 %","-100,00 %",,,
B00006JA7P,"Hama Vis pour appareil photo (5 vis pour accessoires photographiques, longueur 8 mm, filetage A 1/4 "", plastique/métal) Argent",Hama,,,"-100,00 %",,,"-100,00 %",,,"-100,00 %",,,"-100,00 %",,,"-100,00 %",,,"-100,00 %"
B01LH9T4UE,"Hama Chambre à air de vélo (taille de 28"", avec valve automatique, Schrader) Noir",UNKNOWN,,,"-100,00 %",,,"-100,00 %",,,"-100,00 %",,,"-100,00 %",,,"-100,00 %",,,
B076239MY8,"Hama 00137237 Alimentation pour PC",Hama,,,"-100,00 %",,,"-100,00 %",,,"-100,00 %",,,"-100,00 %",,,"-100,00 %",,,"-100,00 %"
B005SALIH6,"Hama Chargeur Mural USB, 5V/1A, Idéal Pour Apple TV 4 Siri Remote, Lecteur MP3 et Autres Périphériques USB, Noir",Hama,,,"-100,00 %",,,"-100,00 %",,,"-100,00 %",,,"-100,00 %",,,"-100,00 %",,,"-100,00 %"
B0BL18SWQC,"Hama Chargeur Rapide USB-A (Chargeur Secteur Quick Charge 3.0 19.5 W, certifié Qualcomm® Quick Charge™ 3.0, Chargeur Mural pour Samsung Galaxy S21/S20/S10/S10E/S9/Note 10 LG Huawei Xiaomi) Noir",Hama,,"-100,00 %",,,"-100,00 %",,,"-100,00 %",,,"-100,00 %",,,"-100,00 %",,,,
B000S8B51M,"Hama Pochettes-classeurs (pour CD/DVD, Couvre classeur à Anneaux, 2 par Pochette, Lot de 50) Noir/Transparent",Hama,,"-100,00 %",,,"-100,00 %",,,"-100,00 %",,,,,,"-100,00 %",,,,
B07CQCWLFL,"Hama “Fine Art"" Spiral Album, 24 x 17 cm, 50 Photos, flamingo",Hama,,"-100,00 %","-100,00 %",,"-100,00 %","-100,00 %",,"-100,00 %","-100,00 %",,"-100,00 %","-100,00 %",,"-100,00 %","-100,00 %",,"-100,00 %",
B0002W68Z2,"Hama - 11947 - Câble audio stéréo, 2 RCA mâles - 2 RCA mâles, 1,50m, Noir",Hama,,"-100,00 %",,,"-100,00 %",,,"-100,00 %",,,"-100,00 %",,,"-100,00 %",,,,
B00006IVD3,"Hama Cadre universel pour autoradio (en métal, ISO) Gris",Hama,,,"-100,00 %",,,"-100,00 %",,,"-100,00 %",,,"-100,00 %",,,"-100,00 %",,,"-100,00 %"
B06XCDMP91,"Hama Câble de charge et transfert de données ""Métal"" (USB-A mâle vers Micro-USB, USB 2.0, nickel, câble anti-torsion, longueur de câble de 1,5 m) Anthracite",Hama,,,"-100,00 %",,,"-100,00 %",,,"-100,00 %",,,"-100,00 %",,,"-100,00 %",,,
B00397F07E,"Hama Support de plafond ou mural pour videoprojecteur (inclinaison à 30°, rotation 360°, pour des projecteurs/vidéoprojecteurs) Blanc",Hama,,"-100,00 %",,,"-100,00 %",,,"-100,00 %",,,"-100,00 %",,,"-100,00 %",,,,
B0002W6A64,"Hama Supports d'enceintes (pour haut-parleur, hauteur réglable jusqu'à 123 cm, capacité de charge de 5 kg, guide-câble dissimulé, lot de 2) Noir",Hama,,,"-100,00 %",,,"-100,00 %",,,"-100,00 %",,,"-100,00 %",,,"-100,00 %",,,"-100,00 %"
B0BL1RHLQD,"Hama Câble iPhone USB-A Lightning (Câble de charge/transfert de données/Data, USB-A 2.0 mâle vers Lightning, 1.5m, Certifié MFI, 480 MBit/s, iPad/iPhone 13/12/11/XS/XR/X/8/7/7+/6s/6/5/SE2020) Blanc",Hama,,,"-100,00 %",,,"-100,00 %",,,"-100,00 %",,,"-100,00 %",,,"-100,00 %",,,
B00006JAKM,"Hama Rack de bureau ""Nexus"" (pour 20 boîtiers de CD, support de CD pour le bureau ou les enfants, support de CD de haute qualité) Argent",Hama,,"-100,00 %","-100,00 %",,"-100,00 %","-100,00 %",,"-100,00 %","-100,00 %",,"-100,00 %","-100,00 %",,"-100,00 %","-100,00 %",,,
B00005YV5C,"Hama lot de 4 piles niCd aA mignon 1,2 v/500 mAh)",Hama,,,"-100,00 %",,,"-100,00 %",,,,,,,,,,,,
B000EOPTEY,"Hama-j-Straps Bijoux de téléphone Portable Snoopy Surf",Hama,,,"100,00 %",,,"100,00 %",,,,,,,,,,,,
B007929SC8,"Xavax Boîte en acier inoxydable (pour 1 kg de grains de café en poudre, pour le café, le thé, le cacao, une boîte de rangement à fermeture aromatique, étanche, 1000g) Argent",xavax,,,"-100,00 %",,,"-100,00 %",,,"-100,00 %",,,"-100,00 %",,,"-100,00 %",,,
B071ZVN9LX,"Hama Album photo à pochettes ""Cool Story"" (format album de 11,7 cm x 12,7 cm, pour 56 instantanés, photos jusqu'à 5,4 cm x 8,6 cm, 28 pages, élégant, insertion latérale) Multicolore",Hama,,"-100,00 %",,,"-100,00 %",,,"-100,00 %",,,"-100,00 %",,,"-100,00 %",,,,
B00005K49X,"Hama Filtre UV (anti-UV et protection, compensation 4X, traitement antireflet, pour objectifs d'appareils photo 72 mm, O-Haze, traité) Noir",Hama,,,"-100,00 %",,,"-100,00 %",,,"-100,00 %",,,"-100,00 %",,,"-100,00 %",,,"-100,00 %"
B09VXZ7GHW,"Hama Coque Etui de Protection Samsung Galaxy A53 5G (Etui Portefeuille Porte-Cartes, Support Flip, Housse Étui Rabattable Fermeture magnétique Antichoc Anti-Rayures Case) Noir",Hama,,"-100,00 %",,,"-100,00 %",,,"-100,00 %",,,"-100,00 %",,,"-100,00 %",,,,
B0000WXD1G,"Hama Trépied Photo/vidéo Star 63"" (Trépied d'entrée de Gamme léger, tête à Trois Voies, 66-166 cm, 3D) Champagne",Hama,,"-100,00 %","-100,00 %",,"-100,00 %","-100,00 %",,"-100,00 %","-100,00 %",,"-100,00 %","-100,00 %",,"-100,00 %","-100,00 %",,,"-100,00 %"
B00006JCYS,"Hama Présentoir de Distributeur de pastilles adhésives (500 coins photos, 12 x 13 mm) Noir",Hama,,,"-100,00 %",,,"-100,00 %",,,"-100,00 %",,,"-100,00 %",,,"-100,00 %",,,
B0CP86445V,"Black Rock Coque pour iPhone 15 Pro 360° Glass Double Face, Antichoc [Etui Housse 360 Degrés] [Coque iPhone Compatible Charge sans Fil] - Noir Carbon","Black Rock",,,"-100,00 %",,,"-100,00 %",,,"-100,00 %",,,"-100,00 %",,,"-100,00 %",,,
B005VNYY2Q,"Hama Cadre pour Portrait Photo Philadelphia, 15 x 20 cm",Hama,,,"-100,00 %",,,"-100,00 %",,,"-100,00 %",,,"-100,00 %",,,"-100,00 %",,,
B0BHT6KMV5,"Hama Multiprise, 5 Prises, USB-A 17 W, 1,4 m, Blanc",HAMA,,,,,,,,,,,,,,,,,,
B0CYN65VFL,"Hama Performance 10 - Batterie Externe [Power Bank 10 000mAh] [Batterie Portable USB C Fast Charge] Compatible avec Les iPhones Samsung et Bien Plus - Gris Anthracite",Hama,,"-100,00 %",,,"-100,00 %",,,"-100,00 %",,,"-100,00 %",,,"-100,00 %",,,,
B071ZVMT5F,"Hama Album photo à pochettes ""Fern"" (format album de 11,7 cm x 12,7 cm, pour 56 instantanés, photos jusqu'à 5,4 cm x 8,6 cm, 28 pages, élégant, insertion latérale) Multicolore",Hama,,"-100,00 %",,,"-100,00 %",,,"-100,00 %",,,"-100,00 %",,,"-100,00 %",,,,
B09FBZL9TN,"Hama Coque iPhone 12/12 Pro Compatible MagSafe MagCase Finest Feel Pro pour Apple (Etui magnétique pour Recharge à Induction, Housse Protection Chocs Rayures et saletés, TPU Mate Soyeuse) Bordeaux",Hama,,,"-100,00 %",,,"-100,00 %",,,"-100,00 %",,,"-100,00 %",,,"-100,00 %",,,
B0002W697E,"Hama Cordon d’alimentation (Euro à 2 pôles de 2,5 m, droit, fiche d'alimentation à double prise Euro 8 avec contact de protection de terre) Noir",Hama,,,,,,,,,,,,,,,,,,
B01LZMRH3M,"Lampe de poche LED ""Professional 1"", 100 lumens",Hama,,,"-100,00 %",,,"-100,00 %",,,"-100,00 %",,,"-100,00 %",,,"-100,00 %",,,
B002QPNGG2,"Hama Cadre Photo Bristol pour Portrait (Taille de Cadre 10x15 cm, Taille de Photos 10x15 cm, Photos Format Horizontal ou Vertical, en métal, 1 Photo par Cadre, élégant, Simple, Classique) Argent",Hama,,,"-100,00 %",,,"-100,00 %",,,"-100,00 %",,,"-100,00 %",,,"-100,00 %",,,"-100,00 %"
B001N5705Y,"Hama Plateau tournant pour téléviseur (jusqu'à 60 kg, pivotable à 360°, 80 x 40 cm, verre) Noir",Hama,,,"-100,00 %",,,"-100,00 %",,,"-100,00 %",,,"-100,00 %",,,"-100,00 %",,,"-100,00 %"
B08NCWQRM6,"Hama Adaptateur vidéo, 2 en 1, f. DisplayPort - Port VGA et HDMI™, Ultra-HD 4K, Métal, Garantie 10 Ans, Noir",HAMA,,"-100,00 %",,,"-100,00 %",,,"-100,00 %",,,"-100,00 %",,,"-100,00 %",,,"-100,00 %",
B08YS1VP2M,"Hama Détecteur Qualité de l’Air Intérieur Safe (Détecteur 3 en 1, Détecteur de CO², Température ambiante, Humidité de l’air, Compact, Rechargeable Micro-USB) Noir",Hama,,,,,,,,,,,,,,,,,,
B0C8SYMDB7,"uRage Casque Micro Gaming (Casque Over-Ear Gamer, certifié DTS X, Micro Flip to Mute, Cable Jack Uflex Amovible, Casque de Jeu Micro Multi-Plateformes PC/PS/Xbox/Nintendo Switch) Blanc",uRage,,"-100,00 %",,,"-100,00 %",,,"-100,00 %",,,"-100,00 %",,,"-100,00 %",,,,
B0015L7I9E,"Hama Films pour plastifieuse à chaud, DIN A4, 80µ, 25 pièces",Hama,,,"-100,00 %",,,"-100,00 %",,,"-100,00 %",,,"-100,00 %",,,"-100,00 %",,,
B077CWDNM4,"Hama Câble de charge pour manette ""Basic"" (pour PS4, 1,50 m, câble extra-long, connexion microUSB) Noir",Hama,,,"-100,00 %",,,"-100,00 %",,,"-100,00 %",,,"-100,00 %",,,"-100,00 %",,,
B07CH5MF6F,"Hama Lampe col de Cygne pour Ordinateur (Lampe de Lecture/Bureau/Ordinateur, USB, 10 LED, capteur Tactile, Lampe à col de Cygne, Flexible, lumière pour éclairage de Bureau/Clavier) Argent",Hama,,,"-100,00 %",,,"-100,00 %",,,"-100,00 %",,,"-100,00 %",,,"-100,00 %",,,"-100,00 %"
B09GLFZLFF,"Hama Coque iPhone 13 Mini Compatible MagSafe MagCase Safety pour Apple (Etui magnétique pour Recharge à Induction, Housse Protection Chocs Rayures et saletés, en TPU) Transparent",Hama,,"-100,00 %","-100,00 %",,"-100,00 %","-100,00 %",,"-100,00 %","-100,00 %",,"-100,00 %","-100,00 %",,"-100,00 %","-100,00 %",,,
B002YGS7L2,"Hama Tube pour câbles (faisceau de câbles, forme en spirale, longueur 2 mètres, diamètre 25 mm) Noir",Hama,,,,,,,,,,,,,,,,,,
B0002W5VS2,"Hama 17495 Accessoire audio Etui Wallker pour baladeur CD + 12 CD + accessoires (piles, casques) Passant ceinture Bandoulière Bleu / Noir",Hama,,,,,,,,,,,,,,,,,,
B08SF6Z9GL,"uRage Clavier Gaming Exodus 100"" (Clavier Gamer Silencieux, Anti-Ghosting, Win-Lock, Filaire, AZERTY, Repose Poignet intégré, 12 Touches Fonctions multimédia) Noir",uRage,,,"-100,00 %",,,"-100,00 %",,,"-100,00 %",,,"-100,00 %",,,"-100,00 %",,,
B001N5ATD4,"Hama Plateau tournant pour téléviseur (jusqu'à 60 kg, pivotable à 360°, 60 x 40 cm, Verre) Noir",Hama,,,"-100,00 %",,,"-100,00 %",,,"-100,00 %",,,"-100,00 %",,,"-100,00 %",,,"-100,00 %"
B08SFFMLDC,"Hama Câble DisplayPort 2m Ultra HD 8K 4K Garantie 30ANS (DP 1.4,HDR, Alu, Contacts Plaqués Or, Gaine Renforcée Fibre Aramide, pour ASUS, Dell, Acer, Carte Graphique, Console de jeu) Noir",Hama,,,"-100,00 %",,,"-100,00 %",,,"-100,00 %",,,"-100,00 %",,,"-100,00 %",,,
B003KKVSYE,"Porte-étiquette à bagage, lot de 2, noir",Hama,,,,,,,,,,,,,,,,,,
B09ZVGB52Y,"Hama Housse Rigide pour Ordinateur Portable jusqu'à 15,6"" (Sacoche pour Tablette, Ordinateur Portable pour Ordinateur Portable, Tablette, MacBook, Surface jusqu'à 15,6"") Noir",Hama,,"-100,00 %",,,"-100,00 %",,,"-100,00 %",,,"-100,00 %",,,"-100,00 %",,,,
B0CYN666QG,"Hama Color 10 - Batterie Externe [Power Bank 10 000mAh] [Batterie Portable USB C Fast Charge], Compatible avec Les iPhones Samsung et Bien Plus - Vert",Hama,,"-100,00 %",,,"-100,00 %",,,"-100,00 %",,,"-100,00 %",,,"-100,00 %",,,,
B00006JD4I,"Hama Kit de Montage Autoradio (Cadre de Montage Universel, Adaptateur Entretoise d'Autoradio, Support Autoradio, Baie de Montage au Standard ISO pour Voiture, Camping Car, Caravane) Noir",Hama,,,"-100,00 %",,,"-100,00 %",,,"-100,00 %",,,"-100,00 %",,,"-100,00 %",,,
B000L9MVPC,"Hama Chemin de câbles (bande en PVC/Aluminium pour montage mural TV ou au sol, cache-câble demi-rond, 100 x 3,5 x 0,9 cm, entrée de câble jusqu'à 2 câbles) Gris",Hama,,,"-100,00 %",,,"-100,00 %",,,"-100,00 %",,,"-100,00 %",,,"-100,00 %",,,
B0CT8V1BJC,"Hama Support Vidéoprojecteur Plafond et Mur Garantie 10ans (Rotatif 360°, Inclinable +-30°, Charge Max 15 kg, Easy Fix, Réglable en Hauteur 44 à 63.4cm) Blanc",Hama,,"-100,00 %",,,"-100,00 %",,,"-100,00 %",,,"-100,00 %",,,"-100,00 %",,,,
B0B59SNRHP,"Hama Housse Ordinateur 13.3 Pouces (Pochette Ordinateur Neoprene, Protection Laptop, jusqu'à 34 cm) Noire",Hama,,"-100,00 %",,,"-100,00 %",,,"-100,00 %",,,"-100,00 %",,,"-100,00 %",,,,
B08SF2GK19,"Hama Radio Internet Dab/Dab+/FM Bluetooth 'DIR355SBT' (Radio de Cuisine numérique WiFi, AUX, Radio-réveil, Compatible Spotify Connect, UNDOK App Control pr Smartphone ou Tablette) Blanc",Hama,,,"-100,00 %",,,"-100,00 %",,,"-100,00 %",,,"-100,00 %",,,"-100,00 %",,,
B0DGL87285,"Hama Coque pour iPhone 16 Pro Max Eco Premium [Housse de Protection avec Rangement Carte] [Etui à Rabat] [Housse Cuir Synthétique] [Etui en matériaux recyclés] - Noir",Hama,,"-100,00 %",,,"-100,00 %",,,"-100,00 %",,,"-100,00 %",,,"-100,00 %",,,,
B00FQOM18E,"Hama Horloge murale ""PG-220"", Mécanisme silencieux, Noir",Hama,,,,,,,,,,,,,,,,,,"-100,00 %"
B08G4SCWQG,"Hama 90W Chargeur Rapide Universel pour PC Portable 12-22V - [8 Adaptateurs] [Protection Contre la surchauffe & sur-tensions] [Temoin LED] Noir",Hama,,,"-100,00 %",,,"-100,00 %",,,"-100,00 %",,,"-100,00 %",,,"-100,00 %",,,"-100,00 %"
B00006JAPR,"Hama Câble d'alimentation secteur (norme européenne, bi-polaire, Euro à 2 broches, droit, fiche d'alimentation sur prise double Euro, 1,5 m) Noir",Hama,,,"-100,00 %",,,"-100,00 %",,,"-100,00 %",,,"-100,00 %",,,"-100,00 %",,,
B01L8U0XXY,"Hama Étui portefeuille ""Smart Move"" (taille XXL, de 5,2 à 5,8 pouces) Noir",Hama,,,"-100,00 %",,,"-100,00 %",,,"-100,00 %",,,"-100,00 %",,,"-100,00 %",,,
B07CH2QZ83,"Hama Album photo grand format ""Decori II"" (album de 30 x 30 cm, à coller de 400 photos format 10 x 15 cm, 100 pages (4 photos/page), pas d'inscription) Bleu",Hama,,,"-100,00 %",,,"-100,00 %",,,"-100,00 %",,,"-100,00 %",,,"-100,00 %",,,"-100,00 %"
B000L9RXRS,"Hama Testeur de batteries/piles ""BT2"" (Testeur de batterie Universel pour piles et batteries, appareil de test avec afficheur LCD de la tension résiduelle et test de la pile bouton) Gris",Hama,,,"-100,00 %",,,"-100,00 %",,,"-100,00 %",,,"-100,00 %",,,"-100,00 %",,,
B015U4F6UO,"Hama Support mural (pour enceinte, support d'enceinte, pour un alignement et une présentation optimaux de l'enceinte, montage mural) Blanc",Hama,,,"-100,00 %",,,"-100,00 %",,,"-100,00 %",,,"-100,00 %",,,"-100,00 %",,,
B01LHWXYZC,"Hama Antivol Velo, Cadenas de velos 120cmx12mm (Câble Antivol pour Vélo Scooter Motos Portail Poussette, Combinaison 4 Chiffres,Verrouillage à Vélo Antivol) Noir",Hama,,"-100,00 %",,,"-100,00 %",,,"-100,00 %",,,"-100,00 %",,,"-100,00 %",,,,
B00FON9CXO,"Hama Clé USB 2.0 ""Hook-Style"", 32 GB, 15 MB/s, vert",UNKNOWN,,"-100,00 %","-100,00 %",,"-100,00 %","-100,00 %",,"-100,00 %","-100,00 %",,"-100,00 %","-100,00 %",,"-100,00 %","-100,00 %",,,
B08SDYPYPK,"Lecteur de Cartes USB All in One, USB-A, USB 3.0",Hama,,"-100,00 %",,,"-100,00 %",,,"-100,00 %",,,"-100,00 %",,,"-100,00 %",,,,
B000KJPE4I,"Hama Cadre photo ""Clip-Fixe"" (sans bordure, 70 x 100 cm, Reflex) Blanc",Hama,,,"-100,00 %",,,"-100,00 %",,"-100,00 %",,,"-100,00 %",,,"-100,00 %",,,"-100,00 %",
B096XM2WGL,"Hama Ecouteurs Bluetooth sans Fil Freedom Light (Ecouteurs TWS, Micro, Ecouteurs Intra Auriculaire, Station de Charge, Grande Autonomie, USB-C, Charge Rapide, Controle Vocale+Tactile) Vert",Hama,,,"-100,00 %",,,"-100,00 %",,,"-100,00 %",,,"-100,00 %",,,"-100,00 %",,,
B00006J9Z4,"Hama Tête à rotule (rotule, filetage 1/4"" (6,4 mm) et 3/8"" (9,5 mm), convient pour trépied, 50 mm de hauteur, inclinaison de 90 degrés et une rotation de 360 ​​degrés) Noir/Argent",Hama,,,,,,,,,,,,,,,,,,
B000UL2MNM,"Hama Coupeuse à molette ""Easy Cut R 320"" (Massicot, 5 mm, 32 cm, 0,5 mm) Noir/Argent",Hama,,"-100,00 %","-100,00 %",,"-100,00 %","-100,00 %",,"-100,00 %","-100,00 %",,"-100,00 %","-100,00 %",,"-100,00 %","-100,00 %",,,
B0C5JMQJ2G,"Hama C-Rotate Pro Clé USB 3.1 - Flash Drive 256 Go, Vitesse jusqu'à 100 Mo/s, Clef avec connecteurs USB A & USB C, pour PC/Mac/Tablette et Smartphone - Argentée",Hama,,"-100,00 %",,,"-100,00 %",,,"-100,00 %",,,"-100,00 %",,,"-100,00 %",,,,
B077MRBLYN,"Hama Filtre de polarisation (polarisant circulaire, verre supérieure, diamètre du filetage de 77 mm, Epaisseur de la monture de 4,5 mm, filetage avant, NMC16 (nano multi-coated 16 couches)) Noir",Hama,,,"-100,00 %",,,"-100,00 %",,,"-100,00 %",,,"-100,00 %",,,"-100,00 %",,,
B09ZBDK7TR,"Hama ""Spirit Pocket Ecouteurs Bluetooth® sans Fil USB C - Intra-Auriculaire, 30H d'Autonomie, Contrôle Tactile, Microphone Intégré, Suppression Passive du Bruit - Blanc",Hama,,,,,,,,,,,,,,,,,,
B00005KHU3,"Hama Pare-soleil caoutchouté pour objectifs standard, 67mm",Hama,,,"-100,00 %",,,"-100,00 %",,,"-100,00 %",,,"-100,00 %",,,"-100,00 %",,,
B07NKM3V9Q,"Étui à Rabat Smart Case pour Huawei P30, Noir",Hama,,,"-100,00 %",,,"-100,00 %",,,"-100,00 %",,,"-100,00 %",,,"-100,00 %",,,
B000X9Z4AE,"Xavax Colliers de serrage (jeu de 2 colliers de serrage avec entraînement par vis sans fin, plage de serrage 110 - 130 mm, largeur de courroie 9 mm) Argent",xavax,,,"-100,00 %",,,"-100,00 %",,,"-100,00 %",,,"-100,00 %",,,"-100,00 %",,,
B07YVNTRXQ,"Hama Réveil à Projection 'Plus Charge' (Projection de l'heure sur Le Plafond, pivotable 360°, Radio piloté DCF, Thermomètre, Hygromètre, Port USB de Charge) Noir",Hama,,"-100,00 %",,,"-100,00 %",,,"-100,00 %",,,"-100,00 %",,,"-100,00 %",,,,
B01DZGI4I0,"Hama Chiffon de nettoyage ""Pocket"" (pour le nettoyage, en microfibre, pour appareil photo/objectif/filtre/lunettes, 15 x 15 cm, dans une pochette pratique en néoprène avec mousqueton) Noir/Gris",Hama,,"-100,00 %","-100,00 %",,"-100,00 %","-100,00 %",,"-100,00 %","-100,00 %",,"-100,00 %","-100,00 %",,"-100,00 %","-100,00 %",,,
B0BL1TWBNY,"Hama Support Téléphone Voiture Move (Support téléphone pour Voiture à Ventouse, pivotable 360°, Support de Voiture pour Smartphones de 5,5 à 8,5 cm de Largeur) Noir",Hama,,,"-100,00 %",,,"-100,00 %",,,"-100,00 %",,,"-100,00 %",,,"-100,00 %",,,
B01CPBN4O0,"Hama Étui Portefeuille Strap pour tablettes Jusqu’à 17,8 cm (7""), Noir",Hama,,"-100,00 %",,,"-100,00 %",,,"-100,00 %",,,"-100,00 %",,,"-100,00 %",,,,
B00009VMO5,"Hama Boîtier double (pour DVD, convient également aux CD et disques Blu-ray, avec film pour l'insertion de la jaquette, lot de 10) Noir",Hama,,,,,,,,,,,,,,,,,,
B000PGIK6K,"Hama Adaptateur de prise de courant (adaptateur de contact, jusqu'à 3500 watts, protection enfant, avec interrupteur marche/arrêt) Blanc",Hama,,,"-100,00 %",,,"-100,00 %",,,"-100,00 %",,,"-100,00 %",,,"-100,00 %",,,
B007M6NDS6,"Hama Répartiteur satellite (2 voies, totalement blindé, distributeur Sat, Protection totale, Sat, Coulage en F, Easy-Open) Argent",Hama,,,,,,,,,,,,,,,,,,
B08H7ZZHWV,"Hama Prise connectée wifi ""Mini"" (Prise intelligente 16A, 3680W, Compteur de consommation en temps réel, compatible Alexa, Google Home, Commande vocale, automatisations faciles) Blanc",Hama,,"-100,00 %",,,"-100,00 %",,,"-100,00 %",,,"-100,00 %",,,"-100,00 %",,,,
B0C7D7G358,"Hama Chargeur Manette Nintendo Switch Joy-Con avec Témoin LED (Station de Charge pour 4 Joycons, Socle et Support de Charge Rapide USB pour Accessoires Switch) Noir",Hama,,"-100,00 %",,,"-100,00 %",,,"-100,00 %",,,"-100,00 %",,,"-100,00 %",,,,
B007C3BG5Q,"Hama Tapis de souris aspect cuir (22 x 18 cm, Tapis de souris Office aspect cuir, glisse optimale, dessous antidérapant) Noir",Hama,,,"-100,00 %",,,"-100,00 %",,,"-100,00 %",,,"-100,00 %",,,"-100,00 %",,,
B08NFHQ21K,"Hama Coque iPhone 12 Mini Crystal Clear pour Apple (Coque Transparente iPhone 12 Mini en TPU, Coque de Protection Souple, Protection téléphone Portable avec Surface antidérapante) Transparent",Hama,,"-100,00 %","-100,00 %",,"-100,00 %","-100,00 %",,"-100,00 %","-100,00 %",,"-100,00 %","-100,00 %",,"-100,00 %","-100,00 %",,,"-100,00 %"
B0CRYZPCZN,"Hama Support TV Autoportant Pivotant Inclinable Réglable en Hauteur Garantie 10 Ans (Pied TV à Poser 32"" à 65"", 165cm 40kg Max, Orientable 70°, VESA 600x400 Max, Easy Fix, Materiel de Montage) Noir",Hama,,"-100,00 %",,,"-100,00 %",,,"-100,00 %",,,"-100,00 %",,,"-100,00 %",,,,
B0079R5LL0,"Hub USB 2.0, 1:4, alimenté par Bus, Noir",Hama,,,"-100,00 %",,,"-100,00 %",,,"-100,00 %",,,"-100,00 %",,,"-100,00 %",,,
B01DZGIH5U,"Hama Support mural TV TILT inclinable pour TV écran de 81cm à 165cm (32"" à 65""), Vesa jusqu'à 400x400, Noir",Hama,,,"-100,00 %",,,"-100,00 %",,,"-100,00 %",,,"-100,00 %",,,"-100,00 %",,,
B00006IVB3,"Hama Bague d'adaptation (en métal, pour monter un Filtre de 37 mm sur un Objectif de 37 mm) Noir",Hama,,"-100,00 %",,,"-100,00 %",,,"-100,00 %",,,"-100,00 %",,,"-100,00 %",,,,
B00006JBBN,"Hama Bague d'adaptation (en métal, pour monter un Filtre 82 mm sur un Objectif 77 mm) Noir",Hama,,"-100,00 %",,,"-100,00 %",,,"-100,00 %",,,"-100,00 %",,,"-100,00 %",,,,
B003LTPG4C,"Hama Chemin de câbles (bande en aluminium pour montage mural TV ou au sol, cache-câble rectangle, 110 x 3,3 x 1,7 cm, entrée de câble jusqu'à 5 câbles, matériel de montage compris) Blanc",Hama,,"-100,00 %","-100,00 %",,"-100,00 %","-100,00 %",,"-100,00 %","-100,00 %",,"-100,00 %","-100,00 %",,"-100,00 %","-100,00 %",,,"-100,00 %"
B000VRHJGK,"Hama Câble HDMI / HDMI 1.3 OR 2 m",Hama,,,,,,,,,,,,,,,,,,
B09GLC41WX,"Hama Coque iPhone 13 Étui Portefeuille Slim Pro pour Apple, Noir",Hama,,,"-100,00 %",,,"-100,00 %",,,"-100,00 %",,,"-100,00 %",,,"-100,00 %",,,
B000S8B51C,"Hama Pochettes-classeurs (pour CD/DVD, Couvre classeur à Anneaux, 2 par Pochette, Lot de 50) Blanc/Transparent",Hama,,,"-100,00 %",,,"-100,00 %",,,"-100,00 %",,,"-100,00 %",,,"-100,00 %",,,"-100,00 %"
B00006JCXU,"Hama Câble vidéo/audio (câble péritel mâle - 3 RCA mâles (vidéo et stéréo), avec bouton In/Out, longueur de câble de 1,5m) Noir/Rouge/Jaune/Blanc",Hama,,,"-100,00 %",,,"-100,00 %",,,"-100,00 %",,,"-100,00 %",,,"-100,00 %",,,"-100,00 %"
B00005QF87,"Hama Filtre UV (390 (O-Haze) HTMC Ø 77 mm) Noir",Hama,,,"-100,00 %",,,"-100,00 %",,,"-100,00 %",,,"-100,00 %",,,"-100,00 %",,,
B015U4FUD2,"Hama Support mural (pour enceinte, support d'enceinte, pour un alignement et une présentation optimaux de l'enceinte, montage mural) Noir",Hama,,,"-100,00 %",,,"-100,00 %",,,"-100,00 %",,,"-100,00 %",,,"-100,00 %",,,
B0089CJZ4S,"Hama Support mural TV Fixe (Pour diagonale d’écran de 81 à 191cm (32"" à 75""), pour un maximum de 60 kg, VESA jusqu'à 800 x 400, 3 étoiles) Noir",Hama,,"-100,00 %","-100,00 %",,"-100,00 %","-100,00 %",,"-100,00 %","-100,00 %",,"-100,00 %","-100,00 %",,"-100,00 %","-100,00 %",,,
B00NCX4S1E,"Hama Perche télescopique ""Selfie 90"" (tige de télescope de voyage à tête inclinable pour smartphones, appareils photo et caméras d'action GoPro, monopode) Noir",UNKNOWN,,"-100,00 %","-100,00 %",,"-100,00 %","-100,00 %",,"-100,00 %","-100,00 %",,"-100,00 %","-100,00 %",,"-100,00 %","-100,00 %",,,"-100,00 %"
B00194HCBG,"Cadre métallique pour portrait ""Laval"", 2x 13x18 cm",Hama,,"-100,00 %","-100,00 %",,"-100,00 %","-100,00 %",,"-100,00 %","-100,00 %",,"-100,00 %","-100,00 %",,"-100,00 %","-100,00 %",,,
B003TQY5YY,"Hama Pochette Up To Fashion (pour 24 disques, CD/DVD/Blu-ray/livres audio, étui de rangement, gain de place pour la voiture, la maison, avec motif rond) Rouge",Hama,,,"-100,00 %",,,"-100,00 %",,,"-100,00 %",,,"-100,00 %",,,"-100,00 %",,,
B007205CJK,"Hama Tapis de Souris Ergonomique (Tapis de Souris Ergonomique, 210 x 255 x 21 mm, Repose-Poignet Confortable, Tapis antidérapant, Convient aux Ordinateurs) Noir",Hama,,"-100,00 %","-100,00 %",,"-100,00 %","-100,00 %",,"-100,00 %","-100,00 %",,"-100,00 %","-100,00 %",,"-100,00 %","-100,00 %",,,"-100,00 %"
B007C3B8ZO,"Hama Veilleuse nocturne ""Amber"" (LED pour la chambre d'enfants, économie d'énergie, seulement 0,2 W, lampe d'orientation pour couloir et cave, éclairage d'ambiance, lampe de nuit, fiche Euro) Ambre",Hama,,,"-100,00 %",,,"-100,00 %",,,"-100,00 %",,,"-100,00 %",,,"-100,00 %",,,
B075V1NGDZ,"Hama Trépied Delta Duo 170', 3D",Hama,,"-100,00 %",,,"-100,00 %",,,"-100,00 %",,,"-100,00 %",,,"-100,00 %",,,,
B0CYMZ5J2S,"Hama Performance 24 - Batterie Externe [Power Bank 24 000mAh] [Batterie Portable USB C Fast Charge] Compatible avec Les iPhones Samsung et Bien Plus - Gris Anthracite",Hama,,"-100,00 %",,,"-100,00 %",,,"-100,00 %",,,"-100,00 %",,,"-100,00 %",,,,
B0C7D6WVQG,"Hama Chargeur Secteur USB-C 30W (Adaptateur Secteur USB-C, Charge Rapide, PD/Qualcomm®/GaN, Mini-Chargeur Laptop Tablette Smartphone PowerBank, iPhone, iPad Pro MacBook Air Samsung Galaxy) Blanc",Hama,,,"-100,00 %",,,"-100,00 %",,,"-100,00 %",,,"-100,00 %",,,"-100,00 %",,,
B00838A26S,"Hama Rotate Clé USB 2.0 - Flash Drive 64 Go, Vitesse jusqu'à 15 Mo/s, Clef avec connecteur USB A, pour PC/Mac - Noire/Argenté",Hama,,,"-100,00 %",,,"-100,00 %",,,"-100,00 %",,,"-100,00 %",,,"-100,00 %",,,
