Programme=[Retail],Aperçu du distributeur.=[Fabrication],Afficher par=[ASIN],Pays=[FR],Entreprises=[~ Hama EURL (FR)],Local=[fr_FR],Devise=[EUR],Intervalle des rapports=[Semaine],Champ de vision.=[02/02/2025 - 08/02/2025],Rapport mis à jour=[21/03/2025]
ASIN,"Nom du produit",Marque,"Chiffre d’affaires basé sur les commandes","Unités commandées","Chiffre d’affaires basé sur les expéditions","COGS expédié","Unités expédiées","Retours client"
B00005QFCJ,"Hama Adaptateur Cassette VHS-C/VHS (Convertisseur Vidéo VHS C vers VHS, Cassette Adaptatrice Motorisée pour magnétoscope, 6 Mm, Non Compatible 8mm/MiniDV/Hi8) Noir",Hama,"3 139,92 €",126,"3 239,60 €","2 663,70 €",130,21
B00D2S92L0,"Xavax Hama Boîte de transport pour un gâteau (boîte rond, Ø 31,5 x 8cm, avec diviseur, capote et compartiments, partie de service et gâteau de gâteau) Anthracite/Transparent",xavax,"1 149,44 €",82,"1 107,47 €","559,26 €",78,5
B08B3QTPMF,"Hama Support TV Design Chevalet pour téléviseur de 37 à 75"" - 94 à 191cm (Hauteur réglable, Acier laqué, Compact Moderne et Contemporain, Compatible VESA) Blanc",Hama,"976,10 €",10,"976,10 €","1 009,80 €",10,
B0764LMPBN,"Hama Multiprise avec Interrupteur 10 Prises 16A (Rallonge multiprises 3m, Bloc 10 Prises Type F Schuko, 3500W Max, Idéal Bureau PC luminaires, Atelier, Meuble TV, Garage) Noir",Hama,"899,64 €",54,"816,34 €","507,64 €",49,
B0BNLLF6YV,"Hama iTuner Hi-FI DIT2105SBTX Dab+ Bluetooth (Tuner Internet Radio FM Dab, Tuner HiFi, Radio numérique, RX/TX, WiFi, Spotify Connect, Amazon Music, App UNDOCK, Port USB, télécommande) Noir",Hama,"796,68 €",4,"796,68 €","809,68 €",4,
B01N6NQ73J,"Thomson Casque TV avec câble extra long (Casque d'écoute ajustable et rembouré, Cordon 8m, Idéal pour regarder la télé, écouter la musique, contrôle du volume, prise jack 3,5mm+adaptat. 6,35mm) Noir",Thomson,"659,52 €",36,"604,56 €","363,28 €",33,7
B08GSRV3PB,"Hama Tête Thermostatique Connectée et Intelligente WiFi (pour Kit de Chauffage Connecté 00176592 Compatible Alexa Google Home, Robinet Intelligent pour Radiateur à Eau Chaude) Blanc",Hama,"653,22 €",18,,,,1
B07GLF5SMF,"Hama Album Photo ""Fine Art"" (format 30 x 30 cm, 100 pages noires, sans spirale) Noir",Hama,"529,62 €",22,"771,96 €","320,96 €",32,
B00SL6I2WI,"Hama Album Photo Jumbo ""Fine Art"" (Album 30x30cm, 50 feuilles/100 pages blanches, pour coller 400 Photos de 10x15 cm, Look livre sans spirale, Couverture personnalisable, Idée cadeau) Noir",Hama,"468,64 €",29,"241,28 €","121,52 €",15,1
B00005QFAY,"Hama Étuis à négatifs, Papier Cristal, 7 Bandes de 6 négatifs, 24x36cm, 100 pièces",Hama,"425,92 €",16,"372,68 €","224,49 €",14,
B00006IVA8,"Hama Cassette de Nettoyage VHS pour MAGNETOSCOPE (Nettoyeur de tête vidéo lecteurs VHS/S-VHS/VHS-C/S-VHS-C, Liquide de Nettoyage Inclus, Nettoyant de Têtes Vidéo - K7 Nettoyage VHS) Noir",Hama,"419,76 €",53,"419,76 €","482,30 €",53,
B08GRRDVN9,"Hama Destructeur de Documents Mini S6 (Broyeur Documents 6 Feuilles 80g, Destructeur Papier, Déchiqueteur sécurité P1, 72 DB, M/A Auto, Fonction Retour, s'adapte sur des Corbeilles à Papier) Noir",Hama,"396,32 €",14,"472,10 €","277,75 €",18,1
B00006JDEX,"Hama Plateau Universel Hama Rond (32 cm, Taille L, Poids supporté 80 kg (idéal pour TV, Enceintes, écrans, appareils de Cuisine) Noir",Hama,"379,82 €",20,"360,37 €","178,34 €",19,
B0009V6Q30,"Hama Boîtier Slim (pour CD et disques Blu-ray, ultra mince, avec une feuille pour la couverture, lot de 25) Transparent/Bleu/Orange/Vert/Rouge/Violet",Hama,"339,66 €",34,"289,71 €","234,61 €",29,
B08GS8FVB5,"Hama Destructeur de Documents Basic S6 (Broyeur de Documents, Sécurité P-2, 6 Feuilles, Corbeille 8L, Découpe en Bandes 6mm, 70 DB, M/A Auto, Idéal Bureau & Maison) Noir",Hama,"332,13 €",12,"390,39 €","253,40 €",14,1
B097HN8V5V,"Hama Câble d'Antenne TV (Cable TV Coaxial Mâle - Coaxial Femelle, 85 db, 1.5m, Connexion d'un Téléviseur vers une Fiche TV Murale ou vers un Décodeur) Blanc",Hama,"329,21 €",99,"411,86 €","391,16 €",129,
B0002W5WBS,"Hama Boîtier Slim (pour CD et disques Blu-Ray, Ultra Mince, avec Une Feuille pour la Couverture, Lot de 50) Noir/Transparent",Hama,"274,12 €",11,"247,60 €","125,00 €",10,
B0002W5WE0,"Hama Boîtier Slim Double (pour DVD, Convient également aux CD et disques Blu-Ray, Ultra Mince, avec Une Feuille pour la Couverture, Lot de 25) Noir/Transparent",Hama,"265,46 €",15,"368,83 €","232,05 €",21,
B07BGLLS26,"Chiffons pour écrans, 100 pièces, dans un distributeur",Hama,"263,12 €",31,"295,10 €","146,17 €",36,
B00005UPC8,"Hama Boîtier standard double (pour CD et disques Blu-Ray, Étui protecteur pour CD, paquet de 10) Transparent",Hama,"259,74 €",26,"229,77 €","154,33 €",23,1
B000N8UX88,"Hama Trépied Appareil Photo Star 20""",Hama,"254,11 €",46,"215,52 €","134,94 €",39,
B06XB2Y8KR,"Hama Album traditionnel ""Lazise"" (taille de l'album de 22,5 x 22 cm, pour 200 photos au format 10 cm x 15 cm, 100 pages, avec pochette CD, élégant) Blanc/Noir/Rose",Hama,"244,72 €",28,"209,76 €","133,94 €",24,
B0BNLNC6KX,"Hama iTuner Hi-FI DIT2105SBTX Dab+ Bluetooth (Tuner Internet Radio FM Dab, Tuner HiFi, Radio numérique, RX/TX, WiFi, Spotify Connect, Amazon Music, App UNDOCK, Port USB, télécommande) Argenté",Hama,"239,90 €",1,"239,90 €","204,00 €",1,
B000EORX5W,"Hama 00033833 Pochette, Noir (pour 120 CD/DVD/Blu-ray, classeur de rangement, gain de place pour le bureau, le salon et la maison, étuis de transport)",Hama,"236,86 €",13,"255,08 €","124,46 €",14,
B000EORX52,"Hama Boîtier Slim (pour CD et disques Blu-Ray, Ultra Mince, avec Une Feuille pour la Couverture, Lot de 25) Transparent",Hama,"224,77 €",13,"259,35 €","155,85 €",15,1
B0BXPLLW89,"Hama Classeur à négatifs (4 anneaux, niveau de remplissage 39 mm, feuilles rectangulaires, album à négatifs d'une pellicule photo, housse de protection) Noir",Hama,"224,64 €",27,"183,04 €","135,30 €",22,
B0949HMZB1,"Hama Chiffon Antistatique Antipoussière (Chiffon de Nettoyage pour Lunettes ou Appareil Photo, Objectif, Filtre, écrans PC Smartphone ou Tablette, négatifs, Diapositives, Jumelles, 23 x 25 cm) Orange",Hama,"220,02 €",27,"220,02 €","115,29 €",27,
B0009V8WNW,"Hama Pochettes de Protection (en Papier pour CD/DVD/Blu-Ray, verrouillables, Lot de 100) Blanc/Transparent",Hama,"219,34 €",22,"194,43 €","63,63 €",21,
B09MQQM1ZJ,"Xavax Socle machine à laver avec étagère (Support Sèche Linge Lave Linge,Réhausseur de Machines, Base universelle avec Pieds Réglables en hauteur, charge 150 kg) Blanc",Xavax,"205,40 €",2,"205,40 €","104,00 €",2,
B00005QFB0,"Hama Étuis à négatifs, papier cristal, 7 bandes de 6 négatifs, 24x36cm, 25 pièces",Hama,"203,45 €",18,"163,16 €","69,03 €",13,1
B00006JAMU,"Hama Étuis à négatifs, polypropylène, 7 bandes de 6 négatifs, 24x36cm, 25 pièces",Hama,"201,76 €",13,"217,28 €","143,55 €",14,
B0CYNHDSJ3,"Hama Ergo Tapis de Souris - Tapis de Bureau 2 en 1 avec Repose Poignet Intégré, Dessous Anti-Dérapant - Noir",Hama,"199,80 €",15,"106,56 €","92,48 €",8,
B001F536FK,"THOMSON Casque Audio Filaire (Casque Stéréo Filaire Jack, Réglable, Supra-aural, Ultra-léger, 54g, Coussinets 27mm, 95dB, Cable 1.3m, idéal PC Smartphone Mac Tablette Ordinateur) Noir",Thomson,"199,77 €",22,"199,77 €","114,40 €",22,2
B00AJKQ4YC,"Hama 2 Pieds Enceintes Universels (Supports Haut-Parleur, Hauteur réglable Max. 123 cm, antidérapant, Charge Max. 5 kg/Pied, câbles cachés, Haut-parleurs Hi-FI/Stéréo/Home Cinema) Noir",Hama,"198,24 €",3,"132,41 €","80,06 €",2,
B00G3BMWQA,"Xavax Minuteur à œuf (avec fonction minuterie, sablier, en acier inoxydable) Argent",xavax,"194,74 €",26,"202,23 €","155,61 €",27,1
B00006IVA9,"Hama CD de nettoyage (pour tête de lecture laser, pour éliminer la poussière dans les lecteurs de CD, CD de nettoyage au laser) Blanc/Bleu/Rouge",Hama,"191,64 €",20,"169,67 €","94,90 €",18,
B00006JAXW,"Hama Plateau Universel Hama Rond (40 cm, Taille XL, Poids supporté 100 kg (idéal pour TV, Enceintes, écrans, appareils de Cuisine) Noir",Hama,"183,33 €",7,"210,00 €","94,96 €",8,1
B0C5JQPC2P,"Classeur avec mécanisme à 4 anneaux, larg. 70 mm, avec étui, noir/gris",Hama,"183,20 €",10,"146,56 €","94,40 €",8,
B0C5JPTNCK,"Classeur avec mécanisme à 4 anneaux, largeur 70 mm, avec étui, blanc",Hama,"183,20 €",10,"183,20 €","129,90 €",10,
B08YS1PZWL,"Hama Adaptateur Jack 6.35 vers 3.5 Garantie 10 Ans (Adaptateur Audio 6.35mm Mâle vers 3.5mm Femelle, Stéréo, Prise Casque, Audio Connecteur Stéréo pour Mélangeur Audio/Piano électrique/Clavier) Noir",Hama,"182,76 €",38,"153,78 €","57,60 €",32,
B07SZ3FCZH,"Hama Album photo mémo ""Forest"" (pour 200 photos au format 10 x 15 cm, album traditionnel enfant de 22,5 x 22 cm, 100 pages blanches, animaux, élégant, emplacement CD) Marron/Beige/Vert/Orange/Jaune",Hama,"170,93 €",13,"154,73 €","61,39 €",12,1
B079PN72PJ,"Hama Souris Optique sans Fil Riano (Souris Gauche sans Fil, avec récepteur Nano USB, Vertical, 800-1600 dpi, Interrupteur de Marche/arrêt, 3 Boutons, 2,4 GHz) Noir",Hama,"167,07 €",11,"136,70 €","90,85 €",9,
B0002W5WBI,"Hama Boîtier Slim (pour CD et disques Blu-Ray, Ultra Mince, avec Une Feuille pour la Couverture, Lot de 100) Noir/Transparent",Hama,"165,78 €",5,"202,51 €","160,08 €",6,
B00T7MB37Q,"Hama Album photo à pochettes ""New York City"" (pour 300 photos au format 10 cm x 15cm, taille de l'album de 19 cm x 34,5 cm, 100 pages, en cuir, protège les photos et les documents) Noir",Hama,"160,31 €",9,"160,31 €","86,16 €",9,
B000V8QPQ4,"hama hama Câble d'antenne, prise coaxiale 75 db - prise coaxiale 10,0 m",Hama,"157,32 €",18,"122,36 €","56,84 €",14,2
B003LTSUN6,"Hama Chemin de câbles (bande en aluminium pour montage mural TV ou au sol, cache-câble rectangle, 110 x 3,3 x 1,7 cm, entrée de câble jusqu'à 5 câbles, matériel de montage compris) Noir",Hama,"155,43 €",9,"155,43 €","100,44 €",9,
B093WSK4SC,"Hama Radio Internet Dab/Dab+ 'DR200BT' (Radio numérique FM/Dab/Dab+ Portable, Haut Parleur Bluetooth Rechargeable USB-C, Ecran Couleur, Entrée AUX, Minuteur, 30 Présélections, 8h d'écoute) Noir",Hama,"153,00 €",4,"38,25 €","34,50 €",1,
B0009V6OD2,"Hama Boîtier Slim Double (pour CD et disques Blu-Ray, Ultra Mince, avec Une Feuille pour la Couverture, Lot de 25) Transparent",Hama,"149,94 €",9,"83,30 €","59,25 €",5,
B08SDTHMQB,"Hama Album Photo bébé ""Our Baby"" personnalisable Scrapbooking (Album photo naissance, baptême, Cadeau d'anniversaire enfant, Style Mémo, 22,5 x 22 cm, 100 Pages, Max. 200 Photos 10x15 cm) Multicolore",Hama,"148,58 €",17,"192,28 €","121,02 €",22,
B004LQ1PLW,"Hama Sacoche de Rangement Sportsline (Sacoche de projecteur, Ordinateur et disques durs, Taille L, 27 x 39 x 15 cm, rembourré, pour Acer, BenQ, Epson, LG, Optoma BeamerL) Noir",Hama,"146,28 €",4,,,,
B0000WXD16,"Hama Trépied Appareil Photo 160cm Star 62"" avec étui de Transport (Trépied Télescopique Aluminium, Tête 3 Voies 3D, Attache Rapide fournie, Niveaux à Bulles intégrés) Beige",Hama,"145,40 €",5,"145,40 €","116,61 €",5,
B00005YVGK,"Pochettes pour 20 Diapositives encadrées de Format 5x5 cm, 25 pièces",Hama,"139,60 €",8,"174,22 €","77,33 €",10,
B0BRL62B16,"Hama Multiprise Etanche 2 Prises 16A avec Interrupteur (Multiprise Extérieur Rallonge 2m, Bloc 2 Prises étanches IP44 avec Couvercle, Type F Schuko, 3680W, Idéal Jardin Garage Atelier Chantier) Noir",Hama,"139,52 €",8,"121,83 €","79,10 €",7,
B001E725JM,"Hama Blu-Ray de Nettoyage (pour tête de Lecture, pour éliminer la poussière dans Les lecteurs de Blu-Ray, Blu-Ray de Nettoyage) Blanc/Bleu/Rouge",Hama,"137,28 €",8,"102,96 €","79,56 €",6,
B000TSO2AM,"Hama Pochette (pour 104 CD/DVD/Blu-Ray, classeur de Rangement, Gain de Place pour Le Bureau, Le Salon et la Maison, étuis de Transport) Noir",Hama,"134,49 €",9,"119,07 €","59,02 €",8,
B00006J6HP,"Hama Casier de rangement Spirit II (système de classement sur socle pour CD, pour 44 boîtiers CD, porte-CD pour le rangement, organisateur antidérapant) Noir",Hama,"133,35 €",7,"133,35 €","57,19 €",7,
B01K47GW46,"Hama Album photo Jumbo ""La Fleur"" 30 x 30 cm (livre photo de 100 pages blanches, album photos souvenirs pour 400 photos au format 10x15 cm, à personnaliser- à coller, Idée Cadeau, motif Feuilles) Noir",Hama,"133,24 €",9,"177,48 €","83,88 €",12,1
B096YFPTBR,"Hama Kit de Nettoyage d'Appareil Photo 4 en 1 ""Optic Dry (Kit de Nettoyage à Sec avec Stylo Lenspen + Chiffon Microfibre + Poire, pour Objectif Photo, Filtre, APN, Caméra Reflex, Jumelle, écran)",Hama,"132,00 €",8,"132,00 €","151,28 €",8,
B000VRFBM4,"Hama Album Photo ""Fine Art"" (format 36 x 32 cm, 50 pages noires, à spirale) Noir",Hama,"131,33 €",8,"98,09 €","48,99 €",6,2
B0000AI3G4,"Hama Cadre en plastique ""Madrid"" (taille de cadre de 50 cm x 70 cm, taille de la photo de 30 cm x 45 cm, 1 photo par cadre, à accrocher, élégant, simple, classique) Noir",Hama,"131,18 €",7,"149,92 €","77,44 €",8,1
B00RLNCZ52,"Hama Album photo ""Moni"" (pour 200 photos au format 10 x 15 cm, album photo bébé de 100 pages blanches, ciel, élégant, pour filles, enfants, bébés) Rose, petit album de taille 22,5 x 22,5 cm",Hama,"129,90 €",10,"117,57 €","55,26 €",9,
B00006JA17,"Hama Étuis à négatifs, Papier Cristal, 4 Bandes de 3 négatifs, 6X7 cm pour 3 negatif et jusqu'a 6 X 9 cm pour 2 negatif, 100 pièces",Hama,"129,48 €",6,"64,74 €","47,27 €",3,1
B0013IPAJY,"Hama Kit de Nettoyage et de réparation pour CD/DVD (25 ML de pâte de réparation, 45 ML de Liquide nettoyant, 1 Coque de Nettoyage, 5 Chiffons, 8 pièces) Blanc/Bleu/Rouge/Noir",Hama,"128,76 €",6,"193,14 €","129,87 €",9,
B000EBFN70,"Hama Trépied Appareil Photo Vidéo 106.5cm Star 5"" avec Sac de Transport (Trépied Télescopique Aluminium 4 éléments, Tête 3 Voies 3D, Niveaux à Bulles intégrés, Attache Rapide) Beige",Hama,"124,02 €",9,"109,94 €","86,82 €",8,1
B0CLD4V1MR,"Hama Support Mural TV Garantie 10ans (TV 37"" à 120"", VESA jusqu'à 1100 x 600, jusqu'à 100 kg, écran de 94 à 305 cm, Support Plat, Distance au Mur 2.8cm, avec Chevilles Fischer) Noir",Hama,"122,80 €",2,"122,80 €","88,02 €",2,
B07HY9LK8J,"Rapoo Clavier multimédia USB Filaire ""N2400"" (filaire, clavier d'ordinateur AZERTY, design, idéal pour les maladroits) Noir",Rapoo,"119,08 €",13,"109,92 €","115,20 €",12,
B07PSPRGMT,"THOMSON Casque TV HQ HED4508 (câble Extra Long de 8 m, Casque stéréo pour TV, réglage du Volume séparé, Embout Filaire, Prise 3,5 mm avec Adaptateur de 6,35 mm) Noir",Thomson,"118,48 €",4,"118,48 €","119,48 €",4,
B00006JAQ7,"Hama 007103 - Ruban photo transparent, Blanc, 1000 pièces (2 paquets de 500 pièces)",Hama,"118,00 €",23,"128,77 €","69,59 €",24,
B00006J4G7,"Hama Présentoir de Distributeur de pastilles adhésives (500 coins photos, diamètre de 10 mm, papier/viskose) Transparent",Hama,"109,56 €",33,"86,32 €","60,06 €",26,
B07ZDMHYMS,"Hama Clé USB C-Laeta (USB3.1/USB3.0 Type-C, 256GB, Double clé USB, pour Ordinateur Portable, téléphone Mobile, Tablette, OTG, 70 Mo/s, boîtier en métal, USB Type-C, clé de téléphone Portable) Argent",Hama,"105,39 €",3,"35,13 €","19,40 €",1,
B0032DAL6U,"Hama Album photo ''Catania'' (taille 22 x 22 cm pour 200 photos au format 10 x 15 cm, 100 pages, papier stratifié, thématique mariage/vacances, emplacement pour CD, personnalisable) Gris",Hama,"103,40 €",8,"66,14 €","24,85 €",5,
B01BBTCVKA,"Hama Album Photo ""Fine Art"" (format 30 x 30 cm, 100 pages blanches, sans spirale) Malibu",Hama,"101,16 €",7,"100,68 €","61,74 €",7,
B0C8SXMV3R,"Rapoo Clavier Souris sans Fil Multi-Mode Rechargeable Blade 9600M (Pack Kit Clavier+ Souris, Clavier Rechargeable AZERTY, Souris 3 Boutons, Bluetooth+ WiFi, Idéal PC, Laptop, Mac) Anthracite",Rapoo,"99,98 €",2,"99,98 €","81,90 €",2,
B07BZVN4MB,"Hama Radio numérique ""DR350"", FM/DAB/DAB+ (pour réception FM / DAB / DAB +,radio de cuisine sous comptoir, écran couleur, fonction d'alarme, fonctionnement sur secteur) Blanc",Hama,"98,90 €",1,"98,90 €","42,00 €",1,1
B000BGFJI6,"Hama Carte mémoire Photo (SD pour Photo/Classe 4, 2 GB - 10 MB/s) Bleu",Hama,"97,80 €",11,"85,93 €","49,00 €",10,
B00QKRKJCQ,"Hama Support De Télécommande Major (pour 4 Télécommandes Au Maximum, Ã‰galement Pour Rangement De Lunettes, Smartphones, Contrôleurs, Clés USB, Porte-télécommande) Blanc",Hama,"93,86 €",6,"109,29 €","71,61 €",7,
B00006JABA,"Hama Adhésif Cinekett (pour films Super 8, 100 pièces, S8, 1 piste audio libre) Blanc/Rouge",Hama,"92,96 €",5,"36,98 €","23,96 €",2,
B071ZVN9LP,"Hama Albums photos ""Designline"" (couverture souple, 24 pages pour 24 photos au format 10x15 cm par album, résistant, pour archiver avec des anecdotes, protège la photo, mini album) Multicolore",Hama,"92,00 €",16,"92,00 €","14,08 €",16,2
B0186D2GQS,"Hama Album Photo ""Fine Art"" (format 29 x 32 cm, 50 pages blanches, sans spirale) Gris",Hama,"90,93 €",6,"60,96 €","40,67 €",4,1
B0C5JRX9HV,"Hama Multiprise avec Interrupteur 1.4m (6 Prises typeE, Norme NF, interrupteurs général + indiv. éclairés, Protection Surtensions, Montage Mural, Sécurité Enfants, 3680W/16A) Noir",Hama,"86,64 €",4,"86,64 €","67,52 €",4,
B00A44OC0G,"Hama Barre Multiprise 6 Prises avec Interrupteur Et Sécurité Enfant Cble Blanc 5 M",Hama,"86,21 €",5,"86,21 €","52,60 €",5,
B08SFG3JH5,"Hama Album photo ""To The Moon"" (Album souvenirs Anniversaires, Baptême, Baby Shower, Idée cadeau, 22.5x22 cm, 100 pages blanches, Zone Mémo, 200 photos 10x15 cm, Insertion latérale) Multicolore",Hama,"83,80 €",5,"83,80 €","43,91 €",5,
B06X9NRXV9,"Hama Album photo vierge ""Lazise"" (album photo traditionnel 29 cm x 32 cm, 50 pages blanches, pour 250 photos 10 cm x 15 cm, format maximum 28 cm x 31 cm) Doré/Blanc",Hama,"82,90 €",5,"95,84 €","55,89 €",6,1
B07SHMY2ZM,"Hama Horloge Murale PP-245 (Radio-pilotée DCF, Pendule sans tic tac, numérique, à LED, sans Fil, avec Piles, Format 24h, Calendrier, Jour, thermomètre 0°C à -50°C, Pause Murale ou Bureau) Noir",Hama,"82,44 €",3,"82,44 €","65,04 €",3,
B00RLNC8UY,"Hama Album photo ""Tim"" (pour 200 photos au format 10 x 15 cm, petit album de taille 22,5 x 22,5 cm, album photo bébé de 100 pages blanches, ciel, élégant, pour garçons, enfants, bébés) Bleu",Hama,"81,69 €",7,"70,02 €","34,74 €",6,
B08SDTPYQP,"Hama Mini Trépied de Table Pocket II Rotation (trépied avec Support Smartphone iPhone/Samsung/GoPro, Rotatif, inclinable Paysage Portrait, idéal Voyage, Pas de vis de 1/4"") Noir",Hama,"81,62 €",11,"74,20 €","88,60 €",10,
B0050GRN2W,"Hama Pochette Up To Fashion (pour 48 disques, CD/DVD/Blu-ray/livres audio, étui de rangement, gain de place pour la voiture, la maison, avec motif papillon) Rose",Hama,"80,40 €",6,"67,00 €","32,90 €",5,
B0015NLFGE,"Hama Chemin de câbles (bande en PVC/Aluminium pour montage mural TV ou au sol, cache-câble demi-rond, 100 x 7 x 2,1 cm, entrée de câble jusqu'à 8 câbles) Gris",Hama,"79,96 €",4,"79,96 €","55,00 €",4,
B08SDTGVK8,"Hama Album Photo Livre bébé ""My Little Me"" à personnaliser (Album photo naissance, baptême, Cadeau d'anniversaire enfant, Idéal scrapbooking, 29x32cm, 60 Pages, Max. 300 Photos 10x15 cm) Multicolore",Hama,"79,92 €",6,"93,24 €","55,93 €",7,
B00UV84E4O,"Hama Album photo vierge ""Anzio"" (album photo traditionnel format 22,8 cm x 22,3 cm, pour 200 photos 10 cm x 15 cm, 100 pages, instax, minimax, idéal pour un mariage) Beige/Noir",Hama,"79,08 €",6,"65,90 €","31,91 €",5,
B00006JALB,"Hama Pinceau de Nettoyage pour Objectif (Lenspen) (pour Le Nettoyage des lentilles et des filtres, 12,5 cm de Long, Lenspen) Noir/Rouge",Hama,"78,92 €",7,"56,32 €","32,95 €",5,
B003PFBLOQ,"Hama Horloge murale ""PP-245"" (radio-pilotée DCF, Pendule sans Tic Tac, Numérique, à led, sans fil, avec des piles, Format 24h, Calendrier, Jour, Thermomètre 0°C à +50°C, pause murale ou bureau) Plastique, Noir",Hama,"78,15 €",3,"104,73 €","71,76 €",4,
B09RCN2PVC,"Hama Album photo ""Skies II"" (Album Elégant et Intemporel, Idéal mariage, anniversaire, baptême, 22,5 x 22 cm, 100 pages avec pochettes pour 200 photos 10x15 cm, Zone Mémo et pochette carte SD) Beige",Hama,"78,04 €",7,"44,67 €","28,44 €",4,
B01IW9057S,"Hama Album photo traditionnel ""Rustico"" (album mémo, album de 22,5 x 22,5 cm, 100 pages blanches, 200 photos au format 10x15, idéal pour le scrapbooking, insertion des photos) Love Key",Hama,"77,19 €",7,"49,04 €","27,80 €",5,
B000N94K22,"Hama Pochette (pour 64 CD/DVD/Blu-ray, classeur de rangement, gain de place pour le bureau, le salon et la maison, étuis de transport) Noir",Hama,"75,92 €",6,"75,92 €","37,86 €",6,
B00UYZ1O6K,"Hama Support Mural TV Spécial Mur mensardé (pour Diagonale d'écran de 48 cm à 117 cm (19"" - 46""), pour Un Maximum de 20 kg, VESA jusqu'à 200 x 200) Noir",Hama,"74,01 €",2,"74,01 €","76,90 €",2,
B08M3X6PFG,"Hama Album Photo Couverture Rigide Tissu 30x30cm (Livre Photo, 400 photos 10 x 15cm à coller, 100 pages blanches separées par Papier Cristal, Album Scrapbooking DIY à Personnaliser) Bordeaux",Hama,"73,37 €",3,"48,20 €","27,92 €",2,
B07CLVR52S,"Hama Album photo enfant ""Batzi"" (taille de l'album de 19 x 25 cm, format pour 200 photos 10 x 15 cm, avec 100 pages, papier stratifié, insertion latérale des photos, ours debout) Marron",Hama,"72,73 €",5,"72,73 €","31,96 €",5,
B08YRY2LQJ,"Hama Câble Jack 3.5 Male Male (Câble Auxiliaire Stéréo Jack 3.5mm, Cable Audio Garantie 10ans, 1.5m, compatible iPhone, iPod, iPad, Voiture, Casque, Autoradio, Smartphones, MP3) Noir",Hama,"70,72 €",17,"79,04 €","87,22 €",19,
B001730SIS,"Etui Fashion pour Sticks USB, Noir",Hama,"70,56 €",7,"70,56 €","34,23 €",7,
B00005QFAZ,"Hama Étuis à négatifs (Lot de 25 Pochettes Rangement Diapos/Negatifs Photo, pour Classeurs à Anneaux, 4 Bandes/Feuille, en Papier Cristal)",Hama,"69,44 €",7,"49,60 €","41,10 €",5,
B00CRB69MI,"Hama Support de télécommande Major (pour 4 télécommandes au maximum, également pour rangement de lunettes, smartphones, contrôleurs, clés USB, porte-télécommande) Noir",Hama,"68,73 €",3,"101,43 €","49,95 €",5,1
B0C5JP288F,"Hama C-Rotate Pro Clé USB 3.1 - Flash Drive 512 Go, Vitesse jusqu'à 100 Mo/s, Clef avec connecteurs USB A & USB C, pour PC/Mac/Tablette et Smartphone - Argentée",Hama,"66,66 €",1,"66,66 €","46,00 €",1,
B0CP84CQHQ,"Hama Support TV Mural Orientable Garantie 10 Ans (Support TV Pivotant Inclinable Extensible, 35kg Max, pour écrans 81 à 165 cm (32"" à 65"") VESA 200x200 à 400x400, Chevilles Fischer fournies) Blanc",Hama,"65,83 €",1,"65,83 €","47,90 €",1,
B0CLD5D3YP,"Hama Support Mural TV Extra Plat Inclinable Pivotant 180° Garantie 10ans (TV 19 à 48 pouces, VESA jusqu'à 200 x 200, 2 articulations, Support Extensible, Cache Cables, Chevilles Fisher & Gabarit) Noir",Hama,"65,82 €",1,,,,
B00005YVIU,"Hama Distributeurs Coins photo (1000 coins, autocollants, distributeur pratique, sans acide, sans solvant, adapté albums, permet un archivage fiable, scrapbooking) Transparent",Hama,"65,42 €",10,"58,95 €","26,10 €",9,
B000K985GC,"Hama Boîtier Standard (pour DVD, Convient également aux CD et aux Blu-Ray, avec Film pour l'insertion de la Jaquette, Lot de 30) Noir",Hama,"64,98 €",3,"64,98 €","42,06 €",3,
B003TKD3YS,"Hama Chemin de câbles (bande en aluminium pour montage mural TV ou au sol, cache-câble demi-rond, 110 x 3,3 x 1,8 cm, entrée de câble jusqu'à 5 câbles, matériel de montage compris) Gris",Hama,"63,28 €",4,"63,28 €","39,10 €",4,
B084HYZP7G,"Hama Album Photo ""Fine Art"" (format 30 x 30 cm, 80 pages blanches, sans spirale) Sable",Hama,"63,26 €",4,"63,26 €","29,53 €",4,
B0186CU9A4,"Hama Album Photo ""Fine Art"" (format 29 x 32 cm, 50 pages blanches, sans spirale) Bleu",Hama,"63,21 €",4,"45,72 €","30,57 €",3,
B00F955SDU,"Hama Antenne intérieure (antenne radio pour l'amplification du signal actif jusqu'à 30 dB, puissance de l'amplificateur réglable, hauteur de 31 cm, DAB/DAB+, en long) Noir",Hama,"63,16 €",2,"63,16 €","36,20 €",2,
B0CNRZ9GWN,"Hama Boîte pour câbles Maxi (Boite Rangement pour Cables chargeurs et multiprises, boitier Cache câbles 40x15,5x13,5cm, Pieds en Caoutchouc) Blanc",Hama,"62,68 €",3,,,,1
B07T63BHGL,"Hama Album photo ""Hello Panda"" (pour 200 photos au format 10 x 15 cm, petit album de taille 22,5 x 22 cm, 100 pages blanches, panda, avec emplacement pour CD, élégant) Turquoise/Noir/Blanc",Hama,"62,40 €",5,"112,32 €","62,28 €",9,
B079PBYJ9P,"Hama Mallette (LP 50, aspect alu, en aluminium, pour stocker 50 disques, verrouillable, Boîte de rangement pour vinyle, boîtier pour disque ) Argent",Hama,"61,97 €",1,"61,97 €","46,24 €",1,
B0CP86Q49Q,"Hama Antenne intérieure (Antenne Réception Radio Numérique (Dab/Dab+) et Analogique FM, Amplification du Signal Actif jusqu'à 30 DB, Cäble 1.5m, Fiche F mâle, Alim Secteur) Noir",Hama,"61,64 €",2,"61,64 €","48,70 €",2,
B01N4C15H5,"Hama Album Photo Fine Art (Format 30 x 30 cm, 100 Pages Blanches, sans Spirale) Bordeaux",Hama,"61,32 €",4,"91,90 €","51,00 €",6,
