B001B4ROAS,"Hama Boîtier Slim (pour CD et disques Blu-ray, ultra mince, avec une feuille pour la couverture, lot de 20) Transparent",Hama,"0,00 €",0,"11,66 €","8,40 €",1,
B006JNYP3K,"Hama Cadre photo en plastique Sevilla (taille du Cadre de 29,7 x 42 cm (DIN A3) avec bordure de 9 mm x 17 mm, pour une photo de 18 x 24 cm, verre en polystyrène) Argent Mat",Hama,"0,00 €",0,"89,91 €","50,98 €",9,
B01BBTCVKA,"Hama Album Photo ""Fine Art"" (format 30 x 30 cm, 100 pages blanches, sans spirale) Malibu",Hama,"0,00 €",0,"16,75 €","8,82 €",1,
B0000AIRRQ,"Hama Cadre photo ""Clip-Fixe"" (sans bordure, 50 x 70 cm, Reflex) Blanc",Hama,"0,00 €",0,"16,66 €","7,96 €",1,
B000X1BGWM,"Hama Fiche universelle pour prises d' allume-cigares (fiche de sécurité 16 A prise allume-cigare, câbles jusqu'à 2 x 2,5 mm², 6V - 24V, avec serre-câble) Rouge/Noir",Hama,"0,00 €",0,,,,
B008H7TK4A,"Tapis de souris, Rouge",Hama,"0,00 €",0,"2,49 €","1,72 €",1,
B003A2EFGA,"Hama Multiprise 6 Prises (multiprise avec Protection de Contact Accrue, multiprise avec Prises coudées à 45°, câble de 1,4 m, 3500 W, certifié GS) Noir",Hama,"0,00 €",0,,,,1
B079PDDSBK,"Hama Mallette (LP 50, Aspect alu, en Aluminium, pour Stocker 50 disques, verrouillable, Boîte de Rangement pour Vinyle, boîtier pour Disque) Noire",Hama,"0,00 €",0,,,,
B00006JEAY,"Hama Filtre UV (anti-UV Et Protection, Compensation 2X, Traitement Antireflet, Pour Objectifs D'appareils Photo 49 Mm, O-Haze, Traité) Noir",Hama,"0,00 €",0,"9,16 €","4,27 €",1,
B09FBSXVBX,"Hama Commutateurs KVM Connect2Switch, avec câble, 4 Ports, Garantie 10 Ans, Gris",HAMA,"0,00 €",0,"143,28 €","120,58 €",4,
B00005KHTB,"Hama Filtre polarisant (circulaire, Traité, 55mm, 2 couches par face) Noir",Hama,"0,00 €",0,"25,56 €","18,44 €",1,
B00AJKQ4YC,"Hama 2 Pieds Enceintes Universels (Supports Haut-Parleur, Hauteur réglable Max. 123 cm, antidérapant, Charge Max. 5 kg/Pied, câbles cachés, Haut-parleurs Hi-FI/Stéréo/Home Cinema) Noir",Hama,"0,00 €",0,,,,
B00IZA0RSM,"Thomson Support Mural TV WAB546 (VESA jusqu'à 200x200, Fixe, pour Une Diagonale d´écran de 25 à 117 cm (de 10' à 46')) Noir",Thomson,"0,00 €",0,,,,
B00475DSKS,"Xavax Siphon (pour évier, lave-linge et lave-vaisselle, 1,5"", 2 ports pour siphon 1"" (2,54 cm) et 2 pièges à odeurs, flexible) Blanc/Noir",xavax,"0,00 €",0,,,,
B00EYVW7TI,"Hama Multiprise 6 Prises 16A avec Interrupteur (Rallonge multiprises 3m, Bloc 6 Prises Type F Schuko, 3680W Max, Idéal Bureau PC luminaires, Atelier, Meuble TV, Garage, sécurité Enfants) Noir",Hama,"0,00 €",0,,,,
B09GLCX9G9,"Hama Coque iPhone 13 Mini Étui Portefeuille Slim Pro pour Apple, Noir",Hama,"0,00 €",0,,,,
B0CBCMH2BZ,"Hama Multiprise Cube avec Interrupteur (Rallonge multiprise 1.4m, Bloc 3 Prises Terre F Schuko + 2 USB-A + 2 USB-C, 3680W 16A Idéal Bureau Cuisine Salon Atelier Garage PC luminaires Meuble TV) Blanc",Hama,"0,00 €",0,,,,1
B002IK2SNM,"Hama - 20563 - Colliers de serrage pour câbles, Champ inscriptible, 98mm, 25 pces, Naturel",Hama,"0,00 €",0,,,,
B07X557RB6,"Thomson Antenne Intérieure ""ANT1639"" (Design UHD ""Sculpture"", pour réception numérique DVB-T/DVB-T2 et HDTV, actif, 2 m, Performance 55) Noir/Gris",Thomson,"0,00 €",0,,,,1
B00006JBG4,"Hama Boîtier Standard (pour CD et disques Blu-Ray, Étui Protecteur pour CD, Paquet de 5) Noir/Transparent",Hama,"0,00 €",0,"16,64 €","11,28 €",4,
B0002W6E56,"Hama 00004133 Trépied Photo/vidéo Star 700 EF Digital, Champagne (Trépied d'entrée de Gamme léger, tête à Trois Voies, 42-125 cm, 3D)",Hama,"0,00 €",0,,,,
B0BL1RN815,"Hama Power Bank 24000 mAh (Batterie Externe, 1 USB C + 2 USB A, Power Pack Fast Charge, Batterie pour Smartphone, Tablette, Haut-Parleur Bluetooth, Voyants LED, Chargeur Portable + Cable 0.25m) Gris",Hama,"0,00 €",0,,,,1
B000EOPSRC,"Hama Pochette (pour 20 CD/DVD/Blu-ray, classeur de rangement, gain de place pour le bureau, le salon et la maison, étuis de transport) Noir",Hama,"0,00 €",0,,,,
B000OXEMVQ,"Hama Casque baladeur stéréo tour de cou noir",Hama,"0,00 €",0,,,,
B00006JCUF,"Hama 00030392 Bloc Multiprises à 3 Sorties avec Interrupteur, 1,4 m, Noir",Hama,"0,00 €",0,,,,
B07HY9LK8J,"Rapoo Clavier multimédia USB Filaire ""N2400"" (filaire, clavier d'ordinateur AZERTY, design, idéal pour les maladroits) Noir",Rapoo,"0,00 €",0,,,,1
B000Y13DPE,"Hama Boîtier CD Slim en polypropylène, Lot de 20, Assortiment de Couleurs",Hama,"0,00 €",0,,,,
B0BL1T8KYR,"Hama Lampe Annulaire LED avec Support (Ring Light LED Portatif, Reglable, Anneau Lumineux 10.2 Pouces, Extensible 52 à 138cm, Télécommande Filaire, Cold Shoe fournis)",Hama,"0,00 €",0,,,,1
B003B0RIUQ,"Hama Bloc ménager de 3 prises avec interrupteur,sécurité enfants,1,4m, noir",Hama,"0,00 €",0,,,,
B000EOVQCS,"Hama Pochettes de Protection Doubles (en Plastique, pour CD/DVD/Blu-Ray, 2 CD par Pochette, Lot de 50) Blanc/Transparent",Hama,"0,00 €",0,"25,44 €","11,72 €",2,
B00006J4DM,"Hama Adaptateur d'antenne (DIN mâle - ISO Femelle) Argent",Hama,"0,00 €",0,"2,67 €","1,55 €",1,
B07PSPRGMT,"THOMSON Casque TV HQ HED4508 (câble Extra Long de 8 m, Casque stéréo pour TV, réglage du Volume séparé, Embout Filaire, Prise 3,5 mm avec Adaptateur de 6,35 mm) Noir",Thomson,"0,00 €",0,,,,
B07TM7WRZY,"Hama Elegance Horloge Murale à Quartz Cercle Gris, Argent - Horloges murales (AA Mignon, Gris, Argent, Plastique, Verre, 45 mm, 495 g)",Hama,"0,00 €",0,"19,16 €","13,68 €",1,
B08SFR7Z13,"uRage Clavier Gaming Rétroéclairé (Clavier Gamer Silencieux, Rétroéclairage 7 Couleurs, Anti-Ghosting, Win-Lock, AZERTY, Filaire, Repose Poignet, 4 Touches Macro, 12 Touches Fonctions directes) Noir",uRage,"0,00 €",0,,,,1
B009X8SFSY,"Hama ""Fine Art"" Spiral Album, 24 x 17 cm, 50 Photos, azure",Hama,"0,00 €",0,,,,
B07S3HXC8W,"Visionneuse LED, grossissement Triple",Hama,"0,00 €",0,,,,
B0CKMSPK2N,"Hama Greenlight-Pointer Télécommande Pointeur Laser - 4 en 1, Laser Vert, sans Fil 2.4 GHz - pour présentation Powerpoint - Noir",Hama,"0,00 €",0,,,,
B0019DK6CY,"Hama Câble de liaison (RCA, 2 fiches mâles - 2 fiches mâles, avec lignee remote intégrée, 5 m) Bleu",Hama,"0,00 €",0,,,,
B01DZGIJ26,"Hama Support mural TV FULLMOTION inclinable et pivotant pour TV écran plat entre 48 cm et 122 cm (19"" à 48""), jusqu'à 20 kg de charge supportée, VESA 200x200, Noir",Hama,"0,00 €",0,"23,41 €","20,35 €",1,
B07KWC3KMG,"Rapoo Souris optique sans fil Multi mode 2,4GHz/BT 3.0/BT 4.0 ""M500"" (bluetooth, souris d'ordinateur, design, avec boutons et molette de défilement) Noir",Rapoo,"-36,64 €",-2,,,,
