Programme=[Retail],Aperçu du distributeur.=[Approvisionnement.],Afficher par=[ASIN],Pays=[FR],Entreprises=[~ Hama EURL (FR)],Local=[fr_FR],Devise=[EUR],Intervalle des rapports=[Semaine],Champ de vision.=[02/02/2025 - 08/02/2025],Rapport mis à jour=[21/03/2025]
ASIN,"Nom du produit",Marque,"Chiffre d’affaires basé sur les expéditions","COGS expédié","Unités expédiées","Retours client"
B01N6NQ73J,"Thomson Casque TV avec câble extra long (Casque d'écoute ajustable et rembouré, Cordon 8m, Idéal pour regarder la télé, écouter la musique, contrôle du volume, prise jack 3,5mm+adaptat. 6,35mm) Noir",Thomson,"512,96 €","310,80 €",28,3
B00006IVA8,"Hama Cassette de Nettoyage VHS pour MAGNETOSCOPE (Nettoyeur de tête vidéo lecteurs VHS/S-VHS/VHS-C/S-VHS-C, Liquide de Nettoyage Inclus, Nettoyant de Têtes Vidéo - K7 Nettoyage VHS) Noir",Hama,"419,76 €","482,30 €",53,
B0764LMPBN,"Hama Multiprise avec Interrupteur 10 Prises 16A (Rallonge multiprises 3m, Bloc 10 Prises Type F Schuko, 3500W Max, Idéal Bureau PC luminaires, Atelier, Meuble TV, Garage) Noir",Hama,"349,86 €","217,56 €",21,
B0BNLNC6KX,"Hama iTuner Hi-FI DIT2105SBTX Dab+ Bluetooth (Tuner Internet Radio FM Dab, Tuner HiFi, Radio numérique, RX/TX, WiFi, Spotify Connect, Amazon Music, App UNDOCK, Port USB, télécommande) Argenté",Hama,"239,90 €","204,00 €",1,
B000N8UX88,"Hama Trépied Appareil Photo Star 20""",Hama,"215,52 €","134,94 €",39,
B09MQQM1ZJ,"Xavax Socle machine à laver avec étagère (Support Sèche Linge Lave Linge,Réhausseur de Machines, Base universelle avec Pieds Réglables en hauteur, charge 150 kg) Blanc",Xavax,"205,40 €","104,00 €",2,
B00005UPC8,"Hama Boîtier standard double (pour CD et disques Blu-Ray, Étui protecteur pour CD, paquet de 10) Transparent",Hama,"199,80 €","134,20 €",20,
B00D2S92L0,"Xavax Hama Boîte de transport pour un gâteau (boîte rond, Ø 31,5 x 8cm, avec diviseur, capote et compartiments, partie de service et gâteau de gâteau) Anthracite/Transparent",xavax,"199,80 €","107,55 €",15,
B0013IPAJY,"Hama Kit de Nettoyage et de réparation pour CD/DVD (25 ML de pâte de réparation, 45 ML de Liquide nettoyant, 1 Coque de Nettoyage, 5 Chiffons, 8 pièces) Blanc/Bleu/Rouge/Noir",Hama,"193,14 €","129,87 €",9,
B000EORX52,"Hama Boîtier Slim (pour CD et disques Blu-Ray, Ultra Mince, avec Une Feuille pour la Couverture, Lot de 25) Transparent",Hama,"172,90 €","103,90 €",10,
B07ZJSSVG8,"Xavax Support Organiseur Pour Aspirateurs sans fil (Station Accueil au sol, avec Porte-Accessoires pour DYSON DC30 DC31 DC34 DC35 DC58 DC59 DC62 DC74, V11, XIAOMI V10, 29.5x22x128cm) Argent/Noir",xavax,"162,48 €","112,50 €",3,
B0949HMZB1,"Hama Chiffon Antistatique Antipoussière (Chiffon de Nettoyage pour Lunettes ou Appareil Photo, Objectif, Filtre, écrans PC Smartphone ou Tablette, négatifs, Diapositives, Jumelles, 23 x 25 cm) Orange",Hama,"161,97 €","85,40 €",20,
B0BXPLLW89,"Hama Classeur à négatifs (4 anneaux, niveau de remplissage 39 mm, feuilles rectangulaires, album à négatifs d'une pellicule photo, housse de protection) Noir",Hama,"158,08 €","116,85 €",19,
B00G3BMWQA,"Xavax Minuteur à œuf (avec fonction minuterie, sablier, en acier inoxydable) Argent",xavax,"157,29 €","93,03 €",21,1
B003LTSUN6,"Hama Chemin de câbles (bande en aluminium pour montage mural TV ou au sol, cache-câble rectangle, 110 x 3,3 x 1,7 cm, entrée de câble jusqu'à 5 câbles, matériel de montage compris) Noir",Hama,"155,43 €","100,44 €",9,
B0000AI3G4,"Hama Cadre en plastique ""Madrid"" (taille de cadre de 50 cm x 70 cm, taille de la photo de 30 cm x 45 cm, 1 photo par cadre, à accrocher, élégant, simple, classique) Noir",Hama,"149,92 €","77,44 €",8,1
B07GLF5SMF,"Hama Album Photo ""Fine Art"" (format 30 x 30 cm, 100 pages noires, sans spirale) Noir",Hama,"144,62 €","60,18 €",6,
B0009V6Q30,"Hama Boîtier Slim (pour CD et disques Blu-ray, ultra mince, avec une feuille pour la couverture, lot de 25) Transparent/Bleu/Orange/Vert/Rouge/Violet",Hama,"139,86 €","113,26 €",14,
B01K47GW46,"Hama Album photo Jumbo ""La Fleur"" 30 x 30 cm (livre photo de 100 pages blanches, album photos souvenirs pour 400 photos au format 10x15 cm, à personnaliser- à coller, Idée Cadeau, motif Feuilles) Noir",Hama,"133,11 €","62,91 €",9,1
B00AJKQ4YC,"Hama 2 Pieds Enceintes Universels (Supports Haut-Parleur, Hauteur réglable Max. 123 cm, antidérapant, Charge Max. 5 kg/Pied, câbles cachés, Haut-parleurs Hi-FI/Stéréo/Home Cinema) Noir",Hama,"132,41 €","80,06 €",2,
B00006JAXW,"Hama Plateau Universel Hama Rond (40 cm, Taille XL, Poids supporté 100 kg (idéal pour TV, Enceintes, écrans, appareils de Cuisine) Noir",Hama,"131,67 €","59,35 €",5,1
B0857M8J9G,"Xavax Kit de superposition universel pour lave-linge/sèche-linge, avec séchoir à linge",xavax,"123,16 €","120,60 €",2,
B07SZ3FCZH,"Hama Album photo mémo ""Forest"" (pour 200 photos au format 10 x 15 cm, album traditionnel enfant de 22,5 x 22 cm, 100 pages blanches, animaux, élégant, emplacement CD) Marron/Beige/Vert/Orange/Jaune",Hama,"117,29 €","45,90 €",9,
B08GS8FVB5,"Hama Destructeur de Documents Basic S6 (Broyeur de Documents, Sécurité P-2, 6 Feuilles, Corbeille 8L, Découpe en Bandes 6mm, 70 DB, M/A Auto, Idéal Bureau & Maison) Noir",Hama,"116,52 €","72,40 €",4,
B07HY9LK8J,"Rapoo Clavier multimédia USB Filaire ""N2400"" (filaire, clavier d'ordinateur AZERTY, design, idéal pour les maladroits) Noir",Rapoo,"109,92 €","115,20 €",12,
B00QKRKJCQ,"Hama Support De Télécommande Major (pour 4 Télécommandes Au Maximum, Ã‰galement Pour Rangement De Lunettes, Smartphones, Contrôleurs, Clés USB, Porte-télécommande) Blanc",Hama,"109,29 €","71,61 €",7,
B0C8SXMV3R,"Rapoo Clavier Souris sans Fil Multi-Mode Rechargeable Blade 9600M (Pack Kit Clavier+ Souris, Clavier Rechargeable AZERTY, Souris 3 Boutons, Bluetooth+ WiFi, Idéal PC, Laptop, Mac) Anthracite",Rapoo,"99,98 €","81,90 €",2,
B07BZVN4MB,"Hama Radio numérique ""DR350"", FM/DAB/DAB+ (pour réception FM / DAB / DAB +,radio de cuisine sous comptoir, écran couleur, fonction d'alarme, fonctionnement sur secteur) Blanc",Hama,"98,90 €","42,00 €",1,1
B06XB2Y8KR,"Hama Album traditionnel ""Lazise"" (taille de l'album de 22,5 x 22 cm, pour 200 photos au format 10 cm x 15 cm, 100 pages, avec pochette CD, élégant) Blanc/Noir/Rose",Hama,"96,14 €","61,38 €",11,
B071ZVN9LP,"Hama Albums photos ""Designline"" (couverture souple, 24 pages pour 24 photos au format 10x15 cm par album, résistant, pour archiver avec des anecdotes, protège la photo, mini album) Multicolore",Hama,"92,00 €","14,08 €",16,2
B079173RCY,"Hama EMW-500 Souris Verticale Ergonomique Filaire - USB A, Capteur 1800 dpi, Droitier/e - Noire",Hama,"90,50 €","57,75 €",5,
B0002W5WE0,"Hama Boîtier Slim Double (pour DVD, Convient également aux CD et disques Blu-Ray, Ultra Mince, avec Une Feuille pour la Couverture, Lot de 25) Noir/Transparent",Hama,"90,05 €","55,25 €",5,
B07MQFLKJQ,"Xavax Hama Xavax Roulette à pizza (en acier inoxydable, 22 cm) Noir/Argent",xavax,"89,76 €","54,48 €",24,
B079PN72PJ,"Hama Souris Optique sans Fil Riano (Souris Gauche sans Fil, avec récepteur Nano USB, Vertical, 800-1600 dpi, Interrupteur de Marche/arrêt, 3 Boutons, 2,4 GHz) Noir",Hama,"89,06 €","60,48 €",6,
B00006J4G7,"Hama Présentoir de Distributeur de pastilles adhésives (500 coins photos, diamètre de 10 mm, papier/viskose) Transparent",Hama,"86,32 €","60,06 €",26,
B097HN8V5V,"Hama Câble d'Antenne TV (Cable TV Coaxial Mâle - Coaxial Femelle, 85 db, 1.5m, Connexion d'un Téléviseur vers une Fiche TV Murale ou vers un Décodeur) Blanc",Hama,"82,55 €","76,00 €",25,
B0043W42ZU,"Xavax Mousseur à lait ""Milchicopter"" (Batteur à lait en acier, moteur très puissant à 14 000 tours/minute, spirale spéciale, nettoyage facile, mousseur à lait, balai Matcha) Noir",xavax,"81,96 €","37,40 €",11,
B0015NLFGE,"Hama Chemin de câbles (bande en PVC/Aluminium pour montage mural TV ou au sol, cache-câble demi-rond, 100 x 7 x 2,1 cm, entrée de câble jusqu'à 8 câbles) Gris",Hama,"79,96 €","55,00 €",4,
B08SDTGVK8,"Hama Album Photo Livre bébé ""My Little Me"" à personnaliser (Album photo naissance, baptême, Cadeau d'anniversaire enfant, Idéal scrapbooking, 29x32cm, 60 Pages, Max. 300 Photos 10x15 cm) Multicolore",Hama,"79,92 €","47,94 €",6,
B07TYWBSZN,"Hama Album photo Jumbo ""Forest"" (pour 400 photos au format 10 x 15 cm, album traditionnel enfant de 30 x 30 cm, 100 pages blanches, animaux, élégant) Marron/Beige/Vert/Orange/Jaune",Hama,"74,63 €","34,08 €",4,
B00UYZ1O6K,"Hama Support Mural TV Spécial Mur mensardé (pour Diagonale d'écran de 48 cm à 117 cm (19"" - 46""), pour Un Maximum de 20 kg, VESA jusqu'à 200 x 200) Noir",Hama,"74,01 €","76,90 €",2,
B0009V8VAQ,"Hama Etui pour Lecteur et CD (pour Lecteur CD, pour Discman, 3 CD, avec Sortie de câble et Boucle de Ceinture) Noir/Bleu",Hama,"73,86 €","30,66 €",6,
B08SFG3JH5,"Hama Album photo ""To The Moon"" (Album souvenirs Anniversaires, Baptême, Baby Shower, Idée cadeau, 22.5x22 cm, 100 pages blanches, Zone Mémo, 200 photos 10x15 cm, Insertion latérale) Multicolore",Hama,"67,04 €","35,12 €",4,
B0002W5WBI,"Hama Boîtier Slim (pour CD et disques Blu-Ray, Ultra Mince, avec Une Feuille pour la Couverture, Lot de 100) Noir/Transparent",Hama,"66,98 €","53,36 €",2,
B08SFFNZ4D,"Rapoo Clavier et Souris sans Fil X 1800s"" (Pack Kit Clavier Souris sans Fil 2.4GHz, Dongle Nano USB, Autonomie 12mois, Souris Optique 1000DPI, Clavier AZERTY FR, Pavé Numérique, pour PC, Laptop) Noir",Rapoo,"66,64 €","55,48 €",4,
B0CP84CQHQ,"Hama Support TV Mural Orientable Garantie 10 Ans (Support TV Pivotant Inclinable Extensible, 35kg Max, pour écrans 81 à 165 cm (32"" à 65"") VESA 200x200 à 400x400, Chevilles Fischer fournies) Blanc",Hama,"65,83 €","47,90 €",1,
B0C5JRX9HV,"Hama Multiprise avec Interrupteur 1.4m (6 Prises typeE, Norme NF, interrupteurs général + indiv. éclairés, Protection Surtensions, Montage Mural, Sécurité Enfants, 3680W/16A) Noir",Hama,"64,98 €","50,67 €",3,
B000K985GC,"Hama Boîtier Standard (pour DVD, Convient également aux CD et aux Blu-Ray, avec Film pour l'insertion de la Jaquette, Lot de 30) Noir",Hama,"64,98 €","42,06 €",3,
B003TKD3YS,"Hama Chemin de câbles (bande en aluminium pour montage mural TV ou au sol, cache-câble demi-rond, 110 x 3,3 x 1,8 cm, entrée de câble jusqu'à 5 câbles, matériel de montage compris) Gris",Hama,"63,28 €","39,10 €",4,
B0CP86Q49Q,"Hama Antenne intérieure (Antenne Réception Radio Numérique (Dab/Dab+) et Analogique FM, Amplification du Signal Actif jusqu'à 30 DB, Cäble 1.5m, Fiche F mâle, Alim Secteur) Noir",Hama,"61,64 €","48,70 €",2,
B00IYX10YA,"Hama Cadre photo en plastique Sevilla (taille du Cadre de 29,7 x 42 cm (DIN A3) avec bordure de 9 mm x 17 mm, pour une photo de 18 x 24 cm, verre en polystyrène) Bleu",Hama,"59,94 €","30,60 €",6,
B07PSPRGMT,"THOMSON Casque TV HQ HED4508 (câble Extra Long de 8 m, Casque stéréo pour TV, réglage du Volume séparé, Embout Filaire, Prise 3,5 mm avec Adaptateur de 6,35 mm) Noir",Thomson,"59,24 €","59,74 €",2,
B0000WXD16,"Hama Trépied Appareil Photo 160cm Star 62"" avec étui de Transport (Trépied Télescopique Aluminium, Tête 3 Voies 3D, Attache Rapide fournie, Niveaux à Bulles intégrés) Beige",Hama,"58,16 €","46,72 €",2,
B071VWLNZB,"Hama 00137234 Alimentation pour PC",Hama,"57,24 €","31,08 €",3,1
B00005QFB0,"Hama Étuis à négatifs, papier cristal, 7 bandes de 6 négatifs, 24x36cm, 25 pièces",Hama,"56,82 €","26,55 €",5,1
B000BGFJI6,"Hama Carte mémoire Photo (SD pour Photo/Classe 4, 2 GB - 10 MB/s) Bleu",Hama,"55,96 €","32,80 €",7,
B0000AHICV,"Hama Boîtier CD/DVD Slim (lot de 10 boitiers standards vierges pour CD/DVD et disques Blu-ray, ultra plat) Noir/Transparent",Hama,"55,60 €","16,75 €",5,
B0C5JQPC2P,"Classeur avec mécanisme à 4 anneaux, larg. 70 mm, avec étui, noir/gris",Hama,"54,96 €","35,40 €",3,
B001F4ZWDK,"Hama Pochettes en polypropylène pour CD/DVD, paquet de 75, Transparent",Hama,"54,81 €","23,40 €",5,
B07PQHPTSG,"THOMSON Casque TV Stéthoscope HED4408 (câble de 8 m, léger pour Personnes âgées et porteurs de Lunettes, Casque stéréo pour TV, Casque Intra-auriculaire, Prise 3,5 mm, avec Adaptateur 6,35 mm) Noir",Thomson,"53,94 €","44,74 €",2,1
B0050GRN2W,"Hama Pochette Up To Fashion (pour 48 disques, CD/DVD/Blu-ray/livres audio, étui de rangement, gain de place pour la voiture, la maison, avec motif papillon) Rose",Hama,"53,60 €","26,32 €",4,
B002ZX98MG,"Hama Boîtier Slim (pour DVD, Convient également aux CD et disques Blu-Ray, Ultra Mince, avec Une Feuille pour la Couverture, Lot de 10) Transparent",Hama,"53,55 €","19,68 €",4,
B083G7F5MR,"uRage Microphone à Condensateur de streaming USB avec bras (Micro Cardioïde d'Enregistrement Studio Conversation YouTube Voix-off, Ordinateur Bureau ou PC Portable, câble 2.5m, 20Hz-16kHz, 2200Ω) Noir",uRage,"51,89 €","72,39 €",1,
B001E725JM,"Hama Blu-Ray de Nettoyage (pour tête de Lecture, pour éliminer la poussière dans Les lecteurs de Blu-Ray, Blu-Ray de Nettoyage) Blanc/Bleu/Rouge",Hama,"51,48 €","39,78 €",3,
B074JDHBXG,"Hama Cadre en Plastique Madrid (Taille de Cadre de 21 cm x 29,7 cm, Taille de la Photo de 15 cm x 20 cm, 1 Photo par Cadre, à accrocher, élégant, Simple, Classique) Noir",Hama,"51,34 €","20,97 €",9,
B0002W5WBS,"Hama Boîtier Slim (pour CD et disques Blu-Ray, Ultra Mince, avec Une Feuille pour la Couverture, Lot de 50) Noir/Transparent",Hama,"49,84 €","25,00 €",2,
B01IW9057S,"Hama Album photo traditionnel ""Rustico"" (album mémo, album de 22,5 x 22,5 cm, 100 pages blanches, 200 photos au format 10x15, idéal pour le scrapbooking, insertion des photos) Love Key",Hama,"49,04 €","27,80 €",5,
B07KWF2WPL,"Rapoo Souris optique sans fil Multi mode 2,4GHz/BT 3.0/BT 4.0 ""M300"" (bluetooth, souris d'ordinateur, design, avec boutons et molette de défilement) Gris foncé",Rapoo,"47,46 €","33,30 €",3,
B084HYZP7G,"Hama Album Photo ""Fine Art"" (format 30 x 30 cm, 80 pages blanches, sans spirale) Sable",Hama,"47,44 €","22,20 €",3,
B086B7JST7,"Hama - WETTERSTATION - Weather Station",Hama,"46,66 €","35,14 €",1,
B0C5JPTNRF,"Hama Pages Intérieures Album Photo Scrapbooking (Recharge de Pages Photo Cartonnées, 250g/m2, 23.3 x 31 cm, Perforées, 25 feuilles) Noir",Hama,"46,56 €","30,48 €",8,
B06X9NRXV9,"Hama Album photo vierge ""Lazise"" (album photo traditionnel 29 cm x 32 cm, 50 pages blanches, pour 250 photos 10 cm x 15 cm, format maximum 28 cm x 31 cm) Doré/Blanc",Hama,"46,10 €","27,93 €",3,1
B003O5MK7E,"Hama Passe-partout Premium, noir, 40 x 50 cm pour photo de 30 x 40 cm",Hama,"45,80 €","23,20 €",5,
B0186D2GQS,"Hama Album Photo ""Fine Art"" (format 29 x 32 cm, 50 pages blanches, sans spirale) Gris",Hama,"45,72 €","30,57 €",3,
B07CKR6PKL,"Hama Album photo enfant ""Batzi"" (taille de l'album de 19 x 25 cm, format pour 200 photos 10 x 15 cm, avec 100 pages, papier stratifié, insertion latérale des photos, ours assis) Marron",Hama,"45,65 €","19,17 €",3,
B00292AZN4,"Hama Cadre photo Clip-Fixe (sans bordure, 30 x 40 cm, Reflex) Blanc",Hama,"44,96 €","12,76 €",4,2
B0015KFAIQ,"Xavax Filtre combiné universel pour friteuses (2 filtres à graisse et à charbon actif pour friteuses, filtre combiné universel, coupe individuelle, 33 x 29,6 cm) Noir/Blanc/Gris",xavax,"44,91 €","27,90 €",9,
B01BBTCVKA,"Hama Album Photo ""Fine Art"" (format 30 x 30 cm, 100 pages blanches, sans spirale) Malibu",Hama,"44,07 €","26,46 €",3,
B00006JA17,"Hama Étuis à négatifs, Papier Cristal, 4 Bandes de 3 négatifs, 6X7 cm pour 3 negatif et jusqu'a 6 X 9 cm pour 2 negatif, 100 pièces",Hama,"43,16 €","31,42 €",2,
B0CLYJQ3YY,"Hama Bras articulé de Telephone (Support articulé, Bras Flexible Smartphone Webcam Mirco Tablette eclairage annulaire, Support Universel Inclus, Fixation de Table à vis, Filetage 1/4"", 70cm Max) Noir",Hama,"43,00 €","43,24 €",4,
B08GSCS399,"Hama Destructeur de Documents Basic S8CD (Broyeur Documents 8 Feuilles 80g, Destructeur CD/CB, Niveaux de sécurité P2 T1, Découpe en Bandes 6mm, 70 DB, M/A Auto, Corbeil 11L) Noir",Hama,"41,65 €","26,10 €",1,
B0CP84WF61,"Hama Support TV Mural Fixe Garantie 10 Ans (Support TV Mural Extra-Plat, 40kg Max, Robuste, pour écrans LCD/LED/OLED/Plasma de 81 cm à 191 cm (32 à 75""), VESA Max 400x400) Noir",Hama,"41,64 €","35,92 €",2,
B0009V8WNW,"Hama Pochettes de Protection (en Papier pour CD/DVD/Blu-Ray, verrouillables, Lot de 100) Blanc/Transparent",Hama,"39,88 €","12,12 €",4,
B0CYQB5JYH,"Hama Émetteur Recepteur Bluetooth Link.it Duo pour TV Stéréo Ecran Audio Video, Adaptateur Bluetooth Multipoint pour 2 Sources, Faible Latence, USB-C, Jack, Fibre Optique Noir",Hama,"39,72 €","32,22 €",1,
B07TM7WRZY,"Hama Elegance Horloge Murale à Quartz Cercle Gris, Argent - Horloges murales (AA Mignon, Gris, Argent, Plastique, Verre, 45 mm, 495 g)",Hama,"38,32 €","27,60 €",2,
B07T4DLJ4Y,"Hama Album photo Jumbo ""Forest"" (pour 400 photos au format 10 x 15 cm, album traditionnel enfant de 30 x 30 cm, 100 pages blanches, renards, élégant) Marron/Beige/Vert/Orange/Blanc",Hama,"38,00 €","19,10 €",2,
B0002VFL1U,"Hama Pochettes pour CD-ROM/DVD-ROM (Pochettes CD Plastique, Pochette de Protection colorées, Lot de 100, Multicolore) Bleu/Orange/Violet/Rose/Vert",Hama,"37,47 €","24,30 €",3,
B07T63BHGL,"Hama Album photo ""Hello Panda"" (pour 200 photos au format 10 x 15 cm, petit album de taille 22,5 x 22 cm, 100 pages blanches, panda, avec emplacement pour CD, élégant) Turquoise/Noir/Blanc",Hama,"37,44 €","20,76 €",3,
B000EOVQCS,"Hama Pochettes de Protection Doubles (en Plastique, pour CD/DVD/Blu-Ray, 2 CD par Pochette, Lot de 50) Blanc/Transparent",Hama,"37,36 €","23,44 €",4,
B000Y138NG,"Hama Boîtier CD ""Slim"" en polypropylène, lot de 20, Transparent",Hama,"37,30 €","11,92 €",2,
B0BLZ1RZKG,"Hama Multiprise avec Interrupteur (Bloc 4 Prises Schuko 16A, Interrupteur Individuel éclairé, idéal économie d'énergie, Prises à 90°, œillet Suspension integré, 3680W, Cable 1.4m H05VV-F) Blanc",Hama,"36,64 €","25,00 €",2,
B01NCK7ZL3,"Hama Album Photo Fine Art (Format 30 x 30 cm, 100 Pages Noires, sans Spirale) Craie",Hama,"36,20 €","19,76 €",2,
B000XA2YGK,"Xavax Hama Thermomètre analogique (à suspendre au réfrigérateur, congélateur, cave à vin, minibar, minimum -35 degrés, maximum 40 degrés) Blanc",xavax,"36,00 €","15,48 €",6,
B0000AHIF7,"Hama Cadre portrait (taille de cadre 10x15 cm, taille de photos 10x15 cm, acrylique, format vertical, en plastique, 1 photo par cadre, élégant, simple, classique) Gris",Hama,"35,15 €","8,15 €",5,
B07ZDMHYMS,"Hama Clé USB C-Laeta (USB3.1/USB3.0 Type-C, 256GB, Double clé USB, pour Ordinateur Portable, téléphone Mobile, Tablette, OTG, 70 Mo/s, boîtier en métal, USB Type-C, clé de téléphone Portable) Argent",Hama,"35,13 €","19,40 €",1,
B0CLD3CC7D,"Hama Support TV Mural Fixe Ultrafin Garantie 10 Ans (Support TV Mural Extra-Plat, 80kg Max, Robuste, pour écrans LCD/LED/OLED/Plasma de 94 à 229 cm (37"" à 90"") VESA Max 600x400) Gris",Hama,"34,99 €","28,54 €",1,
B08SDTHMQB,"Hama Album Photo bébé ""Our Baby"" personnalisable Scrapbooking (Album photo naissance, baptême, Cadeau d'anniversaire enfant, Style Mémo, 22,5 x 22 cm, 100 Pages, Max. 200 Photos 10x15 cm) Multicolore",Hama,"34,96 €","22,00 €",4,
B0CP85VQFG,"Xavax 00220734 Raccord de Siphon, Blanc",Xavax,"34,92 €","20,46 €",6,
B0026MT4CA,"Xavax Rallonge de tuyau d'arrivée d'eau froide (pour tuyau de lavage et lave-vaisselle, tuyau d'arrivée d'eau froide, 2,5 m, 1 pièce) Gris/Blanc",xavax,"34,60 €","17,56 €",3,
B0BL1RN815,"Hama Power Bank 24000 mAh (Batterie Externe, 1 USB C + 2 USB A, Power Pack Fast Charge, Batterie pour Smartphone, Tablette, Haut-Parleur Bluetooth, Voyants LED, Chargeur Portable + Cable 0.25m) Gris",Hama,"33,90 €","25,73 €",1,
B084HZJ2TV,"Hama Album Photo ""Fine Art"" (format 30 x 30 cm, 80 pages blanches, sans spirale) Vert Tilleul",Hama,"33,58 €","18,54 €",2,
B0BL1VLC7R,"Hama Chargeur USB Multiport 34W avec Interrupteur M/A (6 Ports USB-A, Bloc Chargeur Secteur Multi-USB, Hub Prise d'alimentation USB, Temoin LED) Noir",Hama,"33,32 €","25,88 €",1,
B07X557RB6,"Thomson Antenne Intérieure ""ANT1639"" (Design UHD ""Sculpture"", pour réception numérique DVB-T/DVB-T2 et HDTV, actif, 2 m, Performance 55) Noir/Gris",Thomson,"33,24 €","31,07 €",1,
B000FNO03K,"THOMSON Microphone Dynamique M150 (fiche Jack 3,52 mm, Longueur de câble 3 m, Party) Noir",Thomson,"32,34 €","24,78 €",2,
B0026MT4C0,"Xavax Tuyau d'arrivée d'eau froide (pour lave-linge, lave-vaisselle, toutes les marques courantes Miele, Bosch, Beko, Siemens, Bauknecht, AEG, Gorenje, 1,5 mètres, 1 pièces) Gris/Blanc",xavax,"31,05 €","14,01 €",3,
B000TSO2AM,"Hama Pochette (pour 104 CD/DVD/Blu-Ray, classeur de Rangement, Gain de Place pour Le Bureau, Le Salon et la Maison, étuis de Transport) Noir",Hama,"30,84 €","14,36 €",2,
B0BL1CFWRT,"Hama Ecouteurs Lightning Glow (Ecouteurs Intra-Auriculaires filaires, Micro et Contrôle du Volume, Ecouteurs pour iPhone, Certifiés MFi, Compatibles Apple iPhone iPad iPod) Blanc",Hama,"30,82 €","22,01 €",1,
B06XB3M3NX,"Hama Album photo ""Liam"" (pour 200 photos au format 10 x 15 cm, album traditionnel enfant de 22,5 x 22 cm, 100 pages blanches, tigre, élégant) Marron/Orange/Noir/Blanc",Hama,"29,84 €","13,02 €",2,
B079175GWR,"Hama Souris Ergonomique sans Fil (Souris Verticale sans câble pour droitiers, Souris sans Fil sans Fil avec capteur Optique 1000/1400/1800 dpi) Noire, Prise USB Type-A, Pile AA Mignon",Hama,"28,77 €","15,22 €",1,
B0000AISCX,"Hama Cadre Photo Clip-Fixe (sans Bordure, 30 X 45 Cm, Anti-Reflex) Blanc",Hama,"28,32 €","8,92 €",2,
B005GCMZD2,"Hama Album photo à pochettes ""Singo"" (couverture souple, pour 24 photos au format 18x13 cm, résistant, protège la photo) Couleur aléatoire parmi Orange, Vert, Bleu et rose",Hama,"26,91 €","18,98 €",13,5
B017J9FOZA,"Xavax Thermomètre numérique pour rôtis (de torréfaction, numérique, 2 in 1, avec horloge de cuisine, sonde de température amovible, pour viande, -10°C à +250°C, avec minuteur, à câble) Noir/Argent",xavax,"26,64 €","21,32 €",2,
B09W5TSVGB,"Hama NHS-P100 V2 Casque Micro - Casque Tour de Cou, Microphone Intégré, Léger, Télécommande Intégrée, Fonction Mute - Noir",Hama,"26,64 €","19,22 €",2,
B00005QFAY,"Hama Étuis à négatifs, Papier Cristal, 7 Bandes de 6 négatifs, 24x36cm, 100 pièces",Hama,"26,62 €","15,71 €",1,
B006JZ8Q74,"Xavax Rallonge flexible d'arrivée d'eau renforcée (entrée à 90°, pour tuyau d’entrée lave-linge et lave-vaisselle, tuyau d’arrivée de réservoir anti-flambement, 2 m, 1 pièce) Argent",xavax,"26,57 €","18,84 €",1,
B000S8FNTM,"Hama E 80 Enceintes pour Ordinateur - Système Stéréo 2.0, Haut-Parleurs Alimentés en USB, Connexion Jack 3.5mm, Sortie Casque - Noir",Hama,"26,48 €","18,16 €",2,
B00UV84E4O,"Hama Album photo vierge ""Anzio"" (album photo traditionnel format 22,8 cm x 22,3 cm, pour 200 photos 10 cm x 15 cm, 100 pages, instax, minimax, idéal pour un mariage) Beige/Noir",Hama,"26,36 €","12,76 €",2,
B00005UPBH,"Hama Boîtier standard double (pour CD et disques Blu-Ray, Étui protecteur pour CD, paquet de 5) Transparent",Hama,"25,62 €","21,06 €",6,2
B000VRANHW,"Hama Album Photo ""Fine Art"" (format 28 x 24 cm, 50 pages noires, à spirale) Noir 00090145",Hama,"25,09 €","9,60 €",2,
B0CNRWZGY8,"Hama Boîte de Rangement Câbles 'Maxi' (Cache câbles, pour Bureau, Maison, Rangement Chargeurs, Multiprises, Disques durs, 40.0x15.5x13.8cm) Blanc",Hama,"24,99 €","18,44 €",1,
B008JCRAGI,"Xavax Boîte de condensation pour sèche-linges à évacuation, Blanc, 28.5 x 23.5 x 23 cm",xavax,"24,99 €","19,95 €",1,
B07T4DM8JJ,"Hama Album photos enfant mémo ""Forest"" (livre photo 100 pages à pochettes, 200 photos 10x15 cm, album souvenirs 22,5 x 22 cm, Emplacement CD, Album Motif Renards) Marron/Beige/Vert/Orange/Blanc",Hama,"24,96 €","11,00 €",2,
B0BKYL622V,"Hama Power Pack Slim 5HD (Batterie Externe 5 000 mAh, Batterie Portable Charge Rapide, USB 3.0, Power Bank Compatible avec iPhone 14 13 12 11 X Samsung Xiaomi Huawei iPad etc) Blanc",Hama,"24,96 €","29,46 €",3,
B071YB8MFM,"Xavax Boîte de transport pour un gâteau (rectangulaire munie d'une poignée transparente, va au lave-vaisselle, boîte à gâteaux, maître d'hôtel) Anthracite/Transparent",xavax,"24,92 €","14,12 €",1,
B01K47GSQS,"Hama Album photo ""Skies"" (album grand format, 22,5 x 22 cm, 100 pages, pour 200 photos au format 10 x 15 cm) Beige",Hama,"24,80 €","11,26 €",2,
B07F82LSLN,"Hama Support Travel Pliable pour tablettes et Smartphones (Idéal pour Les déplacements, Solide et Pratique) Couleur aléatoire Parmi Blanc/Bleu/Gris/Jaune/Noir/Rouge/Vert",Hama,"23,95 €","8,35 €",5,
B0BL1T6XLZ,"Hama Câble Multi USB Lightning (Cable de charge multi, 3en1, USB-A/micro-USB/USB-C, Lightning, 1 m, Certifié MFI, Câble USB universel iPhones iPads iPods Samsung Galaxy, Huawei, Xiaomi) Blanc",Hama,"23,74 €","13,46 €",1,
B0C6CK8KFG,"Hama Câble Enceinte HiFi (Cable pour enceinte, 10m, Câble Audio pour Enceinte, Câble HP de Haut Parleur en Cuivre pour Hifi et Hifi embarquée, 2 x 0.75 mm²) Transparent",Hama,"23,49 €","12,57 €",3,
