Programme=[Retail],Aperçu du distributeur.=[Fabrication],Afficher par=[ASIN],Pays=[FR],Entreprises=[~ Hama EURL (FR)],Local=[fr_FR],Devise=[EUR],Intervalle des rapports=[Semaine],Champ de vision.=[09/03/2025 - 15/03/2025],Rapport mis à jour=[21/03/2025]
ASIN,"Nom du produit",Marque,"Chiffre d’affaires basé sur les commandes","Unités commandées","Chiffre d’affaires basé sur les expéditions","COGS expédié","Unités expédiées","Retours client"
B00005QFCJ,"Hama Adaptateur Cassette VHS-C/VHS (Convertisseur Vidéo VHS C vers VHS, Cassette Adaptatrice Motorisée pour magnétoscope, 6 Mm, Non Compatible 8mm/MiniDV/Hi8) Noir",Hama,"3 011,54 €",121,"2 884,96 €","2 376,84 €",116,13
B00D2S92L0,"Xavax Hama Boîte de transport pour un gâteau (boîte rond, Ø 31,5 x 8cm, avec diviseur, capote et compartiments, partie de service et gâteau de gâteau) Anthracite/Transparent",xavax,"1 171,15 €",86,"1 131,19 €","595,11 €",83,2
B00006JAQ7,"Hama 007103 - Ruban photo transparent, Blanc, 1000 pièces (2 paquets de 500 pièces)",Hama,"952,84 €",287,"959,48 €","832,22 €",289,
B00005YVIU,"Hama Distributeurs Coins photo (1000 coins, autocollants, distributeur pratique, sans acide, sans solvant, adapté albums, permet un archivage fiable, scrapbooking) Transparent",Hama,"876,48 €",264,"826,68 €","724,95 €",249,4
B0BNLLF6YV,"Hama iTuner Hi-FI DIT2105SBTX Dab+ Bluetooth (Tuner Internet Radio FM Dab, Tuner HiFi, Radio numérique, RX/TX, WiFi, Spotify Connect, Amazon Music, App UNDOCK, Port USB, télécommande) Noir",Hama,"796,68 €",4,"597,51 €","602,04 €",3,
B01N2RIZMU,"Xavax Socle universel ""Gigant"" (60 x 60 cm, augmentation de 50 cm, socle stable avec compartiment inférieur, pieds réglables en hauteur, socle pour lave-linge/sèche-linge) Blanc",xavax,"667,76 €",5,"535,26 €","377,64 €",4,
B00006JAXW,"Hama Plateau Universel Hama Rond (40 cm, Taille XL, Poids supporté 100 kg (idéal pour TV, Enceintes, écrans, appareils de Cuisine) Noir",Hama,"624,75 €",25,"674,73 €","320,49 €",27,1
B07BGLLS26,"Chiffons pour écrans, 100 pièces, dans un distributeur",Hama,"582,88 €",92,"563,44 €","365,35 €",90,
B00006J4EP,"Hama Boîtier standard (pour CD et disques Blu-Ray, Étui protecteur pour CD, paquet de 10) Noir/Transparent",Hama,"524,30 €",70,"584,22 €","292,50 €",78,
B00UYZ1O3I,"Hama Support Plafond (pour Diagonale d'écran de 81 à 165cm (32"" à 65""), pour Un Maximum de 50 kg, VESA jusqu'à 400 x 400) Noir",Hama,"492,84 €",5,"394,10 €","248,80 €",4,
B00006IVA8,"Hama Cassette de Nettoyage VHS pour MAGNETOSCOPE (Nettoyeur de tête vidéo lecteurs VHS/S-VHS/VHS-C/S-VHS-C, Liquide de Nettoyage Inclus, Nettoyant de Têtes Vidéo - K7 Nettoyage VHS) Noir",Hama,"483,12 €",61,"491,04 €","564,20 €",62,2
B01N6NQ73J,"Thomson Casque TV avec câble extra long (Casque d'écoute ajustable et rembouré, Cordon 8m, Idéal pour regarder la télé, écouter la musique, contrôle du volume, prise jack 3,5mm+adaptat. 6,35mm) Noir",Thomson,"472,81 €",28,"472,33 €","306,27 €",28,1
B07GLF5SMF,"Hama Album Photo ""Fine Art"" (format 30 x 30 cm, 100 pages noires, sans spirale) Noir",Hama,"472,79 €",24,"369,74 €","187,09 €",19,
B0009V6Q30,"Hama Boîtier Slim (pour CD et disques Blu-ray, ultra mince, avec une feuille pour la couverture, lot de 25) Transparent/Bleu/Orange/Vert/Rouge/Violet",Hama,"469,53 €",47,"469,53 €","380,23 €",47,
B07CLVR52S,"Hama Album photo enfant ""Batzi"" (taille de l'album de 19 x 25 cm, format pour 200 photos 10 x 15 cm, avec 100 pages, papier stratifié, insertion latérale des photos, ours debout) Marron",Hama,"403,04 €",44,"412,20 €","287,54 €",45,
B0764LMPBN,"Hama Multiprise avec Interrupteur 10 Prises 16A (Rallonge multiprises 3m, Bloc 10 Prises Type F Schuko, 3500W Max, Idéal Bureau PC luminaires, Atelier, Meuble TV, Garage) Noir",Hama,"355,82 €",17,"482,12 €","248,64 €",24,
B08GRRDVN9,"Hama Destructeur de Documents Mini S6 (Broyeur Documents 6 Feuilles 80g, Destructeur Papier, Déchiqueteur sécurité P1, 72 DB, M/A Auto, Fonction Retour, s'adapte sur des Corbeilles à Papier) Noir",Hama,"355,70 €",14,"355,70 €","215,75 €",14,
B0002W5WE0,"Hama Boîtier Slim Double (pour DVD, Convient également aux CD et disques Blu-Ray, Ultra Mince, avec Une Feuille pour la Couverture, Lot de 25) Noir/Transparent",Hama,"325,68 €",23,"311,52 €","243,10 €",22,
B0002W5WEU,"Hama Boîtier Slim (pour DVD, Convient également aux CD et disques Blu-Ray, Ultra Mince, avec Une Feuille pour la Couverture, Lot de 25) Noir/Transparent",Hama,"325,68 €",23,"325,68 €","241,04 €",23,1
B0000AISCF,"Hama Cadre photo en plastique Sevilla (taille du Cadre de 21 x 29,7 cm (DIN 4) avec bordure de 9 mm x 17 mm, pour une photo de 15 x 20 cm) Noir",Hama,"314,37 €",63,"364,27 €","211,70 €",73,
B00006JAMU,"Hama Étuis à négatifs, polypropylène, 7 bandes de 6 négatifs, 24x36cm, 25 pièces",Hama,"304,38 €",23,"331,02 €","256,42 €",25,
B003PFBLOQ,"Hama Horloge murale ""PP-245"" (radio-pilotée DCF, Pendule sans Tic Tac, Numérique, à led, sans fil, avec des piles, Format 24h, Calendrier, Jour, Thermomètre 0°C à +50°C, pause murale ou bureau) Plastique, Noir",Hama,"272,67 €",7,"201,24 €","107,64 €",6,
B00005QFAY,"Hama Étuis à négatifs, Papier Cristal, 7 Bandes de 6 négatifs, 24x36cm, 100 pièces",Hama,"268,81 €",12,"268,81 €","188,52 €",12,
B07CKR6PKL,"Hama Album photo enfant ""Batzi"" (taille de l'album de 19 x 25 cm, format pour 200 photos 10 x 15 cm, avec 100 pages, papier stratifié, insertion latérale des photos, ours assis) Marron",Hama,"247,32 €",27,"238,16 €","166,14 €",26,
B00006IVA9,"Hama CD de nettoyage (pour tête de lecture laser, pour éliminer la poussière dans les lecteurs de CD, CD de nettoyage au laser) Blanc/Bleu/Rouge",Hama,"241,06 €",26,"211,33 €","121,12 €",23,1
B00005UPC8,"Hama Boîtier standard double (pour CD et disques Blu-Ray, Étui protecteur pour CD, paquet de 10) Transparent",Hama,"229,77 €",23,"259,74 €","174,46 €",26,
B08SFPD9F2,"Hama Station météo sans fil interieur exterieur Meteotime (centre de prévision météorologique, Horloge radio pilotée DCF, Sonde sans fil, Thermomètre, Hygromètre, Alarme, Reveil, rétro éclairage) noir",Hama,"217,85 €",4,"270,54 €","236,25 €",5,2
B0002W5WBS,"Hama Boîtier Slim (pour CD et disques Blu-Ray, Ultra Mince, avec Une Feuille pour la Couverture, Lot de 50) Noir/Transparent",Hama,"216,09 €",9,"240,10 €","125,00 €",10,
B00G3BMWQA,"Xavax Minuteur à œuf (avec fonction minuterie, sablier, en acier inoxydable) Argent",xavax,"213,12 €",32,"199,80 €","132,90 €",30,
B0BNLNC6KX,"Hama iTuner Hi-FI DIT2105SBTX Dab+ Bluetooth (Tuner Internet Radio FM Dab, Tuner HiFi, Radio numérique, RX/TX, WiFi, Spotify Connect, Amazon Music, App UNDOCK, Port USB, télécommande) Argenté",Hama,"211,08 €",1,"211,08 €","204,00 €",1,
B0009V8WNW,"Hama Pochettes de Protection (en Papier pour CD/DVD/Blu-Ray, verrouillables, Lot de 100) Blanc/Transparent",Hama,"207,41 €",21,"197,44 €","60,96 €",20,
B00SL6I2WI,"Hama Album Photo Jumbo ""Fine Art"" (Album 30x30cm, 50 feuilles/100 pages blanches, pour coller 400 Photos de 10x15 cm, Look livre sans spirale, Couverture personnalisable, Idée cadeau) Noir",Hama,"194,04 €",11,"211,74 €","97,21 €",12,1
B0083M13TY,"Hama Cadre photo en plastique Sevilla (taille du Cadre de 29,7 x 42 cm (DIN A3) avec bordure de 9 mm x 17 mm, pour une photo de 18 x 24 cm, verre en polystyrène) Noir",Hama,"189,81 €",19,"159,84 €","91,20 €",16,1
B01K47GW46,"Hama Album photo Jumbo ""La Fleur"" 30 x 30 cm (livre photo de 100 pages blanches, album photos souvenirs pour 400 photos au format 10x15 cm, à personnaliser- à coller, Idée Cadeau, motif Feuilles) Noir",Hama,"183,94 €",17,"216,40 €","139,80 €",20,
B018VONYPY,"Hama Sonic Mobil 183 Enceintes pour Ordinateur - Système Stéréo 2.0, Haut-Parleurs Alimentés en USB, Connexion Jack 3.5mm - Noir/Rouge",Hama,"181,93 €",16,"155,39 €","95,90 €",14,1
B00006JABA,"Hama Adhésif Cinekett (pour films Super 8, 100 pièces, S8, 1 piste audio libre) Blanc/Rouge",Hama,"180,18 €",10,"109,20 €","71,88 €",6,
B08SDTHMQB,"Hama Album Photo bébé ""Our Baby"" personnalisable Scrapbooking (Album photo naissance, baptême, Cadeau d'anniversaire enfant, Style Mémo, 22,5 x 22 cm, 100 Pages, Max. 200 Photos 10x15 cm) Multicolore",Hama,"174,80 €",20,"157,32 €","99,03 €",18,
B0013IPAJY,"Hama Kit de Nettoyage et de réparation pour CD/DVD (25 ML de pâte de réparation, 45 ML de Liquide nettoyant, 1 Coque de Nettoyage, 5 Chiffons, 8 pièces) Blanc/Bleu/Rouge/Noir",Hama,"167,87 €",8,"148,29 €","101,01 €",7,2
B08YRY2LQJ,"Hama Câble Jack 3.5 Male Male (Câble Auxiliaire Stéréo Jack 3.5mm, Cable Audio Garantie 10ans, 1.5m, compatible iPhone, iPod, iPad, Voiture, Casque, Autoradio, Smartphones, MP3) Noir",Hama,"166,00 €",50,"142,76 €","199,83 €",43,
B0000AISCX,"Hama Cadre Photo Clip-Fixe (sans Bordure, 30 X 45 Cm, Anti-Reflex) Blanc",Hama,"158,08 €",19,"174,72 €","93,66 €",21,
B000EBFN70,"Hama Trépied Appareil Photo Vidéo 106.5cm Star 5"" avec Sac de Transport (Trépied Télescopique Aluminium 4 éléments, Tête 3 Voies 3D, Niveaux à Bulles intégrés, Attache Rapide) Beige",Hama,"155,29 €",11,"197,20 €","151,90 €",14,
B0032DAL6U,"Hama Album photo ''Catania'' (taille 22 x 22 cm pour 200 photos au format 10 x 15 cm, 100 pages, papier stratifié, thématique mariage/vacances, emplacement pour CD, personnalisable) Gris",Hama,"151,80 €",17,"188,44 €","104,37 €",21,
B000EORX5W,"Hama 00033833 Pochette, Noir (pour 120 CD/DVD/Blu-ray, classeur de rangement, gain de place pour le bureau, le salon et la maison, étuis de transport)",Hama,"149,90 €",10,"149,90 €","88,90 €",10,
B001JTV1HW,"Hama Boîtier standard (pour DVD, convient également aux CD et aux Blu-ray, avec film pour l'insertion de la jaquette, lot de 5) Transparent",Hama,"149,70 €",30,"134,73 €","79,92 €",27,1
B09MQQM1ZJ,"Xavax Socle machine à laver avec étagère (Support Sèche Linge Lave Linge,Réhausseur de Machines, Base universelle avec Pieds Réglables en hauteur, charge 150 kg) Blanc",Xavax,"147,65 €",2,"74,34 €","52,00 €",1,
B00005UPB7,"Hama Boîtier Standard (pour CD et disques Blu-Ray, Étui Protecteur pour CD, Paquet de 5) Transparent",Hama,"144,71 €",29,"144,71 €","95,12 €",29,
B01MS2OU9J,"Hama Chambre à air de vélo (Taille de 26"", avec Valve Automatique, Schrader) Noir",Hama,"144,71 €",29,"134,73 €","96,12 €",27,
B07BZVN4MB,"Hama Radio numérique ""DR350"", FM/DAB/DAB+ (pour réception FM / DAB / DAB +,radio de cuisine sous comptoir, écran couleur, fonction d'alarme, fonctionnement sur secteur) Blanc",Hama,"141,65 €",1,"141,65 €","42,00 €",1,
B08HQH5PSV,"Hama Horloge Murale Numérique Jumbo (Radio-pilotée DCF, Très Grand Format d’Affichage, Affichage XL Heure-Date-température int.-humidité, à Suspendre ou Poser) Noir",Hama,"139,23 €",3,"92,82 €","80,00 €",2,
B0B6362TKP,"Hama Radio numérique DIR3300SBT (Spotify, WLAN/LAN/Dab + / FM, écran Couleur, Fonction USB, réveil et Diffusion Wi-FI, multiroom, télécommande, Application de Radio Gratuite) Noir",Hama,"137,32 €",1,"137,32 €","98,00 €",1,
B001F4ZWDK,"Hama Pochettes en polypropylène pour CD/DVD, paquet de 75, Transparent",Hama,"134,82 €",18,"149,80 €","93,60 €",20,
B000BGFJI6,"Hama Carte mémoire Photo (SD pour Photo/Classe 4, 2 GB - 10 MB/s) Bleu",Hama,"133,65 €",15,"123,56 €","73,60 €",14,
B084HYZP7G,"Hama Album Photo ""Fine Art"" (format 30 x 30 cm, 80 pages blanches, sans spirale) Sable",Hama,"131,20 €",8,"131,20 €","58,78 €",8,
B07T63BHGL,"Hama Album photo ""Hello Panda"" (pour 200 photos au format 10 x 15 cm, petit album de taille 22,5 x 22 cm, 100 pages blanches, panda, avec emplacement pour CD, élégant) Turquoise/Noir/Blanc",Hama,"128,24 €",14,"119,08 €","89,96 €",13,
B00X5K84ZK,"Hama Album photo à pochettes ""New York City"" (pour 400 photos au format 10 cm x 15cm, taille de l'album de 25 cm x 34 cm, 100 pages, en cuir, protège les photos et les documents) Noir",Hama,"122,85 €",5,"122,85 €","64,24 €",5,
B06XB2Y8KR,"Hama Album traditionnel ""Lazise"" (taille de l'album de 22,5 x 22 cm, pour 200 photos au format 10 cm x 15 cm, 100 pages, avec pochette CD, élégant) Blanc/Noir/Rose",Hama,"122,36 €",14,"139,84 €","88,58 €",16,
B0B636GVMW,"Hama Radio numérique DIR3300SBT (Spotify, WLAN/LAN/Dab + / FM, écran Couleur, Fonction USB, réveil et Diffusion Wi-FI, multiroom, télécommande, Application de Radio Gratuite) Blanc",Hama,"120,08 €",1,"120,08 €","98,00 €",1,
B08G4S1RH5,"Hama Slim & Light 70W Chargeur Rapide Voiture Universel pour PC Portable 15-19V - [8 Adaptateurs] [Protection Contre la surchauffe & sur-tensions] Noir",Hama,"116,64 €",4,"116,64 €","112,09 €",4,
B00005YVGK,"Pochettes pour 20 Diapositives encadrées de Format 5x5 cm, 25 pièces",Hama,"116,63 €",7,"100,81 €","46,47 €",6,
B0CP84W4GX,"Hama Support Mural TV Fixe avec Dispositif Antivol Garantie 10 Ans (TV 37"" à 90"", 94 à 229cm 50Kg Max, Idéal espaces Professionnels, Compatible VESA 600x400, Chevilles Fischer founis, Easy Fix) Noir",Hama,"115,10 €",2,"115,10 €","97,42 €",2,
B07SHMY2ZM,"Hama Horloge Murale PP-245 (Radio-pilotée DCF, Pendule sans tic tac, numérique, à LED, sans Fil, avec Piles, Format 24h, Calendrier, Jour, thermomètre 0°C à -50°C, Pause Murale ou Bureau) Noir",Hama,"114,13 €",4,"114,13 €","86,76 €",4,
B079175GWR,"Hama Souris Ergonomique sans Fil (Souris Verticale sans câble pour droitiers, Souris sans Fil sans Fil avec capteur Optique 1000/1400/1800 dpi) Noire, Prise USB Type-A, Pile AA Mignon",Hama,"113,89 €",5,"113,89 €","78,71 €",5,1
B079J94XKT,"Xavax Filtre permanent pour machine à café et thé (Ø 12 cm, hauteur 10 cm, maillage en acier inoxydable, réutilisable, va au lave-vaisselle, rechange pour taille 4) Noir",xavax,"113,55 €",10,"87,87 €","41,04 €",8,
B001E725JM,"Hama Blu-Ray de Nettoyage (pour tête de Lecture, pour éliminer la poussière dans Les lecteurs de Blu-Ray, Blu-Ray de Nettoyage) Blanc/Bleu/Rouge",Hama,"112,40 €",6,"145,72 €","106,63 €",8,
B00006JDEX,"Hama Plateau Universel Hama Rond (32 cm, Taille L, Poids supporté 80 kg (idéal pour TV, Enceintes, écrans, appareils de Cuisine) Noir",Hama,"112,38 €",6,"149,84 €","73,12 €",8,
B0BRL62B16,"Hama Multiprise Etanche 2 Prises 16A avec Interrupteur (Multiprise Extérieur Rallonge 2m, Bloc 2 Prises étanches IP44 avec Couvercle, Type F Schuko, 3680W, Idéal Jardin Garage Atelier Chantier) Noir",Hama,"111,57 €",6,"111,57 €","67,80 €",6,
B08SDTPYQP,"Hama Mini Trépied de Table Pocket II Rotation (trépied avec Support Smartphone iPhone/Samsung/GoPro, Rotatif, inclinable Paysage Portrait, idéal Voyage, Pas de vis de 1/4"") Noir",Hama,"111,30 €",15,"111,30 €","132,90 €",15,1
B07SZ3FCZH,"Hama Album photo mémo ""Forest"" (pour 200 photos au format 10 x 15 cm, album traditionnel enfant de 22,5 x 22 cm, 100 pages blanches, animaux, élégant, emplacement CD) Marron/Beige/Vert/Orange/Jaune",Hama,"109,76 €",8,"123,48 €","46,27 €",9,
B0002W5WBI,"Hama Boîtier Slim (pour CD et disques Blu-Ray, Ultra Mince, avec Une Feuille pour la Couverture, Lot de 100) Noir/Transparent",Hama,"103,20 €",3,"309,60 €","240,12 €",9,
B00RLNCZ52,"Hama Album photo ""Moni"" (pour 200 photos au format 10 x 15 cm, album photo bébé de 100 pages blanches, ciel, élégant, pour filles, enfants, bébés) Rose, petit album de taille 22,5 x 22,5 cm",Hama,"100,88 €",8,"88,27 €","42,98 €",7,
B07ZL4K6DC,"Hama Radio numérique DR36SBT (pour réception FM/Dab/Dab + / Bluetooth,Radio de Cuisine sous comptoir, écran Couleur, Fonction d'alarme, Fonctionnement sur Secteur) Blanc",Hama,"100,51 €",1,,,,
B079PN72PJ,"Hama Souris Optique sans Fil Riano (Souris Gauche sans Fil, avec récepteur Nano USB, Vertical, 800-1600 dpi, Interrupteur de Marche/arrêt, 3 Boutons, 2,4 GHz) Noir",Hama,"99,12 €",7,"155,76 €","110,94 €",11,
B000N8UX88,"Hama Trépied Appareil Photo Star 20""",Hama,"98,95 €",13,"83,79 €","38,04 €",11,
B002QPT4T0,"Xavax Socle universel (60 x 60 cm, augmentation de 40 cm, socle stable avec compartiment inférieur, pieds réglables en hauteur, socle pour lave-linge/sèche-linge) Blanc",xavax,"97,61 €",1,"97,61 €","75,25 €",1,
B00BYCGMEG,"Hama Album photo vierge ""Livorno"" (album photo traditionnel format 22 cm x 22 cm, pour 200 photos 10 cm x 15 cm, 100 pages, emplacement CD) Bleu/Blanc/Jaune",Hama,"96,14 €",11,"87,40 €","55,80 €",10,
B0B638RFP2,"Hama Radio numérique DIR3200SBT (Spotify, WLAN/LAN/Dab + / FM, écran Couleur, Fonction USB, réveil et Diffusion Wi-FI, multiroom, télécommande, Application de Radio Gratuite) Noir",Hama,"94,37 €",1,"187,96 €","140,00 €",2,
B000V8QPQ4,"hama hama Câble d'antenne, prise coaxiale 75 db - prise coaxiale 10,0 m",Hama,"94,23 €",9,"115,85 €","44,66 €",11,1
B08SDTGVK8,"Hama Album Photo Livre bébé ""My Little Me"" à personnaliser (Album photo naissance, baptême, Cadeau d'anniversaire enfant, Idéal scrapbooking, 29x32cm, 60 Pages, Max. 300 Photos 10x15 cm) Multicolore",Hama,"93,24 €",7,"79,92 €","47,94 €",6,
B0BLZ1RZKG,"Hama Multiprise avec Interrupteur (Bloc 4 Prises Schuko 16A, Interrupteur Individuel éclairé, idéal économie d'énergie, Prises à 90°, œillet Suspension integré, 3680W, Cable 1.4m H05VV-F) Blanc",Hama,"91,60 €",5,"91,60 €","62,50 €",5,
B0000AI2JY,"Hama Cadre photo en plastique Sevilla (taille du Cadre de 50 x 60 cm avec bordure de 13 mm x 20 mm, pour une photo de 30 x 40 cm) Noir",Hama,"91,60 €",5,"73,28 €","43,32 €",4,1
B0000AHICV,"Hama Boîtier CD/DVD Slim (lot de 10 boitiers standards vierges pour CD/DVD et disques Blu-ray, ultra plat) Noir/Transparent",Hama,"87,58 €",9,"77,36 €","26,80 €",8,
B08GS8FVB5,"Hama Destructeur de Documents Basic S6 (Broyeur de Documents, Sécurité P-2, 6 Feuilles, Corbeille 8L, Découpe en Bandes 6mm, 70 DB, M/A Auto, Idéal Bureau & Maison) Noir",Hama,"87,48 €",3,"174,96 €","113,78 €",6,
B08SDYYDL2,"Hama Album mémo « Stamps » à personnaliser (Album souvenirs de famille ou de voyage, idéal cadeau et scrapbooking, 22x22,5 cm, album livre 100 Pages, Max : 200 Photos 10x15 cm) Multicolore",Hama,"87,40 €",10,"43,70 €","34,73 €",5,
B00006JA17,"Hama Étuis à négatifs, Papier Cristal, 4 Bandes de 3 négatifs, 6X7 cm pour 3 negatif et jusqu'a 6 X 9 cm pour 2 negatif, 100 pièces",Hama,"83,28 €",4,"83,28 €","62,75 €",4,
B0CNRZ9GWN,"Hama Boîte pour câbles Maxi (Boite Rangement pour Cables chargeurs et multiprises, boitier Cache câbles 40x15,5x13,5cm, Pieds en Caoutchouc) Blanc",Hama,"83,28 €",4,"104,10 €","70,05 €",5,
B000VRFBM4,"Hama Album Photo ""Fine Art"" (format 36 x 32 cm, 50 pages noires, à spirale) Noir",Hama,"83,10 €",5,"83,10 €","40,20 €",5,
B07T4DM8JJ,"Hama Album photos enfant mémo ""Forest"" (livre photo 100 pages à pochettes, 200 photos 10x15 cm, album souvenirs 22,5 x 22 cm, Emplacement CD, Album Motif Renards) Marron/Beige/Vert/Orange/Blanc",Hama,"81,96 €",6,"40,98 €","16,47 €",3,
B096YFPTBR,"Hama Kit de Nettoyage d'Appareil Photo 4 en 1 ""Optic Dry (Kit de Nettoyage à Sec avec Stylo Lenspen + Chiffon Microfibre + Poire, pour Objectif Photo, Filtre, APN, Caméra Reflex, Jumelle, écran)",Hama,"81,17 €",5,"65,00 €","75,64 €",4,
B06XBXLK8B,"Hama Album photo ""Lazise"" (couverture souple, 24 pages pour 24 photos au format 10x15 cm, résistant, pour archiver avec des anecdotes, protège la photo, mini album) 4 Motifs cœur aléatoires",Hama,"80,60 €",65,"83,08 €","58,08 €",67,
B07PQHPTSG,"THOMSON Casque TV Stéthoscope HED4408 (câble de 8 m, léger pour Personnes âgées et porteurs de Lunettes, Casque stéréo pour TV, Casque Intra-auriculaire, Prise 3,5 mm, avec Adaptateur 6,35 mm) Noir",Thomson,"79,98 €",3,"106,64 €","89,48 €",4,
B09W5TSVGB,"Hama NHS-P100 V2 Casque Micro - Casque Tour de Cou, Microphone Intégré, Léger, Télécommande Intégrée, Fonction Mute - Noir",Hama,"79,92 €",6,"79,92 €","57,66 €",6,
B00005UPC4,"Hama Rack (pour CD, pour 20 boîtiers CD) Gris",Hama,"79,92 €",6,"79,92 €","52,08 €",6,
B096YFJPLV,"Hama Coque iPhone 12/12 Pro Compatible MagSafe MagCase Finest Sense pour Apple (Etui magnétique pr Recharge à Induction, protège des Chocs Rayures & saletés, Housse élégante, Cuir synthétique) Noir",Hama,"78,44 €",4,"78,44 €","73,08 €",4,
B01K47HIEY,"Hama Album photo ""Skies"" (album grand format, 22,5 x 22 cm, 100 pages, pour 200 photos au format 10 x 15 cm) Gris",Hama,"77,24 €",8,"77,48 €","43,12 €",8,
B0BHZD1NNZ,"Hama Multiprise avec Interrupteur (Bloc 4 Prises Schuko 16A, Interrupteur Individuel éclairé, idéal économie d'énergie, Prises à 90°, œillet Suspension integré, 3680W, Cable 1.4m H05VV-F) Noir",Hama,"73,28 €",4,"73,28 €","50,00 €",4,
B09N9TH54H,"Xavax Égouttoir Porte Bouteilles (Support d'égouttage jusqu'à 6 Bouteilles, Pots, biberons Verres Tasses ou Mugs, Egouttoir Compact et Design, idéal sodastream, air-up, Avent, Philips) Noir",Xavax,"73,28 €",4,"73,28 €","34,20 €",4,
B0C5JQPC2P,"Classeur avec mécanisme à 4 anneaux, larg. 70 mm, avec étui, noir/gris",Hama,"73,28 €",4,"109,92 €","70,80 €",6,
B001F536FK,"THOMSON Casque Audio Filaire (Casque Stéréo Filaire Jack, Réglable, Supra-aural, Ultra-léger, 54g, Coussinets 27mm, 95dB, Cable 1.3m, idéal PC Smartphone Mac Tablette Ordinateur) Noir",Thomson,"69,93 €",7,"69,93 €","36,40 €",7,
B01KFLHB1E,"Hama Album photo vierge ""Bernd"" (album photo traditionnel format 22,5 cm x 22 cm, 100 pages, pour 200 photos 10 cm x 15 cm) Marron/Blanc/Noir",Hama,"69,92 €",8,"52,44 €","33,48 €",6,
B0000AHIIZ,"Hama Cadre photo Clip-Fixe (sans bordure, 15 x 21 cm, Reflex) Blanc",Hama,"67,23 €",27,"47,31 €","24,39 €",19,
B0BL1T1R5Y,"Hama Casque TV ShellTV (Casque Circum-Auriculaire Stéréo, idéal télé, câble Extra Long 6m, Jack 3.52mm mâle, Adaptateur Jack 6.35mm mâle Inclus, 20 Hz-20 kHz, 32 ohms, 113 DB/MW) Noir",Hama,"66,64 €",4,"66,64 €","51,80 €",4,
B017J9FOZA,"Xavax Thermomètre numérique pour rôtis (de torréfaction, numérique, 2 in 1, avec horloge de cuisine, sonde de température amovible, pour viande, -10°C à +250°C, avec minuteur, à câble) Noir/Argent",xavax,"66,08 €",4,"66,08 €","42,64 €",4,
B0DP4YSM41,"Hama ""Smart Hub"" passerelle WiFi connectée (Matter, Zigbee, Thread, compatible commande vocale Alexa, Google Assitant et Apple Siri), blanche",Hama,"65,83 €",1,"65,83 €","51,91 €",1,
B00292AZN4,"Hama Cadre photo Clip-Fixe (sans bordure, 30 x 40 cm, Reflex) Blanc",Hama,"65,07 €",6,"43,17 €","12,76 €",4,1
B0C5JRX9HV,"Hama Multiprise avec Interrupteur 1.4m (6 Prises typeE, Norme NF, interrupteurs général + indiv. éclairés, Protection Surtensions, Montage Mural, Sécurité Enfants, 3680W/16A) Noir",Hama,"64,98 €",3,"21,66 €","16,90 €",1,
B084HZJ2TV,"Hama Album Photo ""Fine Art"" (format 30 x 30 cm, 80 pages blanches, sans spirale) Vert Tilleul",Hama,"63,48 €",4,"63,48 €","37,08 €",4,
B00W5C0BRS,"Hama Casque Stéréo HK-229 (Casque Audio Supra-Auriculaire pour Lecteur mp3, iPod, Bande passante de 20 Hz - 20 kHz, Jack 3,52mm mâle, câble uni-latéral de 1,5 m, Ajustable et léger) Noir/Gris",Hama,"63,09 €",4,"63,09 €","42,40 €",4,
B08GS628KS,"Hama Destructeur de Documents Home X12CD (Broyeur Documents 12 Feuilles 80g, Destructeur CD/CB, Niveaux de sécurité E3 P4 T4, LED on/Off et surchauffe, 72 DB, M/A Auto, Corbeil 21L) Noir",Hama,"61,87 €",1,"61,87 €","44,10 €",1,
B01K47CMCM,"Hama Album photo vierge ""La Fleur"" (album photo traditionnel 22,5 cm x 22,5 cm, 100 pages, pour l'insertion de 200 photos au format 10 cm x 15 cm, motif de feuilles, pochette CD) Blanc",Hama,"61,18 €",7,"61,18 €","43,31 €",7,
B000VRANHW,"Hama Album Photo ""Fine Art"" (format 28 x 24 cm, 50 pages noires, à spirale) Noir 00090145",Hama,"60,10 €",5,"60,10 €","24,00 €",5,
B00006JA8E,"Hama Étuis à négatifs (Lot de 25 Pochettes Rangement Diapos/Negatifs pour Classeurs à Anneaux, 40 Negatifs par Feuille, Polypropylène)",Hama,"59,96 €",4,"59,96 €","47,60 €",4,
B0C6CK8KFG,"Hama Câble Enceinte HiFi (Cable pour enceinte, 10m, Câble Audio pour Enceinte, Câble HP de Haut Parleur en Cuivre pour Hifi et Hifi embarquée, 2 x 0.75 mm²) Transparent",Hama,"59,52 €",12,"79,56 €","66,95 €",16,
B005GCMZD2,"Hama Album photo à pochettes ""Singo"" (couverture souple, pour 24 photos au format 18x13 cm, résistant, protège la photo) Couleur aléatoire parmi Orange, Vert, Bleu et rose",Hama,"57,96 €",28,"66,24 €","46,72 €",32,
B01IW9057S,"Hama Album photo traditionnel ""Rustico"" (album mémo, album de 22,5 x 22,5 cm, 100 pages blanches, 200 photos au format 10x15, idéal pour le scrapbooking, insertion des photos) Love Key",Hama,"57,02 €",4,"57,02 €","22,24 €",4,
B00T7M8Y6E,"Hama Album photo à pochette minimax ""New York City"" (pour 100 photos au format 10 cm x 15cm, taille de l'album de 13,5 cm x 17 cm, 100 pages, en cuir, protège les photos et les documents) Noir",Hama,"55,94 €",5,"66,88 €","28,74 €",6,
B0009V8VAQ,"Hama Etui pour Lecteur et CD (pour Lecteur CD, pour Discman, 3 CD, avec Sortie de câble et Boucle de Ceinture) Noir/Bleu",Hama,"55,48 €",6,"48,82 €","25,55 €",5,
