B08XZCYYF3,"Hama Montre connectée Fit Watch 4900 étanche avec Protection IP68 pour la résistance à l'eau (6 Jours d'autonomie, podomètre, Tracker de fréquence Cardiaque et Mesure des dépenses de Calories) Bleu",Hama,"55,23 €",1,"55,23 €","21,50 €",1,
B000Y138NG,"Hama Boîtier CD ""Slim"" en polypropylène, lot de 20, Transparent",Hama,"54,96 €",6,"54,96 €","35,76 €",6,
B071ZVN9LP,"Hama Albums photos ""Designline"" (couverture souple, 24 pages pour 24 photos au format 10x15 cm par album, résistant, pour archiver avec des anecdotes, protège la photo, mini album) Multicolore",Hama,"51,75 €",9,"40,25 €","6,16 €",7,7
B01NCK7ZL3,"Hama Album Photo Fine Art (Format 30 x 30 cm, 100 Pages Noires, sans Spirale) Craie",Hama,"51,66 €",3,"34,44 €","20,65 €",2,
B00005QFB0,"Hama Étuis à négatifs, papier cristal, 7 bandes de 6 négatifs, 24x36cm, 25 pièces",Hama,"50,80 €",4,"46,08 €","21,24 €",4,
B08SFG3JH5,"Hama Album photo ""To The Moon"" (Album souvenirs Anniversaires, Baptême, Baby Shower, Idée cadeau, 22.5x22 cm, 100 pages blanches, Zone Mémo, 200 photos 10x15 cm, Insertion latérale) Multicolore",Hama,"50,41 €",3,"50,95 €","26,34 €",3,
B0CKJ46BFN,"Xavax Porte-capsules de café pour Tassimo (Distributeur de capsules à café, Support Rangement pour 26 capsules, Présentoir à Capsules Tassimo) Noir mat",Xavax,"49,98 €",3,"33,32 €","22,88 €",2,
B00IYX10YA,"Hama Cadre photo en plastique Sevilla (taille du Cadre de 29,7 x 42 cm (DIN A3) avec bordure de 9 mm x 17 mm, pour une photo de 18 x 24 cm, verre en polystyrène) Bleu",Hama,"49,95 €",5,"49,95 €","25,50 €",5,
B074JDHBXG,"Hama Cadre en Plastique Madrid (Taille de Cadre de 21 cm x 29,7 cm, Taille de la Photo de 15 cm x 20 cm, 1 Photo par Cadre, à accrocher, élégant, Simple, Classique) Noir",Hama,"49,92 €",12,"58,24 €","32,62 €",14,
B078T62G9K,"Hama Souris Optique à 3 Boutons MC-200, Filaire, Blanche",Hama,"49,90 €",10,"39,92 €","29,66 €",8,
B000EOPSRM,"Hama Pochette (pour 40 CD/DVD/Blu-Ray, classeur de Rangement, Gain de Place pour Le Bureau, Le Salon et la Maison, étuis de Transport) Noir",Hama,"48,72 €",5,"65,36 €","39,41 €",7,
B00A44OC0G,"Hama Barre Multiprise 6 Prises avec Interrupteur Et Sécurité Enfant Cble Blanc 5 M",Hama,"48,64 €",3,"48,64 €","31,56 €",3,
B003O5MK7E,"Hama Passe-partout Premium, noir, 40 x 50 cm pour photo de 30 x 40 cm",Hama,"47,46 €",6,"47,46 €","30,12 €",6,
B0009V6OCS,"Hama Boîtier Slim (pour CD et disques Blu-ray, ultra mince, avec une feuille pour la couverture, lot de 25) Noir/Transparent",Hama,"46,64 €",4,"46,64 €","27,56 €",4,
B08YRZT1RL,"Hama Hub USB, 4 Ports, USB 2.0, 480 Gbit/s, Métal, Noir",HAMA,"46,62 €",7,"39,96 €","24,60 €",6,
B01KHD5GUS,"Hama Multiprise, ""6+1"" (commutable individuellement, avec protection anti-surtension, montage mural, pivotée à 90°, longueur de douille XL, protection enfant, longueur de câble de 1,4 m) Blanc",Hama,"46,10 €",2,"46,10 €","25,76 €",2,
B00006JDOZ,"Hama Filtre UV (Anti-UV et Protection, Compensation 2X, Traitement antireflet, pour objectifs d'appareils Photo 52 mm, O-Haze, traité) Noir",Hama,"45,91 €",8,"40,11 €","31,71 €",7,
B00006JCRV,"Hama Boîtier Standard Double (pour CD et disques Blu-Ray, Étui Protecteur pour CD, Paquet de 5) Noir/Transparent",Hama,"45,70 €",10,"50,27 €","35,42 €",11,
B001JQF4ZU,"Hama Kit d'alimentation, 25mm²",Hama,"45,52 €",1,"45,52 €","32,01 €",1,
B00T7MB37Q,"Hama Album photo à pochettes ""New York City"" (pour 300 photos au format 10 cm x 15cm, taille de l'album de 19 cm x 34,5 cm, 100 pages, en cuir, protège les photos et les documents) Noir",Hama,"44,97 €",3,,,,
B00005UPBH,"Hama Boîtier standard double (pour CD et disques Blu-Ray, Étui protecteur pour CD, paquet de 5) Transparent",Hama,"44,91 €",9,"44,91 €","31,59 €",9,
B079P3WD2X,"Thomson Antenne intérieure ANT1538 (pour réception Radio/télévision numérique, HDTV/3D, DVB-T/T2, avec Amplification du Signal, Performance 45) Noir/Bleu",Thomson,"44,62 €",1,"44,62 €","25,05 €",1,1
B00005QF9N,"Hama Attache Rapide pour Trépied, Click II (Plateau Rapide Tête de Trépied, Fixation Rapide pour Appareil Photo/Caméscope à Filetage 1/4"" 6.4mm, pour Trépieds Gamma) Noir",Hama,"44,26 €",6,"44,26 €","37,32 €",6,
B0000AHIBP,"Hama Boîtier standard (pour 3 DVD, convient également aux CD et disques Blu-ray, avec film pour l'insertion de la jaquette, lot de 5) Noir",Hama,"44,24 €",4,"22,12 €","9,46 €",2,1
B0CNRYZR3R,"Hama Boîte pour câbles Maxi (Boite Rangement pour Cables chargeurs et multiprises, boitier Cache câbles 40x15,5x13,5cm, Pieds en Caoutchouc) Noir",Hama,"43,32 €",2,"21,66 €","14,01 €",1,
B0000AI3IQ,"Hama Cadre photo en plastique Sevilla (taille du Cadre de 50 x 70 cm avec bordure de 13 mm x 20 mm, pour une photo de 30 x 45 cm) Noir",Hama,"42,48 €",2,"42,48 €","25,04 €",2,
B093WSK4SC,"Hama Radio Internet Dab/Dab+ 'DR200BT' (Radio numérique FM/Dab/Dab+ Portable, Haut Parleur Bluetooth Rechargeable USB-C, Ecran Couleur, Entrée AUX, Minuteur, 30 Présélections, 8h d'écoute) Noir",Hama,"42,47 €",1,"42,47 €","34,50 €",1,
B0C2PHJJ9H,"Hama EMW-700 Souris Verticale Ergonomique sans Fil - Technologie 2.4Ghz & Bluetooth® 4.2, Rechageable en USB C, Eclairage RGB, Capteur 2400 dpi, Multi-Devices - Grise Anthracite",Hama,"41,66 €",1,"41,66 €","35,23 €",1,
B00SL6I214,"Hama Album, Bleu, 30 x 30 cm",Hama,"39,96 €",3,"53,28 €","35,92 €",4,
B00006JDAX,"Hama Pâte adhésive (250 g, pour fixer, spécialement conçu pour la photo) Gris Neutre",Hama,"39,84 €",2,"39,84 €","27,52 €",2,
B0CYQB5JYH,"Hama Émetteur Recepteur Bluetooth Link.it Duo pour TV Stéréo Ecran Audio Video, Adaptateur Bluetooth Multipoint pour 2 Sources, Faible Latence, USB-C, Jack, Fibre Optique Noir",Hama,"39,72 €",1,"39,72 €","32,22 €",1,
B071VWLNZB,"Hama 00137234 Alimentation pour PC",Hama,"39,16 €",2,"39,16 €","20,72 €",2,
B00006J4GV,"Hama Multiprise 3 Prises 16A avec Interrupteur (Rallonge multiprises 3m, Bloc 3 Prises Type F Schuko, Idéal Bureau PC luminaires, Atelier, Meuble TV, Garage) Blanc",Hama,"38,40 €",4,"38,40 €","22,40 €",4,
B00006J6HP,"Hama Casier de rangement Spirit II (système de classement sur socle pour CD, pour 44 boîtiers CD, porte-CD pour le rangement, organisateur antidérapant) Noir",Hama,"38,30 €",2,"38,30 €","16,34 €",2,
B000TCQPWG,"Hama Boîtier Slim (pour CD et disques Blu-ray, ultra mince, avec une feuille pour la couverture, lot de 20) Noir/Transparent",Hama,"38,28 €",4,"57,42 €","40,32 €",6,
B07TYWBSZN,"Hama Album photo Jumbo ""Forest"" (pour 400 photos au format 10 x 15 cm, album traditionnel enfant de 30 x 30 cm, 100 pages blanches, animaux, élégant) Marron/Beige/Vert/Orange/Jaune",Hama,"37,16 €",2,"37,16 €","17,04 €",2,
B000VRE3T6,"Hama Album Photo Fine Art (Format 28 x 24 cm, 50 Pages Noires, à Spirale) Bordeaux",Hama,"36,87 €",4,"36,87 €","22,52 €",4,
B08M3X6PFG,"Hama Album Photo Couverture Rigide Tissu 30x30cm (Livre Photo, 400 photos 10 x 15cm à coller, 100 pages blanches separées par Papier Cristal, Album Scrapbooking DIY à Personnaliser) Bordeaux",Hama,"36,64 €",2,"36,64 €","28,12 €",2,
B0000AHIED,"Hama Cadre Photo Clip-Fixe (sans Bordure, 20 x 20 cm, Reflex) Blanc",Hama,"36,52 €",11,"23,24 €","15,12 €",7,
B06X9NRXV9,"Hama Album photo vierge ""Lazise"" (album photo traditionnel 29 cm x 32 cm, 50 pages blanches, pour 250 photos 10 cm x 15 cm, format maximum 28 cm x 31 cm) Doré/Blanc",Hama,"36,23 €",2,"54,35 €","27,93 €",3,
B0002W5WDQ,"Hama Boîtier ""Slim"" double (pour DVD, convient également aux CD et disques Blu-ray, ultra mince, avec une feuille pour la couverture, lot de 10) Noir/Transparent",Hama,"36,18 €",3,"36,18 €","14,40 €",3,
B0000AISQ8,"Hama Anneaux autocollants pour cadres photo (en métal, 10 pièces, attaches triangulaires, pour coller sur du bois, plastique ou métal) Blanc/Doré",Hama,"35,49 €",6,"35,49 €","15,30 €",6,
B07LBBWVSP,"Hama Lampe de Poche LED Ultra Pro, 1 000 lumens",Hama,"35,41 €",1,"35,41 €","22,15 €",1,
B079173RCY,"Hama EMW-500 Souris Verticale Ergonomique Filaire - USB A, Capteur 1800 dpi, Droitier/e - Noire",Hama,"35,32 €",2,"17,66 €","11,57 €",1,
B00RLNC8UY,"Hama Album photo ""Tim"" (pour 200 photos au format 10 x 15 cm, petit album de taille 22,5 x 22,5 cm, album photo bébé de 100 pages blanches, ciel, élégant, pour garçons, enfants, bébés) Bleu",Hama,"35,01 €",3,"46,68 €","23,16 €",4,
B07K2RD3MZ,"Hama Clé USB Rotate 8 GB, 10 MB/s, avec accroche porte-clés, flashpen, emballage fin Noir/Argent",Hama,"34,93 €",7,"29,94 €","31,38 €",6,
B0017UGOX4,"Hama Passe-Partout (Premium, Dimensions : Extérieur : 30 cm x 40 cm/Intérieur : 20 cm x 27 cm) Blanc Arctique",Hama,"34,93 €",7,"39,92 €","22,64 €",8,
B00UYZ1O6K,"Hama Support Mural TV Spécial Mur mensardé (pour Diagonale d'écran de 48 cm à 117 cm (19"" - 46""), pour Un Maximum de 20 kg, VESA jusqu'à 200 x 200) Noir",Hama,"34,88 €",1,"34,88 €","22,25 €",1,1
B07T4DLJ4Y,"Hama Album photo Jumbo ""Forest"" (pour 400 photos au format 10 x 15 cm, album traditionnel enfant de 30 x 30 cm, 100 pages blanches, renards, élégant) Marron/Beige/Vert/Orange/Blanc",Hama,"34,14 €",2,"34,14 €","19,10 €",2,
B07N6HRNMP,"Hama Album photo ""Summerly"" (couverture souple, 24 pages pour 24 photos au format 10x15 cm, résistant, pour archiver avec des anecdotes, protège la photo, mini album) Motifs Aléatoires",Hama,"33,87 €",9,"33,87 €","7,11 €",9,
B00006JALB,"Hama Pinceau de Nettoyage pour Objectif (Lenspen) (pour Le Nettoyage des lentilles et des filtres, 12,5 cm de Long, Lenspen) Noir/Rouge",Hama,"33,81 €",3,"33,81 €","19,83 €",3,
B00006J4G7,"Hama Présentoir de Distributeur de pastilles adhésives (500 coins photos, diamètre de 10 mm, papier/viskose) Transparent",Hama,"33,57 €",5,"23,09 €","9,24 €",4,
B0000AISF4,"Cadre tableau sans bordure Clip-Fix 30x40 antireflet",Hama,"33,30 €",5,,,,
B00006IVSE,"Hama Feuillets pour CD (avec 60 fiches pour étiquetage, archivage, 10 étuis pour 6 CD/DVD/Blu-Ray, adaptés aux dossiers A4, Format A4, pour Le Rangement) Transparent",Hama,"33,28 €",4,"66,56 €","39,52 €",8,
B0BKYL622V,"Hama Power Pack Slim 5HD (Batterie Externe 5 000 mAh, Batterie Portable Charge Rapide, USB 3.0, Power Bank Compatible avec iPhone 14 13 12 11 X Samsung Xiaomi Huawei iPad etc) Blanc",Hama,"33,28 €",4,"66,56 €","78,56 €",8,
B0BXPL8MG9,"Hama Classeur à négatifs (4 anneaux, niveau de remplissage 39 mm, feuilles rectangulaires, album à négatifs d'une pellicule photo) Jaune",Hama,"33,28 €",4,"58,24 €","43,05 €",7,
B00006J9WN,"Hama Boîtier Multipack (pour 4 CD/DVD/Blu-Ray, Multipack, 4 in 1, étui de Protection pour CD) Noir/Transparent",Hama,"33,20 €",10,"29,88 €","17,10 €",9,
B0009V6OD2,"Hama Boîtier Slim Double (pour CD et disques Blu-Ray, Ultra Mince, avec Une Feuille pour la Couverture, Lot de 25) Transparent",Hama,"33,16 €",2,"33,16 €","23,70 €",2,
B00006JBFP,"Hama Filtre UV (anti-UV et protection, compensation 2X, traitement antireflet, pour objectifs d'appareils photo 72 mm, O-Haze, traité) Noir",Hama,"32,97 €",3,"10,99 €","6,30 €",1,
B000KZAV4U,"Hama Cadre photo en plastique ""Sevilla"" (taille du Cadre de 62 x 93 cm avec bordure de 13 mm x 20 mm, pour une photo de 42 x 60 cm) Noir",Hama,"32,49 €",1,,,,
B07CGR879T,"Thomson Télécommande de Rechange ROC1128LG (Télécommande de Remplacement pour Les téléviseurs LG, prête à l'emploi, adaptative, Mode Simple, Touches Lumineuses, Infrarouge) Noir",Thomson,"32,48 €",2,"16,24 €","13,93 €",1,
B017JY5APO,"Hama Fine Art à Spirales 50 Pages Noires 2109, Craie, 36 x 32 cm",Hama,"32,40 €",2,"32,40 €","16,90 €",2,
B0CLYJQ3YY,"Hama Bras articulé de Telephone (Support articulé, Bras Flexible Smartphone Webcam Mirco Tablette eclairage annulaire, Support Universel Inclus, Fixation de Table à vis, Filetage 1/4"", 70cm Max) Noir",Hama,"32,25 €",3,"21,50 €","21,62 €",2,
B00AJJJNLE,"Hama Brosse en fibre carbone pour vos vinyles (nettoyage antistatique des vinyles, brosse pour disques vinyles), noir / argent",Hama,"32,02 €",2,"32,02 €","13,08 €",2,
B00F955SDU,"Hama Antenne intérieure (antenne radio pour l'amplification du signal actif jusqu'à 30 dB, puissance de l'amplificateur réglable, hauteur de 31 cm, DAB/DAB+, en long) Noir",Hama,"31,66 €",1,"31,66 €","18,10 €",1,
B08YS1PZWL,"Hama Adaptateur Jack 6.35 vers 3.5 Garantie 10 Ans (Adaptateur Audio 6.35mm Mâle vers 3.5mm Femelle, Stéréo, Prise Casque, Audio Connecteur Stéréo pour Mélangeur Audio/Piano électrique/Clavier) Noir",Hama,"31,62 €",8,"31,62 €","14,40 €",8,
B00QKRKJCQ,"Hama Support De Télécommande Major (pour 4 Télécommandes Au Maximum, Ã‰galement Pour Rangement De Lunettes, Smartphones, Contrôleurs, Clés USB, Porte-télécommande) Blanc",Hama,"31,32 €",2,"31,32 €","20,46 €",2,
B0000AISDG,"Hama Passe-partout (premium, dimensions : Extérieur : 40 cm x 50 cm / Intérieur : 28 cm x 35 cm) Blanc Arctique",Hama,"31,20 €",5,"37,44 €","23,82 €",6,
B0CP86Q49Q,"Hama Antenne intérieure (Antenne Réception Radio Numérique (Dab/Dab+) et Analogique FM, Amplification du Signal Actif jusqu'à 30 DB, Cäble 1.5m, Fiche F mâle, Alim Secteur) Noir",Hama,"30,82 €",1,"30,82 €","24,35 €",1,1
B0000AI2T9,"Hama Cadre photo en plastique ""Sevilla"" (taille du Cadre de 40 x 60 cm avec bordure de 13 mm x 20 mm, pour une photo de 30 x 45 cm) Blanc",Hama,"30,82 €",2,,,,
B0186D2GQS,"Hama Album Photo ""Fine Art"" (format 29 x 32 cm, 50 pages blanches, sans spirale) Gris",Hama,"30,48 €",2,"30,48 €","20,38 €",2,
B07PHQ17NW,"Hama Album à Spirale 'Watercolor Moments', 28 x 24 cm, 50 Pages Blanches",Hama,"29,96 €",4,"29,96 €","18,69 €",4,
B00006IVE7,"Hama Étuis à négatifs, papier cristal, 10 bandes de 4 négatifs, 24x36cm, 25 pièces",Hama,"29,76 €",3,"59,52 €","50,52 €",6,
B01I6H59KE,"Hama Sonic LS-206 Enceintes pour Ordinateur - Système Stéréo 2.0, Haut-Parleurs Alimentés en USB, Connexion Jack 3.5mm - Noir/Argent",Hama,"29,69 €",2,"14,16 €","11,04 €",1,
B08SDR1ZTM,"Hama Album photo grand format ""Compass"" (Album souvenirs Voyages, Vacances, Famille, Idée cadeau, 30x30 cm, 100 pages blanches à personnaliser et à coller, 400 photos 10x15 cm) Multicolore",Hama,"29,68 €",2,"16,92 €","7,40 €",1,
B0BL1TSV73,"Hama Chargeur Rapide iPhone 38W (Chargeur USB-C Rapide, Chargeur Qualcomm Quick Charge 3.0, Mini Compact, Chargeur PD Secteur, 1 Port USB-C PD + 1 Port USB- A QC) Blanc",Hama,"29,16 €",1,"29,16 €","22,12 €",1,
B000EOVQIM,"Hama Pochette (pour 80 CD/DVD/Blu-Ray, classeur de Rangement, Gain de Place pour Le Bureau, Le Salon et la Maison, étuis de Transport) Noir",Hama,"28,60 €",2,"28,60 €","16,78 €",2,
B07H149QV2,"Hama Album photo 'Susi Pastell' (couverture souple, 24 pages pour 24 photos au format 10x15 cm, résistant, pour archiver avec des anecdotes, protège la photo, mini album) Couleurs pastel Aléatoires",Hama,"28,45 €",5,"28,45 €","4,40 €",5,
B000FNO03K,"THOMSON Microphone Dynamique M150 (fiche Jack 3,52 mm, Longueur de câble 3 m, Party) Noir",Thomson,"28,32 €",2,"42,48 €","37,17 €",3,
B0CYMZ4GG9,"Hama Pocket 5 - Batterie Externe [Power Bank 5 000mAh] [Batterie Portable USB C Fast Charge], Compatible avec Les iPhones Samsung et Bien Plus - Gris Anthracite",Hama,"28,30 €",2,"10,82 €","9,08 €",1,
B00006JDJU,"Hama - 46020H - Micro monophonique, finition noire métal, jack de 3,5mm et adaptateur 3,5/6,35 mm, interrupteur marche/arrêt sur le micro, 600 Ohms, dynamique et unidirectionnel - Cordon 3.00m",Hama,"28,04 €",2,"28,04 €","17,68 €",2,2
B0CYN6KNF2,"Hama Performance 20 - Batterie Externe [Power Bank 20 000mAh] [Batterie Portable USB C Fast Charge] Compatible avec Les iPhones Samsung et Bien Plus - Gris Anthracite",Hama,"27,49 €",1,"27,49 €","22,95 €",1,
B0BL1SS1WK,"Hama MW-300 V2 Souris sans Fil - Technologie 2.4Ghz, Capteur 1600 dpi, Clics Silencieux, Ambidextre - Noire",Hama,"27,48 €",3,"18,32 €","15,82 €",2,
B000S8FNTM,"Hama E 80 Enceintes pour Ordinateur - Système Stéréo 2.0, Haut-Parleurs Alimentés en USB, Connexion Jack 3.5mm, Sortie Casque - Noir",Hama,"27,44 €",2,"26,94 €","18,16 €",2,
B00006JDOB,"Hama Étuis pour 20 diapositives avec cadre au format 5 x 5 cm (12 pièces, 20 glissières) Transparent",Hama,"27,24 €",3,"27,24 €","24,66 €",3,
B09YVGVBH1,"Hama AMW-200 Souris sans Fil - Technologie 2.4Ghz, Capteur 1600 dpi, Technologie Smart-Link, Ambidextre - Noire",Hama,"27,05 €",5,"27,05 €","18,75 €",5,
B0BHZFGZ5Y,"Hama Casque Audio Shell (Casque Circum-Auriculaire Stéréo, 20 Hz-20 kHz, 32 ohms, 113 DB/MW, Jack 3.52mm mâle, Adaptateur Jack 6.35mm mâle Inclus, câble Extra Long 2 m) Noir",Hama,"26,72 €",2,"26,72 €","20,98 €",2,
B01BBTCVOQ,"Hama Album Photo Fine Art (Format 30 x 30 cm, 100 Pages Blanches, sans Spirale) Kiwi",Hama,"26,64 €",2,"26,64 €","16,36 €",2,
B000EORX52,"Hama Boîtier Slim (pour CD et disques Blu-Ray, Ultra Mince, avec Une Feuille pour la Couverture, Lot de 25) Transparent",Hama,"26,64 €",2,"26,64 €","20,78 €",2,
B08YS22QH1,"Hama Plastifieuse A4 A5 A6 Cartes de Visite (Kit de Plastification 4en1 avec Feuille Film Laminage Thermique ep. Max 80-125 Microns, Plastifieuse à chaud, Règle de coupe, Chauffe rapide) Noir",Hama,"26,28 €",1,"26,28 €","20,58 €",1,
B009TLAOW0,"Hama Album Photo ""Fine Art"" (format 28 x 24 cm, 50 pages noires, à spirale) Rose",Hama,"26,04 €",2,"26,04 €","11,26 €",2,
B071YB8MFM,"Xavax Boîte de transport pour un gâteau (rectangulaire munie d'une poignée transparente, va au lave-vaisselle, boîte à gâteaux, maître d'hôtel) Anthracite/Transparent",xavax,"25,57 €",1,"25,57 €","14,12 €",1,
B0BHWL9GGB,"Hama Multiprise Euro 3 Prises (Distribution Alimentation Slim, Extra Plat, 3 Prises 'Euro' Femelles, 16A, 230V, Max 1700W, câble 2.5m) Blanc",Hama,"25,10 €",2,"12,55 €","5,69 €",1,
B0000AI2Y8,"Hama Cadre-galerie photo en plastique ""Madrid"" (taille de cadre de 25 cm x 55 cm, taille de la photo de 13 cm x 18 cm, 3 photos par cadre, à accrocher, élégant, simple, classique) Argent",Hama,"24,98 €",2,"24,98 €","16,24 €",2,
B0000AIRSL,"Hama Cadre photo Clip-Fixe (sans bordure, 50 x 60 cm, Reflex) Blanc",Hama,"24,98 €",2,"12,49 €","6,69 €",1,1
B002L4O6RG,"Hama Etui de protection photo/vidéo semi-rigide ""Colour Style"" (60L, EVA, sacoche avec coque, anti-choc, pour le voyage, appareil petit format, ultra-compact, compact, MP3, MP4, iPod) Noir",Hama,"24,98 €",2,"24,98 €","17,02 €",2,
B0CNRY52S9,"Hama Boîte de Rangement Câbles 'Mini' (Cache câbles, pour Bureau, Maison, Rangement Chargeurs, Multiprises, Disques durs, 23.5x11.5x12.cm) Blanc",Hama,"24,98 €",2,"12,49 €","9,29 €",1,
B0002VFL1U,"Hama Pochettes pour CD-ROM/DVD-ROM (Pochettes CD Plastique, Pochette de Protection colorées, Lot de 100, Multicolore) Bleu/Orange/Violet/Rose/Vert",Hama,"24,98 €",2,"24,98 €","16,20 €",2,
B0D5HHBJ6Y,"Hama Cuir Synthétique Tapis de Souris - Tapis de Bureau élégant, Dessous Anti-Dérapant, Bords Cousus - Noir",Hama,"24,96 €",3,"16,64 €","17,74 €",2,
B00X3JFB40,"Hama Support de Casque (Frontal, pour GoPro) Noir",Hama,"24,96 €",3,"24,96 €","19,47 €",3,
B00005K4A5,"Hama Filtre polarisant (Circulaire, Traité, 72mm, 2 Couches par Face) Noir",Hama,"24,92 €",1,"24,92 €","21,20 €",1,
B00005KHTE,"Hama Filtre polarisant (circulaire, Traité, 77mm, 2 couches par face) Noir",Hama,"24,71 €",1,"24,71 €","23,50 €",1,
B0000AISOV,"Hama Cadre photo Clip-Fixe (sans bordure, 30 x 30 cm, Reflex) Blanc",Hama,"24,65 €",2,"13,23 €","3,11 €",1,
B0009V6OBO,"Hama Pochettes de Protection (en Papier pour CD/DVD/Blu-Ray, Lot de 100) Blanc/Transparent",Hama,"24,24 €",3,"32,76 €","12,09 €",3,
B07RLYK1T9,"Hama Trépied de Table Solid pour Smartphones et appareils Photos, 19B",Hama,"24,08 €",1,"24,08 €","21,15 €",1,
B0000AIRY7,"Hama Cadre en plastique Madrid (taille de cadre de 30 cm x 40 cm, taille de la photo de 20 cm x 28 cm, 1 photo par cadre, à accrocher, élégant, simple, classique) Noir",Hama,"23,73 €",3,"23,73 €","12,51 €",3,3
B000K985GC,"Hama Boîtier Standard (pour DVD, Convient également aux CD et aux Blu-Ray, avec Film pour l'insertion de la Jaquette, Lot de 30) Noir",Hama,"23,32 €",1,"23,32 €","14,02 €",1,
B0BL17MH3S,"Hama Câble Audio Auxiliaire Voiture pour iPhone (Câble Apple Lightning vers Jack 3.5 mm stéréo mâle, Certifié Mfi, Gaine Textile, Compatible iPhone 12/11/X/XS/XS/XR/8P Home/Autoradio-1M) Blanc",Hama,"23,32 €",1,"23,32 €","16,82 €",1,
B00006JB4M,"Hama Filtre UV (anti-UV et protection, compensation 2X, traitement antireflet, pour objectifs d'appareils photo 77 mm, O-Haze, traité) Noir",Hama,"22,96 €",2,"11,48 €","10,05 €",1,
B074JD5KRM,"Hama Cadre en plastique ""Madrid"" (taille de cadre de 21 cm x 29,7 cm, taille de la photo de 15 cm x 20 cm, 1 photo par cadre, à accrocher, élégant, simple, classique) Argent",Hama,"22,85 €",5,"22,85 €","11,90 €",5,
B017JY4RYO,"Hama Album Photo ""Fine Art"" (format 36 x 32 cm, 50 pages blanches, à spirale) Gris",Hama,"22,48 €",2,"22,48 €","14,55 €",2,1
B003KKWLJA,"Xavax Raccord de tuyau d' arrivée d'eau en laiton (pour tuyaux d’arrivée de lavage et de lave-vaisselle, embout de tuyau d’admission) Dorée",xavax,"22,43 €",3,"22,43 €","12,42 €",3,
B0BHZ6ZZ8X,"Hama Multiprise, 6 Prises, Protection Contre surtension., 90°, réglage. Individuel,1,4m, Blanc",HAMA,"21,66 €",1,"21,66 €","17,00 €",1,
B000IH1W20,"Hama Lecteur USB 2.0 ""35en1"" (USB, lecteur cartes multiples, Lecteur de carte SD, SDHC, SDXC, Type I / II CF, MMC) Bleu",Hama,"21,64 €",2,"10,82 €","6,50 €",1,
B07F3FYT43,"Dispositif de Fixation à Pince pour multiprise",Hama,"21,64 €",2,"10,82 €","9,13 €",1,
B009IAWZLK,"Hama Pinceau de nettoyage pour objectif (Lenspen) ""Classic"" (pour le nettoyage des lentilles et des filtres, 11,5 cm de long, Lenspen) Noir/Rouge",Hama,"21,64 €",2,"21,64 €","17,06 €",2,
B0CLD52FFP,"Hama Support Mural Magnétique pour Apple TV HD (4ème génération)/4K (1ère/2ème/3ème génération) (pour Fixer l'Apple TV Box sur Le Mur ou la TV, Garantie 10ans, Chevilles Fischer et vis VESA) Noir",Hama,"21,64 €",2,"10,82 €","6,71 €",1,1
B07NH3LJ1S,"Hama Support pour télécommande ""Agent"" (porte-télécommande, rotatif, 5 compartiments pour télécommandes, téléphones, lunettes, stylos, organisateur pour bureau, rangement) Noir",Hama,"21,05 €",1,,,,
B07GL8PS46,"Hama Album Photo ""Fine Art"" (format 30 x 30 cm, 100 pages noires, sans spirale) Bordeaux",Hama,"21,02 €",1,"21,02 €","10,78 €",1,
B0CP84WF61,"Hama Support TV Mural Fixe Garantie 10 Ans (Support TV Mural Extra-Plat, 40kg Max, Robuste, pour écrans LCD/LED/OLED/Plasma de 81 cm à 191 cm (32 à 75""), VESA Max 400x400) Noir",Hama,"20,82 €",1,"20,82 €","17,96 €",1,
B08M391XW9,"Hama Album Photo Couverture Rigide Tissu 30x30cm (Album Livre, 400 photos 10 x 15cm à coller, 100 pages blanches separées par Papier Cristal, Album Scrapbooking DIY Livre photo à Personnaliser) Gris",Hama,"20,82 €",1,"20,82 €","13,03 €",1,
B0CWL46NF2,"Black Rock Coque pour Samsung S24, Portefeuille The Classic [Housse de Protection avec Rangement pour Carte] [Etui à Rabat] - Noir","Black Rock","20,82 €",1,"20,82 €","17,28 €",1,
B074HZZQN4,"Horloge murale ""Easy Learning"" (horloge d'apprentissage analogique, pour enfants, pour apprendre l'heure, cadran d'apprentissage de diamètre 30 cm, silencieu) Blanc",Hama,"20,82 €",1,"20,82 €","12,82 €",1,
B0009V6OBE,"Hama Pochettes de Protection (en Papier pour CD/DVD/Blu-Ray, Lot de 50) Blanc/Transparent",Hama,"20,80 €",5,"20,80 €","14,49 €",5,
B0050GRN2W,"Hama Pochette Up To Fashion (pour 48 disques, CD/DVD/Blu-ray/livres audio, étui de rangement, gain de place pour la voiture, la maison, avec motif papillon) Rose",Hama,"20,74 €",2,"39,06 €","26,32 €",4,
B000EOVQI2,"Hama Boîtier CD Slim, Lot de 10, Transparent",Hama,"20,50 €",2,"10,25 €","3,15 €",1,
B0000AHICD,"Hama Boîtier ""Slim"" double (pour CD et disques Blu-ray, ultra mince, avec une feuille pour la couverture, lot de 10) Transparent",Hama,"19,98 €",3,"19,98 €","15,21 €",3,
B0BL2PTSJM,"Hama Chargeur Secteur USB (Bloc Secteur USB-A, 6W, 5V/ 1.2A, Adaptateur Secteur Universel, Chargeur Replacement pour iPhone 14/14 Pro Max, Samsung Galaxy, Sony, Xiaomi, Huawei, Wiko) Blanc",Hama,"19,98 €",2,"19,98 €","14,90 €",2,
B0949HMZB1,"Hama Chiffon Antistatique Antipoussière (Chiffon de Nettoyage pour Lunettes ou Appareil Photo, Objectif, Filtre, écrans PC Smartphone ou Tablette, négatifs, Diapositives, Jumelles, 23 x 25 cm) Orange",Hama,"19,70 €",2,"19,70 €","8,54 €",2,
B006L9T90G,"Ventilateur USB avec LEDs de couleur",Hama,"19,41 €",2,"19,41 €","11,58 €",2,
B0000AIRTH,"Hama Cadre photo en plastique ""Décor Sevilla"" (taille du Cadre de 30 x 45 cm avec bordure de 9 mm x 17 mm, pour une photo de 20 x 30 cm) Or Mat",Hama,"19,14 €",2,"19,14 €","13,00 €",2,
B00AJJJNE6,"Hama Blu-Ray de nettoyage (pour tête de lecture, pour éliminer la poussière dans les lecteurs de Blu-Ray, Blu-Ray de nettoyage, emballage sans frustation) Blanc/Bleu/Rouge",Hama,"18,87 €",1,,,,
