B08YRZZ4V3,"Hama Adaptateur Audio, fiche Jack mâle 3,5 mm- f. Femelle RCA, stéréo, Métal, Garantie 10 Ans, Noir",HAMA,"4,16 €",1,"4,16 €","4,29 €",1,
B08C2DRXZK,"Hama Déclencheur à Distance Bluetooth BRS3 (Télécommande Bluetooth pour Appareil Photo de Smartphone et Tablette, portée 10m, idéal Selfies créatifs sur Instagram, TikTok, Youtube, Facebook) Noir",Hama,"4,08 €",1,,,,
B07BBGWQSB,"Tapis de souris ""Work in Progress""",Hama,"3,99 €",1,"3,99 €","2,05 €",1,
B08YRVXB6R,"Hama Adaptateur audio, jack mâle 3,5 mm-2 jacks stéréo femelle 3,5m, stéréo, Garantie 10 ans, Argent, Noir",HAMA,"3,32 €",1,,,,
B007WAYQRY,"Hama Tapis de souris (1 pièce, taille de 22,3 cm x 18,3 cm x 0,6 cm, en EVA/Jersey) Couleur aléatoire parmi Bleu/Rouge",Hama,"2,07 €",1,"10,35 €","7,55 €",5,
B08YS3LP36,"Hama Adaptateur de prise d'antenne Coaxiale (Raccord Connecteurs Coaxial, Adaptateur SAT, Fiche Coaxiale F femelle vers Fiche coaxiale mâle)",Hama,"2,07 €",1,"2,07 €","2,39 €",1,
B00006J4HS,"Hama Présentoir de Distributeur de pastilles adhésives (10 distributeurs, 500 coins photos, diamètre de 10 mm, PP anti statique) Transparent",Hama,"0,31 €",0,"6,97 €","1,59 €",1,
B009TLAQ3M,"Hama Album Photo ""Fine Art"" (format 28 x 24 cm, 50 pages noires, à spirale) Azur",Hama,"0,00 €",0,,,,
B000KJOLUQ,"Hama Cadre photo Clip-Fixe (sans bordure, 60 x 80 cm, Reflex) Blanc",Hama,"0,00 €",0,,,,
B000LRHKP0,"Hama Cadre photo ""Clip-Fixe"" (sans bordure, 62 x 93 cm, Reflex) Blanc",Hama,"0,00 €",0,,,,2
B06XB97YH4,"Hama Album photo ""Nora"" (pour 200 photos au format 10 x 15 cm, album traditionnel enfant de 22,5 x 22 cm, 100 pages blanches, hippopotame, élégant) Gris/Marron/Blanc",Hama,"0,00 €",0,"11,12 €","6,69 €",1,
B0CP84W4GX,"Hama Support Mural TV Fixe avec Dispositif Antivol Garantie 10 Ans (TV 37"" à 90"", 94 à 229cm 50Kg Max, Idéal espaces Professionnels, Compatible VESA 600x400, Chevilles Fischer founis, Easy Fix) Noir",Hama,"0,00 €",0,,,,
B0000AIRXC,"Hama Cadre photo en plastique ""Sevilla"" (taille du Cadre de 30 x 45 cm avec bordure de 9 mm x 17 mm, pour une photo de 20 x 30 cm) Blanc",Hama,"0,00 €",0,,,,1
B01AT3Z228,"Xavax Couvercle universel (anneau en silicone pour casseroles/poêles de diamètre 24, 26 ou 28 cm, trou de vapeur, design à bords gradués, verre, va lave-vaisselle, peu encombrant) Noir/Transparent",xavax,"0,00 €",0,"16,66 €","8,79 €",1,
B09TRG96K2,"Hama Caméra Surveillance WiFi (Camera de Surveillance Interieur, Caméra Connectée, Micro, App. Mobile, Détection Mouvements 355°, Vision Nuit, Enregistre sur Carte SD, Alexa, Google Assistant) Noir",Hama,"0,00 €",0,,,,
B01KHD5GUS,"Hama Multiprise, ""6+1"" (commutable individuellement, avec protection anti-surtension, montage mural, pivotée à 90°, longueur de douille XL, protection enfant, longueur de câble de 1,4 m) Blanc",Hama,"0,00 €",0,,,,
B06XBXLK8B,"Hama Album photo ""Lazise"" (couverture souple, 24 pages pour 24 photos au format 10x15 cm, résistant, pour archiver avec des anecdotes, protège la photo, mini album) 4 Motifs cœur aléatoires",Hama,"0,00 €",0,,,,
B005IB5HRW,"Hama Câble d'alimentation secteur bipolaire (câble de longueur 1,50 m, prise euro 8, pour connecter divers appareils tels les consoles de jeux, les rasoirs) Noir",Hama,"0,00 €",0,,,,
B06XCBWTRC,"Hama Câble audio avec jack de 3,5 mm ""Elite"", métal, doré, anthrac., 0,75 m",UNKNOWN,"0,00 €",0,"14,16 €","6,12 €",1,
B001F536RS,"THOMSON Microphone Dynamique M135 (Microphone Karaoké Filaire, Motif cardioïde, fiche Jack 3,52 mm, Longueur de câble 3 m, idéal Karaoké, Chant, Live, Conférence, Mariage) Noir",Thomson,"0,00 €",0,,,,
B0000AIRRQ,"Hama Cadre photo ""Clip-Fixe"" (sans bordure, 50 x 70 cm, Reflex) Blanc",Hama,"0,00 €",0,,,,
B01MXGY1S1,"THOMSON Casque HED2006BK/AN (Circum-aural, câblage uni-latéral, Over-The-Ear, Serre-tête, avec Fil, 20-20000 Hz, 1,2 m) Noir",Thomson,"0,00 €",0,,,,1
B00AJJJMLU,"Hama 116200 Nettoyeur de Lentille Laser DVD ""Deluxe"", Bleu, 1,3 cm*22,5 cm*15,0 cm",Hama,"0,00 €",0,,,,1
B0054RDOCA,"Thomson Télécommande Universelle 2 en 1 ""ROC 2411"" (Télécommande avec Fonction d'apprentissage, Convient pour Deux appareils, pour Plus de 1 000 Marques) Noir",Thomson,"0,00 €",0,,,,
B07F3RKPTB,"Hama Support mural pour Google Home mini (pour enceinte sans/avec fil, support d'enceinte, pour un alignement et une présentation optimaux de l'enceinte, montage mural) Blanc",Hama,"0,00 €",0,"10,82 €","6,05 €",1,
B0000AHIFI,"Hama Passe-partout Premium, blanc neige, 20 x 30 cm",Hama,"0,00 €",0,,,,
B0050GRMW8,"Hama Pochette ""Up To Fashion"" (pour 48 disques, CD/DVD/Blu-ray/livres audio, étui de rangement, gain de place pour la voiture, la maison, avec motif du diable) Rouge",Hama,"0,00 €",0,"9,16 €","6,80 €",1,
B0D6CP4MYL,"Hama Coque pour iPhone 15 Pro Always Clear [Housse Anti-jaunissement] [Etui Antidérapant] - Transparent",Hama,"0,00 €",0,,,,1
B0BL1VLC7R,"Hama Chargeur USB Multiport 34W avec Interrupteur M/A (6 Ports USB-A, Bloc Chargeur Secteur Multi-USB, Hub Prise d'alimentation USB, Temoin LED) Noir",Hama,"0,00 €",0,"33,32 €","25,88 €",1,
B07PHQ17NW,"Hama Album à Spirale 'Watercolor Moments', 28 x 24 cm, 50 Pages Blanches",Hama,"0,00 €",0,"7,49 €","4,68 €",1,
B00006IVVB,"Hama Boîtier standard double (pour CD et disques Blu-Ray, Étui protecteur pour CD, paquet de 10) Noir/Transparent",Hama,"0,00 €",0,,,,
B01JUB4KNC,"Trépied Appareil Photo Star 64""",Hama,"0,00 €",0,,,,
B08SFHZXK6,"Hama Album Jumbo « Stamps » à personnaliser (Album souvenirs de famille ou de voyage, idéal cadeau et scrapbooking, 30x30 cm, album livre 100 Pages, Max : 400 Photos 10x15 cm) Multicolore",Hama,"0,00 €",0,,,,1
B07KWF2WPL,"Rapoo Souris optique sans fil Multi mode 2,4GHz/BT 3.0/BT 4.0 ""M300"" (bluetooth, souris d'ordinateur, design, avec boutons et molette de défilement) Gris foncé",Rapoo,"0,00 €",0,"47,46 €","33,30 €",3,
B00006JBG4,"Hama Boîtier Standard (pour CD et disques Blu-Ray, Étui Protecteur pour CD, Paquet de 5) Noir/Transparent",Hama,"0,00 €",0,,,,
B00006JAOU,"Hama Fusibles en verre (fusible voiture, 60A, , AGU, 10 x 38mm, plaqué or, 2 pièces) Or/Transparent",Hama,"0,00 €",0,,,,
B0032D8WCA,"Hama Album Photo Catania (Taille de l'album 29 x 32 cm pour 300 Photos au Format 10 x 15 cm, 60 Pages, Papier stratifié, thématique Mariage/Vacances, Personnalisable) Gris",Hama,"0,00 €",0,,,,1
B009OUPITK,"Hama Lampes LED de sécurité à pince (à 2 LED, ampoule rouge, fonctionnement sur piles, voyant fixe et clignotant, idéal pour les joggeurs, les écoliers, les cyclistes, ensemble 2 pièces) Rouge/Noir",Hama,"0,00 €",0,,,,
B07GW1R5DT,"Hama Détecteur de Mouvement WiFi (Fonction Alarme, lumière, capteur Infrarouge, Notification d'alarme sur Le Mobile, Compatible Alexa/Google Home, sur Secteur/Batterie, sans concentrateur, A +) Blanc",Hama,"0,00 €",0,,,,6
B083G7F5MR,"uRage Microphone à Condensateur de streaming USB avec bras (Micro Cardioïde d'Enregistrement Studio Conversation YouTube Voix-off, Ordinateur Bureau ou PC Portable, câble 2.5m, 20Hz-16kHz, 2200Ω) Noir",uRage,"0,00 €",0,"51,89 €","72,39 €",1,
B07CGZY714,"Hama Loupe de Lecture à LED Basic 90 LED (1 unité, grossissement x4, diamètre de 90 mm, Taille de 94 mm x 202 mm x 16 mm) Noir/Transparent",Hama,"0,00 €",0,"7,49 €","5,96 €",1,
B009X8SCV4,"Hama ""Fine Art"" Spiral Album, 24 x 17 cm, 50 Photos, pink",Hama,"0,00 €",0,,,,
B00005UPB7,"Hama Boîtier Standard (pour CD et disques Blu-Ray, Étui Protecteur pour CD, Paquet de 5) Transparent",Hama,"0,00 €",0,,,,1
B0BL1R8Y3V,"Hama Cordon alimmentation, coudé des 2 côtés, fiche Euro, Forme en 8/C7, 5 m, Noir",Hama,"0,00 €",0,"12,49 €","8,39 €",1,
B00C1C2KJY,"Hama Support mural fixe pour TV (pour une diagonale comprise entre 117 et 229 cm (46"" et 90"")) Noir",Hama,"0,00 €",0,,,,
B0CLD3CC7D,"Hama Support TV Mural Fixe Ultrafin Garantie 10 Ans (Support TV Mural Extra-Plat, 80kg Max, Robuste, pour écrans LCD/LED/OLED/Plasma de 94 à 229 cm (37"" à 90"") VESA Max 600x400) Gris",Hama,"0,00 €",0,"69,98 €","57,08 €",2,
B08SFPD9F2,"Hama Station météo sans fil interieur exterieur Meteotime (centre de prévision météorologique, Horloge radio pilotée DCF, Sonde sans fil, Thermomètre, Hygromètre, Alarme, Reveil, rétro éclairage) noir",Hama,"0,00 €",0,"57,98 €","47,25 €",1,1
B0BXPKDN7W,"Hama Classeur à négatifs (4 anneaux, niveau de remplissage 39 mm, feuilles rectangulaires, album à négatifs d'une pellicule photo) Vert pale",Hama,"0,00 €",0,,,,
B0015NLFFA,"Hama Chemin de câble (en PVC, semi-circulaire, 100 x 7 x 2,1 cm) Blanc",Hama,"0,00 €",0,,,,
B0000AISDL,"Hama Passe-partout Premium, blanc neige, 40 x 50 cm",Hama,"0,00 €",0,,,,3
B0845F2JG2,"Hama Souris Verticale, Ergonomique, pour gaucher EMC-500L, Filaire, USB A, Noire",Hama,"0,00 €",0,,,,
B08YS1T5PZ,"Hama Câble Réseau RJ45 Plat (Câble Ethernet Cat 6a, 10 Gbit/s, U/UTP, 10m, Garantie 10ans, Idéal pour PC, ordinateur portable, téléviseur, console de jeux, routeur, commutateur, hub) Blanc",Hama,"0,00 €",0,,,,
B00NCX5T6W,"Hama Sac Photo Fancy Neopren Quad, 70E, Noir",Hama,"0,00 €",0,"9,58 €","5,57 €",1,
B09GLCFQWQ,"Hama Clé USB 128 Go (USB C 3.1, Stockage de données avec taux de Transfert de données de 100 Mo/s et Capuchon pour Windows/MacBook), Anthracite, compacte",Hama,"0,00 €",0,"8,66 €","13,40 €",1,
B0000AHIKN,"Hama Cadre photo ""Clip-Fixe"" (sans bordure, 10,5 x 15 cm, Reflex) Blanc",Hama,"0,00 €",0,,,,
B00UYZ1O3I,"Hama Support Plafond (pour Diagonale d'écran de 81 à 165cm (32"" à 65""), pour Un Maximum de 50 kg, VESA jusqu'à 400 x 400) Noir",Hama,"0,00 €",0,,,,
B0CKJ46BFN,"Xavax Porte-capsules de café pour Tassimo (Distributeur de capsules à café, Support Rangement pour 26 capsules, Présentoir à Capsules Tassimo) Noir mat",Xavax,"0,00 €",0,,,,
B09FBT44RR,"Hama MW-650 Souris sans Fil - Technologie 2.4Ghz & Bluetooth® 5.0, Capteur 2400 dpi, Clics Silencieux, Droitier/e - Noire",Hama,"0,00 €",0,,,,
B0000AISFJ,"Hama Cadre photo en plastique Sevilla (taille du Cadre de 15 x 20 cm avec bordure de 9 mm x 17 mm, pour une photo de 10 x 15 cm) Blanc",Hama,"0,00 €",0,"7,13 €","3,93 €",1,
B000Y138NG,"Hama Boîtier CD ""Slim"" en polypropylène, lot de 20, Transparent",Hama,"0,00 €",0,"37,30 €","11,92 €",2,
B0BL1RQBPV,"Hama Chargeur Rapide 51W 5 Ports USB (Chargeur Qualcomm Quick Charge 3.0, Chargeur USB C, Adaptateur Secteur, Charge Rapide, 1 USB-A QC, 1 USB-C PD, 3 USB-A) Noir",Hama,"0,00 €",0,,,,
B0BQWSBTK1,"Hama Plafonnier LED Connecté Glitzer (Lampe de Plafond 27x27cm, Wifi sans Hub, 18W, 2000LM, Lumière réglable 2700-6500K, Commande vocale Alexa, Assistant Google, Siri Shortcuts, iOS et Android)",Hama,"0,00 €",0,,,,
B078T73Z22,"Hama Souris sans Fil avec Mini Récepteur USB MW-110 (Résolution Capteur 1000 PPP, 2.4 Ghz, pour Droitiers & Gauchers, 3 Boutons, Ultra-Compacte, idéale PC, Mac, Ordinateur Portable, Tablette) Noir",Hama,"0,00 €",0,,,,
B0083M13TY,"Hama Cadre photo en plastique Sevilla (taille du Cadre de 29,7 x 42 cm (DIN A3) avec bordure de 9 mm x 17 mm, pour une photo de 18 x 24 cm, verre en polystyrène) Noir",Hama,"0,00 €",0,,,,
B001UBBJD0,"Hama Album Photo Fine Art (Format 28 x 24 cm, 50 Pages Noires, à Spirale) Lilas",Hama,"0,00 €",0,,,,
B00EUSMHE0,"THOMSON Kit Casque sans Fil TVWHP3203D (on-Ear, pour TV/HiFi, Circum-aural, supprimer Bruit Fond, 100 m) Noir",Thomson,"0,00 €",0,,,,1
B017JY5EF0,"Hama Album Photo ""Fine Art"" (format 28 x 24 cm, 50 pages blanches, à spirale) Kiwi",Hama,"0,00 €",0,,,,
B00475DSKS,"Xavax Siphon (pour évier, lave-linge et lave-vaisselle, 1,5"", 2 ports pour siphon 1"" (2,54 cm) et 2 pièges à odeurs, flexible) Blanc/Noir",xavax,"0,00 €",0,,,,
B00005YVI3,"Hama Étuis à négatifs, polypropylène, 7 bandes de 6 négatifs, 24x36cm, 100 pièces",Hama,"0,00 €",0,"45,44 €","29,12 €",1,
B00792A822,"Etui ""Vegas"" pour 5 clés USB, noir",Hama,"0,00 €",0,"10,82 €","7,49 €",1,
B07MFZ6N7M,"Perche à Selfies Fun 70"", Bluetooth, Noir",Hama,"0,00 €",0,,,,
B09RC7QDPM,"Hama Album photo ""Skies II"" (Album Elégant et Intemporel, Idéal mariage, anniversaire, baptême, 22,5 x 22 cm, 100 pages avec pochettes pour 200 photos 10x15 cm, Zone Mémo et pochette carte SD) Gris",Hama,"0,00 €",0,"13,99 €","7,10 €",1,
B005DJKFIU,"Hama Album Photo Singo (Album Auto-adhésif, 28 x 31 cm, 20 Pages, pour 60 Photos au Format 10 x 15 cm) Rose",Hama,"0,00 €",0,,,,1
B0D97YPYX1,"Hama Cuir Synthétique Tapis de Souris - Tapis de Bureau élégant, Dessous Anti-Dérapant, Bords Cousus - Blanc",Hama,"0,00 €",0,"8,32 €","5,83 €",1,
B000EOOCJW,"Hama Fiche F (pour câble coaxial de 7 mm, vissable, pour connexion au LNB, commutateur multiple, récepteur, 4 pièces) Argent",Hama,"0,00 €",0,"4,99 €","2,55 €",1,
B08BNYFVFS,"Hama Ring Light LED avec Trépied extensible et Support Smartphone (Anneau Lumineux Selfie 26.5cm, télécommande Bluetooth, 10 niveaux d'intensité, Idéal TikTok/Youtube/Live Stream/Maquillage) Noir",Hama,"0,00 €",0,,,,
B00005K4A5,"Hama Filtre polarisant (Circulaire, Traité, 72mm, 2 Couches par Face) Noir",Hama,"0,00 €",0,,,,1
B00005UPBH,"Hama Boîtier standard double (pour CD et disques Blu-Ray, Étui protecteur pour CD, paquet de 5) Transparent",Hama,"0,00 €",0,"25,62 €","21,06 €",6,2
B0BL1V2BDN,"Hama MW-300 V2 Souris sans Fil - Technologie 2.4Ghz, Capteur 1600 dpi, Clics Silencieux, Ambidextre - Bleu",Hama,"0,00 €",0,"9,16 €","7,87 €",1,
B00BYCGMEG,"Hama Album photo vierge ""Livorno"" (album photo traditionnel format 22 cm x 22 cm, pour 200 photos 10 cm x 15 cm, 100 pages, emplacement CD) Bleu/Blanc/Jaune",Hama,"-14,06 €",-1,"14,06 €","5,58 €",1,
B00006J4EP,"Hama Boîtier standard (pour CD et disques Blu-Ray, Étui protecteur pour CD, paquet de 10) Noir/Transparent",Hama,"-22,47 €",-3,"59,92 €","31,23 €",8,
