B0CYN6M918,"Hama Ampoule Connectée WIFI G95, Ampoule Vintage Globe Filament ST64 Spiral, 2700-6500K, Ampoule Smart Intelligente, Matter, Ampoule Alexa/Google Home, 4.9W, 470lm, Dimmable, cde voc+appl",Hama,"23,32 €","18,39 €",1,
B0000AISQJ,"Hama Passe-partout Premium, blanc neige, 30 x 40 cm",Hama,"23,28 €","11,84 €",4,
B003LTLSFS,"Hama Chemin de câbles (Bande en Aluminium pour Montage Mural TV ou au Sol, Cache-câble Rectangle, 110 x 3,3 x 1,7 cm, entrée de câble jusqu'à 5 câbles, matériel de Montage Compris) Gris",Hama,"22,97 €","11,54 €",1,
B00CRB69MI,"Hama Support de télécommande Major (pour 4 télécommandes au maximum, également pour rangement de lunettes, smartphones, contrôleurs, clés USB, porte-télécommande) Noir",Hama,"22,67 €","9,99 €",1,1
B08SDTPYQP,"Hama Mini Trépied de Table Pocket II Rotation (trépied avec Support Smartphone iPhone/Samsung/GoPro, Rotatif, inclinable Paysage Portrait, idéal Voyage, Pas de vis de 1/4"") Noir",Hama,"22,26 €","26,58 €",3,
B0000AHIBP,"Hama Boîtier standard (pour 3 DVD, convient également aux CD et disques Blu-ray, avec film pour l'insertion de la jaquette, lot de 5) Noir",Hama,"22,12 €","9,46 €",2,
B0009V6OBO,"Hama Pochettes de Protection (en Papier pour CD/DVD/Blu-Ray, Lot de 100) Blanc/Transparent",Hama,"21,84 €","7,96 €",2,
B0000AISF4,"Cadre tableau sans bordure Clip-Fix 30x40 antireflet",Hama,"19,98 €","13,23 €",3,
B000Y13DPE,"Hama Boîtier CD Slim en polypropylène, Lot de 20, Assortiment de Couleurs",Hama,"19,98 €","12,74 €",2,
B0000AISOV,"Hama Cadre photo Clip-Fixe (sans bordure, 30 x 30 cm, Reflex) Blanc",Hama,"19,93 €","6,22 €",2,
B00006J6HP,"Hama Casier de rangement Spirit II (système de classement sur socle pour CD, pour 44 boîtiers CD, porte-CD pour le rangement, organisateur antidérapant) Noir",Hama,"19,05 €","8,17 €",1,
B01MS2OU9J,"Hama Chambre à air de vélo (Taille de 26"", avec Valve Automatique, Schrader) Noir",Hama,"18,62 €","7,12 €",2,
B079PNH64S,"Hama Chevalet album photo vierge à spirale (album photo traditionnel 18 cm x 16,5 cm, 12 pages noires, pour 12 ou 24 photos de 10 cm x 15 cm ou 11 cm x 15 cm, avec dictons) Noir",Hama,"18,32 €","13,16 €",2,
B00T7MB37Q,"Hama Album photo à pochettes ""New York City"" (pour 300 photos au format 10 cm x 15cm, taille de l'album de 19 cm x 34,5 cm, 100 pages, en cuir, protège les photos et les documents) Noir",Hama,"17,72 €","9,57 €",1,
B0BL1RQ6DQ,"Hama Adaptateur USB C à Jack auxiliaire 3.5 mm (Connecteur Casque Audio, Compatible OnePlus 6T/Huawei P30 Pro/Mate 20 Pro/Samsung Galaxy S21/S21+ ou Ultra/S20/S10/S9/Note/Xiaomi/iPad Pro 2021) Blanc",Hama,"17,49 €","13,11 €",1,
B084J116L1,"Hama Album Photo ""Fine Art"" (format 30 x 30 cm, 80 pages blanches, sans spirale) Lilas",Hama,"17,42 €","9,27 €",1,
B07RLYK1T9,"Hama Trépied de Table Solid pour Smartphones et appareils Photos, 19B",Hama,"17,42 €","21,09 €",1,
B006JZ5ADW,"Hama Cadre Photo Philadelphia, Format Paysage, 2X 13x18 cm",Hama,"17,27 €","9,45 €",1,
B01AT3Z228,"Xavax Couvercle universel (anneau en silicone pour casseroles/poêles de diamètre 24, 26 ou 28 cm, trou de vapeur, design à bords gradués, verre, va lave-vaisselle, peu encombrant) Noir/Transparent",xavax,"16,66 €","8,79 €",1,
B0009V6OD2,"Hama Boîtier Slim Double (pour CD et disques Blu-Ray, Ultra Mince, avec Une Feuille pour la Couverture, Lot de 25) Transparent",Hama,"16,66 €","11,85 €",1,
B08YRY2LQJ,"Hama Câble Jack 3.5 Male Male (Câble Auxiliaire Stéréo Jack 3.5mm, Cable Audio Garantie 10ans, 1.5m, compatible iPhone, iPod, iPad, Voiture, Casque, Autoradio, Smartphones, MP3) Noir",Hama,"16,64 €","18,36 €",4,
B000EOPSRM,"Hama Pochette (pour 40 CD/DVD/Blu-Ray, classeur de Rangement, Gain de Place pour Le Bureau, Le Salon et la Maison, étuis de Transport) Noir",Hama,"16,64 €","11,26 €",2,
B096YFPTBR,"Hama Kit de Nettoyage d'Appareil Photo 4 en 1 ""Optic Dry (Kit de Nettoyage à Sec avec Stylo Lenspen + Chiffon Microfibre + Poire, pour Objectif Photo, Filtre, APN, Caméra Reflex, Jumelle, écran)",Hama,"16,50 €","18,91 €",1,
B00006IVVD,"Hama Rack (pour CD, pour 20 boîtiers CD) Noir",Hama,"15,89 €","8,66 €",1,
B07N6HRNMP,"Hama Album photo ""Summerly"" (couverture souple, 24 pages pour 24 photos au format 10x15 cm, résistant, pour archiver avec des anecdotes, protège la photo, mini album) Motifs Aléatoires",Hama,"15,82 €","3,16 €",4,
B01K47G2W8,"Hama Album Jumbo ""Skies"" (album grand format, 30 x 30 cm, 60 pages, pour 240 photos au format 10 x 15 cm) Beige",Hama,"15,75 €","5,90 €",1,
B00006J4EP,"Hama Boîtier standard (pour CD et disques Blu-Ray, Étui protecteur pour CD, paquet de 10) Noir/Transparent",Hama,"14,98 €","7,52 €",2,
B084HZN6S4,"Hama Album Photo ""Fine Art"" (format 24 x 17 cm, 36 pages blanches, sans spirale) Sable",Hama,"14,98 €","11,46 €",2,
B003KL3Q2U,"Xavax Raccord pour tuyaux avec colliers (en laiton, pour tuyaux de vidange pour lave-linge et lave-vaisselle, connecteur de tuyau de vidange) Argent/Dorée",xavax,"14,45 €","4,76 €",1,
B00FQFYOM4,"Lecteur USB 3.0 de Cartes SD/microSD, argenté",Hama,"14,20 €","9,00 €",1,
B08BFFFTKJ,"Hama Album photo Jumbo ""Romance"" à personnaliser (Album Photo Livre de Mariage ou naissance bébé, Livre d'or ou cadeau, 30x30 cm, 80 pages, Motif cœur, Titre Love, 320 photos 10x15 cm) Beige/blanc",Hama,"14,17 €","6,19 €",1,
B06XCBWTRC,"Hama Câble audio avec jack de 3,5 mm ""Elite"", métal, doré, anthrac., 0,75 m",UNKNOWN,"14,16 €","6,12 €",1,
B00CBVEZNO,"Hama Support pour Ordinateur Portable Carbone (Support pour Ordinateur Portable jusqu'à 47 cm, Hauteur 8 cm, Pieds en Caoutchouc antidérapants, Aspect Carbone) Noir",Hama,"14,16 €","8,05 €",1,
B009HSQ3ES,"Hama Album Photo ""Fine Art"" (format 36 x 32 cm, 50 pages noires, à spirale) Turquoise",Hama,"14,16 €","8,45 €",1,
B079P3WHJ5,"Hama Kit de Nettoyage pour disques Vinyles (Nettoyage et Entretien de Disque Vinyle, Solution Spray pour Vinyl et Brosse de Nettoyage) Noir",Hama,"14,16 €","10,18 €",1,
B07CGTVBVH,"Hama Cadre Photo pour Portrait ´Scala´, Taupe, 23 x 23 cm",Hama,"14,08 €","6,17 €",1,
B078T62G9K,"Hama Souris Optique à 3 Boutons MC-200, Filaire, Blanche",Hama,"14,05 €","7,42 €",2,
B09RC7QDPM,"Hama Album photo ""Skies II"" (Album Elégant et Intemporel, Idéal mariage, anniversaire, baptême, 22,5 x 22 cm, 100 pages avec pochettes pour 200 photos 10x15 cm, Zone Mémo et pochette carte SD) Gris",Hama,"13,99 €","7,10 €",1,
B01AT3K7NC,"Xavax Couvercle universel (anneau en silicone pour casseroles/poêles de diamètre 16, 18 ou 20 cm, trou de vapeur, design à bords gradués, verre, va lave-vaisselle, peu encombrant) Noir/Transparent",xavax,"13,44 €","7,27 €",1,
B0CP84KK4C,"THOMSON Ecouteurs Filaire USB-C pour iPhone 15 / Samsung (écouteurs Intra-Auriculaires filaires avec Micro, Cable 1.2m, Multi Contrôle, Compatible Siri et Google Assistant) Violet",Thomson,"13,32 €","11,00 €",1,
B000N94K22,"Hama Pochette (pour 64 CD/DVD/Blu-ray, classeur de rangement, gain de place pour le bureau, le salon et la maison, étuis de transport) Noir",Hama,"13,27 €","6,31 €",1,
B00RLNCZ52,"Hama Album photo ""Moni"" (pour 200 photos au format 10 x 15 cm, album photo bébé de 100 pages blanches, ciel, élégant, pour filles, enfants, bébés) Rose, petit album de taille 22,5 x 22,5 cm",Hama,"13,08 €","6,14 €",1,
B01K47EVSK,"Hama Album photo vierge ""La Fleur"" (album photo traditionnel 22,5 cm x 22,5 cm, 100 pages, pour l'insertion de 200 photos au format 10 cm x 15 cm, motif de feuilles, pochette CD) Noir",Hama,"13,08 €","5,85 €",1,
B01EG0O104,"Hama Sonic Mobil 185 Enceintes pour Ordinateur - Système Stéréo 2.0, Haut-Parleurs Alimentés en USB, Connexion Jack 3.5mm - Noir/Argent",Hama,"12,82 €","9,25 €",1,
B073PGV9QC,"Hama 00124156 Lecteur de Cartes 3 en 1 USB 3.0, Noir",Hama,"12,49 €","7,50 €",1,
B0BL1H5S5W,"Hama Ecouteurs sans Fil Tour du Cou Freedom Run (Casque Bluetooth Intra-Auriculaires Tour d'oreille avec Micro, 6h d'autonomie, Idéal Sport, Course, Vélo, Gym, Contrôle Vocal) Noir",Hama,"12,49 €","14,80 €",1,
B0C2PHVDNV,"Hama MW-500 Recharge Souris sans Fil - Technologie 2.4Ghz, Rechargeable en USB C, Capteur Blue Wave 1600 dpi, Technologie Smart-Link, Clics Silencieux, Droitier/e - Blanche",Hama,"12,49 €","12,90 €",1,
B07DHNSBP1,"Hama Mini souris sans fil 'Pesaro 2.4' (Souris optique résistant, idéal ordinateurs portables, léger et compact lors des déplacements) Anthracite",Hama,"12,49 €","8,55 €",1,
B094JJTMRP,"Hama Câble HDMI (Cable HDMI Haute Vitesse High Speed, Cordon HDMI, 1.5m, mâle-mâle) Noir",Hama,"12,48 €","6,15 €",3,
B005DJKH1A,"Hama Album Photo ""Singo"" (album minimax, 22 x 22,5 cm, 100 pages, pour 200 photos au format 10 x 15 cm) Aqua",Hama,"12,42 €","5,40 €",1,
B08YV6JSHN,"Hama Blasebalg Appareil Photo Reflex numérique avec système de Valve pour Appareil Photo Reflex numérique, Objectif, oculaire, Surface Sensible, Air Blower avec système de Valve Rouge/Noir 16,6 cm",Hama,"12,35 €","5,61 €",1,
B001UBIN7K,"Hama Album Photo ""Fine Art"" (format 24 x 17 cm, 50 pages noires, à spirale) Vert Pomme",Hama,"12,22 €","3,93 €",1,
B09YVGVBH1,"Hama AMW-200 Souris sans Fil - Technologie 2.4Ghz, Capteur 1600 dpi, Technologie Smart-Link, Ambidextre - Noire",Hama,"12,04 €","7,50 €",2,
B000CZ2LQE,"Hama Gel de nettoyage (pour écran LCD / TFT avec chiffon en microfibre, 200 ml) Gris/Bleu",Hama,"11,92 €","5,91 €",1,
B072Q7YFFT,"Hama Album photo ""Designline"" (Album photo souvenirs mariage anniversaire, 22,5x22cm, 100 pages avec pochettes pour 200 photos 10 x 15 cm, Zone Mémo et pochette CD) Bleu Turquoise Blanc, Stripes",Hama,"11,83 €","6,56 €",1,
B08SDYYDL2,"Hama Album mémo « Stamps » à personnaliser (Album souvenirs de famille ou de voyage, idéal cadeau et scrapbooking, 22x22,5 cm, album livre 100 Pages, Max : 200 Photos 10x15 cm) Multicolore",Hama,"11,82 €","6,85 €",1,
B00F2BNE82,"Hama Album Photo ""Fine Art"" (format 22,5 x 22 cm, 80 pages blanches, sans spirale) Gris",Hama,"11,71 €","5,34 €",1,
B0187XDXPA,"Hama Casque Essential HS 300"" avec Microphone (Ultra-léger, Oreillettes rembourrées, Casque stéréo, chaîne stéréo, réglage du Volume sur Le câble, Longueur de câble de 2 m, Prise Jack 3,5 mm) Noir",Hama,"10,90 €","8,04 €",1,
B00792A822,"Etui ""Vegas"" pour 5 clés USB, noir",Hama,"10,82 €","7,49 €",1,
B07F3RKPTB,"Hama Support mural pour Google Home mini (pour enceinte sans/avec fil, support d'enceinte, pour un alignement et une présentation optimaux de l'enceinte, montage mural) Blanc",Hama,"10,82 €","6,05 €",1,
B0CLD52FFP,"Hama Support Mural Magnétique pour Apple TV HD (4ème génération)/4K (1ère/2ème/3ème génération) (pour Fixer l'Apple TV Box sur Le Mur ou la TV, Garantie 10ans, Chevilles Fischer et vis VESA) Noir",Hama,"10,82 €","6,71 €",1,
B07BB2FQR1,"Hama Album photo traditionnel ""Rustico"" (grand format, album de 30 x 30 cm, 100 pages blanches, 400 photos au format 10x15, idéal pour le scrapbooking, photos à coller) Love Key",Hama,"10,82 €","7,12 €",1,
B01KFLHB1E,"Hama Album photo vierge ""Bernd"" (album photo traditionnel format 22,5 cm x 22 cm, 100 pages, pour 200 photos 10 cm x 15 cm) Marron/Blanc/Noir",Hama,"10,79 €","5,58 €",1,
B07JX89WGL,"Plaque de fixation d’appareil photo/caméscope pour trépied ""Star 75""",Hama,"10,54 €","5,58 €",1,
B007WAYQRY,"Hama Tapis de souris (1 pièce, taille de 22,3 cm x 18,3 cm x 0,6 cm, en EVA/Jersey) Couleur aléatoire parmi Bleu/Rouge",Hama,"10,35 €","7,55 €",5,
B0015K9MTY,"Xavax Filtre à fibres longues pour hottes aspirantes (2 filtres universels pour extraction par extraction, sur mesure, 57 x 47 cm) Blanc",xavax,"10,30 €","2,90 €",1,
B079PCTWYM,"Hama Brosse (en Fibre de Carbone, pour Le Nettoyage des disques, vinyles) Noir/Argent",Hama,"10,24 €","5,28 €",1,
B01CQ54W6E,"Hama Casque Essential HS 200"" avec Microphone (Ultra-léger, Oreillettes rembourrées, Casque stéréo, chaîne stéréo, réglage du Volume sur Le câble, Longueur de câble de 2 m, Prise Jack 3,5 mm) Noir",Hama,"9,99 €","5,72 €",1,
B0000AHIED,"Hama Cadre Photo Clip-Fixe (sans Bordure, 20 x 20 cm, Reflex) Blanc",Hama,"9,99 €","2,16 €",1,
B0041IRLS6,"Xavax Rallonge pour Tuyau d' évacuation (pour Tyau de Lavage et de Lave-vaisselle, Tuyau de Vidange, 2,5 m, 1 pièce) Gris",xavax,"9,99 €","6,78 €",1,
B07QQ8F3P1,"Hama Réveil Analogique de Voyage A50 (Mini Réveil Compact, Fonction Snooze, Rétroéclairage, Aiguilles Fluorescentes, Idéal Voyage Chambre Bureau) Blanc",Hama,"9,99 €","7,11 €",1,
B00006J4GV,"Hama Multiprise 3 Prises 16A avec Interrupteur (Rallonge multiprises 3m, Bloc 3 Prises Type F Schuko, Idéal Bureau PC luminaires, Atelier, Meuble TV, Garage) Blanc",Hama,"9,99 €","5,60 €",1,
B000EOPSRC,"Hama Pochette (pour 20 CD/DVD/Blu-ray, classeur de rangement, gain de place pour le bureau, le salon et la maison, étuis de transport) Noir",Hama,"9,68 €","3,98 €",1,
B08YS1PZWL,"Hama Adaptateur Jack 6.35 vers 3.5 Garantie 10 Ans (Adaptateur Audio 6.35mm Mâle vers 3.5mm Femelle, Stéréo, Prise Casque, Audio Connecteur Stéréo pour Mélangeur Audio/Piano électrique/Clavier) Noir",Hama,"9,66 €","3,60 €",2,
B00NCX5T6W,"Hama Sac Photo Fancy Neopren Quad, 70E, Noir",Hama,"9,58 €","5,57 €",1,
B000TCQPWG,"Hama Boîtier Slim (pour CD et disques Blu-ray, ultra mince, avec une feuille pour la couverture, lot de 20) Noir/Transparent",Hama,"9,57 €","6,72 €",1,
B003KKWLJA,"Xavax Raccord de tuyau d' arrivée d'eau en laiton (pour tuyaux d’arrivée de lavage et de lave-vaisselle, embout de tuyau d’admission) Dorée",xavax,"9,18 €","12,42 €",3,
B08YS2VWFQ,"Hama Cordon Alimentation Secteur (Contact de Protection Type F, Câble pour Bloc d'alimentation Chargeur Ordinateur Portable, Scanner, Imprimante, 1.5m, Garantie 10ans) Noir",Hama,"9,16 €","5,72 €",1,
B00SOOJGJ0,"Hama Support de smartphone ""Flipper"" (1 pièce, Support voiture pour smartphone de 4,8 à 9 cm de large, permet une rotation de 360°, en plastique) Noir",Hama,"9,16 €","4,81 €",1,
B000XA2YM4,"Xavax Amortisseur de vibrations (pour laveuse, sécheuse et lave-vaisselle, diamètre intérieur 4,5 cm, Jeu de 4) Blanc",xavax,"9,16 €","5,38 €",1,
B005DJKIKK,"Hama Album Photo ""Singo"" (album grand format, 30 x 30 cm, 100 pages, pour 400 photos au format 10 x 15 cm) Orange",Hama,"9,16 €","6,18 €",1,
B0BL1RYFT8,"Hama MW-300 V2 Souris sans Fil - Technologie 2.4Ghz, Capteur 1600 dpi, Clics Silencieux, Ambidextre - Rouge",Hama,"9,16 €","7,87 €",1,
B01K47CMCM,"Hama Album photo vierge ""La Fleur"" (album photo traditionnel 22,5 cm x 22,5 cm, 100 pages, pour l'insertion de 200 photos au format 10 cm x 15 cm, motif de feuilles, pochette CD) Blanc",Hama,"8,74 €","5,68 €",1,
B08YS1ZZ99,"Hama Hub USB Garantie 10ans '00200119' (4 Ports USB 2.0, 480Mbit/s, Plug&Play, Idéal PC, Ordinateur Portable, Tablette, MacBook) Noir",Hama,"8,32 €","4,98 €",1,
B00006JAPE,"Hama Multiprise 6 Prises 16A (Rallonge multiprises 1.4m, Bloc 6 Prises Type F Schuko, 3680W Max, Idéal Bureau PC luminaires, Atelier, Meuble TV, Garage) Blanc",Hama,"8,32 €","5,22 €",1,
B00006JAOZ,"Hama Fusibles en Verre (fusible de voiture, 40A, 10 x 38mm, plaqué or, 2 pièces) Or/Transparent",Hama,"8,32 €","3,56 €",2,
B08YRYYV9F,"Hama Câble HDMI 4K Garantie 10 ans (Cable HDMI High Speed avec Ethernet, Cordon HDMI 4k, 1.5m, mâle-mâle, Câble Ethernet HEC, Retour Audio, HDR, 18 Gbit/s, 600MHz, Résolution 4096x2160, Blindé) Noir",Hama,"8,32 €","6,25 €",1,
B002MC62C4,"Xavax Raccord Y pour tuyau d' arrivée d'eau (à 2 voies pour tuyaux d'admission, 26,9 mm (3/4 "") en laiton, collecteur en Y) Dorée",xavax,"8,32 €","7,02 €",1,
B002IKBZWM,"Xavax Thermomètre analogique pour réfrigérateur, freezer ou congélateur (à suspendre au réfrigérateur, congélateur, cave à vin, minibar, minimum -40 degrés, maximum 30 degrés, format stylo) Blanc, -40°C/+30°C",xavax,"8,07 €","3,19 €",1,
B002GQOTTY,"Hama Clé USB 2.0 ""Laeta, 16 GB (Transfert de données à 10 Mo/s, clé USB avec Anneau œillet, Capuchon de Verrouillage, pour Windows/Macbook, en métal) Gris",Hama,"7,83 €","3,40 €",1,
B0000AISCF,"Hama Cadre photo en plastique Sevilla (taille du Cadre de 21 x 29,7 cm (DIN 4) avec bordure de 9 mm x 17 mm, pour une photo de 15 x 20 cm) Noir",Hama,"7,82 €","3,95 €",1,
B07PHQ17NW,"Hama Album à Spirale 'Watercolor Moments', 28 x 24 cm, 50 Pages Blanches",Hama,"7,49 €","4,68 €",1,
B07CGZY714,"Hama Loupe de Lecture à LED Basic 90 LED (1 unité, grossissement x4, diamètre de 90 mm, Taille de 94 mm x 202 mm x 16 mm) Noir/Transparent",Hama,"7,49 €","5,96 €",1,
B0002W6B90,"Hama Interrupteur pour véhicules (Interrupteur de voiture, rond, 10 A, 12 V, interrupteur à bascule) Noir",Hama,"7,32 €","2,90 €",1,
B0002VFL1K,"Hama Pochettes pour CD-ROM/DVD-ROM (Pochettes CD plastique, pochette de protection colorées, lot de 50, Multicolore) Bleu/Orange/Violet/Rose/Vert",Hama,"7,07 €","4,84 €",1,
B0CP85387S,"Xavax 00220738 Raccord en Y, Blanc",Xavax,"7,07 €","4,52 €",1,
B0019DPZPC,"Hama 29308 Présentoir de Distributeur de pastilles adhésives, Transparent (1 distributeurs, 1000 coins photos, 12 x 13 mm)",Hama,"6,64 €","4,62 €",2,
B08YRZD1X6,"Hama Câble Optique Audio 3m (Cable Toslink Audio Optique, Cable fibre Optique Audio pour Home Cinema, Barre de Son, TV, Samsung, Bose, LG, Sony, Sonos, PS4, Xbox, fiche Mâle ODT) Noir",Hama,"5,92 €","8,66 €",1,1
B0000AISQG,"Hama Passe-partout Premium, ivoire, 30 x 40 cm",Hama,"5,82 €","3,05 €",1,
B07GX2V6JG,"Lecteur Multi-Cartes USB-2.0, SD/microSD/CF, Bleu",Hama,"5,82 €","3,65 €",1,
B0000AIRXI,"Hama Plaque de Fixation Rapide pour Appareil Photo (Plaque d'attache Rapide pour appareils Photo avec Filetage 1/4"" (6,4 mm), Adaptateur tête de trépied Star 55 à 64"",""Gamma 153"", ""Action 165"") Noir",Hama,"5,82 €","4,72 €",1,
B0000AHIE0,"Hama Cadre portrait (taille de cadre 13x18 cm, taille de photos 13x18 cm, acrylique, format horizontal, en plastique, 1 photo par cadre, élégant, simple, classique) Transparent",Hama,"5,72 €","2,03 €",1,
B00006JAQ7,"Hama 007103 - Ruban photo transparent, Blanc, 1000 pièces (2 paquets de 500 pièces)",Hama,"5,41 €","2,90 €",1,
B00006J9VM,"Hama Boîtier Multipack (pour 6 CD/DVD/Blu-Ray, Multipack, 6 in 1, étui de Protection pour CD) Noir/Transparent",Hama,"5,40 €","2,36 €",1,
B01KJER734,"Hama 24 Albums photos ""Skies"" (couverture souple, 24 pages pour 24 photos au format 10x15 cm par album, résistant, pour archiver avec des anecdotes, protège la photo, mini album) Multicolore",Hama,"4,96 €","5,28 €",4,
B0000AIST9,"Porte-tableaux Clip-Fix 21x29cm antireflet",Hama,"4,16 €","2,78 €",1,
B005GCMZLY,"Hama Album photo ""Singo"" (couverture souple, 36 pages pour 36 photos au format 10x15 cm par album, résistant, pour archiver avec des anecdotes, protège la photo, mini album) Multicolore",Hama,"4,14 €","2,68 €",2,
B08YS3LP36,"Hama Adaptateur de prise d'antenne Coaxiale (Raccord Connecteurs Coaxial, Adaptateur SAT, Fiche Coaxiale F femelle vers Fiche coaxiale mâle)",Hama,"2,07 €","2,39 €",1,
B0026MT4CK,"Xavax Tuyau d'Arrivée d'Eau Froide 2.5m (Tuyau Universel pour Lave Vaisselle, Lave-Linge, Connexion 3/4""(1,91 cm) Droit/Coudé Angle 90°) Gris",xavax,,,,1
B0053DXXJO,"Xavax Thermomètre analogique pour réfrigérateur, freezer ou congélateur (à suspendre au réfrigérateur, congélateur, cave à vin, minibar, minimum -30 degrés, maximum 50 degrés, format rond) Blanc",xavax,,,,1
B0002W5WB8,"Hama Pochettes de protection (pour CD/DVD/Blu-Ray, design étroit, pochette en plastique, lot de 50) Transparent",Hama,,,,2
B000LRHKP0,"Hama Cadre photo ""Clip-Fixe"" (sans bordure, 62 x 93 cm, Reflex) Blanc",Hama,,,,2
B08GRRDVN9,"Hama Destructeur de Documents Mini S6 (Broyeur Documents 6 Feuilles 80g, Destructeur Papier, Déchiqueteur sécurité P1, 72 DB, M/A Auto, Fonction Retour, s'adapte sur des Corbeilles à Papier) Noir",Hama,,,,1
B006PG6778,"Xavax - 111945 - Adaptateur pour valve de radiateur avec filetage M28 x 1,5mm",xavax,,,,1
B0032D8WCA,"Hama Album Photo Catania (Taille de l'album 29 x 32 cm pour 300 Photos au Format 10 x 15 cm, 60 Pages, Papier stratifié, thématique Mariage/Vacances, Personnalisable) Gris",Hama,,,,1
B0000AISDL,"Hama Passe-partout Premium, blanc neige, 40 x 50 cm",Hama,,,,3
B0000AI2T9,"Hama Cadre photo en plastique ""Sevilla"" (taille du Cadre de 40 x 60 cm avec bordure de 13 mm x 20 mm, pour une photo de 30 x 45 cm) Blanc",Hama,,,,2
B08GSRV3PB,"Hama Tête Thermostatique Connectée et Intelligente WiFi (pour Kit de Chauffage Connecté 00176592 Compatible Alexa Google Home, Robinet Intelligent pour Radiateur à Eau Chaude) Blanc",Hama,,,,1
B00T7M9IU0,"Hama Album photo à pochettes ""New York City"" (pour 200 photos au format 9 cm x 13 cm, taille de l'album de 16,5 cm x 21 cm, 100 pages, en cuir, protège les photos et les documents) Noir",Hama,,,,1
B0000AIRXC,"Hama Cadre photo en plastique ""Sevilla"" (taille du Cadre de 30 x 45 cm avec bordure de 9 mm x 17 mm, pour une photo de 20 x 30 cm) Blanc",Hama,,,,1
B00EUSMHE0,"THOMSON Kit Casque sans Fil TVWHP3203D (on-Ear, pour TV/HiFi, Circum-aural, supprimer Bruit Fond, 100 m) Noir",Thomson,,,,1
