B079J94XKT,"Xavax Filtre permanent pour machine à café et thé (Ø 12 cm, hauteur 10 cm, maillage en acier inoxydable, réutilisable, va au lave-vaisselle, rechange pour taille 4) Noir",xavax,"23,08 €",2,"30,60 €","15,39 €",3,
B00006IVJJ,"Hama Nettoyeur de contacts en fibre de verre ""Glass Fibre"" (gomme à effacer, en fibre de verre pour contacts électriques, fibre de verre) Noir/Blanc",Hama,"23,00 €",2,"23,00 €","21,28 €",2,
B003LTLSFS,"Hama Chemin de câbles (Bande en Aluminium pour Montage Mural TV ou au Sol, Cache-câble Rectangle, 110 x 3,3 x 1,7 cm, entrée de câble jusqu'à 5 câbles, matériel de Montage Compris) Gris",Hama,"22,97 €",1,"22,97 €","11,54 €",1,
B06XB72BS3,"Hama Album traditionnel ""Lazise"" (taille de l'album de 22,5 x 22 cm, pour 200 photos au format 10 cm x 15 cm, 100 pages, avec pochette CD, élégant) Blanc/Doré",Hama,"22,88 €",2,"8,74 €","5,57 €",1,
B0002W5WB8,"Hama Pochettes de protection (pour CD/DVD/Blu-Ray, design étroit, pochette en plastique, lot de 50) Transparent",Hama,"22,54 €",2,"22,54 €","9,68 €",2,4
B00006J9VM,"Hama Boîtier Multipack (pour 6 CD/DVD/Blu-Ray, Multipack, 6 in 1, étui de Protection pour CD) Noir/Transparent",Hama,"22,18 €",4,"22,18 €","9,44 €",4,
B000JFVCK8,"Hama Adaptateur secteur (prise de voyage pour : Amérique, apon, Canada, Brésil, Thaïlande, ... adapté aux apparails avec fiche Euro) Blanc",Hama,"21,80 €",2,"21,80 €","5,18 €",2,
B0D6CJFVDS,"Hama Coque pour l'iPhone 15 Plus Extreme Protect [Housse Anti-jaunissement] [Etui D3O®] [Coque Robuste] [Compatible MagSafe] - Transparent",Hama,"21,66 €",1,"21,66 €","19,36 €",1,
B0BHZ6ZZ8X,"Hama Multiprise, 6 Prises, Protection Contre surtension., 90°, réglage. Individuel,1,4m, Blanc",HAMA,"21,66 €",1,"21,66 €","17,00 €",1,
B07BB2FQR1,"Hama Album photo traditionnel ""Rustico"" (grand format, album de 30 x 30 cm, 100 pages blanches, 400 photos au format 10x15, idéal pour le scrapbooking, photos à coller) Love Key",Hama,"21,64 €",2,"21,64 €","14,24 €",2,
B00005KHTC,"Hama Filtre polarisant (circulaire, Traité, 62mm, 2 couches par face) Noir",Hama,"21,58 €",1,"21,58 €","20,22 €",1,
B0CP85387S,"Xavax 00220738 Raccord en Y, Blanc",Xavax,"21,21 €",3,"7,07 €","4,52 €",1,
B000EOVQIW,"Hama Pochette (pour 160 CD/DVD/Blu-ray, classeur de rangement, gain de place pour le bureau, le salon et la maison, étuis de transport) Noir",Hama,"21,15 €",1,"21,15 €","15,69 €",1,
B00006JDAX,"Hama Pâte adhésive (250 g, pour fixer, spécialement conçu pour la photo) Gris Neutre",Hama,"20,97 €",1,"20,97 €","13,76 €",1,
B07R85FWGP,"Hama Station météo ""Action""(avec horloge, réveil, thermomètre, prévisions météorologiques, climat, plage de 50 m) Blanc",Hama,"20,82 €",1,"20,82 €","14,27 €",1,
B08SDR48Q1,"Hama Câble Optique Audio (Câble Audio à Fibres Optiques ODT Toslink, 1.5m, Garantie 30ans, Idéal Home Cinema, Barre de Son, TV, Samsung, Bose, LG, Sony, Sonos, PS4, Xbox) Noir",Hama,"20,82 €",1,"20,82 €","13,27 €",1,
B08SFDDNWD,"Hama Câble USB C 0,75m Garantie 30ANS (USB C vers USB, Câble de Charge Rapide 3A, Cable iphone 16/15, Samsung S22/S21/S20/S10) Noir",Hama,"20,64 €",2,,,,
B0000AISCF,"Hama Cadre photo en plastique Sevilla (taille du Cadre de 21 x 29,7 cm (DIN 4) avec bordure de 9 mm x 17 mm, pour une photo de 15 x 20 cm) Noir",Hama,"20,34 €",3,"7,82 €","3,95 €",1,6
B0054RDOL6,"Thomson Télécommande universelle 4 en 1 ""ROC 4411"" (Télécommande avec fonction d'apprentissage, convient pour quatre appareils, pour plus de 1 000 marques) Noir",Thomson,"20,02 €",1,"20,02 €","10,78 €",1,
B000Y13DPE,"Hama Boîtier CD Slim en polypropylène, Lot de 20, Assortiment de Couleurs",Hama,"19,98 €",2,"19,98 €","12,74 €",2,
B01CQ54W6E,"Hama Casque Essential HS 200"" avec Microphone (Ultra-léger, Oreillettes rembourrées, Casque stéréo, chaîne stéréo, réglage du Volume sur Le câble, Longueur de câble de 2 m, Prise Jack 3,5 mm) Noir",Hama,"19,98 €",2,"19,98 €","11,44 €",2,
B0000AISF4,"Cadre tableau sans bordure Clip-Fix 30x40 antireflet",Hama,"19,98 €",3,"19,98 €","13,23 €",3,
B07F82LSLN,"Hama Support Travel Pliable pour tablettes et Smartphones (Idéal pour Les déplacements, Solide et Pratique) Couleur aléatoire Parmi Blanc/Bleu/Gris/Jaune/Noir/Rouge/Vert",Hama,"19,16 €",4,"23,95 €","8,35 €",5,
B000TCQPWG,"Hama Boîtier Slim (pour CD et disques Blu-ray, ultra mince, avec une feuille pour la couverture, lot de 20) Noir/Transparent",Hama,"19,14 €",2,"19,14 €","13,44 €",2,
B084J116L1,"Hama Album Photo ""Fine Art"" (format 30 x 30 cm, 80 pages blanches, sans spirale) Lilas",Hama,"19,02 €",1,"52,26 €","27,89 €",3,
B01MS2OU9J,"Hama Chambre à air de vélo (Taille de 26"", avec Valve Automatique, Schrader) Noir",Hama,"18,62 €",2,"18,62 €","7,12 €",2,
B08SDTGG5L,"Hama Album Photo bébé ""Our Baby"" à personnaliser (Album photo de naissance, baptême, Cadeau d'anniversaire enfant, Idéal scrapbooking, 29 x32 cm, 60 Pages, Max. 300 Photos 10x15 cm) Multicolore",Hama,"18,55 €",1,"37,11 €","17,10 €",2,
B079PNH64S,"Hama Chevalet album photo vierge à spirale (album photo traditionnel 18 cm x 16,5 cm, 12 pages noires, pour 12 ou 24 photos de 10 cm x 15 cm ou 11 cm x 15 cm, avec dictons) Noir",Hama,"18,32 €",2,"18,32 €","13,16 €",2,
B07GVV7N77,"Hama Contact de Porte/fenêtre WiFi (WLAN, sans concentrateur, Contact magnétique, Notification d'alarme sur téléphone Mobile, Compatible IFTTT/Alexa/Google Home, 2,4 GHz, sur Batterie, A +) Blanc",Hama,"18,32 €",1,"18,32 €","13,02 €",1,
B0DGL96V5R,"Hama Coque pour iPhone 16 Pro Max Extreme Protect [Housse Anti-jaunissement] [Etui D3O®] [Coque Robuste] - Transparent",Hama,"18,32 €",1,"18,32 €","16,78 €",1,
B005DJXZ7I,"Hama Album Photo Singo (Album minimax, 13 x 16,5 cm, 100 Pages, pour 100 Photos au Format 10 x 15 cm) Orange",Hama,"18,28 €",4,"18,28 €","9,64 €",4,
B079173RCY,"Hama EMW-500 Souris Verticale Ergonomique Filaire - USB A, Capteur 1800 dpi, Droitier/e - Noire",Hama,"18,15 €",1,"126,80 €","80,89 €",7,
B000L9RQJ8,"Hama Adaptateur Cassette Automobile (pour Smartphones, lecteurs MP3/CD, Jack 3,5 mm, Car Cassette Adapter) Noir",Hama,"18,14 €",2,"9,07 €","3,50 €",1,
B0BL1RQ6DQ,"Hama Adaptateur USB C à Jack auxiliaire 3.5 mm (Connecteur Casque Audio, Compatible OnePlus 6T/Huawei P30 Pro/Mate 20 Pro/Samsung Galaxy S21/S21+ ou Ultra/S20/S10/S9/Note/Xiaomi/iPad Pro 2021) Blanc",Hama,"17,49 €",1,"17,49 €","13,11 €",1,
B01K47GUKC,"Hama Album photo vierge ""La Fleur"" (album photo traditionnel 30 cm x 30 cm, 100 pages noires, de 400 photos au format 10 cm x 15 cm, motif de feuilles) Blanc",Hama,"17,47 €",1,"17,47 €","6,49 €",1,
B0000AIRXI,"Hama Plaque de Fixation Rapide pour Appareil Photo (Plaque d'attache Rapide pour appareils Photo avec Filetage 1/4"" (6,4 mm), Adaptateur tête de trépied Star 55 à 64"",""Gamma 153"", ""Action 165"") Noir",Hama,"17,46 €",3,"23,28 €","18,88 €",4,
B07H149QV2,"Hama Album photo 'Susi Pastell' (couverture souple, 24 pages pour 24 photos au format 10x15 cm, résistant, pour archiver avec des anecdotes, protège la photo, mini album) Couleurs pastel Aléatoires",Hama,"17,43 €",13,"6,87 €","0,88 €",1,
B006JZ5ADW,"Hama Cadre Photo Philadelphia, Format Paysage, 2X 13x18 cm",Hama,"17,27 €",1,"17,27 €","9,45 €",1,
B00AJJJNE6,"Hama Blu-Ray de nettoyage (pour tête de lecture, pour éliminer la poussière dans les lecteurs de Blu-Ray, Blu-Ray de nettoyage, emballage sans frustation) Blanc/Bleu/Rouge",Hama,"17,16 €",1,"17,16 €","9,86 €",1,
B06XB66B6Y,"Hama Album photo vierge ""Lazise"" (album photo traditionnel 29 cm x 32 cm, 50 pages blanches, pour 250 photos 10 cm x 15 cm, format maximum 28 cm x 31 cm) Rose/Noir/Blanc",Hama,"17,13 €",1,"17,13 €","9,31 €",1,
B00SL6I214,"Hama Album, Bleu, 30 x 30 cm",Hama,"16,75 €",1,"17,66 €","8,98 €",1,
B00006J9WN,"Hama Boîtier Multipack (pour 4 CD/DVD/Blu-Ray, Multipack, 4 in 1, étui de Protection pour CD) Noir/Transparent",Hama,"16,70 €",2,,,,
B0BL1XTCSC,"Hama Câble iPhone Lightning USB-C (Câble de charge/transfert de données/Data, USB-C mâle vers Lightning, 1m, Certifié MFI, 480 MBit/s, iPad/iPhone 13/12/11/XS/XR/X/8/7/7+/6s/6/5/SE2020) Blanc",Hama,"16,66 €",1,"16,66 €","12,44 €",1,
B0CYNHPGLH,"Hama Color 10 - Batterie Externe [Power Bank 10 000mAh] [Batterie Portable USB C Fast Charge], Compatible avec iPhones Samsung et Bien Plus - Rouge",Hama,"16,66 €",1,,,,
B000EOPSRM,"Hama Pochette (pour 40 CD/DVD/Blu-Ray, classeur de Rangement, Gain de Place pour Le Bureau, Le Salon et la Maison, étuis de Transport) Noir",Hama,"16,64 €",2,"16,64 €","11,26 €",2,1
B009HSQ3OS,"Hama Fine Art 50 pages Noires/à spirales 10608, Rose, 36 x 32 cm",Hama,"16,58 €",1,"16,58 €","8,45 €",1,
B009HSQ45G,"Hama Album Photo ""Fine Art"" (format 36 x 32 cm, 50 pages noires, à spirale) Kiwi",Hama,"16,58 €",1,"16,58 €","8,45 €",1,
B000VRANI6,"Hama Fine Art Bordeaux 50 Pages Noires/à spirales090144, Bordeaux, 36 x 32 cm",Hama,"16,20 €",1,"16,20 €","8,53 €",1,
B009HSQ3YS,"Hama Album Photo ""Fine Art"" (format 36 x 32 cm, 50 pages noires, à spirale) Taupe",Hama,"16,20 €",1,"16,20 €","8,45 €",1,
B001UBGSZE,"Hama Album Photo Fine Art (Format 36 x 32 cm, 50 Pages Noires, à Spirale) Lilas",Hama,"16,18 €",1,"16,18 €","8,53 €",1,
B009H1U9X6,"Xavax Pot à lait en inox (en acier inoxydable, 400 ml, cuiseur à lait à mousser, bord large pour verser en coulant, convient pour les cafetières ou pour la cuisson au four) Argent",xavax,"16,12 €",1,,,,
B009HSQ4JM,"Hama Album Photo ""Fine Art"" (format 36 x 32 cm, 50 pages noires, à spirale) Azur",Hama,"15,90 €",1,"15,90 €","8,45 €",1,
B005DJKFUS,"Hama Album Photo Singo (Album Grand Format, 30 x 30 cm, 100 Pages, pour 400 Photos au Format 10 x 15 cm) Aqua",Hama,"15,88 €",1,,,,
B07N6HRNMP,"Hama Album photo ""Summerly"" (couverture souple, 24 pages pour 24 photos au format 10x15 cm, résistant, pour archiver avec des anecdotes, protège la photo, mini album) Motifs Aléatoires",Hama,"15,82 €",4,"15,82 €","3,16 €",4,
B07NH3LJ1S,"Hama Support pour télécommande ""Agent"" (porte-télécommande, rotatif, 5 compartiments pour télécommandes, téléphones, lunettes, stylos, organisateur pour bureau, rangement) Noir",Hama,"15,73 €",1,,,,
B01I6H59KE,"Hama Sonic LS-206 Enceintes pour Ordinateur - Système Stéréo 2.0, Haut-Parleurs Alimentés en USB, Connexion Jack 3.5mm - Noir/Argent",Hama,"15,53 €",1,"15,53 €","11,04 €",1,
B0000AI2T9,"Hama Cadre photo en plastique ""Sevilla"" (taille du Cadre de 40 x 60 cm avec bordure de 13 mm x 20 mm, pour une photo de 30 x 45 cm) Blanc",Hama,"15,41 €",1,,,,2
B017JY5APO,"Hama Fine Art à Spirales 50 Pages Noires 2109, Craie, 36 x 32 cm",Hama,"15,22 €",1,"15,22 €","8,45 €",1,
B017JY4RYO,"Hama Album Photo ""Fine Art"" (format 36 x 32 cm, 50 pages blanches, à spirale) Gris",Hama,"15,05 €",1,"15,05 €","7,26 €",1,
B084HZN6S4,"Hama Album Photo ""Fine Art"" (format 24 x 17 cm, 36 pages blanches, sans spirale) Sable",Hama,"14,98 €",2,"14,98 €","11,46 €",2,
B0000AISOV,"Hama Cadre photo Clip-Fixe (sans bordure, 30 x 30 cm, Reflex) Blanc",Hama,"14,94 €",1,"19,93 €","6,22 €",2,
B00FQFYOM4,"Lecteur USB 3.0 de Cartes SD/microSD, argenté",Hama,"14,20 €",1,"14,20 €","9,00 €",1,
B08BFFFTKJ,"Hama Album photo Jumbo ""Romance"" à personnaliser (Album Photo Livre de Mariage ou naissance bébé, Livre d'or ou cadeau, 30x30 cm, 80 pages, Motif cœur, Titre Love, 320 photos 10x15 cm) Beige/blanc",Hama,"14,17 €",1,"14,17 €","6,19 €",1,
B0C5JMXBV6,"Hama Multiprise Parasurtenseur avec Interrupteur Lumineux (Bloc 5 Prises 16A, Rallonge 1.5m, Prise Multiple économie d'énergie, Prises 45°, Prise Male Plate, 3680W, Cable H05VV-F3G1.5) Noir",Hama,"14,16 €",1,"14,16 €","8,70 €",1,
B079P3WHJ5,"Hama Kit de Nettoyage pour disques Vinyles (Nettoyage et Entretien de Disque Vinyle, Solution Spray pour Vinyl et Brosse de Nettoyage) Noir",Hama,"14,16 €",1,"14,16 €","10,18 €",1,
B08YRYCMP3,"Hama Câble d'alimentation Secteur avec Terre (câble Alimentation pour Ordinateur/Notebook/TV, Adaptateur Secteur, Prise de Terre Type F, Fiche trèfle à 3 Broches, 1.5 m, Garantie 10ans) Noir",Hama,"14,16 €",1,"14,16 €","6,52 €",1,
B00FQOM5J4,"Horloge murale ""PG-220"", Mécanisme silencieux, Blanc",Hama,"14,16 €",1,,,,
B0000AI3IZ,"Hama Cadre photo en plastique Décor Sevilla (taille du Cadre de 40 x 50 cm avec bordure de 13 mm x 20 mm, pour une photo de 40 x 50 cm) Or Mat",Hama,"14,16 €",1,,,,
B07CGTVBVH,"Hama Cadre Photo pour Portrait ´Scala´, Taupe, 23 x 23 cm",Hama,"14,08 €",1,"14,08 €","6,17 €",1,
B00006J6P8,"Hama Boîtier standard (pour DVD, convient également aux CD et aux Blu-ray, avec film pour l'insertion de la jaquette, lot de 5) Noir",Hama,"13,86 €",2,"13,86 €","5,48 €",2,
B003B0RIUQ,"Hama Bloc ménager de 3 prises avec interrupteur,sécurité enfants,1,4m, noir",Hama,"13,71 €",3,"13,71 €","12,15 €",3,
B0CP84KK4C,"THOMSON Ecouteurs Filaire USB-C pour iPhone 15 / Samsung (écouteurs Intra-Auriculaires filaires avec Micro, Cable 1.2m, Multi Contrôle, Compatible Siri et Google Assistant) Violet",Thomson,"13,32 €",1,"13,32 €","11,00 €",1,
B0CNGY9DBG,"Xavax Mousseur à lait (Batteur à lait, fouet inox très puissant 14 000 tr/min, Emulsionneur à lait à piles, Fouet Électrique Idéal Café Latte Cappuccino Macchiato Matcha Sauces Blancs d'oeufs) Noir",Xavax,"13,32 €",1,"13,32 €","4,06 €",1,
B09W5TSVGB,"Hama NHS-P100 V2 Casque Micro - Casque Tour de Cou, Microphone Intégré, Léger, Télécommande Intégrée, Fonction Mute - Noir",Hama,"13,32 €",1,"26,64 €","19,22 €",2,
B0BWFCSF1R,"Hama Album photo mémo ""La souris"" (Album photo, 22x22.5 cm, 200 pochettes pour photos 10x15 cm, Zone Mémo, pochette carte SD, idéal photos souvenirs enfants, anniversaire, bébé, Motif Souris) Orange",Hama,"13,32 €",1,"13,32 €","10,00 €",1,
B0019DPZPC,"Hama 29308 Présentoir de Distributeur de pastilles adhésives, Transparent (1 distributeurs, 1000 coins photos, 12 x 13 mm)",Hama,"13,28 €",4,"6,64 €","4,62 €",2,
B01K47EVSK,"Hama Album photo vierge ""La Fleur"" (album photo traditionnel 22,5 cm x 22,5 cm, 100 pages, pour l'insertion de 200 photos au format 10 cm x 15 cm, motif de feuilles, pochette CD) Noir",Hama,"13,08 €",1,"13,08 €","5,85 €",1,
B01EG0O104,"Hama Sonic Mobil 185 Enceintes pour Ordinateur - Système Stéréo 2.0, Haut-Parleurs Alimentés en USB, Connexion Jack 3.5mm - Noir/Argent",Hama,"12,82 €",1,"12,82 €","9,25 €",1,1
B079P435JW,"Hama Pochettes intérieures pour vinyles (pour 33 tours, 10 pièces, 30,5 x 30,3 x 0,3) Blanc",Hama,"12,79 €",1,"12,79 €","6,18 €",1,
B07DHNSBP1,"Hama Mini souris sans fil 'Pesaro 2.4' (Souris optique résistant, idéal ordinateurs portables, léger et compact lors des déplacements) Anthracite",Hama,"12,49 €",1,"12,49 €","8,55 €",1,
B0BL1H5S5W,"Hama Ecouteurs sans Fil Tour du Cou Freedom Run (Casque Bluetooth Intra-Auriculaires Tour d'oreille avec Micro, 6h d'autonomie, Idéal Sport, Course, Vélo, Gym, Contrôle Vocal) Noir",Hama,"12,49 €",1,"12,49 €","14,80 €",1,
B073PGV9QC,"Hama 00124156 Lecteur de Cartes 3 en 1 USB 3.0, Noir",Hama,"12,49 €",1,"12,49 €","7,50 €",1,
B0C2PHVDNV,"Hama MW-500 Recharge Souris sans Fil - Technologie 2.4Ghz, Rechargeable en USB C, Capteur Blue Wave 1600 dpi, Technologie Smart-Link, Clics Silencieux, Droitier/e - Blanche",Hama,"12,49 €",1,"12,49 €","12,90 €",1,
B0C2PDLY43,"Hama MW-500 Recharge Souris sans Fil - Technologie 2.4Ghz, Rechargeable en USB C, Capteur Blue Wave 1600 dpi, Technologie Smart-Link, Clics Silencieux, Droitier/e - Noire",Hama,"12,49 €",1,"12,49 €","12,86 €",1,1
B00006JAOZ,"Hama Fusibles en Verre (fusible de voiture, 40A, 10 x 38mm, plaqué or, 2 pièces) Or/Transparent",Hama,"12,48 €",3,"16,64 €","7,12 €",4,
B017JY4WEY,"Hama ""Fine Art"" Spiral Album, 24 x 17cm, 50 Photos, chalk",Hama,"12,48 €",2,"12,48 €","8,66 €",2,
B005DJKG0C,"Hama Album Photos Mémo Singo (Livre Photo 100 Pages Blanches avec Pochettes pour 200 Photos 10x15 cm, Album Photos Souvenirs 22,5x22 cm, Range CD, Zone Mémo, Album Traditionnel Motif Fleurs) Orange",Hama,"12,42 €",1,,,,
B0BL1TNWQ4,"Hama Câble Micro-USB Reflective (Câble de charge et transfert de données USB-A 2.0 mâle vers Micro-USB, Fiche Aluminium, Cordon Réflechissant Anti-torsion, Gaine en nylon tressé, 1.5 m) Bleu",Hama,"12,23 €",1,"12,23 €","9,11 €",1,
B001UBIN7K,"Hama Album Photo ""Fine Art"" (format 24 x 17 cm, 50 pages noires, à spirale) Vert Pomme",Hama,"12,22 €",1,"12,22 €","3,93 €",1,
B005DJXZIM,"Hama Album Photo Singo (Album minimax, 13 x 16,5 cm, 100 Pages, pour 100 Photos au Format 10 x 15 cm) Vert",Hama,"12,06 €",2,"12,06 €","5,94 €",2,
B000VRANHW,"Hama Album Photo ""Fine Art"" (format 28 x 24 cm, 50 pages noires, à spirale) Noir 00090145",Hama,"11,77 €",1,"25,09 €","9,60 €",2,
B00F2BNE82,"Hama Album Photo ""Fine Art"" (format 22,5 x 22 cm, 80 pages blanches, sans spirale) Gris",Hama,"11,71 €",1,"11,71 €","5,34 €",1,
B00006JB4M,"Hama Filtre UV (anti-UV et protection, compensation 2X, traitement antireflet, pour objectifs d'appareils photo 77 mm, O-Haze, traité) Noir",Hama,"11,58 €",1,"11,58 €","10,05 €",1,
B0000AHIE0,"Hama Cadre portrait (taille de cadre 13x18 cm, taille de photos 13x18 cm, acrylique, format horizontal, en plastique, 1 photo par cadre, élégant, simple, classique) Transparent",Hama,"11,44 €",2,"5,72 €","2,03 €",1,
B009X8SEOO,"Hama ""Fine Art"" Spiral Album, 24 x 17 cm, 50 Photos, kiwi",Hama,"11,18 €",1,"11,18 €","3,93 €",1,
B006L9T90G,"Ventilateur USB avec LEDs de couleur",Hama,"10,99 €",1,"10,99 €","5,79 €",1,
B07FPZLB75,"Hama Tapis de Souris (fabriqué en Aluminium, Tapis de Souris élégant pour Souris Laser/Optique, antidérapant, Dur, Fin, effaçable, 22 x 0,3 x 18 cm) Argent",Hama,"10,82 €",1,,,,
B0CLD52FFP,"Hama Support Mural Magnétique pour Apple TV HD (4ème génération)/4K (1ère/2ème/3ème génération) (pour Fixer l'Apple TV Box sur Le Mur ou la TV, Garantie 10ans, Chevilles Fischer et vis VESA) Noir",Hama,"10,82 €",1,"10,82 €","6,71 €",1,
B000JIA7YW,"Hama Boîtier Standard (pour 6 DVD, Convient également aux CD et disques Blu-Ray, avec Film pour l'insertion de la Jaquette, Lot de 3) Noir",Hama,"10,64 €",1,"10,64 €","4,80 €",1,
B07JX89WGL,"Plaque de fixation d’appareil photo/caméscope pour trépied ""Star 75""",Hama,"10,54 €",1,"10,54 €","5,58 €",1,
B001JTV1HW,"Hama Boîtier standard (pour DVD, convient également aux CD et aux Blu-ray, avec film pour l'insertion de la jaquette, lot de 5) Transparent",Hama,"10,52 €",1,"23,66 €","5,92 €",2,
B00006JCWM,"Hama Casier de rangement ""Spirit II"" (système de classement sur socle pour CD, pour 22 boîtiers CD, porte-CD pour le rangement, organisateur antidérapant) Noir",Hama,"10,34 €",1,"10,34 €","6,42 €",1,
B079PCTWYM,"Hama Brosse (en Fibre de Carbone, pour Le Nettoyage des disques, vinyles) Noir/Argent",Hama,"10,24 €",1,"10,24 €","5,28 €",1,
B007M6NI18,"Hama Rallonge allume-cigares ( pour voiture, pour allume-cigare, câble de 1,5 m, adapté aux 12-24 V, pour voiture/camion/véhicule de loisirs/caravanes, fusible de 8 A maximum) Noir",Hama,"9,99 €",1,"9,99 €","5,00 €",1,
B0BL228SD3,"Hama Chargeur Secteur USB (Bloc Secteur USB-A, 6W, 5V/ 1.2A, Adaptateur Secteur Universel, Chargeur Replacement pour c) Noir",Hama,"9,99 €",1,"9,99 €","7,45 €",1,
B07QQ8F3P1,"Hama Réveil Analogique de Voyage A50 (Mini Réveil Compact, Fonction Snooze, Rétroéclairage, Aiguilles Fluorescentes, Idéal Voyage Chambre Bureau) Blanc",Hama,"9,99 €",1,"9,99 €","7,11 €",1,
B0000AHIED,"Hama Cadre Photo Clip-Fixe (sans Bordure, 20 x 20 cm, Reflex) Blanc",Hama,"9,99 €",1,"9,99 €","2,16 €",1,
B006WYIWVM,"Hama 2 Clés de desserrage pour filtres Photo (pour filtres de 62 à 86mm) Noir",Hama,"9,72 €",1,"9,72 €","5,91 €",1,
B08YRZC67P,"Hama Câble USB-C mâle - USB-A 3.2 Gen1 (Câble données/chargement rapide Super Speed, 5Gbit/s, 0.25 m, pour PC, Macbook, Tablette, Smartphone, Power Pack, Enceinte, Manette jeux, Garantie 10ans) Noir",Hama,"9,71 €",1,,,,
B000EOPSRC,"Hama Pochette (pour 20 CD/DVD/Blu-ray, classeur de rangement, gain de place pour le bureau, le salon et la maison, étuis de transport) Noir",Hama,"9,68 €",1,"9,68 €","3,98 €",1,
B003KKWLJA,"Xavax Raccord de tuyau d' arrivée d'eau en laiton (pour tuyaux d’arrivée de lavage et de lave-vaisselle, embout de tuyau d’admission) Dorée",xavax,"9,18 €",3,"12,24 €","16,56 €",4,
B08YS2VWFQ,"Hama Cordon Alimentation Secteur (Contact de Protection Type F, Câble pour Bloc d'alimentation Chargeur Ordinateur Portable, Scanner, Imprimante, 1.5m, Garantie 10ans) Noir",Hama,"9,16 €",1,"9,16 €","5,72 €",1,
B0000AITJE,"Hama Chevalet ""Clip-Fix"" (en fer, 24 x 30 cm) Argent",Hama,"9,16 €",1,"9,16 €","3,27 €",1,
B000XA2YM4,"Xavax Amortisseur de vibrations (pour laveuse, sécheuse et lave-vaisselle, diamètre intérieur 4,5 cm, Jeu de 4) Blanc",xavax,"9,16 €",1,"9,16 €","5,38 €",1,
B00SOOJGJ0,"Hama Support de smartphone ""Flipper"" (1 pièce, Support voiture pour smartphone de 4,8 à 9 cm de large, permet une rotation de 360°, en plastique) Noir",Hama,"9,16 €",1,"9,16 €","4,81 €",1,
B00A44N3MY,"Câble de liaison ""AluLine"", fiche jack 3,5mm - fiche jack 3,5mm 90°, 0,75 m",Hama,"8,39 €",1,"8,39 €","7,96 €",1,
B003TKJ6B2,"Hama Carte mémoire Photo (SDHC pour Photo/Classe 10, 16 GB - 22 MB/s) Bleu",Hama,"8,32 €",1,,,,
B00006JAPE,"Hama Multiprise 6 Prises 16A (Rallonge multiprises 1.4m, Bloc 6 Prises Type F Schuko, 3680W Max, Idéal Bureau PC luminaires, Atelier, Meuble TV, Garage) Blanc",Hama,"8,32 €",1,"8,32 €","5,22 €",1,
B08YRYYV9F,"Hama Câble HDMI 4K Garantie 10 ans (Cable HDMI High Speed avec Ethernet, Cordon HDMI 4k, 1.5m, mâle-mâle, Câble Ethernet HEC, Retour Audio, HDR, 18 Gbit/s, 600MHz, Résolution 4096x2160, Blindé) Noir",Hama,"8,32 €",1,"8,32 €","6,25 €",1,
B08YS1ZZ99,"Hama Hub USB Garantie 10ans '00200119' (4 Ports USB 2.0, 480Mbit/s, Plug&Play, Idéal PC, Ordinateur Portable, Tablette, MacBook) Noir",Hama,"8,32 €",1,"8,32 €","4,98 €",1,
B000GIGR4O,"Hama Mini microphone pour ordinateur portable (seulement 23 x 32 mm, métal précieux) Argent",Hama,"8,22 €",1,,,,
B079PBY42T,"Hama Pochettes extérieures pour vinyles (pour 33 tours, 10 pièces, 32,7 x 0,07 x 32,5 cm) Transparent",Hama,"7,91 €",1,"7,91 €","5,96 €",1,
B00006IVX3,"Hama Câble réseau (RJ11, modulaire, connecteurs mâles 6p4c, 3m) Blanc",Hama,"7,90 €",2,"7,90 €","4,16 €",2,
B002GQOTTY,"Hama Clé USB 2.0 ""Laeta, 16 GB (Transfert de données à 10 Mo/s, clé USB avec Anneau œillet, Capuchon de Verrouillage, pour Windows/Macbook, en métal) Gris",Hama,"7,83 €",1,"7,83 €","3,40 €",1,
B00006JAS7,"Hama lot de 2 Fiches d’antenne coaxiale TV (Diam 9.52mm, 1 Mâle+1 Femelle), Blanc",Hama,"7,48 €",2,"7,48 €","4,66 €",2,
B00006JCZK,"Hama Filtre UV (Anti-UV Et Protection, Compensation 2X, Traitement Antireflet, pour Objectifs D'appareils Photo 62 Mm, O-Haze, Traité) Noir",Hama,"7,42 €",1,,,,
B0002W6B90,"Hama Interrupteur pour véhicules (Interrupteur de voiture, rond, 10 A, 12 V, interrupteur à bascule) Noir",Hama,"7,32 €",1,"7,32 €","2,90 €",1,
B0015KAVRQ,"Hama Détartrant Premium pour cafetières de haute qualité",Hama,"7,12 €",1,,,,
B0002VFL1K,"Hama Pochettes pour CD-ROM/DVD-ROM (Pochettes CD plastique, pochette de protection colorées, lot de 50, Multicolore) Bleu/Orange/Violet/Rose/Vert",Hama,"7,07 €",1,"7,07 €","4,84 €",1,
B002QPPBME,"Hama Cadre photo ""Bristol"" pour portrait (taille de cadre 13x18 cm, taille de photos 13x18 cm, photos format horizontal ou vertical, en métal, 1 photo par cadre, élégant, simple, classique) Argent",Hama,"6,66 €",1,"6,66 €","4,89 €",1,
B006JNYOGI,"Hama Cadre photo en plastique ""Sevilla"" Argent Mat (taille du Cadre de 21 x 29,7 cm (DIN 4) avec bordure de 9 mm x 17 mm, pour une photo de 15 x 20 cm, verre en polystyrène) Argent Mat",Hama,"6,60 €",1,"6,60 €","3,50 €",1,
B000OS1ETO,"Câble d'antenne, Coax mâle - Coax Femelle, 75dB, Blanc, 3,00m",Hama,"5,94 €",1,"5,94 €","1,61 €",1,
B08YRZD1X6,"Hama Câble Optique Audio 3m (Cable Toslink Audio Optique, Cable fibre Optique Audio pour Home Cinema, Barre de Son, TV, Samsung, Bose, LG, Sony, Sonos, PS4, Xbox, fiche Mâle ODT) Noir",Hama,"5,92 €",1,"5,92 €","8,66 €",1,1
B07GX2V6JG,"Lecteur Multi-Cartes USB-2.0, SD/microSD/CF, Bleu",Hama,"5,82 €",1,"5,82 €","3,65 €",1,
B00006J9XX,"Hama Bloc 3 Prises Avec Terre 16A (Rallonge multiprises 1.4m, Prises Multiple Contact de Terre, Bloc Multiprise electrique Schuko, 3680W, ) Blanc",Hama,"5,82 €",1,,,,
B0000AISQG,"Hama Passe-partout Premium, ivoire, 30 x 40 cm",Hama,"5,82 €",1,"5,82 €","3,05 €",1,
B0B59QYN7N,"Hama Adaptateur Secteur 2 Compartiments 2 Prises Euro, Pack de 2 Adaptateurs, Blanc",HAMA,"4,99 €",1,,,,
B0000AIST9,"Porte-tableaux Clip-Fix 21x29cm antireflet",Hama,"4,16 €",1,"4,16 €","2,78 €",1,
B001JTTAQ6,"Hama Boîtier ""Slim"" double (pour DVD, convient également aux CD et disques Blu-ray, ultra mince, avec une feuille pour la couverture, lot de 5) Transparent",Hama,"4,16 €",1,,,,
