B00IYX10YA,"Hama Cadre photo en plastique Sevilla (taille du Cadre de 29,7 x 42 cm (DIN A3) avec bordure de 9 mm x 17 mm, pour une photo de 18 x 24 cm, verre en polystyrène) Bleu",Hama,"59,94 €",6,"59,94 €","30,60 €",6,
B00006J4GV,"Hama Multiprise 3 Prises 16A avec Interrupteur (Rallonge multiprises 3m, Bloc 3 Prises Type F Schuko, Idéal Bureau PC luminaires, Atelier, Meuble TV, Garage) Blanc",Hama,"59,94 €",6,"59,94 €","33,60 €",6,
B0002W5WDQ,"Hama Boîtier ""Slim"" double (pour DVD, convient également aux CD et disques Blu-ray, ultra mince, avec une feuille pour la couverture, lot de 10) Noir/Transparent",Hama,"59,60 €",5,"71,52 €","28,80 €",6,
B07TYWBSZN,"Hama Album photo Jumbo ""Forest"" (pour 400 photos au format 10 x 15 cm, album traditionnel enfant de 30 x 30 cm, 100 pages blanches, animaux, élégant) Marron/Beige/Vert/Orange/Jaune",Hama,"59,47 €",3,"74,63 €","34,08 €",4,1
B01DZGIJ26,"Hama Support mural TV FULLMOTION inclinable et pivotant pour TV écran plat entre 48 cm et 122 cm (19"" à 48""), jusqu'à 20 kg de charge supportée, VESA 200x200, Noir",Hama,"59,18 €",2,"59,18 €","30,20 €",2,
B08SDYYDL2,"Hama Album mémo « Stamps » à personnaliser (Album souvenirs de famille ou de voyage, idéal cadeau et scrapbooking, 22x22,5 cm, album livre 100 Pages, Max : 200 Photos 10x15 cm) Multicolore",Hama,"59,10 €",5,"59,10 €","34,75 €",5,
B07T4DLJ4Y,"Hama Album photo Jumbo ""Forest"" (pour 400 photos au format 10 x 15 cm, album traditionnel enfant de 30 x 30 cm, 100 pages blanches, renards, élégant) Marron/Beige/Vert/Orange/Blanc",Hama,"57,49 €",3,"57,49 €","28,65 €",3,
B071VWLNZB,"Hama 00137234 Alimentation pour PC",Hama,"57,24 €",3,"76,32 €","41,44 €",4,1
B0002W5WEU,"Hama Boîtier Slim (pour DVD, Convient également aux CD et disques Blu-Ray, Ultra Mince, avec Une Feuille pour la Couverture, Lot de 25) Noir/Transparent",Hama,"56,64 €",4,,,,
B0000AHIBP,"Hama Boîtier standard (pour 3 DVD, convient également aux CD et disques Blu-ray, avec film pour l'insertion de la jaquette, lot de 5) Noir",Hama,"55,30 €",5,"22,12 €","9,46 €",2,
B01K47HIEY,"Hama Album photo ""Skies"" (album grand format, 22,5 x 22 cm, 100 pages, pour 200 photos au format 10 x 15 cm) Gris",Hama,"55,28 €",4,"55,28 €","21,56 €",4,
B005DJKIKK,"Hama Album Photo ""Singo"" (album grand format, 30 x 30 cm, 100 pages, pour 400 photos au format 10 x 15 cm) Orange",Hama,"54,96 €",6,"54,96 €","37,08 €",6,
B0BL1TH1PX,"Hama Kit Support Téléphone Voiture Universel (Ensemble Support téléphone pour Voiture, 2en1 Clip pour aération et Ventouse, pivotable 360°, pour Mobile de Largeur de 4 à 11 cm) Noir",Hama,"54,96 €",3,"54,96 €","38,34 €",3,
B00006JCRV,"Hama Boîtier Standard Double (pour CD et disques Blu-Ray, Étui Protecteur pour CD, Paquet de 5) Noir/Transparent",Hama,"54,84 €",12,"54,84 €","38,96 €",12,
B08HQH5PSV,"Hama Horloge Murale Numérique Jumbo (Radio-pilotée DCF, Très Grand Format d’Affichage, Affichage XL Heure-Date-température int.-humidité, à Suspendre ou Poser) Noir",Hama,"54,50 €",1,"54,50 €","40,00 €",1,
B07PQHPTSG,"THOMSON Casque TV Stéthoscope HED4408 (câble de 8 m, léger pour Personnes âgées et porteurs de Lunettes, Casque stéréo pour TV, Casque Intra-auriculaire, Prise 3,5 mm, avec Adaptateur 6,35 mm) Noir",Thomson,"53,94 €",2,"53,94 €","44,74 €",2,1
B0BZDYD7TJ,"Hama Double Enceinte Bluetooth Portable Waterproof Flottante (Double Enceinte Bluetooth séparables sans Fil, Haut-Parleurs Bluetooth 2en1 TWS, 30 W, Etanche IP67, Batterie 10h, Stéréo) Noir",Hama,"53,90 €",1,"53,90 €","72,00 €",1,
B002ZX98MG,"Hama Boîtier Slim (pour DVD, Convient également aux CD et disques Blu-Ray, Ultra Mince, avec Une Feuille pour la Couverture, Lot de 10) Transparent",Hama,"53,55 €",4,"53,55 €","19,68 €",4,
B00005QF9N,"Hama Attache Rapide pour Trépied, Click II (Plateau Rapide Tête de Trépied, Fixation Rapide pour Appareil Photo/Caméscope à Filetage 1/4"" 6.4mm, pour Trépieds Gamma) Noir",Hama,"51,94 €",7,"59,36 €","49,76 €",8,
B074JDHBXG,"Hama Cadre en Plastique Madrid (Taille de Cadre de 21 cm x 29,7 cm, Taille de la Photo de 15 cm x 20 cm, 1 Photo par Cadre, à accrocher, élégant, Simple, Classique) Noir",Hama,"51,34 €",9,"51,34 €","20,97 €",9,
B079175GWR,"Hama Souris Ergonomique sans Fil (Souris Verticale sans câble pour droitiers, Souris sans Fil sans Fil avec capteur Optique 1000/1400/1800 dpi) Noire, Prise USB Type-A, Pile AA Mignon",Hama,"51,26 €",2,"51,26 €","30,44 €",2,1
B001F4ZWDK,"Hama Pochettes en polypropylène pour CD/DVD, paquet de 75, Transparent",Hama,"50,47 €",5,"54,81 €","23,40 €",5,
B07GCHTZ3B,"Hama Radio numérique DR40BT-PlugIn (Dab/Dab + / FM/Bluetooth/AUX, Radio-réveil intégré, écran rétro-éclairé) Blanc",Hama,"49,91 €",1,"49,91 €","34,50 €",1,
B0009V8VAQ,"Hama Etui pour Lecteur et CD (pour Lecteur CD, pour Discman, 3 CD, avec Sortie de câble et Boucle de Ceinture) Noir/Bleu",Hama,"49,24 €",4,"73,86 €","30,66 €",6,1
B00T7M8Y6E,"Hama Album photo à pochette minimax ""New York City"" (pour 100 photos au format 10 cm x 15cm, taille de l'album de 13,5 cm x 17 cm, 100 pages, en cuir, protège les photos et les documents) Noir",Hama,"49,15 €",5,"35,01 €","14,41 €",3,
B018VONYPY,"Hama Sonic Mobil 183 Enceintes pour Ordinateur - Système Stéréo 2.0, Haut-Parleurs Alimentés en USB, Connexion Jack 3.5mm - Noir/Rouge",Hama,"47,85 €",5,"47,85 €","34,25 €",5,1
B00T7M8ET6,"Hama Album photo à pochettes ""New York City"" (pour 200 photos au format 10 cm x 15cm, taille de l'album de 19 cm x 23,5 cm, 100 pages, en cuir, protège les photos et les documents) Noir",Hama,"47,46 €",3,"15,82 €","7,96 €",1,
B086B7JST7,"Hama - WETTERSTATION - Weather Station",Hama,"46,66 €",1,"46,66 €","35,14 €",1,
B0CYN6M918,"Hama Ampoule Connectée WIFI G95, Ampoule Vintage Globe Filament ST64 Spiral, 2700-6500K, Ampoule Smart Intelligente, Matter, Ampoule Alexa/Google Home, 4.9W, 470lm, Dimmable, cde voc+appl",Hama,"46,64 €",2,"46,64 €","36,78 €",2,
B000FNO03K,"THOMSON Microphone Dynamique M150 (fiche Jack 3,52 mm, Longueur de câble 3 m, Party) Noir",Thomson,"46,50 €",3,"46,50 €","37,17 €",3,
B00006JDOZ,"Hama Filtre UV (Anti-UV et Protection, Compensation 2X, Traitement antireflet, pour objectifs d'appareils Photo 52 mm, O-Haze, traité) Noir",Hama,"46,00 €",8,"51,75 €","40,77 €",9,
B003O5MK7E,"Hama Passe-partout Premium, noir, 40 x 50 cm pour photo de 30 x 40 cm",Hama,"45,80 €",5,"45,80 €","23,20 €",5,
B00292AZN4,"Hama Cadre photo Clip-Fixe (sans bordure, 30 x 40 cm, Reflex) Blanc",Hama,"44,96 €",4,"44,96 €","12,76 €",4,2
B00006JDJU,"Hama - 46020H - Micro monophonique, finition noire métal, jack de 3,5mm et adaptateur 3,5/6,35 mm, interrupteur marche/arrêt sur le micro, 600 Ohms, dynamique et unidirectionnel - Cordon 3.00m",Hama,"44,61 €",3,"44,61 €","26,52 €",3,
B0000AHICV,"Hama Boîtier CD/DVD Slim (lot de 10 boitiers standards vierges pour CD/DVD et disques Blu-ray, ultra plat) Noir/Transparent",Hama,"44,48 €",4,"55,60 €","16,75 €",5,
B0CRZCFQRL,"Hama Support TV sur Pied Pivotant 60° Réglable en Hauteur Garantie 10ans (Socle pour TV 32 à 55 Pouces, Pied TV Stable, Base en Verre trempé, Cache Cables, jusqu'à 30kg, VESA jusqu'à 400 x 400) Noir",Hama,"43,72 €",1,"43,72 €","46,78 €",1,
B0009V6OBO,"Hama Pochettes de Protection (en Papier pour CD/DVD/Blu-Ray, Lot de 100) Blanc/Transparent",Hama,"43,68 €",4,"43,68 €","15,92 €",4,
B0BL1T1R5Y,"Hama Casque TV ShellTV (Casque Circum-Auriculaire Stéréo, idéal télé, câble Extra Long 6m, Jack 3.52mm mâle, Adaptateur Jack 6.35mm mâle Inclus, 20 Hz-20 kHz, 32 ohms, 113 DB/MW) Noir",Hama,"43,32 €",2,"43,32 €","25,90 €",2,
B0CYMZ4GG9,"Hama Pocket 5 - Batterie Externe [Power Bank 5 000mAh] [Batterie Portable USB C Fast Charge], Compatible avec Les iPhones Samsung et Bien Plus - Gris Anthracite",Hama,"43,28 €",4,"43,28 €","36,43 €",4,
B01KFLHB1E,"Hama Album photo vierge ""Bernd"" (album photo traditionnel format 22,5 cm x 22 cm, 100 pages, pour 200 photos 10 cm x 15 cm) Marron/Blanc/Noir",Hama,"43,16 €",4,"55,56 €","27,90 €",5,
B0CLYJQ3YY,"Hama Bras articulé de Telephone (Support articulé, Bras Flexible Smartphone Webcam Mirco Tablette eclairage annulaire, Support Universel Inclus, Fixation de Table à vis, Filetage 1/4"", 70cm Max) Noir",Hama,"43,00 €",4,"43,00 €","43,24 €",4,
B0BG5G1HST,"Hama Montre Connectée Fit Watch 4910 (Montre Sport, Etanche IP68, Montre Fitness 15 Sports Fréq. Cardiaque Oxymètre Podomètre Compatible Google Fit Apple Health Strava) Gris",Hama,"42,77 €",1,"85,54 €","91,40 €",2,
B074HZZQN4,"Horloge murale ""Easy Learning"" (horloge d'apprentissage analogique, pour enfants, pour apprendre l'heure, cadran d'apprentissage de diamètre 30 cm, silencieu) Blanc",Hama,"42,48 €",2,"42,48 €","25,64 €",2,
B08GSCS399,"Hama Destructeur de Documents Basic S8CD (Broyeur Documents 8 Feuilles 80g, Destructeur CD/CB, Niveaux de sécurité P2 T1, Découpe en Bandes 6mm, 70 DB, M/A Auto, Corbeil 11L) Noir",Hama,"41,65 €",1,"41,65 €","26,10 €",1,
B0CP84WF61,"Hama Support TV Mural Fixe Garantie 10 Ans (Support TV Mural Extra-Plat, 40kg Max, Robuste, pour écrans LCD/LED/OLED/Plasma de 81 cm à 191 cm (32 à 75""), VESA Max 400x400) Noir",Hama,"41,64 €",2,"41,64 €","35,92 €",2,
B0000AI2UP,"Hama Cadre photo ""Clip-Fixe"" (sans bordure, 50 x 70 cm, Anti-Reflex) Blanc",Hama,"41,64 €",2,"62,46 €","34,71 €",3,
B0CKMSPK2N,"Hama Greenlight-Pointer Télécommande Pointeur Laser - 4 en 1, Laser Vert, sans Fil 2.4 GHz - pour présentation Powerpoint - Noir",Hama,"41,58 €",1,,,,
B0CP85VQFG,"Xavax 00220734 Raccord de Siphon, Blanc",Xavax,"40,74 €",7,"34,92 €","20,46 €",6,
B0002W6E56,"Hama 00004133 Trépied Photo/vidéo Star 700 EF Digital, Champagne (Trépied d'entrée de Gamme léger, tête à Trois Voies, 42-125 cm, 3D)",Hama,"40,30 €",2,"40,30 €","24,22 €",2,
B01DZGIF6G,"Hama Support mural TV FULLMOTION pour TV écran plat entre 48 cm et 122 cm (19"" à 48""), pivotant et inclinable, jusqu'à 20 kg de charge supportée, VESA 200x200, 1 bras, Noir",Hama,"39,92 €",2,"19,96 €","12,94 €",1,
B0CYQB5JYH,"Hama Émetteur Recepteur Bluetooth Link.it Duo pour TV Stéréo Ecran Audio Video, Adaptateur Bluetooth Multipoint pour 2 Sources, Faible Latence, USB-C, Jack, Fibre Optique Noir",Hama,"39,72 €",1,"39,72 €","32,22 €",1,
B01K47CMCM,"Hama Album photo vierge ""La Fleur"" (album photo traditionnel 22,5 cm x 22,5 cm, 100 pages, pour l'insertion de 200 photos au format 10 cm x 15 cm, motif de feuilles, pochette CD) Blanc",Hama,"39,36 €",3,"48,02 €","24,10 €",4,
B000S8FNTM,"Hama E 80 Enceintes pour Ordinateur - Système Stéréo 2.0, Haut-Parleurs Alimentés en USB, Connexion Jack 3.5mm, Sortie Casque - Noir",Hama,"39,24 €",3,"52,64 €","36,32 €",4,
B0C6CK8KFG,"Hama Câble Enceinte HiFi (Cable pour enceinte, 10m, Câble Audio pour Enceinte, Câble HP de Haut Parleur en Cuivre pour Hifi et Hifi embarquée, 2 x 0.75 mm²) Transparent",Hama,"39,15 €",5,"39,15 €","20,91 €",5,1
B0000AIRRP,"Hama Cadre photo ""Clip-Fixe"" (sans bordure, 40 x 60 cm, Anti-Reflex) Blanc",Hama,"38,73 €",3,,,,
B0187XDXPA,"Hama Casque Essential HS 300"" avec Microphone (Ultra-léger, Oreillettes rembourrées, Casque stéréo, chaîne stéréo, réglage du Volume sur Le câble, Longueur de câble de 2 m, Prise Jack 3,5 mm) Noir",Hama,"38,52 €",3,"10,90 €","8,04 €",1,
B07TM7WRZY,"Hama Elegance Horloge Murale à Quartz Cercle Gris, Argent - Horloges murales (AA Mignon, Gris, Argent, Plastique, Verre, 45 mm, 495 g)",Hama,"38,32 €",2,"38,32 €","27,60 €",2,
B00005KHSU,"Hama Filtre UV (anti-UV et protection, compensation 4X, traitement antireflet, pour objectifs d'appareils photo 46 mm, O-Haze, traité) Noir",Hama,"37,70 €",5,"30,16 €","32,80 €",4,
B0000AHIF7,"Hama Cadre portrait (taille de cadre 10x15 cm, taille de photos 10x15 cm, acrylique, format vertical, en plastique, 1 photo par cadre, élégant, simple, classique) Gris",Hama,"37,64 €",6,"35,15 €","8,15 €",5,
B0002VFL1U,"Hama Pochettes pour CD-ROM/DVD-ROM (Pochettes CD Plastique, Pochette de Protection colorées, Lot de 100, Multicolore) Bleu/Orange/Violet/Rose/Vert",Hama,"37,47 €",3,"37,47 €","24,30 €",3,
B078T7GHFK,"Hama Souris Optique Filaire MC-100-3 Boutons - Ergonomique, Précise, USB Plug & Play - Compatible Windows, Mac, Linux - Idéale pour Bureautique, Droitiers et Gauchers - Noire",Hama,"37,40 €",10,"37,40 €","25,10 €",10,
B000EOVQCS,"Hama Pochettes de Protection Doubles (en Plastique, pour CD/DVD/Blu-Ray, 2 CD par Pochette, Lot de 50) Blanc/Transparent",Hama,"37,36 €",4,"37,36 €","23,44 €",4,
B0BLZ1RZKG,"Hama Multiprise avec Interrupteur (Bloc 4 Prises Schuko 16A, Interrupteur Individuel éclairé, idéal économie d'énergie, Prises à 90°, œillet Suspension integré, 3680W, Cable 1.4m H05VV-F) Blanc",Hama,"36,64 €",2,"36,64 €","25,00 €",2,
B0BL1RYFT8,"Hama MW-300 V2 Souris sans Fil - Technologie 2.4Ghz, Capteur 1600 dpi, Clics Silencieux, Ambidextre - Rouge",Hama,"36,64 €",4,"36,64 €","31,48 €",4,
B094JJTMRP,"Hama Câble HDMI (Cable HDMI Haute Vitesse High Speed, Cordon HDMI, 1.5m, mâle-mâle) Noir",Hama,"36,63 €",8,"36,63 €","16,40 €",8,
B01BBTCVOQ,"Hama Album Photo Fine Art (Format 30 x 30 cm, 100 Pages Blanches, sans Spirale) Kiwi",Hama,"36,40 €",2,"36,40 €","16,36 €",2,
B000XA2YGK,"Xavax Hama Thermomètre analogique (à suspendre au réfrigérateur, congélateur, cave à vin, minibar, minimum -35 degrés, maximum 40 degrés) Blanc",xavax,"36,00 €",6,"36,00 €","15,48 €",6,
B09YVGVBH1,"Hama AMW-200 Souris sans Fil - Technologie 2.4Ghz, Capteur 1600 dpi, Technologie Smart-Link, Ambidextre - Noire",Hama,"36,00 €",6,"41,96 €","26,25 €",7,
B0000AI2XV,"Hama Cadre-galerie photo en plastique Madrid (taille de cadre de 25 cm x 55 cm, taille de la photo de 13 cm x 18 cm, 3 photos par cadre, à accrocher, élégant, simple, classique) Noir",Hama,"35,28 €",2,"35,28 €","14,96 €",2,
B005DJKH1A,"Hama Album Photo ""Singo"" (album minimax, 22 x 22,5 cm, 100 pages, pour 200 photos au format 10 x 15 cm) Aqua",Hama,"35,13 €",3,"22,98 €","10,80 €",2,
B078T62G9K,"Hama Souris Optique à 3 Boutons MC-200, Filaire, Blanche",Hama,"34,99 €",6,"28,10 €","14,85 €",4,
B0C5JPTNRF,"Hama Pages Intérieures Album Photo Scrapbooking (Recharge de Pages Photo Cartonnées, 250g/m2, 23.3 x 31 cm, Perforées, 25 feuilles) Noir",Hama,"34,92 €",6,"46,56 €","30,48 €",8,
B07RLYK1T9,"Hama Trépied de Table Solid pour Smartphones et appareils Photos, 19B",Hama,"34,84 €",2,"17,42 €","21,09 €",1,
B0CYN97SRK,"Hama 65W Chargeur Rapide Compatible iPhone, Samsung, MacBook - [Technologie GaN, PD + QC 3.0] [Recharge Optimisée] [3 Ports] Blanc",Hama,"34,46 €",1,"34,46 €","32,32 €",1,
B0BL1RN815,"Hama Power Bank 24000 mAh (Batterie Externe, 1 USB C + 2 USB A, Power Pack Fast Charge, Batterie pour Smartphone, Tablette, Haut-Parleur Bluetooth, Voyants LED, Chargeur Portable + Cable 0.25m) Gris",Hama,"33,90 €",1,"33,90 €","25,73 €",1,
B00X3JFB40,"Hama Support de Casque (Frontal, pour GoPro) Noir",Hama,"33,75 €",3,"45,00 €","25,99 €",4,
B01NCK7ZL3,"Hama Album Photo Fine Art (Format 30 x 30 cm, 100 Pages Noires, sans Spirale) Craie",Hama,"33,66 €",2,"89,82 €","50,26 €",5,
B0BL1TKNJN,"Hama Chargeur Rapide iPhone 20W (Chargeur USB-C Rapide, Certifié Apple MFI, Cable USB C vers Lightning 1m Inclus, Chargeur Mini Compact, Chargeur PD) Blanc",Hama,"33,60 €",1,"33,60 €","24,59 €",1,
B084HZJ2TV,"Hama Album Photo ""Fine Art"" (format 30 x 30 cm, 80 pages blanches, sans spirale) Vert Tilleul",Hama,"33,58 €",2,"33,58 €","18,54 €",2,
B08SFFNZ4D,"Rapoo Clavier et Souris sans Fil X 1800s"" (Pack Kit Clavier Souris sans Fil 2.4GHz, Dongle Nano USB, Autonomie 12mois, Souris Optique 1000DPI, Clavier AZERTY FR, Pavé Numérique, pour PC, Laptop) Noir",Rapoo,"33,32 €",2,"66,64 €","55,48 €",4,
B07X557RB6,"Thomson Antenne Intérieure ""ANT1639"" (Design UHD ""Sculpture"", pour réception numérique DVB-T/DVB-T2 et HDTV, actif, 2 m, Performance 55) Noir/Gris",Thomson,"33,24 €",1,"33,24 €","31,07 €",1,
B0000AIRY7,"Hama Cadre en plastique Madrid (taille de cadre de 30 cm x 40 cm, taille de la photo de 20 cm x 28 cm, 1 photo par cadre, à accrocher, élégant, simple, classique) Noir",Hama,"33,21 €",3,"33,21 €","12,51 €",3,
B07CKR6PKL,"Hama Album photo enfant ""Batzi"" (taille de l'album de 19 x 25 cm, format pour 200 photos 10 x 15 cm, avec 100 pages, papier stratifié, insertion latérale des photos, ours assis) Marron",Hama,"32,74 €",2,"75,90 €","31,95 €",5,
B002IK75DA,"Xavax Thermomètre Mécanique Spécial Four et Viandes (2 en 1, en Acier Inoxydable, Mesure Simultanée du Four et de La Température du Four, va au Lave-vaisselle) Argent, -30°C/+50°C",xavax,"32,50 €",2,"16,25 €","9,36 €",1,
B000IH1W20,"Hama Lecteur USB 2.0 ""35en1"" (USB, lecteur cartes multiples, Lecteur de carte SD, SDHC, SDXC, Type I / II CF, MMC) Bleu",Hama,"32,46 €",3,"32,46 €","19,50 €",3,
B00006IVVD,"Hama Rack (pour CD, pour 20 boîtiers CD) Noir",Hama,"32,13 €",2,"32,13 €","17,32 €",2,
B00AJJJNLE,"Hama Brosse en fibre carbone pour vos vinyles (nettoyage antistatique des vinyles, brosse pour disques vinyles), noir / argent",Hama,"31,72 €",2,"30,61 €","13,08 €",2,
B01K47G2W8,"Hama Album Jumbo ""Skies"" (album grand format, 30 x 30 cm, 60 pages, pour 240 photos au format 10 x 15 cm) Beige",Hama,"31,50 €",2,"31,50 €","11,80 €",2,
B0CP8584TW,"Black Rock Coque pour iPhone 15 ""360° Glass Double Face, Antichoc [Etui Housse 360 Degrés] [Coque iPhone Compatible Charge sans Fil] - Noir Carbon","Black Rock","31,24 €",1,"31,24 €","20,74 €",1,
B0BL1CFWRT,"Hama Ecouteurs Lightning Glow (Ecouteurs Intra-Auriculaires filaires, Micro et Contrôle du Volume, Ecouteurs pour iPhone, Certifiés MFi, Compatibles Apple iPhone iPad iPod) Blanc",Hama,"30,82 €",1,"30,82 €","22,01 €",1,
B00005QFA6,"Hama Bague d'adaptation (en métal, pour monter un Filtre de 58 mm sur un Objectif de 52 mm) Noir",Hama,"30,51 €",3,,,,
B06XB3M3NX,"Hama Album photo ""Liam"" (pour 200 photos au format 10 x 15 cm, album traditionnel enfant de 22,5 x 22 cm, 100 pages blanches, tigre, élégant) Marron/Orange/Noir/Blanc",Hama,"29,84 €",2,"29,84 €","13,02 €",2,
B00006JB4X,"Hama Antenne filaire de pare-brise électronique (pour la réception VHF, AM et FM) Noir",Hama,"29,77 €",1,"29,77 €","21,36 €",1,
B00W5C0BRS,"Hama Casque Stéréo HK-229 (Casque Audio Supra-Auriculaire pour Lecteur mp3, iPod, Bande passante de 20 Hz - 20 kHz, Jack 3,52mm mâle, câble uni-latéral de 1,5 m, Ajustable et léger) Noir/Gris",Hama,"29,73 €",2,"29,73 €","21,20 €",2,
B000EOVQIM,"Hama Pochette (pour 80 CD/DVD/Blu-Ray, classeur de Rangement, Gain de Place pour Le Bureau, Le Salon et la Maison, étuis de Transport) Noir",Hama,"29,14 €",2,"29,14 €","16,78 €",2,
B005GCMZD2,"Hama Album photo à pochettes ""Singo"" (couverture souple, pour 24 photos au format 18x13 cm, résistant, protège la photo) Couleur aléatoire parmi Orange, Vert, Bleu et rose",Hama,"28,98 €",14,"26,91 €","18,98 €",13,5
B005GCMZLY,"Hama Album photo ""Singo"" (couverture souple, 36 pages pour 36 photos au format 10x15 cm par album, résistant, pour archiver avec des anecdotes, protège la photo, mini album) Multicolore",Hama,"28,98 €",14,"4,14 €","2,68 €",2,
B00CBVEZNO,"Hama Support pour Ordinateur Portable Carbone (Support pour Ordinateur Portable jusqu'à 47 cm, Hauteur 8 cm, Pieds en Caoutchouc antidérapants, Aspect Carbone) Noir",Hama,"28,32 €",2,"14,16 €","8,05 €",1,
B009HSQ3ES,"Hama Album Photo ""Fine Art"" (format 36 x 32 cm, 50 pages noires, à spirale) Turquoise",Hama,"28,32 €",2,"28,32 €","16,90 €",2,
B0000AISCX,"Hama Cadre Photo Clip-Fixe (sans Bordure, 30 X 45 Cm, Anti-Reflex) Blanc",Hama,"28,32 €",2,"28,32 €","8,92 €",2,
B071WFLJ94,"Hama Album photo minimax ""Designline"" (album de 22,5 x 22 cm, insertion latéral de 200 photos format 10 x 15 cm, emplacement CD, 100 pages (2 photos/page), inscription possible) Triangle",Hama,"28,14 €",2,"28,14 €","13,00 €",2,
B0BFBZDPBW,"uRage Enceinte PC Gamer LED RVB/RGB Blast-R 200"" (Haut Parleur Ordinateur PC, 5W, Système Dynamique d’Enceinte Gaming Lumineux, Alimentation USB, Jack 3.52mm)",uRage,"27,49 €",1,,,,
B0000AHIIZ,"Hama Cadre photo Clip-Fixe (sans bordure, 15 x 21 cm, Reflex) Blanc",Hama,"27,39 €",11,"54,78 €","28,64 €",22,
B01KJER734,"Hama 24 Albums photos ""Skies"" (couverture souple, 24 pages pour 24 photos au format 10x15 cm par album, résistant, pour archiver avec des anecdotes, protège la photo, mini album) Multicolore",Hama,"27,28 €",22,"33,48 €","35,64 €",27,
B017J9FOZA,"Xavax Thermomètre numérique pour rôtis (de torréfaction, numérique, 2 in 1, avec horloge de cuisine, sonde de température amovible, pour viande, -10°C à +250°C, avec minuteur, à câble) Noir/Argent",xavax,"26,64 €",2,"26,64 €","21,32 €",2,
B08YRZT1RL,"Hama Hub USB, 4 Ports, USB 2.0, 480 Gbit/s, Métal, Noir",HAMA,"26,64 €",4,"26,64 €","16,40 €",4,
B00006JDGH,"Hama Filtre UV (anti-UV et protection, compensation 2X, traitement antireflet, pour objectifs d'appareils photo 58 mm, O-Haze, traité) Noir",Hama,"26,32 €",4,"32,90 €","22,55 €",5,
B005DJKJIQ,"Hama Album Photo ""Singo"" (album grand format, 30 x 30 cm, 100 pages, pour 400 photos au format 10 x 15 cm) Rose",Hama,"25,78 €",2,"12,81 €","6,41 €",1,
B00T7M9IU0,"Hama Album photo à pochettes ""New York City"" (pour 200 photos au format 9 cm x 13 cm, taille de l'album de 16,5 cm x 21 cm, 100 pages, en cuir, protège les photos et les documents) Noir",Hama,"25,44 €",2,"50,88 €","25,00 €",4,1
B0CNRWZGY8,"Hama Boîte de Rangement Câbles 'Maxi' (Cache câbles, pour Bureau, Maison, Rangement Chargeurs, Multiprises, Disques durs, 40.0x15.5x13.8cm) Blanc",Hama,"24,99 €",1,"24,99 €","18,44 €",1,
B0D5HHBJ6Y,"Hama Cuir Synthétique Tapis de Souris - Tapis de Bureau élégant, Dessous Anti-Dérapant, Bords Cousus - Noir",Hama,"24,96 €",3,"8,32 €","8,91 €",1,
B08YRZS5BR,"Hama Hub USB, 4 Ports, USB 2.0, 480 Mbit/s, Métal, Garantie 10 Ans, Blanc",HAMA,"24,96 €",3,"24,96 €","18,63 €",3,
B0BKYL622V,"Hama Power Pack Slim 5HD (Batterie Externe 5 000 mAh, Batterie Portable Charge Rapide, USB 3.0, Power Bank Compatible avec iPhone 14 13 12 11 X Samsung Xiaomi Huawei iPad etc) Blanc",Hama,"24,96 €",3,"24,96 €","29,46 €",3,
B07T4DM8JJ,"Hama Album photos enfant mémo ""Forest"" (livre photo 100 pages à pochettes, 200 photos 10x15 cm, album souvenirs 22,5 x 22 cm, Emplacement CD, Album Motif Renards) Marron/Beige/Vert/Orange/Blanc",Hama,"24,96 €",2,"24,96 €","11,00 €",2,
B071YB8MFM,"Xavax Boîte de transport pour un gâteau (rectangulaire munie d'une poignée transparente, va au lave-vaisselle, boîte à gâteaux, maître d'hôtel) Anthracite/Transparent",xavax,"24,92 €",1,"24,92 €","14,12 €",1,
B08YS22QH1,"Hama Plastifieuse A4 A5 A6 Cartes de Visite (Kit de Plastification 4en1 avec Feuille Film Laminage Thermique ep. Max 80-125 Microns, Plastifieuse à chaud, Règle de coupe, Chauffe rapide) Noir",Hama,"24,88 €",1,"25,37 €","20,58 €",1,
B01K47GSQS,"Hama Album photo ""Skies"" (album grand format, 22,5 x 22 cm, 100 pages, pour 200 photos au format 10 x 15 cm) Beige",Hama,"24,80 €",2,"24,80 €","11,26 €",2,
B000CZ2LQE,"Hama Gel de nettoyage (pour écran LCD / TFT avec chiffon en microfibre, 200 ml) Gris/Bleu",Hama,"23,84 €",2,"23,84 €","11,82 €",2,
B0BL1T6XLZ,"Hama Câble Multi USB Lightning (Cable de charge multi, 3en1, USB-A/micro-USB/USB-C, Lightning, 1 m, Certifié MFI, Câble USB universel iPhones iPads iPods Samsung Galaxy, Huawei, Xiaomi) Blanc",Hama,"23,74 €",1,"23,74 €","13,46 €",1,
B096YDY67K,"Hama Chiffon de Nettoyage en Microfibres Pocket (Chiffon avec Sac de Rangement et Mousqueton, idéal pour Appareil Photo Objectif Écran Caméra Smartphone Ipad Bijoux Filtre Lunette)",Hama,"23,73 €",3,"15,82 €","6,90 €",2,
B072Q7YFFT,"Hama Album photo ""Designline"" (Album photo souvenirs mariage anniversaire, 22,5x22cm, 100 pages avec pochettes pour 200 photos 10 x 15 cm, Zone Mémo et pochette CD) Bleu Turquoise Blanc, Stripes",Hama,"23,66 €",2,"35,49 €","19,68 €",3,
B01CV1RPVM,"Hama Horloge murale radio-pilotée DCF ""Bahnhof"" (horloge radio DCF, mise à l'heure automatique, diamètre de 30 cm) Argent/Blanc",Hama,"23,32 €",1,"23,32 €","17,71 €",1,
B00GRP4HDI,"Hama Boîtier pour câbles Maxi (Boite pour câbles, 40 x 15,5 x 13,8 cm, avec Pieds en Caoutchouc) Noir",Hama,"23,32 €",1,"23,32 €","12,66 €",1,
B002ADGINS,"Hama Étui Hard Drive Case (pour Disque Dur, 2,5"", néoprène, Étui de Protection pour Disque Dur Externe 6,4"", Accessoire, néoprène) Noir",Hama,"23,28 €",4,"17,46 €","12,99 €",3,
B0000AISQJ,"Hama Passe-partout Premium, blanc neige, 30 x 40 cm",Hama,"23,28 €",4,"23,28 €","11,84 €",4,
B00006JDF0,"Hama DVD de nettoyage (pour tête de lecture laser, pour enlever la saleté dans les lecteurs de DVD, DVD de nettoyage au laser) Blanc/Bleu/Rouge",Hama,"23,14 €",2,"34,71 €","18,18 €",3,
