B00CRB69MI,"Hama Support de télécommande Major (pour 4 télécommandes au maximum, également pour rangement de lunettes, smartphones, contrôleurs, clés USB, porte-télécommande) Noir",Hama,"18,57 €",1,"37,14 €","19,98 €",2,
B08SDTGG5L,"Hama Album Photo bébé ""Our Baby"" à personnaliser (Album photo de naissance, baptême, Cadeau d'anniversaire enfant, Idéal scrapbooking, 29 x32 cm, 60 Pages, Max. 300 Photos 10x15 cm) Multicolore",Hama,"18,50 €",1,"18,50 €","8,55 €",1,
B00006JCYL,"Hama 16772 boucle pour un filtre adapteur 67-72",Hama,"18,37 €",1,"18,37 €","11,97 €",1,
B08M3MBVPL,"Hama Album Photo Couverture Rigide Tissu 30x30cm (Livre Photo, 400 photos 10 x 15cm à coller, 100 pages blanches separées par Papier Cristal, Album Scrapbooking DIY à Personnaliser) Turquoise",Hama,"18,32 €",1,"18,32 €","14,24 €",1,
B09W5WBSGL,"Hama HS-P200 V2 Casque Micro - Casque Jack, Microphone Intégré, Léger, Télécommande Intégrée, Fonction Mute - Noir",Hama,"18,32 €",1,"18,32 €","13,79 €",1,
B09FBT44RR,"Hama MW-650 Souris sans Fil - Technologie 2.4Ghz & Bluetooth® 5.0, Capteur 2400 dpi, Clics Silencieux, Droitier/e - Noire",Hama,"18,32 €",1,"18,32 €","17,80 €",1,
B0D6CSFF15,"Hama Coque pour iPhone 15 ""Extreme Protect [Housse Anti-jaunissement] [Etui D3O®] [Coque Robuste] - Transparent",Hama,"18,32 €",1,"18,32 €","16,78 €",1,
B08M3L2Z9P,"Hama Album Photo Couverture Rigide Tissu 30x30cm (Livre Photo, 400 photos 10 x 15cm à coller, 100 pages blanches separées par Papier Cristal, Album Scrapbooking DIY à Personnaliser) Vert",Hama,"18,32 €",1,"18,32 €","14,03 €",1,
B0BL1TNWQ4,"Hama Câble Micro-USB Reflective (Câble de charge et transfert de données USB-A 2.0 mâle vers Micro-USB, Fiche Aluminium, Cordon Réflechissant Anti-torsion, Gaine en nylon tressé, 1.5 m) Bleu",Hama,"18,12 €",2,"18,12 €","18,18 €",2,
B000EOMQM2,"Hama Trépied photo/vidéo ""Star 75"" (Trépied d'entrée de gamme léger, tête à trois voies, 42-125 cm, 3D) Champagne",Hama,"18,12 €",1,"18,12 €","10,73 €",1,
B01K47GSQS,"Hama Album photo ""Skies"" (album grand format, 22,5 x 22 cm, 100 pages, pour 200 photos au format 10 x 15 cm) Beige",Hama,"17,48 €",2,"8,74 €","5,63 €",1,
B0000AISOU,"Porte-tableaux Clip-Fix 28x35cm antireflet",Hama,"17,46 €",3,"17,46 €","11,04 €",3,
B0000AISQJ,"Hama Passe-partout Premium, blanc neige, 30 x 40 cm",Hama,"17,46 €",3,"23,28 €","11,84 €",4,3
B0000AIRXI,"Hama Plaque de Fixation Rapide pour Appareil Photo (Plaque d'attache Rapide pour appareils Photo avec Filetage 1/4"" (6,4 mm), Adaptateur tête de trépied Star 55 à 64"",""Gamma 153"", ""Action 165"") Noir",Hama,"17,39 €",3,"23,16 €","18,89 €",4,
B005DJKFUS,"Hama Album Photo Singo (Album Grand Format, 30 x 30 cm, 100 Pages, pour 400 Photos au Format 10 x 15 cm) Aqua",Hama,"16,80 €",1,"16,80 €","5,86 €",1,
B0000AIS8M,"Hama Cadre photo en plastique ""Décor Sevilla"" (taille du Cadre de 21 x 29,7 cm (DIN 4) avec bordure de 9 mm x 17 mm, pour une photo de 15 x 20 cm) Or Mat",Hama,"16,66 €",2,"16,66 €","8,52 €",2,1
B08SFFNZ4D,"Rapoo Clavier et Souris sans Fil X 1800s"" (Pack Kit Clavier Souris sans Fil 2.4GHz, Dongle Nano USB, Autonomie 12mois, Souris Optique 1000DPI, Clavier AZERTY FR, Pavé Numérique, pour PC, Laptop) Noir",Rapoo,"16,66 €",1,"16,66 €","13,87 €",1,1
B0BL1RL5YW,"Hama Chargeur Rapide 33W 4 Ports USB (Chargeur Qualcomm Quick Charge 3.0, Chargeur USB, Adaptateur Secteur Charge Rapide, 1 USB-A QC, 3 USB-A) Noir",Hama,"16,66 €",1,"16,66 €","13,45 €",1,
B0054RDOCA,"Thomson Télécommande Universelle 2 en 1 ""ROC 2411"" (Télécommande avec Fonction d'apprentissage, Convient pour Deux appareils, pour Plus de 1 000 Marques) Noir",Thomson,"16,66 €",1,"16,66 €","11,40 €",1,
B096XK8FJ3,"Hama Ecouteurs Bluetooth sans Fil Freedom Light (Ecouteurs TWS, Micro, Ecouteurs Intra Auriculaire, Station de Charge, Grande Autonomie, USB-C, Charge Rapide, Controle Vocale+Tactile) Blanc",Hama,"16,66 €",1,"16,66 €","15,45 €",1,
B00F2BNE82,"Hama Album Photo ""Fine Art"" (format 22,5 x 22 cm, 80 pages blanches, sans spirale) Gris",Hama,"16,64 €",2,"16,64 €","10,69 €",2,
B0BKZ1C59D,"Hama Support Téléphone Voiture Compact (pour Smartphones Largeur de 5.5 à 8.5 cm, Fixation Clip Grille aération, pivotable 360°) Noir",Hama,"16,64 €",2,,,,
B08YRZS5BR,"Hama Hub USB, 4 Ports, USB 2.0, 480 Mbit/s, Métal, Garantie 10 Ans, Blanc",HAMA,"16,64 €",2,"16,64 €","12,42 €",2,
B00006J9XY,"Hama 0003039 - Panneau de distribution, 3 prises, Noir, 1,4 m",Hama,"16,60 €",5,"16,60 €","16,10 €",5,
B009HSQ4JM,"Hama Album Photo ""Fine Art"" (format 36 x 32 cm, 50 pages noires, à spirale) Azur",Hama,"16,20 €",1,"16,20 €","8,45 €",1,
B009HSQ3YS,"Hama Album Photo ""Fine Art"" (format 36 x 32 cm, 50 pages noires, à spirale) Taupe",Hama,"16,20 €",1,"16,20 €","8,45 €",1,
B000VRANI6,"Hama Fine Art Bordeaux 50 Pages Noires/à spirales090144, Bordeaux, 36 x 32 cm",Hama,"16,20 €",1,"16,20 €","8,53 €",1,
B009HSQ45G,"Hama Album Photo ""Fine Art"" (format 36 x 32 cm, 50 pages noires, à spirale) Kiwi",Hama,"16,20 €",1,"16,20 €","8,45 €",1,
B000OS1ETO,"Câble d'antenne, Coax mâle - Coax Femelle, 75dB, Blanc, 3,00m",Hama,"16,19 €",2,"16,19 €","3,22 €",2,
B0000AIRXA,"Hama Cadre photo en plastique Décor Sevilla (taille du Cadre de 30 x 40 cm avec bordure de 9 mm x 17 mm, pour une photo de 20 x 28 cm) Argent Mat",Hama,"16,10 €",1,"31,92 €","17,43 €",3,
B0CYQC52BQ,"Hama Album Photo ""Singo II"" 30x30cm (400 photos 10x15cm, 100 pages blanches avec intercalaires Papier Cristal, Album Scrapbooking DIY Livre photo à Personnaliser et à Coller) Terracotta",Hama,"16,07 €",1,,,,
B09RC7QDPM,"Hama Album photo ""Skies II"" (Album Elégant et Intemporel, Idéal mariage, anniversaire, baptême, 22,5 x 22 cm, 100 pages avec pochettes pour 200 photos 10x15 cm, Zone Mémo et pochette carte SD) Gris",Hama,"14,99 €",1,"14,99 €","7,10 €",1,
B0CYNBTBP5,"Hama 20W Chargeur USB C Rapide Compatible iPhone, Samsung - [PD + QC 3.0] [Recharge Optimisée] [1 Port USB C] Noir",Hama,"14,99 €",1,"14,99 €","11,61 €",1,
B001UBGSZE,"Hama Album Photo Fine Art (Format 36 x 32 cm, 50 Pages Noires, à Spirale) Lilas",Hama,"14,99 €",1,"14,99 €","8,53 €",1,
B001730SIS,"Etui Fashion pour Sticks USB, Noir",Hama,"14,97 €",3,"9,98 €","9,78 €",2,
B01K47G7VO,"Mini album photo à pochettes ""La Fleur"" pr 40 photos 10 x 15 cm, blc",Hama,"14,96 €",4,"14,96 €","9,96 €",4,
B08YS1FPJV,"Hama Adaptateur USB-C vers HDMI 4K Garantie 10 Ans (Adaptateur Thunderbolt 3/4 USB-C vers HDMI, Compatible iPhone15, MacBook, iPad, iMac) Noir",Hama,"14,63 €",1,"14,63 €","15,23 €",1,
B00006IVVD,"Hama Rack (pour CD, pour 20 boîtiers CD) Noir",Hama,"14,58 €",1,"60,39 €","34,79 €",4,
B0000AHIEM,"Hama Passe-partout, blanc arctique, 24 x 30 cm",Hama,"14,58 €",2,"14,58 €","4,02 €",2,
B07CGTVBVH,"Hama Cadre Photo pour Portrait ´Scala´, Taupe, 23 x 23 cm",Hama,"14,33 €",1,"14,33 €","6,17 €",1,
B0C7VHX9FG,"Hama Album photo Jumbo ""La Souris"" (livre photo album grand format 30x30cm, 80 pages blanches à personnaliser et à coller, album enfant pour 320 photos au format 10 x 15 cm, Motif Souris) Jaune",Hama,"14,16 €",1,,,,
B08YRYTLNX,"Hama Câble d'Antenne TV coudé 90° (Cable TV Coaxial Mâle - Coaxial Femelle, 95 db, 5 m, plaqué or, Connexion d'un Téléviseur vers une Fiche TV Murale ou vers un Décodeur) Blanc",Hama,"14,16 €",1,"14,16 €","10,40 €",1,
B07RJNVVN6,"Hama Horloge Murale 25cm (Horloge Murale Ronde et Moderne, Pendule sans tic tac à Quartz, Fonction Hygromètre & Thermomètre, sur Piles, idéal Salon, Cuisine, Bureau, Chambre à Coucher) Blanc/Noir",Hama,"14,16 €",1,"14,16 €","10,11 €",1,
B08YS2W9DG,"Hama Adaptateur Audio, fiche USB-C - Jack Femelle 3,5 mm, stéréo, Métal, Garantie 10 Ans, Noir",HAMA,"14,16 €",1,"14,16 €","8,52 €",1,
B079P3WHJ5,"Hama Kit de Nettoyage pour disques Vinyles (Nettoyage et Entretien de Disque Vinyle, Solution Spray pour Vinyl et Brosse de Nettoyage) Noir",Hama,"14,16 €",1,"14,16 €","10,18 €",1,
B009HSQ3OS,"Hama Fine Art 50 pages Noires/à spirales 10608, Rose, 36 x 32 cm",Hama,"14,16 €",1,"14,16 €","8,45 €",1,
B0CP85387S,"Xavax 00220738 Raccord en Y, Blanc",Xavax,"14,14 €",2,"14,14 €","9,04 €",2,
B000CZ2LQE,"Hama Gel de nettoyage (pour écran LCD / TFT avec chiffon en microfibre, 200 ml) Gris/Bleu",Hama,"14,14 €",2,"14,14 €","11,82 €",2,
B000Z1UORI,"Hama Album Photo Fine Art (Format 24 x 17 cm, 50 Pages Noires, à Spirale) Noir",Hama,"14,14 €",2,"14,14 €","7,86 €",2,
B00UV84E4O,"Hama Album photo vierge ""Anzio"" (album photo traditionnel format 22,8 cm x 22,3 cm, pour 200 photos 10 cm x 15 cm, 100 pages, instax, minimax, idéal pour un mariage) Beige/Noir",Hama,"14,11 €",1,"14,11 €","6,39 €",1,4
B084HZNPS3,"Hama Album Photo ""Fine Art"" (format 24 x 17 cm, 36 pages blanches, sans spirale) Vert Tilleul",Hama,"14,08 €",1,"14,08 €","5,73 €",1,
B0000AHIF7,"Hama Cadre portrait (taille de cadre 10x15 cm, taille de photos 10x15 cm, acrylique, format vertical, en plastique, 1 photo par cadre, élégant, simple, classique) Gris",Hama,"13,99 €",3,"13,99 €","4,89 €",3,
B005DJXZ7I,"Hama Album Photo Singo (Album minimax, 13 x 16,5 cm, 100 Pages, pour 100 Photos au Format 10 x 15 cm) Orange",Hama,"13,71 €",3,"13,71 €","8,91 €",3,
B072Q7YFFT,"Hama Album photo ""Designline"" (Album photo souvenirs mariage anniversaire, 22,5x22cm, 100 pages avec pochettes pour 200 photos 10 x 15 cm, Zone Mémo et pochette CD) Bleu Turquoise Blanc, Stripes",Hama,"13,38 €",1,"13,38 €","6,56 €",1,
B0BWFCSF1R,"Hama Album photo mémo ""La souris"" (Album photo, 22x22.5 cm, 200 pochettes pour photos 10x15 cm, Zone Mémo, pochette carte SD, idéal photos souvenirs enfants, anniversaire, bébé, Motif Souris) Orange",Hama,"13,32 €",1,"13,32 €","10,00 €",1,
B0CP84KK4C,"THOMSON Ecouteurs Filaire USB-C pour iPhone 15 / Samsung (écouteurs Intra-Auriculaires filaires avec Micro, Cable 1.2m, Multi Contrôle, Compatible Siri et Google Assistant) Violet",Thomson,"13,32 €",1,"13,32 €","11,00 €",1,
B0BXPLLW89,"Hama Classeur à négatifs (4 anneaux, niveau de remplissage 39 mm, feuilles rectangulaires, album à négatifs d'une pellicule photo, housse de protection) Noir",Hama,"13,31 €",1,"13,31 €","6,15 €",1,
B000N94K22,"Hama Pochette (pour 64 CD/DVD/Blu-ray, classeur de rangement, gain de place pour le bureau, le salon et la maison, étuis de transport) Noir",Hama,"13,30 €",1,"26,60 €","12,62 €",2,1
B005DJKJIQ,"Hama Album Photo ""Singo"" (album grand format, 30 x 30 cm, 100 pages, pour 400 photos au format 10 x 15 cm) Rose",Hama,"13,17 €",1,"13,17 €","6,41 €",1,
B002ZX98MG,"Hama Boîtier Slim (pour DVD, Convient également aux CD et disques Blu-Ray, Ultra Mince, avec Une Feuille pour la Couverture, Lot de 10) Transparent",Hama,"12,99 €",1,"12,99 €","4,92 €",1,
B0002W5WEK,"Hama Boîtier ""Slim"" (pour DVD, convient également aux CD et disques Blu-ray, ultra mince, avec une feuille pour la couverture, lot de 10) Noir/Transparent",Hama,"12,14 €",1,"12,14 €","4,42 €",1,
B01LRD3YUG,"Black Rock Coque 'Air' (pour Apple iPhone 6S/7/8 Plus, protection parfaite, design mince, en polycarbonate, polyurethane termoplastique (PUT)) Noir","Black Rock","11,69 €",1,,,,
B0DQ1PK5GV,"Hama Coque pour Samsung Galaxy S25+ Fantastic Feel [Housse de Protection avec Rangement Carte] [Etui à Rabat] [Housse Anti-poussière] [Etui Soft Touch] [Compatible Charge sans Fil] - Bleu",Hama,"11,66 €",1,"11,66 €","11,41 €",1,
B0DQ1QW9B2,"Hama Coque pour Samsung Galaxy S25 Fantastic Feel [Housse de Protection avec Rangement Carte] [Etui à Rabat] [Housse Anti-poussière] [Etui Soft Touch] [Compatible Charge sans Fil] - Bleu",Hama,"11,66 €",1,"11,66 €","11,41 €",1,
B0CP85VQFG,"Xavax 00220734 Raccord de Siphon, Blanc",Xavax,"11,64 €",2,"17,46 €","9,00 €",3,
B0000AISQG,"Hama Passe-partout Premium, ivoire, 30 x 40 cm",Hama,"11,64 €",2,"11,64 €","6,10 €",2,
B003LSETI2,"Hama Sangle pour Bagages (Sangle simple pour la Fermeture Sécurisée de la Valise lors d'un Voyage, 5 x 200 cm) Noir",Hama,"11,64 €",2,"5,82 €","4,47 €",1,
B00006J9XX,"Hama Bloc 3 Prises Avec Terre 16A (Rallonge multiprises 1.4m, Prises Multiple Contact de Terre, Bloc Multiprise electrique Schuko, 3680W, ) Blanc",Hama,"11,64 €",2,"11,64 €","6,22 €",2,
B009TLAQ3M,"Hama Album Photo ""Fine Art"" (format 28 x 24 cm, 50 pages noires, à spirale) Azur",Hama,"11,62 €",1,"11,62 €","5,63 €",1,
B000L10VLQ,"Hama Vide-poche (format DIN) Noir",Hama,"11,58 €",1,"11,58 €","10,66 €",1,
B0002W5WB8,"Hama Pochettes de protection (pour CD/DVD/Blu-Ray, design étroit, pochette en plastique, lot de 50) Transparent",Hama,"11,27 €",1,,,,
B017JY56TY,"Hama Album Photo ""Fine Art"" (format 36 x 32 cm, 50 pages blanches, à spirale) Kiwi",Hama,"11,24 €",1,"11,24 €","7,26 €",1,
B00006JAPE,"Hama Multiprise 6 Prises 16A (Rallonge multiprises 1.4m, Bloc 6 Prises Type F Schuko, 3680W Max, Idéal Bureau PC luminaires, Atelier, Meuble TV, Garage) Blanc",Hama,"11,21 €",1,"11,21 €","5,22 €",1,
B00006IVJJ,"Hama Nettoyeur de contacts en fibre de verre ""Glass Fibre"" (gomme à effacer, en fibre de verre pour contacts électriques, fibre de verre) Noir/Blanc",Hama,"11,09 €",1,"11,17 €","10,64 €",1,
B001JTTAPW,"Hama Boîtier double (pour DVD, convient également aux CD et disques Blu-ray, avec film pour l'insertion de la jaquette, lot de 5) Transparent",Hama,"10,82 €",2,"10,82 €","7,04 €",2,
B07BB2FQR1,"Hama Album photo traditionnel ""Rustico"" (grand format, album de 30 x 30 cm, 100 pages blanches, 400 photos au format 10x15, idéal pour le scrapbooking, photos à coller) Love Key",Hama,"10,82 €",1,"21,64 €","14,24 €",2,
B01EG0O104,"Hama Sonic Mobil 185 Enceintes pour Ordinateur - Système Stéréo 2.0, Haut-Parleurs Alimentés en USB, Connexion Jack 3.5mm - Noir/Argent",Hama,"10,82 €",1,"10,82 €","9,28 €",1,
B07F6Q3314,"THOMSON Ecouteurs Filaire Jack EAR3008BK Piccolino (écouteurs Intra-Auriculaires filaires, Ultra-léger, Prise Jack 3.5 mm Plaqué Or, Micro et Fonction Télécommande) Noir",Thomson,"10,82 €",1,"10,82 €","7,19 €",1,
B07F3RKPTB,"Hama Support mural pour Google Home mini (pour enceinte sans/avec fil, support d'enceinte, pour un alignement et une présentation optimaux de l'enceinte, montage mural) Blanc",Hama,"10,82 €",1,"21,64 €","12,35 €",2,
B06XB3M3NX,"Hama Album photo ""Liam"" (pour 200 photos au format 10 x 15 cm, album traditionnel enfant de 22,5 x 22 cm, 100 pages blanches, tigre, élégant) Marron/Orange/Noir/Blanc",Hama,"10,82 €",1,"21,64 €","13,02 €",2,
B01IEJXG0E,"Hama Clé USB ""C-Laeta"" (USB3.1/USB3.0 Type-C, 32GB, double clé USB, pour ordinateur portable, téléphone mobile, tablette, OTG, 40 Mo/s, boîtier en métal, USB Type-C, clé de téléphone portable) Argent",Hama,"10,82 €",1,"10,82 €","8,00 €",1,
B07B2DS3CW,"Thomson Télécommande Universelle 2 en 1 Zapper ROC Z107 (Télécommande, Zapper, STB, TV, IR sans Fil, Boutons) Noir",Thomson,"10,82 €",1,"10,82 €","8,99 €",1,
B000L9RQJ8,"Hama Adaptateur Cassette Automobile (pour Smartphones, lecteurs MP3/CD, Jack 3,5 mm, Car Cassette Adapter) Noir",Hama,"10,82 €",2,"10,82 €","7,00 €",2,
B00T7M9IU0,"Hama Album photo à pochettes ""New York City"" (pour 200 photos au format 9 cm x 13 cm, taille de l'album de 16,5 cm x 21 cm, 100 pages, en cuir, protège les photos et les documents) Noir",Hama,"10,82 €",1,"21,64 €","12,50 €",2,
B005DJKGFC,"Hama Album Photo Singo (Album minimax, 22 x 22,5 cm, 100 Pages, pour 200 Photos au Format 10 x 15 cm) Vert",Hama,"10,77 €",1,"10,77 €","5,40 €",1,
B079PCTWYM,"Hama Brosse (en Fibre de Carbone, pour Le Nettoyage des disques, vinyles) Noir/Argent",Hama,"10,24 €",1,"10,24 €","5,28 €",1,
B0BL228SD3,"Hama Chargeur Secteur USB (Bloc Secteur USB-A, 6W, 5V/ 1.2A, Adaptateur Secteur Universel, Chargeur Replacement pour c) Noir",Hama,"9,99 €",1,,,,
B01CQ54W6E,"Hama Casque Essential HS 200"" avec Microphone (Ultra-léger, Oreillettes rembourrées, Casque stéréo, chaîne stéréo, réglage du Volume sur Le câble, Longueur de câble de 2 m, Prise Jack 3,5 mm) Noir",Hama,"9,99 €",1,"9,99 €","5,72 €",1,
B08YRXWRWT,"Hama Adaptateur USB C vers USB 3.2 Garantie 10 Ans (Adaptateur USB-C Male vers USB-OTG Femelle) Noir",Hama,"9,98 €",2,"4,99 €","3,09 €",1,
B004IYLMHE,"Hama Clé USB 2.0 ""Rotate, 8 GB (10 MB/s, Flashpen Rotate) Noir/Argenté",Hama,"9,98 €",2,"4,99 €","3,00 €",1,
B00005QFAZ,"Hama Étuis à négatifs (Lot de 25 Pochettes Rangement Diapos/Negatifs Photo, pour Classeurs à Anneaux, 4 Bandes/Feuille, en Papier Cristal)",Hama,"9,83 €",1,"9,83 €","8,22 €",1,
B005DJKJ2C,"Hama Album, Vert, 30x30 cm",Hama,"9,16 €",1,"9,16 €","6,41 €",1,1
B0BL1VJBJ4,"Hama MW-300 V2 Souris sans Fil - Technologie 2.4Ghz, Capteur 1600 dpi, Clics Silencieux, Ambidextre - Verte",Hama,"9,16 €",1,,,,
B07NH31NL6,"Couvercle Pare-poussière pour Clavier, Transparent",Hama,"9,14 €",2,"22,85 €","17,50 €",5,
B07F82LSLN,"Hama Support Travel Pliable pour tablettes et Smartphones (Idéal pour Les déplacements, Solide et Pratique) Couleur aléatoire Parmi Blanc/Bleu/Gris/Jaune/Noir/Rouge/Vert",Hama,"9,04 €",2,"9,04 €","3,34 €",2,
B00006JCWM,"Hama Casier de rangement ""Spirit II"" (système de classement sur socle pour CD, pour 22 boîtiers CD, porte-CD pour le rangement, organisateur antidérapant) Noir",Hama,"8,74 €",1,"8,74 €","6,08 €",1,
B0002W6AIW,"Hama Tube pour câbles (faisceau de câbles, forme en spirale, longueur 2,5 mètres, diamètre 30 mm) Noir",Hama,"8,38 €",1,"8,38 €","0,00 €",1,
B00006JDF0,"Hama DVD de nettoyage (pour tête de lecture laser, pour enlever la saleté dans les lecteurs de DVD, DVD de nettoyage au laser) Blanc/Bleu/Rouge",Hama,"8,32 €",1,"8,32 €","6,06 €",1,
B00006JAOZ,"Hama Fusibles en Verre (fusible de voiture, 40A, 10 x 38mm, plaqué or, 2 pièces) Or/Transparent",Hama,"8,32 €",2,"8,32 €","3,56 €",2,
B0000AIRSP,"Hama Boîtier ""Slim"" quadruple (pour CD et disques Blu-ray, ultra mince, avec une feuille pour la couverture, pour 4 CD, lot de 10) Transparent",Hama,"8,32 €",1,"8,32 €","6,98 €",1,
B009TLAPLK,"Hama Album Photo ""Fine Art"" (format 28 x 24 cm, 50 pages noires, à spirale) Kiwi",Hama,"8,32 €",1,"8,32 €","5,63 €",1,
B096YDY67K,"Hama Chiffon de Nettoyage en Microfibres Pocket (Chiffon avec Sac de Rangement et Mousqueton, idéal pour Appareil Photo Objectif Écran Caméra Smartphone Ipad Bijoux Filtre Lunette)",Hama,"7,91 €",1,"7,91 €","3,45 €",1,
B00006JCUB,"Hama Multiprise 3 Prises 16A avec Interrupteur (Rallonge multiprises 1.4m, Bloc 3 Prises Type F Schuko, Idéal Bureau PC luminaires, Atelier, Meuble TV, Garage) Blanc",Hama,"7,87 €",1,"7,87 €","3,40 €",1,
B000JIA828,"Hama Pochettes de protection (en papier pour CD/DVD/Blu-Ray, lot de 100) Bleu/Vert/Orange/Rouge/Jaune",Hama,"7,49 €",1,"7,49 €","5,43 €",1,
B006WYIWVM,"Hama 2 Clés de desserrage pour filtres Photo (pour filtres de 62 à 86mm) Noir",Hama,"7,49 €",1,"7,49 €","5,91 €",1,
B00G3BMZDA,"Xavax Minuteur de cuisine ""Countdown"" (avec minuterie et fonction chronomètre, fixation via un aimant, une pince, un support ou un support, à piles, numérique) Noir/Blanc",xavax,"7,49 €",1,"7,49 €","5,69 €",1,
B08YRYNK16,"Hama Câble USB-C 'Flexi-Slim' (USB 2.0, 480 Mbit/s, 0.75 m, pour PC, ordinateur, Macbook, Tablette, Smartphone, Power Pack, Enceinte, Manette de jeux, garantie 10ans) Noir",Hama,"7,49 €",1,,,,
B01K47G660,"Mini album photo à pochettes pour 40 photos au format 10 x 15 cm, noir",Hama,"7,48 €",2,"7,48 €","5,32 €",2,
B0000AHIFI,"Hama Passe-partout Premium, blanc neige, 20 x 30 cm",Hama,"7,48 €",2,"7,48 €","3,48 €",2,
B00006JCZK,"Hama Filtre UV (Anti-UV Et Protection, Compensation 2X, Traitement Antireflet, pour Objectifs D'appareils Photo 62 Mm, O-Haze, Traité) Noir",Hama,"7,42 €",1,"7,42 €","7,63 €",1,
B09FBSCB6Q,"Hama Album photo à spirale ""Craft"" (Album souvenirs mariage, anniversaire, baptême, 24x17 cm, 40 pages en papier Kraft chic à personnaliser et à coller, jusqu'à 40 photos de 10 x 15 cm) Marron",Hama,"7,36 €",1,"7,36 €","4,65 €",1,
B000VRCKS2,"Hama Album Photo Fine Art (Format 24 x 17 cm, 50 Pages Noires, à Spirale) Bleu",Hama,"7,07 €",1,,,,
B0002VFL1K,"Hama Pochettes pour CD-ROM/DVD-ROM (Pochettes CD plastique, pochette de protection colorées, lot de 50, Multicolore) Bleu/Orange/Violet/Rose/Vert",Hama,"7,07 €",1,"7,07 €","4,84 €",1,
B07ZR24KQZ,"Hama Clé USB 4Bizz, USB 3.0, 32 GB, 70 MB/s, Argent/Noire",Hama,"7,01 €",1,"7,01 €","21,28 €",1,
B00005V37U,"Hama Tapis de souris porte-documents (personnalisable avec photos, images ou cartes postales, 23 x 19,5 cm) Transparent/Noir",Hama,"6,66 €",1,,,,
B0000AISEE,"Hama Cadre photo ""Clip-Fixe"" (sans bordure, 30 x 30 cm, Anti-Reflex) Blanc",Hama,"6,24 €",1,"6,24 €","4,38 €",1,
B001UBEUZE,"Coque de Protection Crystal Clear pr Samsung Galaxy S20, transpar.",Hama,"5,82 €",2,"2,91 €","2,07 €",1,
B08SF1QJHJ,"Hama Câble d'alimentation 1.5m Fiche Euro Type C vers C7 Figure 8 - Garantie 10ans (Cordon Alimentation Fiche Bipolaire Figure 8, pour PC, Ecran, Imprimante, DVD) Noir",Hama,"5,82 €",1,"5,82 €","3,70 €",1,
B07BGM19Y7,"Hama Lingette Nettoyante Bureau (Boite de 100 Lingettes Humides, Chiffons de nettoyage pour les surfaces de bureau, clavier, étagère)",Hama,"5,41 €",1,"5,41 €","3,80 €",1,
B0000AIS8P,"Hama Cadre photo en plastique ""Décor Sevilla"" (taille du Cadre de 21 x 29,7 cm (DIN 4) avec bordure de 9 mm x 17 mm, pour une photo de 15 x 20 cm) Argent Mat",Hama,"5,38 €",1,"5,38 €","4,13 €",1,
B0B59QYN7N,"Hama Adaptateur Secteur 2 Compartiments 2 Prises Euro, Pack de 2 Adaptateurs, Blanc",HAMA,"4,99 €",1,"4,99 €","3,19 €",1,
B08YS3LP36,"Hama Adaptateur de prise d'antenne Coaxiale (Raccord Connecteurs Coaxial, Adaptateur SAT, Fiche Coaxiale F femelle vers Fiche coaxiale mâle)",Hama,"4,14 €",2,"4,14 €","4,80 €",2,
B0009N8N9I,"Hama Lot de 4 marqueurs pour CD/DVD/Blu-ray, Noir, Rouge, Bleu et Vert",Hama,"2,91 €",1,,,,
B0BFBZDPBW,"uRage Enceinte PC Gamer LED RVB/RGB Blast-R 200"" (Haut Parleur Ordinateur PC, 5W, Système Dynamique d’Enceinte Gaming Lumineux, Alimentation USB, Jack 3.52mm)",uRage,"0,00 €",0,"27,49 €","19,51 €",1,
B000JIA7YW,"Hama Boîtier Standard (pour 6 DVD, Convient également aux CD et disques Blu-Ray, avec Film pour l'insertion de la Jaquette, Lot de 3) Noir",Hama,"0,00 €",0,"11,24 €","4,80 €",1,
B001JTTAQ6,"Hama Boîtier ""Slim"" double (pour DVD, convient également aux CD et disques Blu-ray, ultra mince, avec une feuille pour la couverture, lot de 5) Transparent",Hama,"0,00 €",0,"8,32 €","6,34 €",2,
B0000AI2XV,"Hama Cadre-galerie photo en plastique Madrid (taille de cadre de 25 cm x 55 cm, taille de la photo de 13 cm x 18 cm, 3 photos par cadre, à accrocher, élégant, simple, classique) Noir",Hama,"0,00 €",0,"32,46 €","22,23 €",3,
B0019DPZPC,"Hama 29308 Présentoir de Distributeur de pastilles adhésives, Transparent (1 distributeurs, 1000 coins photos, 12 x 13 mm)",Hama,"0,00 €",0,,,,
B00RWY5ZD4,"Hama Répartiteur triple pour prise allume-cigare (12 V, avec USB, avec écran LED) Noir",Hama,"0,00 €",0,,,,
B08GSCS399,"Hama Destructeur de Documents Basic S8CD (Broyeur Documents 8 Feuilles 80g, Destructeur CD/CB, Niveaux de sécurité P2 T1, Découpe en Bandes 6mm, 70 DB, M/A Auto, Corbeil 11L) Noir",Hama,"0,00 €",0,,,,
B0BL1H5S5W,"Hama Ecouteurs sans Fil Tour du Cou Freedom Run (Casque Bluetooth Intra-Auriculaires Tour d'oreille avec Micro, 6h d'autonomie, Idéal Sport, Course, Vélo, Gym, Contrôle Vocal) Noir",Hama,"0,00 €",0,,,,
B0032D8WCA,"Hama Album Photo Catania (Taille de l'album 29 x 32 cm pour 300 Photos au Format 10 x 15 cm, 60 Pages, Papier stratifié, thématique Mariage/Vacances, Personnalisable) Gris",Hama,"0,00 €",0,"16,66 €","8,21 €",1,1
B00006JAOU,"Hama Fusibles en verre (fusible voiture, 60A, , AGU, 10 x 38mm, plaqué or, 2 pièces) Or/Transparent",Hama,"0,00 €",0,"6,53 €","1,76 €",1,
B0000AIRVB,"Hama Cadre photo ""Clip-Fixe"" (sans bordure, 40 x 50 cm, Anti-Reflex) Blanc",Hama,"0,00 €",0,,,,
B0C7VK9TBD,"Hama Album photo Jumbo ""La Souris"" (livre photo album grand format 30x30cm, 80 pages blanches à personnaliser et à coller, album enfant pour 320 photos au format 10 x 15 cm, Motif Souris) Vert",Hama,"0,00 €",0,,,,
B000EOOCJW,"Hama Fiche F (pour câble coaxial de 7 mm, vissable, pour connexion au LNB, commutateur multiple, récepteur, 4 pièces) Argent",Hama,"0,00 €",0,,,,1
B0050GRM28,"Hama Pochette Ready for Business (pour Stocker 24 CD/DVD/Blu-Ray, 6 emplacements pour Carte mémoire) Noir",Hama,"0,00 €",0,"7,49 €","4,58 €",1,
B003TKD3YS,"Hama Chemin de câbles (bande en aluminium pour montage mural TV ou au sol, cache-câble demi-rond, 110 x 3,3 x 1,8 cm, entrée de câble jusqu'à 5 câbles, matériel de montage compris) Gris",Hama,"0,00 €",0,,,,
B001K9LNA6,"Hama Support Télécommande TV Commander (porte-télécommande TV Chaine Hifi DVD Blue-Ray, 3 grands compartiments, Boite de Rangement organiseur lunettes, smartphones, contrôleurs) Noir",Hama,"0,00 €",0,,,,
