B00006JDJU,"Hama - 46020H - Micro monophonique, finition noire métal, jack de 3,5mm et adaptateur 3,5/6,35 mm, interrupteur marche/arrêt sur le micro, 600 Ohms, dynamique et unidirectionnel - Cordon 3.00m",Hama,"29,18 €","0,07 %","-80,02 %",2,"0,00 %","-80,00 %","14,59 €","-49,97 %","-87,50 %","8,84 €","-46,55 %","-85,51 %",1,"-50,00 %","-87,50 %",,,"-100,00 %"
B0BK8YGW25,"Hama Fold Clear Coque pour Apple iPad 10,9"" (22) - Housse Fonction Chevalet, Protection Fermeture Magnétique, Dos Transparent - Bleu",Hama,"29,17 €",,,1,,,"29,17 €",,,"17,82 €",,,1,,,,,
B01M5B8SIP,"Hama Support mural pour Sonos PLAY:3 (entièrement mobile, pour enceintesans/avec fil, support d'enceinte, pour un alignement et une présentation optimaux de l'enceinte, montage mural) Noir",Hama,"29,16 €",,,1,,,"29,16 €",,,"17,50 €",,,1,,,,,
B017JY4RYO,"Hama Album Photo ""Fine Art"" (format 36 x 32 cm, 50 pages blanches, à spirale) Gris",Hama,"29,13 €","4,45 %","-51,19 %",2,"0,00 %","-50,00 %","29,13 €","4,45 %","-51,19 %","14,51 €","-0,07 %","-44,53 %",2,"0,00 %","-50,00 %",,,
B07GX2V6JG,"Lecteur Multi-Cartes USB-2.0, SD/microSD/CF, Bleu",Hama,"29,10 €","-28,57 %","-64,29 %",5,"-28,57 %","-64,29 %","29,10 €","-28,57 %","-50,00 %","18,25 €","-28,57 %","-66,27 %",5,"-28,57 %","-50,00 %",,,
B00FON28DK,"Hama Clé USB 2.0 ""Hook-Style"", 64 GB, 15 MB/s, gris",Hama,"28,84 €","46,40 %","-83,22 %",2,"0,00 %","-86,67 %","28,84 €","46,40 %","-82,00 %","11,20 €","0,00 %","-93,90 %",2,"0,00 %","-85,71 %",,,"-100,00 %"
B077ZGYBZS,"Hama Stylet ""Active Fineline"" pour écrans tactiles (universel, pour tablettes/smartphones/GPS, utilisation facile, stylet de 116 mm, pour Samsung, Apple, Huawei, Xiaomi, LG, Sony) Noir",Hama,"28,83 €",,,1,,,,,,,,,,,,,,
B079NH8MDY,"Hama Lot de Protections de joysticks 8 en 1' pour Nintendo Switch, muticol.",Hama,"28,71 €",,"200,00 %",3,,"200,00 %","28,71 €",,"200,00 %","12,81 €",,"200,00 %",3,,"200,00 %",,,
B0BK8ZQS6R,"Hama Fold Clear Coque pour Apple iPad 10,9"" (22) - Housse Fonction Chevalet, Protection Fermeture Magnétique, Dos Transparent - Mauve",Hama,"28,68 €",,,1,,,"28,68 €",,,"17,82 €",,,1,,,,,
B0BL1RHLQD,"Hama Câble iPhone USB-A Lightning (Câble de charge/transfert de données/Data, USB-A 2.0 mâle vers Lightning, 1.5m, Certifié MFI, 480 MBit/s, iPad/iPhone 13/12/11/XS/XR/X/8/7/7+/6s/6/5/SE2020) Blanc",Hama,"28,58 €",,"-61,00 %",2,,"-50,00 %","28,58 €",,"-61,00 %","24,90 €",,"-50,00 %",2,,"-50,00 %",,,
B00FQOM5J4,"Horloge murale ""PG-220"", Mécanisme silencieux, Blanc",Hama,"28,52 €","-48,52 %",,2,"-50,00 %",,"28,52 €","-48,52 %",,"17,92 €","-50,00 %",,2,"-50,00 %",,,,
B08SFR7Z13,"uRage Clavier Gaming Rétroéclairé (Clavier Gamer Silencieux, Rétroéclairage 7 Couleurs, Anti-Ghosting, Win-Lock, AZERTY, Filaire, Repose Poignet, 4 Touches Macro, 12 Touches Fonctions directes) Noir",uRage,"28,34 €",,,1,,,"28,34 €",,,"24,99 €",,,1,,,,,
B003QQBDUG,"Hama Goulotte Passe-Câbles Aluminium Anodisé (Cache-Câble Mural ou au Sol, Moulure Décorative en Demi-Rond, Rangement de Câbles Design, Protection de Câble, 1.8x3.3x110cm, pour 5 câbles) Blanc",Hama,"28,32 €","0,00 %",,2,"0,00 %",,"28,32 €","-33,33 %",,"14,46 €","-33,33 %",,2,"-33,33 %",,,,
B009HSQ3YS,"Hama Album Photo ""Fine Art"" (format 36 x 32 cm, 50 pages noires, à spirale) Taupe",Hama,"28,32 €","-62,35 %","-57,30 %",2,"-60,00 %","-50,00 %",,"-100,00 %","-100,00 %",,"-100,00 %","-100,00 %",,"-100,00 %","-100,00 %",,,
B001SLCC7Y,"Hama Lecteur USB 2.0 ""8en1 de Cartes (USB, microSD/SDHC, SD/SDHC, MMC) Transparent",Hama,"28,28 €",,"-21,16 %",4,,"-20,00 %","28,28 €",,"-21,16 %","16,80 €",,"-64,63 %",4,,"-20,00 %",,,
B000S8B51C,"Hama Pochettes-classeurs (pour CD/DVD, Couvre classeur à Anneaux, 2 par Pochette, Lot de 50) Blanc/Transparent",Hama,"28,28 €","-55,40 %","6,16 %",4,"-42,86 %","0,00 %","28,28 €","-55,40 %","-29,23 %","21,20 €","-42,86 %","-33,71 %",4,"-42,86 %","-33,33 %",,,
B005F3CG36,"Hama Paire de jumelles ""Optec"" 12 x 25 compacte (pour une vision nette, grossissement 12x, diamètre de la lentill 25 mm, forme de bordure de toit) Noir",Hama,"27,49 €",,"7,72 %",1,,"0,00 %","27,49 €",,,"20,42 €",,,1,,,,,
B005DJXZSC,"Hama Album Photo Singo (Album minimax, 13 x 16,5 cm, 100 Pages, pour 100 Photos au Format 10 x 15 cm) Rose",Hama,"27,42 €","66,28 %",,6,"100,00 %",,"27,42 €","66,28 %",,"17,82 €","100,00 %",,6,"100,00 %",,,,
B001JQD33U,"Kit d'alimentation, 6mm²",Hama,"27,42 €",,,1,,,"27,42 €",,,"15,37 €",,,1,,,,,
B07PHQ17NW,"Hama Album à Spirale 'Watercolor Moments', 28 x 24 cm, 50 Pages Blanches",Hama,"27,24 €","-21,48 %","-30,72 %",3,"-25,00 %","-25,00 %","34,73 €","27,68 %","18,45 %","18,72 €","33,33 %","41,18 %",4,"33,33 %","33,33 %",,,
B00IZA0RPU,"Thomson Support Mural TV WAB156 (VESA jusqu'à 400x400, Inclinable, pour Une Diagonale d´écran de 58 à 142 cm (de 23"" à 56"")) Noir",Thomson,"26,94 €","0,90 %",,1,"0,00 %",,"26,94 €","-50,40 %",,"17,65 €","-50,00 %",,1,"-50,00 %",,,,
B09RC45SFJ,"Hama Album photo Livre ""Relax"" avec Mémo (Album souvenirs vacances, anniversaire, 22x22.5 cm, 100 pages avec pochettes pour 200 photos 10x15 cm, Zone Mémo et pochette carte SD) Multicolore/Breathe",Hama,"26,64 €",,,2,,,"26,64 €",,,"17,96 €",,,2,,,,,
B005SS65GW,"Hama Chiffon 3 en 1 (pour ordinateur portable avec écran de 40 cm (15,6""), tapis de souris, en microfibre, film de protection, chiffon de nettoyage) Anthracite",Hama,"26,64 €","-55,56 %",,4,"-55,56 %",,"26,64 €","-55,56 %",,"18,20 €","-57,20 %",,4,"-55,56 %",,,,
B000NRU88E,"Hama Jeu de tournevis (pour appareils electroniques, montre, Lunettes, Maquettisme, Téléphone, Ordinateur, 12 inserts amovibles (Phillips, Torx, Pentalob), ensemble d'outils, 14 pièces) Noir/Argent",Hama,"26,64 €","-18,88 %","-68,21 %",2,"0,00 %","-66,67 %","26,64 €","-18,88 %","-68,21 %","17,34 €","10,03 %","-63,32 %",2,"0,00 %","-66,67 %",,,
B001F536FK,"THOMSON Casque Audio Filaire (Casque Stéréo Filaire Jack, Réglable, Supra-aural, Ultra-léger, 54g, Coussinets 27mm, 95dB, Cable 1.3m, idéal PC Smartphone Mac Tablette Ordinateur) Noir",Thomson,"26,58 €","-74,72 %","6,49 %",2,"-75,00 %","-33,33 %","26,58 €","-74,72 %","6,49 %","10,40 €","-75,00 %","-27,02 %",2,"-75,00 %","-33,33 %",,,
B0000AHIJ5,"Cadre photo sans bordure Clip-Fix, anti-reflet, 10,5 x 15 cm",Hama,"26,56 €","-72,41 %","-79,49 %",16,"-72,41 %","-79,49 %","26,56 €","-73,77 %","-79,49 %","18,88 €","-73,77 %","-77,80 %",16,"-73,77 %","-79,49 %",,,
B0BZDS8G7R,"Hama Enceinte Bluetooth Pocket 3.0"" (Mini Enceinte sans Fil Portable Légère, Basses intenses, Style Tendance, Étanche Eau et Poussière IP67, Autonomie 14h, USB-C, Prise Jack, 3.5W) Noir",Hama,"26,54 €",,,1,,,"26,54 €",,,"21,00 €",,,1,,,,,
B076Z59MZL,"Hama Filtre de polarisation (polarisant circulaire, verre supérieure, diamètre du filetage de 67 mm, Epaisseur de la monture de 4,5 mm, filetage avant, NMC16 (nano multi-coated 16 couches)) Noir",Hama,"26,46 €","0,00 %",,1,"0,00 %",,"26,46 €","0,00 %",,"18,29 €","0,00 %",,1,"0,00 %",,,,
B00006JCWM,"Hama Casier de rangement ""Spirit II"" (système de classement sur socle pour CD, pour 22 boîtiers CD, porte-CD pour le rangement, organisateur antidérapant) Noir",Hama,"26,22 €","0,00 %","-84,63 %",3,"0,00 %","-85,71 %","26,22 €","0,00 %","-86,51 %","18,24 €","0,00 %","-86,79 %",3,"0,00 %","-87,50 %",,,
B01K47G7VO,"Mini album photo à pochettes ""La Fleur"" pr 40 photos 10 x 15 cm, blc",Hama,"26,18 €","-58,82 %","75,00 %",7,"-58,82 %","75,00 %","29,92 €","-46,67 %","166,67 %","19,92 €","-46,67 %","171,02 %",8,"-46,67 %","166,67 %",1,,
B0000AHIE0,"Hama Cadre portrait (taille de cadre 13x18 cm, taille de photos 13x18 cm, acrylique, format horizontal, en plastique, 1 photo par cadre, élégant, simple, classique) Transparent",Hama,"26,18 €","15,74 %","-73,08 %",7,"75,00 %","-73,08 %","26,18 €","15,74 %","-74,07 %","14,21 €","75,00 %","-72,78 %",7,"75,00 %","-74,07 %",,,
B084HZN6S4,"Hama Album Photo ""Fine Art"" (format 24 x 17 cm, 36 pages blanches, sans spirale) Sable",Hama,"26,12 €","223,67 %","248,73 %",3,"200,00 %","200,00 %","26,12 €","223,67 %","248,73 %","17,19 €","200,00 %","281,15 %",3,"200,00 %","200,00 %",,,
B08YRZS5BR,"Hama Hub USB, 4 Ports, USB 2.0, 480 Mbit/s, Métal, Garantie 10 Ans, Blanc",HAMA,"25,88 €",,"-50,00 %",4,,"-50,00 %","25,88 €",,"-33,33 %","24,69 €",,"-23,56 %",4,,"-33,33 %",,,"-100,00 %"
B01K47G2W8,"Hama Album Jumbo ""Skies"" (album grand format, 30 x 30 cm, 60 pages, pour 240 photos au format 10 x 15 cm) Beige",Hama,"25,48 €","-2,41 %","65,78 %",2,"0,00 %","100,00 %","25,48 €","-2,41 %","65,78 %","11,80 €","0,00 %","131,83 %",2,"0,00 %","100,00 %",1,,
B000VRANHM,"Hama Album, Bleu, 28 x 24 cm",Hama,"25,14 €","104,89 %","-63,89 %",2,"100,00 %","-71,43 %","25,14 €","104,89 %","-68,67 %","11,26 €","100,00 %","-72,51 %",2,"100,00 %","-75,00 %",,,"-100,00 %"
B0CBCMH2BZ,"Hama Multiprise Cube avec Interrupteur (Rallonge multiprise 1.4m, Bloc 3 Prises Terre F Schuko + 2 USB-A + 2 USB-C, 3680W 16A Idéal Bureau Cuisine Salon Atelier Garage PC luminaires Meuble TV) Blanc",Hama,"24,99 €",,,1,,,"24,99 €",,,"18,49 €",,,1,,,,,
B0BGRR8MXW,"Hama Ecouteurs Bluetooth sans Fil Spirit Chop (Ecouteurs TWS, Micro, Station de Charge, IPX4, Ecouteurs Intra-Auriculaire, Grande Autonomie, Port Micro USB, Controle Vocale+Tactile) Noir",Hama,"24,99 €",,,1,,,"24,99 €",,,"24,95 €",,,1,,,,,
B0BXPKDN7W,"Hama Classeur à négatifs (4 anneaux, niveau de remplissage 39 mm, feuilles rectangulaires, album à négatifs d'une pellicule photo) Vert pale",Hama,"24,96 €",,,3,,,"24,96 €",,,"18,45 €",,,3,,,,,
B009X8SIV8,"Hama Album Photo ""Fine Art"" (format 28 x 24 cm, 50 pages noires, à spirale) Taupe",Hama,"24,96 €","19,83 %","-50,00 %",3,"50,00 %","-50,00 %","24,96 €","19,83 %","-50,00 %","16,89 €","50,00 %","-44,11 %",3,"50,00 %","-50,00 %",,,
B005DJKEY0,"Hama Album Photo Singo (Album Auto-adhésif, 28 x 31 cm, 20 Pages, pour 60 Photos au Format 10 x 15 cm) Orange",Hama,"24,96 €","-62,50 %",,3,"-62,50 %",,"24,96 €","-62,50 %",,"13,65 €","-62,50 %",,3,"-62,50 %",,,,
B075RJLTJW,"Hama Album Photo ""Fine Art"" (format 24 x 17 cm, 50 pages blanches, à spirale) Bordeaux",Hama,"24,95 €",,"40,25 %",5,,"66,67 %","19,96 €",,"12,20 %","10,60 €",,"33,33 %",4,,"33,33 %",,,
B01A72KIHA,"Hama Cordon d’alimentation Euro (coudé à 90 degrés des deux côtés, fiche secteur vers prise double Euro 8 avec contact de protection de terre, coudé des deux côtés, 1,5 m) Noir",Hama,"24,94 €","299,68 %","-89,03 %",3,"200,00 %","-90,63 %","24,94 €","299,68 %","-89,03 %","12,42 €","200,00 %","-90,45 %",3,"200,00 %","-90,63 %",,,"-100,00 %"
B01DZGIF6G,"Hama Support mural TV FULLMOTION pour TV écran plat entre 48 cm et 122 cm (19"" à 48""), pivotant et inclinable, jusqu'à 20 kg de charge supportée, VESA 200x200, 1 bras, Noir",Hama,"24,92 €","-62,39 %","-43,42 %",1,"-66,67 %","-50,00 %","24,92 €","-62,39 %","-43,42 %","12,94 €","-71,13 %","-58,87 %",1,"-66,67 %","-50,00 %",,,"-100,00 %"
B0000AIS8M,"Hama Cadre photo en plastique ""Décor Sevilla"" (taille du Cadre de 21 x 29,7 cm (DIN 4) avec bordure de 9 mm x 17 mm, pour une photo de 15 x 20 cm) Or Mat",Hama,"24,84 €",,"35,74 %",2,,"-33,33 %","24,84 €",,"35,74 %","8,52 €",,"-33,33 %",2,,"-33,33 %",,,
B002IK2SNM,"Hama - 20563 - Colliers de serrage pour câbles, Champ inscriptible, 98mm, 25 pces, Naturel",Hama,"24,44 €","-37,95 %","-61,80 %",4,"-55,56 %","-71,43 %","24,44 €","-37,95 %","-40,58 %","11,08 €","-56,05 %","-48,49 %",4,"-55,56 %","-55,56 %",,,
B00005KHTB,"Hama Filtre polarisant (circulaire, Traité, 55mm, 2 couches par face) Noir",Hama,"24,28 €",,,1,,,"24,28 €",,,"24,95 €",,,1,,,,,
B00T7M8ET6,"Hama Album photo à pochettes ""New York City"" (pour 200 photos au format 10 cm x 15cm, taille de l'album de 19 cm x 23,5 cm, 100 pages, en cuir, protège les photos et les documents) Noir",Hama,"24,14 €","-78,87 %","-78,36 %",2,"-77,78 %","-75,00 %","24,14 €","-78,87 %","-80,76 %","15,92 €","-77,53 %","-76,20 %",2,"-77,78 %","-77,78 %",1,,
B09W5X2PJ6,"Hama HS-USB250 V2 Casque Micro - Casque USB, Microphone Intégré, Léger, Télécommande Intégrée, Fonction Mute - Noir",Hama,"23,53 €",,,1,,,"23,53 €",,,"17,32 €",,,1,,,,,
B079NX1LC5,"Thomson Antenne Intérieure ANT1418BK (pour Radio/TV, réception numérique DVB-T/-T2, réception Dab/Dab+, Convient au récepteur/syntoniseur VHF, avec Prise 12V pour Voiture, Performance 35) Noir",Thomson,"23,32 €","-54,84 %","-72,84 %",1,"-50,00 %","-66,67 %","23,32 €","-54,84 %","-61,29 %","19,54 €","-39,91 %","-39,91 %",1,"-50,00 %","-50,00 %",,,
B0CN9J2CSF,"Hama Télécommande Universelle, Remplacement de Télécommande TV LG/Samsung/Sony/Hitachi/TCL/Philips/Panasonic Smart TV, Infrarouge, controlez jusqu'à 8 appareils, Touche App Noir",Hama,"23,32 €",,,2,,,"23,32 €",,,"14,71 €",,,2,,,,,
B0C2PHVTY4,"Hama MW-500 Recharge Souris sans Fil - Technologie 2.4Ghz, Rechargeable en USB C, Capteur Blue Wave 1600 dpi, Technologie Smart-Link, Clics Silencieux, Droitier/e - Verte",Hama,"23,17 €","-50,11 %",,1,"-50,00 %",,"23,17 €","-50,11 %",,"12,90 €","-50,00 %",,1,"-50,00 %",,,,
B00IZA0RSM,"Thomson Support Mural TV WAB546 (VESA jusqu'à 200x200, Fixe, pour Une Diagonale d´écran de 25 à 117 cm (de 10' à 46')) Noir",Thomson,"23,07 €","-38,43 %","-76,91 %",2,"-33,33 %","-75,00 %","23,07 €","-38,43 %","-69,22 %","18,58 €","-33,33 %","-63,65 %",2,"-33,33 %","-66,67 %",,,
B07X557RB6,"Thomson Antenne Intérieure ""ANT1639"" (Design UHD ""Sculpture"", pour réception numérique DVB-T/DVB-T2 et HDTV, actif, 2 m, Performance 55) Noir/Gris",Thomson,"22,98 €",,,1,,,"22,98 €",,,"31,07 €",,,1,,,,,
B0000AI3DJ,"Hama Cadre photo en plastique ""Décor Sevilla"" (taille du Cadre de 50 x 70 cm avec bordure de 13 mm x 20 mm, pour une photo de 30 x 45 cm) Or Mat",Hama,"22,91 €","0,00 %",,1,"0,00 %",,"22,91 €","0,00 %",,"11,50 €","0,00 %",,1,"0,00 %",,,,"-100,00 %"
B0000932BP,"Hama Etui universel (pour cartes mémoire, pour cartes CF/SM/SD/MMC/xD/MStick, en simili cuir, pour 4 cartes) Noir 4007249471529",Hama,"22,85 €","25,00 %","66,67 %",5,"25,00 %","66,67 %","22,85 €","25,00 %","66,67 %","16,69 €","26,15 %","84,83 %",5,"25,00 %","66,67 %",,,
B07KWC3KMG,"Rapoo Souris optique sans fil Multi mode 2,4GHz/BT 3.0/BT 4.0 ""M500"" (bluetooth, souris d'ordinateur, design, avec boutons et molette de défilement) Noir",Rapoo,"22,77 €",,,1,,,"22,77 €",,,"17,17 €",,,1,,,,,
B009TLAOA2,"Hama Album Photo ""Fine Art"" (format 28 x 24 cm, 50 pages noires, à spirale) Turquoise",Hama,"22,51 €",,"35,28 %",2,,"0,00 %","22,51 €",,"35,28 %","11,25 €",,"-0,09 %",2,,"0,00 %",,,
B00194JFW0,"Cadre pour portrait ""Laval"", 3x 13x18 cm",Hama,"22,49 €",,,1,,,"22,49 €",,"0,00 %","13,83 €",,"9,94 %",1,,"0,00 %",1,,
B075RHN1M4,"Hama Album Photo Fine Art (Format 28 x 24 cm, 50 Pages Blanches, à Spirale) Bordeaux",Hama,"22,47 €","10,04 %","15,23 %",3,"50,00 %","50,00 %","22,47 €","10,04 %","-23,18 %","14,43 €","45,46 %","8,09 %",3,"50,00 %","0,00 %",,,
B017JY4RG2,"Hama Album Photo ""Fine Art"" (format 28 x 24 cm, 50 pages blanches, à spirale) Gris",Hama,"22,47 €","159,17 %","-80,00 %",3,"200,00 %","-80,00 %","22,47 €","159,17 %","-82,35 %","13,65 €","200,00 %","-81,03 %",3,"200,00 %","-82,35 %",,,
B08SDVY3V6,"Hama Câble HDMI (Cable HMDI ultra haute vitesse, Certifié, Mâle-Mâle, Ultra HD, 8K@60 Hz /4K@120Hz, 2.0m, Garantie 30ans, résolution 7680x4320pixels, EARC supportant les formats audio) Gris Noir",Hama,"22,42 €",,,1,,,"22,42 €",,,"12,22 €",,,1,,,,,
B07B93BSF8,"Hama Trépied ""FlexPro"" (pour smartphone, GoPro et appareils photo, avec pieds articulés, hauteur de 27 cm) Noir/Rouge",Hama,"21,92 €",,,1,,,"21,92 €",,,"14,80 €",,,1,,,,,
B0CLD41YWS,"Hama Goulotte Passe-câbles Magnétique (Goulotte Cache Cables Couvercle Magétique, Conduit de Cables Pratique et Decoratif pour Meuble TV, Bureau, Salon, en métal 90x5.6x1.6cm) Noir",Hama,"21,66 €",,,1,,,,,,,,,,,,,,
B0CNRYZR3R,"Hama Boîte pour câbles Maxi (Boite Rangement pour Cables chargeurs et multiprises, boitier Cache câbles 40x15,5x13,5cm, Pieds en Caoutchouc) Noir",Hama,"21,66 €","-92,31 %",,1,"-92,31 %",,"238,26 €","266,67 %",,"154,11 €","266,67 %",,11,"266,67 %",,,,
B0000AI3G6,"Hama Cadre en plastique ""Madrid"" (taille de cadre de 50 cm x 70 cm, taille de la photo de 30 cm x 45 cm, 1 photo par cadre, à accrocher, élégant, simple, classique) Argent",Hama,"21,66 €","-80,00 %","-16,53 %",1,"-80,00 %","0,00 %","21,66 €","-80,00 %","-16,53 %","9,69 €","-80,00 %","12,02 %",1,"-80,00 %","0,00 %",1,,
B08SFHWQDC,"Hama Câble HDMI (Cable HMDI ultra haute vitesse, Certifié, Mâle-Mâle, Ultra HD, 8K@60 Hz /4K@120Hz, 3.0m, Garantie 10ans, résolution 7680x4320pixels, EARC supportant les formats audio) Noir",Hama,"21,64 €",,,1,,,"21,64 €",,,"14,29 €",,,1,,,,,
B09RGWV4NB,"Hama Casque-Micro pour téléphones sans Fil (Intra-Auriculaire, Contour d'oreille Réglable, Bras de Micro Flexible, Jack 2.5 mm, Qualité Audio Cristaline, 32 Ω, 1.2m, Garantie 10ans) Noir",Hama,"21,64 €",,"0,00 %",2,,"0,00 %","21,64 €",,,"17,90 €",,,2,,,,,
B0000AIRVB,"Hama Cadre photo ""Clip-Fixe"" (sans bordure, 40 x 50 cm, Anti-Reflex) Blanc",Hama,"21,42 €",,"-77,87 %",1,,"-85,71 %","21,42 €",,"-80,64 %","6,81 €",,"-86,30 %",1,,"-87,50 %",,,
B09GLDXKYK,"Hama Coque iPhone 13 Pro Compatible MagSafe MagCase Finest Feel Pro pour Apple (Etui magnétique pour Recharge à Induction, Housse Protection Chocs Rayures et saletés, en TPU Mate Soyeuse) Vert",Hama,"21,24 €","0,00 %",,1,"0,00 %",,"21,24 €","0,00 %",,"15,35 €","0,26 %",,1,"0,00 %",,1,,
B0002VFL1K,"Hama Pochettes pour CD-ROM/DVD-ROM (Pochettes CD plastique, pochette de protection colorées, lot de 50, Multicolore) Bleu/Orange/Violet/Rose/Vert",Hama,"21,21 €","0,00 %","6,16 %",3,"0,00 %","50,00 %","21,21 €","0,00 %","6,16 %","14,52 €","0,00 %","57,14 %",3,"0,00 %","50,00 %",,,
B0BRYDB26C,"Hama Canosa V2 Souris sans Fil - Technologie Bluetooth® 5.0, Capteur 1600 dpi, Clics Silencieux, Ambidextre - Grise Anthracite",Hama,"21,14 €","0,00 %",,1,"0,00 %",,"21,14 €","0,00 %",,"13,05 €","0,00 %",,1,"0,00 %",,,,
B0002W6FOQ,"Hama Etui Universel (pour Cartes mémoire, pour Cartes CF/SM/SD/MMC/xD/MStick, pour 20 Cartes) Noir/Gris",Hama,"20,82 €",,"0,00 %",2,,"0,00 %","20,82 €",,"0,00 %","13,88 €",,"0,00 %",2,,"0,00 %",,,"-100,00 %"
B07MZYSH95,"Black Rock Coque de protection 'Flex Carbon' (pour Samsung Galaxy S10, design mince, en microfibres, plastique, polyuréthane (PU), protection idéale, protection à 180° ou 360°) Noir","Black Rock","20,82 €",,,1,,,"20,82 €",,,"17,28 €",,,1,,,,,
B002N8WE2Y,"Hama Etui universel (pour cartes mémoire, pour cartes SD, pour 12 cartes SD) Noir",Hama,"20,82 €",,,2,,,"20,82 €",,,"15,63 €",,,2,,,,,
B0C2PDMLCW,"Hama MW-500 Recharge Souris sans Fil - Technologie 2.4Ghz, Rechargeable en USB C, Capteur Blue Wave 1600 dpi, Technologie Smart-Link, Clics Silencieux, Droitier/e - Bleu",Hama,"20,82 €",,,1,,,"20,82 €",,,"12,90 €",,,1,,,,,
B0015LCK5G,"Système de Rangement Universel pour Voiture, Grand modèle, Noir",Hama,"20,82 €",,,1,,,,,,,,,,,,,,
B081S4YTDT,"Tige pour Selfie Funstand 57"", avec déclench. à dist. Bluetooth, Noir",Hama,"20,75 €",,,1,,,"20,75 €",,,"17,26 €",,,1,,,,,
B007C3BDPO,"Hama Tapis de souris ""Ergonomique"" (tapis de souris ergonomique, 200 x 230 x 21 mm, repose-poignet confortable, tapis antidérapant, convient aux ordinateurs, taille mini) Noir",Hama,"20,64 €","100,00 %",,2,"100,00 %",,"20,64 €","100,00 %",,"16,04 €","100,00 %",,2,"100,00 %",,,,
B000K67ZD4,"Hama Support ""X"" à roulettes (pour Les Tours PC Les Plus Populaires, jusqu'à 25,5 cm de Large) Noir",Hama,"19,99 €","-72,62 %","-35,14 %",1,"-75,00 %","-50,00 %","19,99 €","-72,62 %","-56,76 %","11,42 €","-75,33 %","-62,96 %",1,"-75,00 %","-66,67 %",,,
B0BL228SD3,"Hama Chargeur Secteur USB (Bloc Secteur USB-A, 6W, 5V/ 1.2A, Adaptateur Secteur Universel, Chargeur Replacement pour c) Noir",Hama,"19,98 €",,,2,,,"19,98 €",,,"14,90 €",,,2,,,1,,
B000L9PSVG,"Hama Pochettes de classeurs pour CD-ROM, DIN A4, Lot de 10",Hama,"19,98 €",,,2,,,"19,98 €",,,"13,84 €",,,2,,,,,
B00006JDAX,"Hama Pâte adhésive (250 g, pour fixer, spécialement conçu pour la photo) Gris Neutre",Hama,"19,92 €","0,00 %","4,46 %",1,"0,00 %","0,00 %","19,92 €","0,00 %","4,46 %","13,76 €","0,00 %","0,00 %",1,"0,00 %","0,00 %",,,
B00006IVE7,"Hama Étuis à négatifs, papier cristal, 10 bandes de 4 négatifs, 24x36cm, 25 pièces",Hama,"19,84 €","-81,82 %","-55,67 %",2,"-81,82 %","-33,33 %","19,84 €","-81,82 %","-55,67 %","16,84 €","-81,84 %","-24,01 %",2,"-81,82 %","-33,33 %",,,
B00A44MVZ4,"Hama Chemin de câble (bande en PVC/Aluminium pour montage mural TV ou au sol, cache-câble rectangle, 100 x 2,1 x 1 cm, entrée de câble jusqu'à 3 câbles, 3 pièces, matériel de montage compris) Blanc",Hama,"19,67 €","2,82 %",,1,"0,00 %",,"19,67 €","2,82 %",,"8,36 €","0,00 %",,1,"0,00 %",,,,
B00006J6P8,"Hama Boîtier standard (pour DVD, convient également aux CD et aux Blu-ray, avec film pour l'insertion de la jaquette, lot de 5) Noir",Hama,"19,64 €",,"140,69 %",2,,"100,00 %","19,64 €",,"140,69 %","5,60 €",,"95,80 %",2,,"100,00 %",,,
B09FBZL9TN,"Hama Coque iPhone 12/12 Pro Compatible MagSafe MagCase Finest Feel Pro pour Apple (Etui magnétique pour Recharge à Induction, Housse Protection Chocs Rayures et saletés, TPU Mate Soyeuse) Bordeaux",Hama,"19,57 €",,,1,,,"19,57 €",,,"14,94 €",,,1,,,,,
B00005KHTC,"Hama Filtre polarisant (circulaire, Traité, 62mm, 2 couches par face) Noir",Hama,"19,42 €","-55,00 %",,1,"-50,00 %",,"19,42 €","-55,00 %",,"20,22 €","-55,59 %",,1,"-50,00 %",,,,
B0009N8L5O,"Trépied Appareil Photo Star 20""",Hama,"19,08 €",,,1,,,"19,08 €",,,"14,78 €",,,1,,,1,,
B00005KHTA,"Hama Filtre polarisant (circulaire, Traité, 52mm, 2 couches par face) Noir",Hama,"19,08 €",,,1,,,"19,08 €",,,"24,26 €",,,1,,,,,
B004IYLMHE,"Hama Clé USB 2.0 ""Rotate, 8 GB (10 MB/s, Flashpen Rotate) Noir/Argenté",Hama,"19,00 €",,"90,38 %",4,,"100,00 %","19,00 €",,"90,38 %","23,20 €",,"100,00 %",4,,"100,00 %",,,
B00005UPE1,"Hama Câble réseau RJ45 Droit Ethernet Cat 5e STP (câble de raccordement de 10 m, 1000 Mbit/s, plaqué Or, blindé) Gris",Hama,"18,86 €",,"19,22 %",1,,"0,00 %","18,86 €",,"19,22 %","8,97 €",,"0,00 %",1,,"0,00 %",,,
B0949HMZB1,"Hama Chiffon Antistatique Antipoussière (Chiffon de Nettoyage pour Lunettes ou Appareil Photo, Objectif, Filtre, écrans PC Smartphone ou Tablette, négatifs, Diapositives, Jumelles, 23 x 25 cm) Orange",Hama,"18,72 €","-72,73 %","-70,00 %",3,"-72,73 %","-70,00 %","12,48 €","-83,33 %","-84,62 %","8,54 €","-83,33 %","-84,45 %",2,"-83,33 %","-84,62 %",,,"-100,00 %"
B009X8SEOO,"Hama ""Fine Art"" Spiral Album, 24 x 17 cm, 50 Photos, kiwi",Hama,"18,72 €",,"-40,00 %",3,,"-40,00 %","18,72 €",,"-40,00 %","11,79 €",,"-35,40 %",3,,"-40,00 %",,,
B073RM3C4L,"Hama Support universel voiture ""Magnet"" (pour tous les smartphones et tablettes, avec ventouse, poids de 160 g) Noir/Gris",Hama,"18,67 €",,,1,,,"18,67 €",,,"13,25 €",,,1,,,,,
B0BL1TWBNY,"Hama Support Téléphone Voiture Move (Support téléphone pour Voiture à Ventouse, pivotable 360°, Support de Voiture pour Smartphones de 5,5 à 8,5 cm de Largeur) Noir",Hama,"18,32 €",,,1,,,"18,32 €",,,"13,95 €",,,1,,,,,
B0BL19JS13,"Hama Câble iPhone USB-A Lightning (Câble de charge/transfert de données/Data, USB-A 2.0 mâle vers Lightning, 1.5m, Certifié MFI, 480 MBit/s, iPad/iPhone 13/12/11/XS/XR/X/8/7/7+/6s/6/5/SE2020) Noir",Hama,"18,32 €",,,1,,,"18,32 €",,,"12,45 €",,,1,,,,,
B08NCF2H9V,"Hama Transmetteur FM Bluetooth de Voiture (Adaptateur Allume Cigare Bluetooth, Kit MP3 sans Fil avec 2 Ports USB, Fentes MicroSD, Chargeur de Voiture USB-A)",Hama,"18,32 €",,,1,,,"18,32 €",,,"15,30 €",,,1,,,,,
B0BL1TH1PX,"Hama Kit Support Téléphone Voiture Universel (Ensemble Support téléphone pour Voiture, 2en1 Clip pour aération et Ventouse, pivotable 360°, pour Mobile de Largeur de 4 à 11 cm) Noir",Hama,"18,32 €","0,00 %","-39,90 %",1,"0,00 %","-50,00 %","36,64 €",,"20,21 %","25,50 €",,"0,00 %",2,,"0,00 %",,,
B0071BIZG2,"Hama Support mural TV Fixe (Pour diagonale d’écran de 81 à 165cm (32"" à 65""), pour un maximum de 30 kg, VESA jusqu'à 400 x 400, 3 étoiles) Noir",Hama,"18,32 €","-83,33 %",,1,"-83,33 %",,"18,32 €","-83,33 %",,"11,54 €","-83,33 %",,1,"-83,33 %",,,,"-100,00 %"
B07NH1CZQ2,"Hama Microphone 'MIC-USB Allround' pour PC et Ordinateur Portable, USB",Hama,"18,32 €",,,1,,,"18,32 €",,,"19,88 €",,,1,,,,,
B000HWYAL6,"Hama Support universel (pour véhicule, support, pour vitre/grille de ventilation) Noir",Hama,"18,30 €",,,1,,,"18,30 €",,,"9,98 €",,,1,,,,,
