B00006JA36,"Hama - 46040H - Micro monophonique, finition argent, jack de 3,5mm et adaptateur 3,5/6,35 mm, prise XLR, interrupteur marche/arrêt sur le micro, 600 Ohms, dynamique et unidirectionnel - Cordon 3.00m",Hama,,,"-100,00 %",,,"-100,00 %",,,"-100,00 %",,,
B01K47G2W8,"Hama Album Jumbo ""Skies"" (album grand format, 30 x 30 cm, 60 pages, pour 240 photos au format 10 x 15 cm) Beige",Hama,,"-100,00 %","-100,00 %",,"-100,00 %","-100,00 %",,"-100,00 %","-100,00 %",1,,
B008JCRCWK,"Xavax Douille de raccord (pour Siphons Intégration dans mur sans Ouverture de Nettoyage, pour Lave-linge et Lave-vaisselle, 90 degrés, Raccord de Tuyau de 20-23 mm) Blanc/Bleu",xavax,,,"-100,00 %",,,"-100,00 %",,,"-100,00 %",,,
B00006IVKJ,"Hama Câble réseau (RJ11, modulaire, connecteurs mâles 6p4c, 6m) Blanc",Hama,,,"-100,00 %",,,"-100,00 %",,,"-100,00 %",,,
B01EG0O104,"Hama Sonic Mobil 185 Enceintes pour Ordinateur - Système Stéréo 2.0, Haut-Parleurs Alimentés en USB, Connexion Jack 3.5mm - Noir/Argent",Hama,,"-100,00 %","-100,00 %",,"-100,00 %","-100,00 %",,"-100,00 %","-100,00 %",,,"-100,00 %"
B00APYQTPQ,"Xavax Graisse silicone multiple ""OKS 1110"" (pour l'entretien des machines à café, des raccords et des joints d'étanchéité, sans danger pour les aliments, transparent, 20 g) Blanc/Bleu",xavax,,,"-100,00 %",,,"-100,00 %",,,"-100,00 %",,"-100,00 %","-100,00 %"
B086XSF5QW,"Xavax Tampons antidérapants avec protection contre vibration 10x10x1,5cm, lot de 4",xavax,,,"-100,00 %",,,"-100,00 %",,,"-100,00 %",,,
B086XSHJ68,"Cadre Hama 10 x 15 cm , Line Gold Matt",Hama,,"-100,00 %",,,"-100,00 %",,,"-100,00 %",,,,
B00006JDB2,"Hama Microphone Dynamique DM 60"" (avec caractéristique cardioïde, boîtier en métal, Longueur de câble 3m) Noir",Hama,,"-100,00 %",,,"-100,00 %",,,"-100,00 %",,,"-100,00 %",
B00006JDEX,"Hama Plateau Universel Hama Rond (32 cm, Taille L, Poids supporté 80 kg (idéal pour TV, Enceintes, écrans, appareils de Cuisine) Noir",Hama,,"-100,00 %","-100,00 %",,"-100,00 %","-100,00 %",,"-100,00 %","-100,00 %",,,"-100,00 %"
B00X3JFB40,"Hama Support de Casque (Frontal, pour GoPro) Noir",Hama,,"-100,00 %","-100,00 %",,"-100,00 %","-100,00 %",,"-100,00 %","-100,00 %",,,
B01AUBT8OW,"Cor. alim. Euro pr Sonos PLAY:1/PLAY:5/One, coudé aux extrém., 5m, blc",Hama,,,"-100,00 %",,,"-100,00 %",,,"-100,00 %",,,
B000VRAKX4,"Xavax Filtre moteur MF 01 (Filtre de protection pour moteur et aspirateur universel, découpable) Noir",xavax,,,"-100,00 %",,,"-100,00 %",,,"-100,00 %",,,
B07TSQJ5W1,"Hama Casque Micro PC Tour de Cou NHS-P100 (Casque Micro de Bureau Tour de Nuque, Stéréo, Casque Micro Filaire, réglage Volume, Casque Micro Perche Flexible, idéal télétravail, Bureau) Noir",Hama,,"-100,00 %",,,"-100,00 %",,,"-100,00 %",,1,,
B076Z59MZL,"Hama Filtre de polarisation (polarisant circulaire, verre supérieure, diamètre du filetage de 67 mm, Epaisseur de la monture de 4,5 mm, filetage avant, NMC16 (nano multi-coated 16 couches)) Noir",Hama,,"-100,00 %",,,"-100,00 %",,,"-100,00 %",,,,
B0857M8J9G,"Xavax Kit de superposition universel pour lave-linge/sèche-linge, avec séchoir à linge",xavax,,,"-100,00 %",,,"-100,00 %",,,"-100,00 %",,,
B07FR35F8P,"Hama Plafonnier WiFi (effet scintillant, rond, diamètre de 30 cm, encastré, compatible avec Alexa/Google Home, application/commande vocale, 2,4 GHz, IFTTT) Blanc",Hama,,"-100,00 %",,,"-100,00 %",,,"-100,00 %",,,,
B009X8SDUO,"Hama ""Fine Art"" Spiral Album, 24 x 17 cm, 50 Photos, taupe",Hama,,,"-100,00 %",,,"-100,00 %",,,"-100,00 %",,,
B003ZYRL9G,"Xavax Colliers de serrage (jeu de 10 colliers de serrage avec entraînement par vis sans fin, plage de serrage 20 - 32 mm, largeur de courroie 9 mm) Argent",xavax,,"-100,00 %",,,"-100,00 %",,,"-100,00 %",,,,
B000EW5338,"Hama Microphone (Jack 3,5mm, pour ordinateur portable, Col de cigne) Noir",Hama,,,"-100,00 %",,,"-100,00 %",,,"-100,00 %",,,
B000NRU88E,"Hama Jeu de tournevis (pour appareils electroniques, montre, Lunettes, Maquettisme, Téléphone, Ordinateur, 12 inserts amovibles (Phillips, Torx, Pentalob), ensemble d'outils, 14 pièces) Noir/Argent",Hama,,,"-100,00 %",,,"-100,00 %",,,"-100,00 %",,,
B00QRHG81K,"Hama Clé USB 3.0 ""Laeta Twin (FlashPen, OTG, Aluminium, USB 3.0, jusqu'à 40 Mo/s, 16GB) Noir",Hama,,,"-100,00 %",,,"-100,00 %",,,"-100,00 %",,,
B017J9FOZA,"Xavax Thermomètre numérique pour rôtis (de torréfaction, numérique, 2 in 1, avec horloge de cuisine, sonde de température amovible, pour viande, -10°C à +250°C, avec minuteur, à câble) Noir/Argent",xavax,,"-100,00 %","-100,00 %",,"-100,00 %","-100,00 %",,"-100,00 %","-100,00 %",,,
B00006J4G6,"Hama Jeu de câbles d'adaptation pour enceintes III (pour Opel,Renault,Seat,Volkswagen, câble adaptateur pour haut-parleur III, Adaptateur de câble) Noir",Hama,,,"-100,00 %",,,"-100,00 %",,,"-100,00 %",,,
B00006JAMZ,"Hama Câble d'alimentation secteur 3 pôles terre (pour connecter divers appareils tels les appareils froids, mâle avec contact de protectection femelle 3 pôles, câble de longueur 2,5 m) Noir",Hama,,,"-100,00 %",,,"-100,00 %",,,"-100,00 %",,,
B0002W5WAE,"Hama Pochettes de protection (pour CD/DVD/Blu-Ray, design étroit, pochette en plastique, lot de 25) Transparent",Hama,,,"-100,00 %",,,"-100,00 %",,,"-100,00 %",,,
B09GLD1SCF,"Hama Coque iPhone 13 Protector (Etui de Protection pour Apple en TPU, Coque de Protection Souple, Protection de téléphone Portable avec Cadre Antichoc) Transparente, Noire",Hama,,"-100,00 %",,,"-100,00 %",,,"-100,00 %",,,,
B000L9PSVG,"Hama Pochettes de classeurs pour CD-ROM, DIN A4, Lot de 10",Hama,,"-100,00 %","-100,00 %",,"-100,00 %","-100,00 %",,"-100,00 %","-100,00 %",,,
B07PBXBL7G,"Hama Mini-Album Photo à Pochettes Brushstroke (Album Photo Traditionnel 13 x 16,5 cm, 24 Pages pour 24 Photos Format 10 x 15 cm, Protection idéale, Artistique, élégant) Vert/Jaune/Marron/Blanc",Hama,,,"-100,00 %",,,"-100,00 %",,,"-100,00 %",,,
B08BFGXP63,"Hama Album photo à spirale ""Romance"" (Album souvenirs Mariage, Anniversaire, Baby Shower, Baptême, Idée cadeau, 28x24 cm, 40 pages noires, 80 photos de 10x15 cm à coller, Motif Cœurs Love) Beige Noir",Hama,,,"-100,00 %",,,"-100,00 %",,,"-100,00 %",,,
B017JY4RYO,"Hama Album Photo ""Fine Art"" (format 36 x 32 cm, 50 pages blanches, à spirale) Gris",Hama,,,"-100,00 %",,,"-100,00 %",,,"-100,00 %",,,"-100,00 %"
B08SFFF4W8,"Hama Hub USB-C Multiport Data (USB 3.2 Gen2, 4 Ports, Vitesse de Transfert Super Speed 10Gbits/s, Boitier Aluminium Robuste, Garantie 10 Ans, Plug & Play, Compatible Thunderbolt-3/4) Anthracite",Hama,,,,,,,,,,,,"-100,00 %"
B07N9GQKD5,"Hama Étui Portefeuille Guard Pro pour Apple iPhone 5/5s/SE, Noir",Hama,,"-100,00 %",,,"-100,00 %",,,"-100,00 %",,,"-100,00 %",
B018VONYPY,"Hama Sonic Mobil 183 Enceintes pour Ordinateur - Système Stéréo 2.0, Haut-Parleurs Alimentés en USB, Connexion Jack 3.5mm - Noir/Rouge",Hama,,"-100,00 %","-100,00 %",,"-100,00 %","-100,00 %",,"-100,00 %","-100,00 %",,,"-100,00 %"
B0002VFLQ0,"Hama Pochettes (pour CD/DVD/blu-Ray, 2 pièces par pochette, lot de 100) Transparent",UNKNOWN,,,"-100,00 %",,,"-100,00 %",,,"-100,00 %",,,
B01AUBT6IU,"Cor. alim. Euro pr Sonos PLAY:1/PLAY:5/One, coudé aux extrém., 3 m, nr",Hama,,,"-100,00 %",,,"-100,00 %",,,"-100,00 %",,,
B0BL1CFWRT,"Hama Ecouteurs Lightning Glow (Ecouteurs Intra-Auriculaires filaires, Micro et Contrôle du Volume, Ecouteurs pour iPhone, Certifiés MFi, Compatibles Apple iPhone iPad iPod) Blanc",Hama,,"-100,00 %",,,"-100,00 %",,,"-100,00 %",,,"-100,00 %",
B079NX1LC5,"Thomson Antenne Intérieure ANT1418BK (pour Radio/TV, réception numérique DVB-T/-T2, réception Dab/Dab+, Convient au récepteur/syntoniseur VHF, avec Prise 12V pour Voiture, Performance 35) Noir",Thomson,,,"-100,00 %",,,"-100,00 %",,,"-100,00 %",,,
B0000AHIEL,"Hama Cadre Photo sans Cadre de 15 x 20 cm, Noir, 24 x 30 cm",Hama,,,"-100,00 %",,,"-100,00 %",,,"-100,00 %",,,
B0068QJHKE,"Rapoo Souris optique sans fil 2,4GHz ""1620"" (bluetooth, souris d'ordinateur, design, avec boutons et molette de défilement) Noir",Rapoo,,,,,,,,,,,"-100,00 %",
B001O18CDG,"Hama Antivol à combinaison (pour ordinateur portable, câble de 1,8 m, diamètre de 4 mm, sans clé, avec code) Argent",Hama,,,"-100,00 %",,,"-100,00 %",,,"-100,00 %",,,
B073CPQYY9,"Thomson Télécommande de rechange ""ROC1117GRU"" (Télécommande de remplacement pour les téléviseurs Grundig, prête à l'emploi, adaptative, mode SIMPLE, touches lumineuses, infrarouge) Noir",Thomson,,"-100,00 %",,,"-100,00 %",,,"-100,00 %",,,,
B07B2DS3CW,"Thomson Télécommande Universelle 2 en 1 Zapper ROC Z107 (Télécommande, Zapper, STB, TV, IR sans Fil, Boutons) Noir",Thomson,,,"-100,00 %",,,"-100,00 %",,,"-100,00 %",,,
B00194NBGG,"Hama Cadre photo Davos en métal, 10 x 15 cm, couleur : argent, argent",Hama,,,"-100,00 %",,,"-100,00 %",,,"-100,00 %",,,
B005MIGBDU,"Hama Support mural TV Ultraslim Orientable (pour diagonale d'écran de 25 à 66cm (10"" et 26""), pour un maximum de 25 kg, VESA jusqu'à 100 x 100, 5 étoiles) Blanc",Hama,,,"-100,00 %",,,"-100,00 %",,,"-100,00 %",,,"-100,00 %"
B08R597JY8,"Hama Album photo traditionnel ""Londres"" (Album photo 14.5 x 19.5 cm, 100 pochettes pour photos 13x18 cm,Idéal pour souvenirs de voyages, vacances, mariage, anniversaire) Gris",Hama,,"-100,00 %",,,"-100,00 %",,,"-100,00 %",,,,
B017IM48R8,"Hama Cadre Photo en Plastique Paris (Cadre de 15 cm x 20 cm, Bordures de 20 mm x 15 mm, pour Les Photo de Taille 10 cm x 15 cm, Verre Reflex, polystyrene (PS), avec Crochet et Pied) Cuivre",Hama,,"-100,00 %","-100,00 %",,"-100,00 %","-100,00 %",,"-100,00 %","-100,00 %",,,
B000X1BGWM,"Hama Fiche universelle pour prises d' allume-cigares (fiche de sécurité universelle 16 A prise allume-cigare, câbles jusqu'à 2 x 2,5 mm², 6V - 24V, fiche allume-cigare avec serre-câble) Rouge/Noir",Hama,,"-100,00 %","-100,00 %",,"-100,00 %","-100,00 %",,"-100,00 %","-100,00 %",,,"-100,00 %"
B00194JG0Q,"Hama Cadre Photo Métallique Davos pour Portrait, Doré, 13 x 18 cm",Hama,,,"-100,00 %",,,"-100,00 %",,,"-100,00 %",,,
B01L1LUAIS,"Protection d’écran en verre véritable pour iPhone 6 Pl/6s Pl/7 Pl/8 Pl",Hama,,"-100,00 %",,,"-100,00 %",,,"-100,00 %",,,,
B07K2RD3MZ,"Hama Clé USB Rotate 8 GB, 10 MB/s, avec accroche porte-clés, flashpen, emballage fin Noir/Argent",Hama,,"-100,00 %","-100,00 %",,"-100,00 %","-100,00 %",,"-100,00 %","-100,00 %",,,
B00A44MUY6,"Hama Chemin de câble (bande en PVC/Aluminium pour montage mural TV ou au sol, cache-câble demi-rond, 100 x 1,1 x 1 cm, entrée de câble jusqu'à 2 câbles, 4 pièces, matériel de montage compris) Blanc",Hama,,"-100,00 %","-100,00 %",,"-100,00 %","-100,00 %",,"-100,00 %","-100,00 %",,"-100,00 %",
B07Q4FLFQZ,"Hama X-Pointer Télécommande Pointeur Laser - Laser Rouge, Technologie Smart-Link, sans Fil 2.4 GHz - pour présentation Powerpoint - Noir",Hama,,"-100,00 %",,,"-100,00 %",,,"-100,00 %",,,,
B00006JBG4,"Hama Boîtier Standard (pour CD et disques Blu-Ray, Étui Protecteur pour CD, Paquet de 5) Noir/Transparent",Hama,,"-100,00 %","-100,00 %",,"-100,00 %","-100,00 %",,"-100,00 %","-100,00 %",,,"-100,00 %"
B01J54Z1RS,"Xavax Cuillère doseuse à café en acier inoxydable (pour environ 6 g de poudre de café, cuillère à mesurer en acier inoxydable, longueur de 16,8 cm, lavable au lave-vaisselle) Argent",xavax,,,"-100,00 %",,,"-100,00 %",,,"-100,00 %",,,
B00006JABA,"Hama Adhésif Cinekett (pour films Super 8, 100 pièces, S8, 1 piste audio libre) Blanc/Rouge",Hama,,,"-100,00 %",,,"-100,00 %",,,"-100,00 %",,,
B0000AIS8P,"Hama Cadre photo en plastique ""Décor Sevilla"" (taille du Cadre de 21 x 29,7 cm (DIN 4) avec bordure de 9 mm x 17 mm, pour une photo de 15 x 20 cm) Argent Mat",Hama,,,"-100,00 %",,,"-100,00 %",,,"-100,00 %",,,
B01KFLFBH0,"Hama Album photo vierge ""Bernd"" (album photo traditionnel format 29 cm x 32 cm, 50 pages, pour 250 photos 10 cm x 15 cm, format maximum 28 cm x 31 cm) Marron/Blanc/Noir",Hama,,,"-100,00 %",,,"-100,00 %",,,"-100,00 %",,,
B096XH84CL,"Hama Ecouteurs Bluetooth sans Fil Freedom Light (Ecouteurs TWS, Micro, Ecouteurs Intra Auriculaire, Station de Charge, Grande Autonomie, USB-C, Charge Rapide, Controle Vocale+Tactile) Noir",Hama,,"-100,00 %",,,"-100,00 %",,,"-100,00 %",,,,
B0002W697E,"Hama Cordon d’alimentation (Euro à 2 pôles de 2,5 m, droit, fiche d'alimentation à double prise Euro 8 avec contact de protection de terre) Noir",Hama,,,"-100,00 %",,,"-100,00 %",,,"-100,00 %",,,
B07ZDMHYMS,"Hama Clé USB C-Laeta (USB3.1/USB3.0 Type-C, 256GB, Double clé USB, pour Ordinateur Portable, téléphone Mobile, Tablette, OTG, 70 Mo/s, boîtier en métal, USB Type-C, clé de téléphone Portable) Argent",Hama,,,,,,,,,,,"-100,00 %",
B002GQOTTY,"Hama Clé USB 2.0 ""Laeta, 16 GB (Transfert de données à 10 Mo/s, clé USB avec Anneau œillet, Capuchon de Verrouillage, pour Windows/Macbook, en métal) Gris",Hama,,"-100,00 %","-100,00 %",,"-100,00 %","-100,00 %",,"-100,00 %","-100,00 %",,,
B07BZXVZWD,"Hama Câble de charge/données ""Magnetic"" (câble USB-A vers micro-USB-C, compatible avec Samsung, Huawei, LG, Sony, Xiaomi, Wiko, haute résistant, longueur de 1 m) Noir",Hama,,,"-100,00 %",,,"-100,00 %",,,"-100,00 %",,,
B01LZLUJHT,"Pêle-mêle de cadres photo pr portrt, 2 en 10 x 15 cm, 1 en 10 x 10 cm",Hama,,,"-100,00 %",,,"-100,00 %",,,"-100,00 %",,,
B017JY55K4,"Hama Carte mémoire Photo (Micro SDXC pour Photo/Classe 10, 64 GB - 80 MB/s, Adaptateur Photo) Noir",Hama,,"-100,00 %",,,"-100,00 %",,,"-100,00 %",,,,
B07F3RKPTB,"Hama Support mural pour Google Home mini (pour enceinte sans/avec fil, support d'enceinte, pour un alignement et une présentation optimaux de l'enceinte, montage mural) Blanc",Hama,,"-100,00 %","-100,00 %",,"-100,00 %","-100,00 %",,"-100,00 %","-100,00 %",,,
B00G3BMZDA,"Xavax Minuteur de cuisine ""Countdown"" (avec minuterie et fonction chronomètre, fixation via un aimant, une pince, un support ou un support, à piles, numérique) Noir/Blanc",xavax,,,"-100,00 %",,,"-100,00 %",,,"-100,00 %",,,
B005DJKF5I,"Hama Album Photo Singo (Album Auto-adhésif, 28 x 31 cm, 20 Pages, pour 60 Photos au Format 10 x 15 cm) Vert",Hama,,,"-100,00 %",,,"-100,00 %",,,"-100,00 %",,"-100,00 %",
B0069MD6LI,"THOMSON Casque sans Fil TV WHP3311W (sur l'oreille, avec Station de Recharge système, PLL, Circum-auriculaire, portée 100 m, 863 MHz, sans Fil) Blanc/Gris",Thomson,,,"-100,00 %",,,"-100,00 %",,,"-100,00 %",,,"-100,00 %"
B07RJNVVN6,"Hama Horloge Murale 25cm (Horloge Murale Ronde et Moderne, Pendule sans tic tac à Quartz, Fonction Hygromètre & Thermomètre, sur Piles, idéal Salon, Cuisine, Bureau, Chambre à Coucher) Blanc/Noir",Hama,,"-100,00 %",,,"-100,00 %",,,"-100,00 %",,,,
B0000AISC4,"Hama Cadre photo en plastique ""Sevilla"" (taille du Cadre de 24 x 30 cm avec bordure de 9 mm x 17 mm, pour une photo de 15 x 20 cm) Bleu",Hama,,,"-100,00 %",,,"-100,00 %",,,"-100,00 %",,,
B00006JBEE,"Hama Filtre anti-parasites (haute puissance, 10 A) Noir/Bleu/Rouge",Hama,,,"-100,00 %",,,"-100,00 %",,,"-100,00 %",,,"-100,00 %"
B0000AI3IQ,"Hama Cadre photo en plastique Sevilla (taille du Cadre de 50 x 70 cm avec bordure de 13 mm x 20 mm, pour une photo de 30 x 45 cm) Noir",Hama,,,"-100,00 %",,,"-100,00 %",,,"-100,00 %",,,
B005VNYXWM,"Cadre pour portrait photo ""Philadelphia"", 3x 13x18 cm",Hama,,,"-100,00 %",,,"-100,00 %",,,"-100,00 %",,,
B01M1SACZG,"Hama Cadre photo en plastique ""Saragossa"" (taille de cadre 10x15 cm, taille de photos 7x10 cm, photos format vertical, en plastique, 1 photo par cadre, élégant, simple, classique) Blanc",Hama,,,"-100,00 %",,,"-100,00 %",,,"-100,00 %",,,
B001JTTAQ6,"Hama Boîtier ""Slim"" double (pour DVD, convient également aux CD et disques Blu-ray, ultra mince, avec une feuille pour la couverture, lot de 5) Transparent",Hama,,"-100,00 %","-100,00 %",,"-100,00 %","-100,00 %",,"-100,00 %","-100,00 %",,,
B000XA1556,"Xavax Sécurité pour tuyau d' arrêt d'eau (pour tuyau d’entrée, Aqua-Stop pour lave-linge et lave-vaisselle, filetage standard 3/4 pouce) Dorée",xavax,,,"-100,00 %",,,"-100,00 %",,,"-100,00 %",,,
B002QPNGG2,"Hama Cadre Photo Bristol pour Portrait (Taille de Cadre 10x15 cm, Taille de Photos 10x15 cm, Photos Format Horizontal ou Vertical, en métal, 1 Photo par Cadre, élégant, Simple, Classique) Argent",Hama,,,"-100,00 %",,,"-100,00 %",,,"-100,00 %",,,
B08BF6DHXP,"Hama Album photo à pochettes ""Rainbow"" (album photo souvenirs 22 x 22,5 cm, 100 pages, 200 photos 10 x 15 cm, livre photo à pochettes idée cadeau anniversaire) Multicolore Arc en Ciel",Hama,,,"-100,00 %",,,"-100,00 %",,,"-100,00 %",,,"-100,00 %"
B0BXPLS7Z1,"Hama Classeur à négatifs (4 anneaux, niveau de remplissage 39 mm, feuilles rectangulaires, album à négatifs d'une pellicule photo) Bleu",Hama,,"-100,00 %",,,"-100,00 %",,,"-100,00 %",,,,
B017JY56TY,"Hama Album Photo ""Fine Art"" (format 36 x 32 cm, 50 pages blanches, à spirale) Kiwi",Hama,,,"-100,00 %",,,"-100,00 %",,,"-100,00 %",,"-100,00 %",
B00IZA0V4M,"Thomson Support Mural TV WAB846 (VESA 200x200, inclinable et orientable, avec 2 Bras, pour Une Diagonale d'écran de 25 à 117 cm (de 10"" à 46"")) Noir",Thomson,,,"-100,00 %",,,"-100,00 %",,,"-100,00 %",,,
B017JY4WEY,"Hama ""Fine Art"" Spiral Album, 24 x 17cm, 50 Photos, chalk",Hama,,"-100,00 %",,,"-100,00 %",,,"-100,00 %",,,,
B009HSQ3OS,"Hama Fine Art 50 pages Noires/à spirales 10608, Rose, 36 x 32 cm",Hama,,"-100,00 %","-100,00 %",,"-100,00 %","-100,00 %",,"-100,00 %","-100,00 %",,,
B07623M7YQ,"Hama Multiprise 4 Prises 16A avec Interrupteur individuel (Rallonge multiprises 1.4m, Bloc 4 prises Type F Schuko, Idéal Bureau PC luminaires, Atelier, Meuble TV, Garage )Noir",Hama,,"-100,00 %","-100,00 %",,"-100,00 %","-100,00 %",,"-100,00 %","-100,00 %",,,
B00005QFBX,"Classeur à négatifs, 4 anneaux, niv. rempl. 45mm, housse de protection",Hama,,,"-100,00 %",,,"-100,00 %",,,"-100,00 %",,,
B07B9SNGVJ,"Hama Mini album photo vierge à pochettes ""Blossom"" (album format 17,5 cm x 12 cm, 24 pages, 24 photos au format 10 cm x 15 cm, idéal pour un cadeau, insertion des photos par le haut) Lilas",UNKNOWN,,,"-100,00 %",,,"-100,00 %",,,"-100,00 %",,,
B06XCCSFMK,"Multiprise euro, 3 prises, blanche",Hama,,,"-100,00 %",,,"-100,00 %",,,"-100,00 %",,,
B00005K49X,"Hama Filtre UV (anti-UV et protection, compensation 4X, traitement antireflet, pour objectifs d'appareils photo 72 mm, O-Haze, traité) Noir",Hama,,,"-100,00 %",,,"-100,00 %",,,"-100,00 %",,,
B09GLCX9G9,"Hama Coque iPhone 13 Mini Étui Portefeuille Slim Pro pour Apple, Noir",Hama,,"-100,00 %",,,"-100,00 %",,,"-100,00 %",,,,
B07P8FSN9D,"Hama Album Photo Vierge Minimax Brushstroke (Album Photo Traditionnel 13 x 16,5 cm, 100 Pages pour 100 Photos Format 10 x 15 cm, Protection idéale, Artistique, élégant) Vert/Jaune/Marron/Blanc",Hama,,,"-100,00 %",,,"-100,00 %",,,"-100,00 %",,,"-100,00 %"
B01MRVHE6N,"Xavax Balles de séchage (en laine, 3 pièces, 100% naturelles en laine de mouton, idéales aussi pour le duvet, balles de séchage) Blanc",xavax,,,,,,,,,,,"-100,00 %",
B000X9XCSK,"Xavax Collier de serrage, 20-32 mm",xavax,,,"-100,00 %",,,"-100,00 %",,,"-100,00 %",,,
B0000AISCX,"Hama Cadre Photo Clip-Fixe (sans Bordure, 30 X 45 Cm, Anti-Reflex) Blanc",Hama,,"-100,00 %","-100,00 %",,"-100,00 %","-100,00 %",,"-100,00 %","-100,00 %",2,"-50,00 %",
B07MFZ6N7M,"Perche à Selfies Fun 70"", Bluetooth, Noir",Hama,,"-100,00 %",,,"-100,00 %",,,"-100,00 %",,,"-100,00 %",
B01KAD4TK8,"Hama Télécommande universelle ""Smart TV"" 4 en 1 (Contrôle 4 Appareils Préprogrammés, TV/DVD/STB/VCR, Télécommande de Remplacement pour Télécommande MultiFonction IR) Noir",Hama,,,"-100,00 %",,,"-100,00 %",,,"-100,00 %",,,"-100,00 %"
B0BXPLPKZD,"Hama Classeur à négatifs (4 anneaux, niveau de remplissage 39 mm, feuilles rectangulaires, album à négatifs d'une pellicule photo) Rose",Hama,,"-100,00 %",,,"-100,00 %",,,"-100,00 %",,,,
B0BL1SLJPB,"Hama Support Téléphone Voiture Flipper (Fixation sur Grille aération, pivotable 360°, pour Smartphone de 6 à 8 cm, compacte) Noir",Hama,,"-100,00 %",,,"-100,00 %",,,"-100,00 %",,,,
B08R2K1WQG,"Hama Câble Audio USB-C vers RCA mâle (Cable Audio Adaptateur USB C vers RCA, Garantie 10 Ans, stéréo, 1,50 m) Noir",Hama,,,"-100,00 %",,,"-100,00 %",,,"-100,00 %",,,
B0CBCMH2BZ,"Hama Multiprise Cube avec Interrupteur (Rallonge multiprise 1.4m, Bloc 3 Prises Terre F Schuko + 2 USB-A + 2 USB-C, 3680W 16A Idéal Bureau Cuisine Salon Atelier Garage PC luminaires Meuble TV) Blanc",Hama,,"-100,00 %",,,"-100,00 %",,,"-100,00 %",,,,
B07BBDFW78,"Hama Spray de nettoyage ""AntiDust"" (volume de 400 ml, gaz stable, ettoyant, pour appareils photo/ordinateurs/claviers, vanne de pulvérisation, tube capillaire) Blanc/Bleu",Hama,,,"-100,00 %",,,"-100,00 %",,,"-100,00 %",,,
B079NH8MDY,"Hama Lot de Protections de joysticks 8 en 1' pour Nintendo Switch, muticol.",Hama,,"-100,00 %","-100,00 %",,"-100,00 %","-100,00 %",,"-100,00 %","-100,00 %",,,
B0000AHIBP,"Hama Boîtier standard (pour 3 DVD, convient également aux CD et disques Blu-ray, avec film pour l'insertion de la jaquette, lot de 5) Noir",Hama,,,"-100,00 %",,,"-100,00 %",,,"-100,00 %",,,
B00IZA0RSM,"Thomson Support Mural TV WAB546 (VESA jusqu'à 200x200, Fixe, pour Une Diagonale d´écran de 25 à 117 cm (de 10' à 46')) Noir",Thomson,,"-100,00 %","-100,00 %",,"-100,00 %","-100,00 %",,"-100,00 %","-100,00 %",,"-100,00 %","-100,00 %"
B00T7MB37Q,"Hama Album photo à pochettes ""New York City"" (pour 300 photos au format 10 cm x 15cm, taille de l'album de 19 cm x 34,5 cm, 100 pages, en cuir, protège les photos et les documents) Noir",Hama,,,"-100,00 %",,,"-100,00 %",,,"-100,00 %",,,
B002IK2SNM,"Hama - 20563 - Colliers de serrage pour câbles, Champ inscriptible, 98mm, 25 pces, Naturel",Hama,,,"-100,00 %",,,"-100,00 %",,,"-100,00 %",,,
B000L9MBGQ,"Hama Album CD/DVD/Blu-Ray (pour 28 CD/DVD/Blu-ray, construction stable avec panneaux latéraux en bois) Noir/Marron",Hama,,,"-100,00 %",,,"-100,00 %",,,"-100,00 %",,,
B00194JFW0,"Cadre pour portrait ""Laval"", 3x 13x18 cm",Hama,,"-100,00 %","-100,00 %",,"-100,00 %","-100,00 %",,"-100,00 %","-100,00 %",,,
B00F955SDU,"Hama Antenne intérieure (antenne radio pour l'amplification du signal actif jusqu'à 30 dB, puissance de l'amplificateur réglable, hauteur de 31 cm, DAB/DAB+, en long) Noir",Hama,,,"-100,00 %",,,"-100,00 %",,,"-100,00 %",,,"-100,00 %"
B0015LCK38,"Hama Films pour plastifieuse à chaud, format carte de visite, 80µ, 100 pièces",Hama,,,"-100,00 %",,,"-100,00 %",,,"-100,00 %",,,
B0000AISQG,"Hama Passe-partout Premium, ivoire, 30 x 40 cm",Hama,,"-100,00 %","-100,00 %",,"-100,00 %","-100,00 %",,"-100,00 %","-100,00 %",,,
B08FSZRZ4S,"Hama Étui pour Samsung Galaxy Tab S7 11 pouces et S-Pen (étui de tablette à rabat, étui de protection avec fonction support, fermeture magnétique avec fonction veille/réveil automatique, matériau résistant Noir",Hama,,"-100,00 %",,,"-100,00 %",,,"-100,00 %",,,,
B0000AHID2,"Hama Cadre photo en plastique ""Décor Sevilla"" (taille du Cadre de 9 x 13 cm avec bordure de 9 mm x 17 mm, pour une photo de 5 x 7 cm) Argent Mat",Hama,,,"-100,00 %",,,"-100,00 %",,,"-100,00 %",,,
B07XM7M6TG,"Hama Support universel voiture ""Magnet Vent"" (pour tous les smartphones et tablettes, fente aération, poids de 36 g) Noir",Hama,,,"-100,00 %",,,"-100,00 %",,,"-100,00 %",,,
B000NQQ3J8,"Hama Rouleau adhésif ""Quick-Fix"" (ruban adhésif de 8mm x 12m, double face, rechargeable, pour photos, scrapbooking,...) rouge",Hama,,,"-100,00 %",,,"-100,00 %",,,"-100,00 %",,,
B0000AIRXC,"Hama Cadre photo en plastique ""Sevilla"" (taille du Cadre de 30 x 45 cm avec bordure de 9 mm x 17 mm, pour une photo de 20 x 30 cm) Blanc",Hama,,,"-100,00 %",,,"-100,00 %",,,"-100,00 %",,,
B08SDR49RS,"Hama Radio Internet Dab/Dab+/FM, Bluetooth RX+TX DIR3510SCBTX (Radio numérique avec Lecteur CD, Compatible Spotify Connect, UNDOK App Control pr Smartphone ou Tablette, Télécommande, Réveil) Noir",Hama,,,"-100,00 %",,,"-100,00 %",,,"-100,00 %",,,
B007M6NI18,"Hama Rallonge allume-cigares ( pour voiture, pour allume-cigare, câble de 1,5 m, adapté aux 12-24 V, pour voiture/camion/véhicule de loisirs/caravanes, fusible de 8 A maximum) Noir",Hama,,,,,,,,,,,,"-100,00 %"
B01GKI0ES8,"Hama Support universel voiture ""Magnet Alu"" (pour tous les smartphones et tablettes, fente aération, poids de 52 g) Noir/Gris",Hama,,,"-100,00 %",,,"-100,00 %",,,"-100,00 %",,,
B000X9VFVG,"Xavax Colliers de serrage (jeu de 2 colliers de serrage avec entraînement par vis sans fin, plage de serrage 90 - 110 mm, largeur de courroie 9 mm) Argent",xavax,,,"-100,00 %",,,"-100,00 %",,,"-100,00 %",,,"-100,00 %"
B0038HP8KE,"Xavax - 111059 - Porte-capsules à café ""Donatore"" pour Nespresso, 36 capsules",xavax,,,"-100,00 %",,,"-100,00 %",,,"-100,00 %",,,
B00006JDJU,"Hama - 46020H - Micro monophonique, finition noire métal, jack de 3,5mm et adaptateur 3,5/6,35 mm, interrupteur marche/arrêt sur le micro, 600 Ohms, dynamique et unidirectionnel - Cordon 3.00m",Hama,,"-100,00 %",,,"-100,00 %",,,"-100,00 %",,,,
B00283V7OA,"Hama 2 Accus (LR03, 700 mAh, rechargeables, 2 piles NiMH, 1,2 V, adapté aux téléphones sans fil) Vert/Blanc",Hama,,,"-100,00 %",,,"-100,00 %",,,"-100,00 %",,,
B00EYVW7QQ,"Hama Bloc multiprises, 3 prises, avec interrupteur, 3m, Blanc",Hama,,,"-100,00 %",,,"-100,00 %",,,"-100,00 %",,,
