B00006JCOK,"Hama Support mural tubulaire pour fixation de parabole/antenne en aluminium",Hama,"0,00 €",,,0,,,,,,,,,,,,,,
B09R4TJDBQ,"Hama Coque S22 (5G) Invisible pour Samsung (Etui de Protection Rigide Galaxy S22, Cadre Anti-Chocs, Protège des Rayures et saleté, comptatible Chargement sans Fil) Transparent, Noir",Hama,"0,00 €",,,0,,,,,,,,,,,,,,
B08BFMYCJ2,"Hama Album photo Jumbo ""Romance"" à personnaliser (Album Photo Livre de Mariage ou naissance bébé, Livre d'or ou cadeau, 22,5x22 cm, 100 pages, Motif cœur, Titre Love, 200 photos 10x15 cm) Beige/Blanc",Hama,"0,00 €","-100,00 %","-100,00 %",0,"-100,00 %","-100,00 %",,"-100,00 %","-100,00 %",,"-100,00 %","-100,00 %",,"-100,00 %","-100,00 %",,,
B07CH2QZ83,"Hama Album photo grand format ""Decori II"" (album de 30 x 30 cm, à coller de 400 photos format 10 x 15 cm, 100 pages (4 photos/page), pas d'inscription) Bleu",Hama,"0,00 €",,,0,,,,,,,,,,,,,,
B00U78QYHI,"Hama Clé USB 3.0 ""Laeta, 64 Go, 40 Mo/s, Marron",Hama,"0,00 €",,,0,,,,,,,,,,,,1,,
B0000AHIH1,"Hama Boîtier ""Slim"" (pour CD et disques Blu-ray, ultra mince, avec une feuille pour la couverture, lot de 5) Noir/Transparent",Hama,"0,00 €","-100,00 %",,0,"-100,00 %",,,"-100,00 %",,,"-100,00 %",,,"-100,00 %",,1,,
B000Y2XOQG,"Hama Trendwerk77–j-Straps-étui carquois pour téléphone Portable-eL Barto Chaussettes",Hama,"-6,78 €",,,-1,,,,,,,,,,,,,,
B0002W5VS2,"Hama 17495 Accessoire audio Etui Wallker pour baladeur CD + 12 CD + accessoires (piles, casques) Passant ceinture Bandoulière Bleu / Noir",Hama,"-8,56 €",,,-1,,,,,,,,,,,,,,
B07VBG77FH,"Hama Verre de protection (Full-Screen, pour Samsung Galaxy S10) Noir/Transparent",Hama,"-46,15 €","-200,00 %",,-5,"-200,00 %",,,,,,,,,,,,,
B0000AI2TB,"Hama Cadre photo ""Clip-Fixe"" (sans bordure, 50 x 75 cm, Anti-Reflex) Blanc",Hama,,,,,,,,,,,,,,,,,,
B09FBSHLTS,"Hama Hub USB C Connect2QiCharge (Adaptateur Multiports Ethernet/HDMI/VGA/4x USB-A/2xUSB-C (1PD)/Lecteur Cartes SD+Micro SD/Jack 3.5mm, Station d'acceuil 100W & Chargeur Induction Qi) Gris/Noir",Hama,,,"-100,00 %",,,"-100,00 %",,,"-100,00 %",,,"-100,00 %",,,"-100,00 %",,,
B07PGGWWJX,"Hama Chambre à air de vélo (taille de 27,5"", avec valve automatique Dunlop) Noir",Hama,,,"-100,00 %",,,"-100,00 %",,,"-100,00 %",,,"-100,00 %",,,"-100,00 %",,,
B0749PHPX4,"Thomson Casque sans fil TV ""WHP5327"" (Over-Ear, pour TV/Hifi/Smartphone/Tablette/Ordinateur portable, avec station de charge, portée sans fil 20 m) Noir",Thomson,,,"-100,00 %",,,"-100,00 %",,,"-100,00 %",,,"-100,00 %",,,"-100,00 %",,"-100,00 %",
B01LZLUJHT,"Pêle-mêle de cadres photo pr portrt, 2 en 10 x 15 cm, 1 en 10 x 10 cm",Hama,,,"-100,00 %",,,"-100,00 %",,,"-100,00 %",,,"-100,00 %",,,"-100,00 %",,,
B00005UPC3,"Hama Câble d'alimentation secteur 3 pôles terre (pour connecter divers appareils tels les appareils froids, mâle avec contact de protectection femelle 3 pôles, câble de longueur 1,5 m) Noir",Hama,,,"-100,00 %",,,"-100,00 %",,,"-100,00 %",,,"-100,00 %",,,"-100,00 %",,,
B096XM5NMX,"Hama ""Freedom Light Ecouteurs Bluetooth® sans Fil USB C - 7H d'Autonomie, Assistant Vocaux Siri & Google, Microphone Intégré, Commande Tactile - Rouge",Hama,,,,,,,,,,,,,,,,,"-100,00 %",
B00006JBEE,"Hama Filtre anti-parasites (haute puissance, 10 A) Noir/Bleu/Rouge",Hama,,"-100,00 %","-100,00 %",,"-100,00 %","-100,00 %",,"-100,00 %","-100,00 %",,"-100,00 %","-100,00 %",,"-100,00 %","-100,00 %",,"-100,00 %","-100,00 %"
B000VRCKS2,"Hama Album Photo Fine Art (Format 24 x 17 cm, 50 Pages Noires, à Spirale) Bleu",Hama,,,,,,,,,,,,,,,,,,
B07JX89WGL,"Plaque de fixation d’appareil photo/caméscope pour trépied ""Star 75""",Hama,,,"-100,00 %",,,"-100,00 %",,,"-100,00 %",,,"-100,00 %",,,"-100,00 %",,,
B07ZPFD8PJ,"Hama Album Photo ""Fine Art"" (format 18,5 x 15 cm, 36 pages blanches, à spirale) Noir",Hama,,,,,,,,,,,,,,,,,,
B0163ZHC38,"Hama Carte SDXC Classe 10 - Carte SD 64 Go, Vitesse jusqu'à 90 Mo/s, Carte Mémoire Compatible UHS-I, pour Ordinateur/Appareil Photo/Smartphone - Bleu",Hama,,"-100,00 %",,,"-100,00 %",,,"-100,00 %",,,"-100,00 %",,,"-100,00 %",,,,
B01KAD9SCM,"Hama Kit de nettoyage photo ""Optic Dry Basic"" (stylo de nettoyage, soufflet, chiffon de nettoyage en microfibre, pour nettoyer les appareils photo reflex, objectifs, filtres, 3 pièces) Rouge",Hama,,,"-100,00 %",,,"-100,00 %",,,"-100,00 %",,,"-100,00 %",,,"-100,00 %",,,
B08YS3CC9W,"Hama Câble HDMI (Cable HMDI ultra haute vitesse, Certifié, Mâle-Mâle, Ultra HD, 8K@60 Hz /4K@120Hz, 1.0m, Garantie 30ans, résolution 7680x4320pixels, EARC supportant les formats audio) Gris Noir",Hama,,"-100,00 %",,,"-100,00 %",,,"-100,00 %",,,"-100,00 %",,,"-100,00 %",,,,
B002L4QB3I,"Hama Clé USB 2.0 ""Smartly"", 8 GB (10 MB/s, Flashpen Rotate) Noir",Hama,,,,,,,,,,,,,,,,,,
B007M6NGC4,"Hama Adaptateur d'antenne (fiche mâle DIN - fiche femelle ISO) Noir/Argent",Hama,,"-100,00 %","-100,00 %",,"-100,00 %","-100,00 %",,"-100,00 %","-100,00 %",,"-100,00 %","-100,00 %",,"-100,00 %","-100,00 %",,,
B0000AIS82,"Hama Cadre photo ""Clip-Fixe"" (sans bordure, 40 x 60 cm, Reflex) Blanc",Hama,,,"-100,00 %",,,"-100,00 %",,,"-100,00 %",,,"-100,00 %",,,"-100,00 %",,,
B08SF57MNJ,"Hama Adapt. Audio, Jack mâle 3,5 mm 2X 3 br. - Casque Micro Jack 3,5 mm 4 br., Métal, Garantie 10 Ans, Noir",HAMA,,"-100,00 %",,,"-100,00 %",,,"-100,00 %",,,"-100,00 %",,,"-100,00 %",,,,
B0000AI3DP,"Hama Cadre photo en plastique ""Décor Sevilla"" (taille du Cadre de 50 x 70 cm avec bordure de 13 mm x 20 mm, pour une photo de 30 x 45 cm) Argent Mat",Hama,,"-100,00 %",,,"-100,00 %",,,"-100,00 %","-100,00 %",,"-100,00 %","-100,00 %",,"-100,00 %","-100,00 %",,,"-100,00 %"
B07PD148G7,"Hama Mini-Album Photo à Pochettes Brushstroke (Album Photo Traditionnel 13 x 16,5 cm, 24 Pages pour 24 Photos Format 10 x 15 cm, Protection idéale, Artistique, élégant) Violet/Jaune/Orange/Blanc",Hama,,"-100,00 %","-100,00 %",,"-100,00 %","-100,00 %",,"-100,00 %",,,"-100,00 %",,,"-100,00 %",,,,
B07KKTF5JW,"Hama Chargeur pour voiture, USB Type-C, 2,4 A, noir",Hama,,,,,,,,,"-100,00 %",,,"-100,00 %",,,"-100,00 %",,,
B076239MY8,"Hama 00137237 Alimentation pour PC",Hama,,,"-100,00 %",,,"-100,00 %",,,"-100,00 %",,,"-100,00 %",,,"-100,00 %",,,
B00006JCUB,"Hama Multiprise 3 Prises 16A avec Interrupteur (Rallonge multiprises 1.4m, Bloc 3 Prises Type F Schuko, Idéal Bureau PC luminaires, Atelier, Meuble TV, Garage) Blanc",Hama,,,"-100,00 %",,,"-100,00 %",,,,,,,,,,,,
B00006J6H0,"Hama Adaptateur d'antenne (fiche ISO mâle 90° - fiche DIN Femelle) Argent",Hama,,,"-100,00 %",,,"-100,00 %",,,"-100,00 %",,,"-100,00 %",,,"-100,00 %",,,
B0B59SP3PC,"Hama Clé WiFi Nano N150 (Adaptateur USB WiFi, Dongle WiFi USB 2.0n 2.4GHz, 150Mbit/s, Compatible WPA/WPA2 et WEP 128/64 Bits)",Hama,,"-100,00 %",,,"-100,00 %",,,"-100,00 %",,,"-100,00 %",,,"-100,00 %",,,,
B07PCQGGBF,"Hama Album Photo Vierge Grand Format Brushstroke (Album Photo Traditionnel 30 x 30 cm, 80 Pages pour 320 Photos Format 10 x 15 cm, Protection idéale, Artistique, élégant) Bleu/Jaune/Orange/Blanc",Hama,,,"-100,00 %",,,"-100,00 %",,,"-100,00 %",,,"-100,00 %",,,"-100,00 %",,,
B0009N8N9S,"Hama Marqueurs (pour CD-ROM/DVD/Blu-ray, 3 marqueurs, 1 effaceur marqueur, lot de 4 pièces) Noir/Rouge/Bleu",Hama,,,"-100,00 %",,,"-100,00 %",,,"-100,00 %",,,"-100,00 %",,,"-100,00 %",,,
B0BL1TSV73,"Hama Chargeur Rapide iPhone 38W (Chargeur USB-C Rapide, Chargeur Qualcomm Quick Charge 3.0, Mini Compact, Chargeur PD Secteur, 1 Port USB-C PD + 1 Port USB- A QC) Blanc",Hama,,"-100,00 %",,,"-100,00 %",,,"-100,00 %",,,"-100,00 %",,,"-100,00 %",,,,
B0BL1TNR1M,"Hama Câble iPhone USB-A Lightning (Câble de charge/transfert de données/Data, USB-A 2.0 mâle vers Lightning, 1m, Certifié MFI, 480 MBit/s, iPad/iPhone 13/12/11/XS/XR/X/8/7/7+/6s/6/5/SE2020) Blanc",Hama,,"-100,00 %","-100,00 %",,"-100,00 %","-100,00 %",,"-100,00 %","-100,00 %",,"-100,00 %","-100,00 %",,"-100,00 %","-100,00 %",,,
B00JY6VG18,"Hama Câble audio à fibre optique avec prise ODT Plaqué or 0,75 m",Hama,,,"-100,00 %",,,"-100,00 %",,,"-100,00 %",,,"-100,00 %",,,"-100,00 %",,,
B0CP86445V,"Black Rock Coque pour iPhone 15 Pro 360° Glass Double Face, Antichoc [Etui Housse 360 Degrés] [Coque iPhone Compatible Charge sans Fil] - Noir Carbon","Black Rock",,,,,,,,,,,,,,,,,"-100,00 %",
B0000AIS5M,"Hama 00066224 Cadre en plastique Sevilla, Noir, 28 x 35 cm",Hama,,,"-100,00 %",,,"-100,00 %",,,"-100,00 %",,,"-100,00 %",,,"-100,00 %",,,"-100,00 %"
B0000AIRTH,"Hama Cadre photo en plastique ""Décor Sevilla"" (taille du Cadre de 30 x 45 cm avec bordure de 9 mm x 17 mm, pour une photo de 20 x 30 cm) Or Mat",Hama,,,"-100,00 %",,,"-100,00 %",,,"-100,00 %",,,"-100,00 %",,,"-100,00 %",,,"-100,00 %"
B01AUBT1F8,"Cordon d’alimentation Euro pour Sonos PLAY:3/PLAY:5, droit, 5m, noir",Hama,,,,,,,,,,,,,,,,,,
B017IM3KLS,"Hama Cadre photo en plastique ""Paris"" (cadre de 20 cm x 30 cm, bordures de 20 mm x 15 mm, pour les photo de taille 13 cm x 18 cm, verre reflex, polystyrene (PS), avec crochet) Cuivre",Hama,,,"100,00 %",,,"100,00 %",,,,,,,,,,,,
B005VNYXOA,"Hama Cadre pour Portrait Photo Philadelphia, 13 x 18 cm",Hama,,,"-100,00 %",,,"-100,00 %",,,,,,,,,,,,
B0000AISC4,"Hama Cadre photo en plastique ""Sevilla"" (taille du Cadre de 24 x 30 cm avec bordure de 9 mm x 17 mm, pour une photo de 15 x 20 cm) Bleu",Hama,,,"-100,00 %",,,"-100,00 %",,,"-100,00 %",,,"-100,00 %",,,"-100,00 %",,,
B01A72KJ1U,"Hama Cordon d’alimentation Euro (coudé à 90 degrés des deux côtés, fiche secteur vers prise double Euro 8 avec contact de protection de terre, coudé des deux côtés, 3 m) Noir",Hama,,,,,,,,,,,,,,,,,,
B00006JA8E,"Hama Étuis à négatifs (Lot de 25 Pochettes Rangement Diapos/Negatifs pour Classeurs à Anneaux, 40 Negatifs par Feuille, Polypropylène)",Hama,,,,,,,,,,,,,,,,,,
B07CQCWLFL,"Hama “Fine Art"" Spiral Album, 24 x 17 cm, 50 Photos, flamingo",Hama,,,"-100,00 %",,,"-100,00 %",,,"-100,00 %",,,"-100,00 %",,,"-100,00 %",,,
B00O4Y5RV0,"Hama 00057998 Cadre photo pour portrait Cape Coral, Blanc (taille de cadre 10x15 cm, photos format horizontal ou vertical, en métal, 1 photo par cadre, élégant, simple, classique)",Hama,,,"-100,00 %",,,"-100,00 %",,,"-100,00 %",,,"-100,00 %",,,"-100,00 %",,,
B0BL1T9GPQ,"Hama Câble iPhone Reflective (Câble de charge/transfert de données USB-A 2.0 mâle vers Lightning, Certifié MFI, plaqué or, 480 MBit/s, 1.5 m, iPad/iPhone 13/12/11/XS/XR/X/8/7/7+/6s/6/5/SE2020) Rouge",Hama,,,"-100,00 %",,,"-100,00 %",,,"-100,00 %",,,"-100,00 %",,,"-100,00 %",,,
B0BL1WPKVV,"Hama MW-300 V2 Souris sans Fil - Technologie 2.4Ghz, Capteur 1600 dpi, Clics Silencieux, Ambidextre - Jaune",Hama,,"-100,00 %",,,"-100,00 %",,,"-100,00 %",,,"-100,00 %",,,"-100,00 %",,,,
B08YS3XVDK,"Hama Câble HDMI 4K Garantie 10 ans (Cable HDMI High Speed avec Ethernet, Cordon HDMI 4k, 5m, mâle-mâle, Câble Ethernet HEC, Retour Audio, HDR, 18 Gbit/s, 600MHz, Résolution 4096x2160, Blindé) Noir",Hama,,,"-100,00 %",,,"-100,00 %",,,"-100,00 %",,,"-100,00 %",,,"-100,00 %",,,
B00006JA36,"Hama - 46040H - Micro monophonique, finition argent, jack de 3,5mm et adaptateur 3,5/6,35 mm, prise XLR, interrupteur marche/arrêt sur le micro, 600 Ohms, dynamique et unidirectionnel - Cordon 3.00m",Hama,,,"-100,00 %",,,"-100,00 %",,,"-100,00 %",,,"-100,00 %",,,"-100,00 %",,,
B0000AI3IQ,"Hama Cadre photo en plastique Sevilla (taille du Cadre de 50 x 70 cm avec bordure de 13 mm x 20 mm, pour une photo de 30 x 45 cm) Noir",Hama,,,"-100,00 %",,,"-100,00 %",,,"-100,00 %",,,"-100,00 %",,,"-100,00 %",,,"-100,00 %"
B008IBBY1M,"Hama Support Mural TV Tilt (pour Diagonale d'écran de 25 à 66cm (10"" et 26""), pour Un Maximum de 30 kg, VESA jusqu'à 100 x 100, 1 étoile) Noir",Hama,,"-100,00 %",,,"-100,00 %",,,"-100,00 %",,,"-100,00 %",,,"-100,00 %",,,,
B07N6LC9FJ,"Hama Album photo vierge ""Stones"" (album photo traditionnel format 19 cm x 25 cm, pour 200 photos 10 cm x 15 cm, 100 pages, emplacement CD) Gris/Rose/Blanc/Bleu",Hama,,,,,,,,,,,,,,,,,,
B01LZXLX9Z,"Pêle-mêle de cadres photo pr portrt, 2 en 10 x 15 cm, 1 en 10 x 10 cm",Hama,,"-100,00 %",,,"-100,00 %",,,"-100,00 %",,,"-100,00 %",,,"-100,00 %",,,,
B0000AIRXC,"Hama Cadre photo en plastique ""Sevilla"" (taille du Cadre de 30 x 45 cm avec bordure de 9 mm x 17 mm, pour une photo de 20 x 30 cm) Blanc",Hama,,"-100,00 %",,,"-100,00 %",,,"-100,00 %",,,"-100,00 %",,,"-100,00 %",,,,
B01AAEJWM2,"Xavax Ampoule pour four (15 W, E14, 85 lm, 1000 h, blanc chaud, forme ampoule) blanc chaud",Xavax,,,,,,,,,,,,,,,,,,
B003589J1A,"Hama Câble de liaison ""AluLine"" (fiche jack 3,5 mm, mâle - mâle, stéréo, gaine en tissu, 0,5 m) Argent",Hama,,,"-100,00 %",,,"-100,00 %",,,"-100,00 %",,,"-100,00 %",,,"-100,00 %",,,
B07JKT7GBS,"Chargeur pour Voiture, USB Type-C, 2,4 A, Noir",Hama,,,"-100,00 %",,,"-100,00 %",,,"-100,00 %",,,"-100,00 %",,,"-100,00 %",,,
B00N4ORI6S,"Hama Support mural orientable pour TV Fullmotion (58-142 cm (23-56 pouces), VESA 400x400, max. 35 kg, entièrement mobile) Noir",Hama,,,"-100,00 %",,,"-100,00 %",,,"-100,00 %",,,"-100,00 %",,,"-100,00 %",,,
B001N5705Y,"Hama Plateau tournant pour téléviseur (jusqu'à 60 kg, pivotable à 360°, 80 x 40 cm, verre) Noir",Hama,,,,,,,,,,,,,,,,,,
B01DF1Y9Q6,"Hama Support mural TV fixe (pour une diagonale d’écran de 48 à 122 cm (19"" à 48"")) Noir",Hama,,,"-100,00 %",,,"-100,00 %",,,"-100,00 %",,,"-100,00 %",,,"-100,00 %",,,"-100,00 %"
B0015L7I9E,"Hama Films pour plastifieuse à chaud, DIN A4, 80µ, 25 pièces",Hama,,"-100,00 %","-100,00 %",,"-100,00 %","-100,00 %",,"-100,00 %","-100,00 %",,"-100,00 %","-100,00 %",,"-100,00 %","-100,00 %",,,
B0000AISE1,"Hama Cadre photo ""Clip-Fixe"" (sans bordure, 29,7 x 42 cm, Anti-Reflex) Blanc",Hama,,"-100,00 %","-100,00 %",,"-100,00 %","-100,00 %",,"-100,00 %","-100,00 %",,"-100,00 %","-100,00 %",,"-100,00 %","-100,00 %",,,
B00IZA0V56,"Thomson Support Mural TV WAB646, (VESA jusqu'à 200x200, Inclinable, pour Une Diagonale d´écran de 25 à 117 cm (de 10' à 46')) Noir",Thomson,,"-100,00 %",,,"-100,00 %",,,"-100,00 %",,,"-100,00 %",,,"-100,00 %",,,,
B00006IVAR,"Hama Bague d'adaptation (en métal, pour monter un Filtre de 46 mm sur un Objectif de 37 mm) Noir",Hama,,,,,,,,,,,,,,,,,,
B078MNXNNS,"Hama Cadre Photo en Plastique Rio (Cadre de 15 cm x 20 cm, Bordures de 25 mm x 16 mm, pour les Photo de Taille 10 cm x 15 cm, Verre reflex, Bois-plastique (WPC), avec Crochet et Pied) Noir",UNKNOWN,,,"100,00 %",,,"100,00 %",,,,,,,,,,,,
B0015IQ2JO,"Hama Cadre photo en plastique ""Sevilla"" (taille du Cadre de 30 x 30 cm avec bordure de 13 mm x 17 mm, pour une photo de 20 x 20 cm) Noir",Hama,,,"-100,00 %",,,"-100,00 %",,,"-100,00 %",,,"-100,00 %",,,"-100,00 %",,,
B07BRNCRMN,"Hama Souris sans fil compacte ""Milano"" (souris sans fil avec piles, plage sans fil de 8 m, vitesse de rotation jusqu'à 4400 vitesses, jusqu'à 2400 ppp, boutonS avant/arrière, ergonomique) Noir",Hama,,,,,,,,,,,,,,,,,,
B01LGPFYXA,"Hama Chargeur, 1A, noir",UNKNOWN,,,"-100,00 %",,,"-100,00 %",,,"-100,00 %",,,"-100,00 %",,,"-100,00 %",,,
B00006JE6G,"Hama Bague d'adaptation (en métal, pour monter un Filtre de 52 mm sur un Objectif de 46 mm) Noir",Hama,,,,,,,,,,,,,,,,,,
B00006J4IM,"Hama Préamplificateur phono stéréo ""PA 506"" (avec alimentation secteur 230V/50 Hz, pour platines, 3000mA, câble Cinch 0,9 m) Noir",Hama,,,"-100,00 %",,,"-100,00 %",,,"-100,00 %",,,"-100,00 %",,,"-100,00 %",,,
B001AGFCZG,"Hama Kit d'alimentation (kit AMP avec câbles d'alimentation de 10 mm², câbles RCA, porte-fusible, fusible, cosse, attache de câble) Noir/Rouge/Bleu/Transparent",Hama,,,"-100,00 %",,,"-100,00 %",,,"-100,00 %",,,"-100,00 %",,,"-100,00 %",,,
B08KR9VCF2,"Hama Coque iPhone 12/12 Pro Étui Portefeuille Slim Pro pour Apple, Noir",Hama,,,"-100,00 %",,,"-100,00 %",,,"-100,00 %",,,"-100,00 %",,,"-100,00 %",,,
B007WAYTLM,"Hama Tapis de Souris pour Souris Laser (Auto-adhésif, Amovible) Noir",Hama,,"-100,00 %","-100,00 %",,"-100,00 %","-100,00 %",,"-100,00 %","-100,00 %",,"-100,00 %","-100,00 %",,"-100,00 %","-100,00 %",,,
B005GCMZD2,"Hama Album photo à pochettes ""Singo"" (couverture souple, pour 24 photos au format 18x13 cm, résistant, protège la photo) Couleur aléatoire parmi Orange, Vert, Bleu et rose",Hama,,"-100,00 %","-100,00 %",,"-100,00 %","-100,00 %",,"-100,00 %","-100,00 %",,"-100,00 %","-100,00 %",,"-100,00 %","-100,00 %",,,
B0015L5HCE,"Hama Passe-partout Premium, blanc neige, 30 x 40, numérique",Hama,,,,,,,,"-100,00 %",,,"-100,00 %",,,"-100,00 %",,,,
B08M391XW9,"Hama Album Photo Couverture Rigide Tissu 30x30cm (Album Livre, 400 photos 10 x 15cm à coller, 100 pages blanches separées par Papier Cristal, Album Scrapbooking DIY Livre photo à Personnaliser) Gris",Hama,,"-100,00 %","-100,00 %",,"-100,00 %","-100,00 %",,"-100,00 %","-100,00 %",,"-100,00 %","-100,00 %",,"-100,00 %","-100,00 %",,"-100,00 %",
B08SF7DZLY,"Hama Hub USB multiport Data (4 ports, USB 2.0, Vitesse de Transfert de Données 480 Mbit/s, Interrupteur Marche/Arrêt, Témoin de fonctionnement à LED,Garantie 10 ans,Plug et Play,Compact, Robuste) Noir",Hama,,"-100,00 %",,,"-100,00 %",,,"-100,00 %",,,"-100,00 %",,,"-100,00 %",,,,
B0000AHIDZ,"Hama Cadre portrait (taille de cadre 13x18 cm, taille de photos 13x18 cm, acrylique, format vertical, en plastique, 1 photo par cadre, élégant, simple, classique) Gris",Hama,,,"-100,00 %",,,"-100,00 %",,,"-100,00 %",,,"-100,00 %",,,"-100,00 %",,,
B01M7PKUUC,"Hama Support mural (pour enceintes Bose SoundTouch 10/Bose SoundTouch 20, pivotantes, système Easy-Fix, support pour haut-parleur) Blanc",Hama,,,"-100,00 %",,,"-100,00 %",,,"-100,00 %",,,"-100,00 %",,,"-100,00 %",,,
B00U78QXOM,"Hama Cadre Photo métallique Davos pour Portrait, argenté, 10 x 20 cm",Hama,,,"-100,00 %",,,"-100,00 %",,,"-100,00 %",,,"-100,00 %",,,"-100,00 %",,,
B0BL1R3S16,"Hama Câble iPhone (Câble Lightning Certifié MFI, Câble Chargeur iPhone USB/Lightning, 1.5m, Refléchissant, Idéal Apple iPad/iPhone 14 13 12 11 Pro Max Plus mini SE XS Max XR X 8 7) Bleu",Hama,,"-100,00 %",,,"-100,00 %",,,"-100,00 %",,,"-100,00 %",,,"-100,00 %",,,,
B07FLBW42H,"Hama Casque TV ""Basic4TV"" (casque circum-auriculaire, bande passante de 20 Hz - 20 kHz, jack 3,52mm mâle, jack 6,35mm mâle, câble extra long de longueur 6 m) Noir",Hama,,,"-100,00 %",,,"-100,00 %",,,"-100,00 %",,,"-100,00 %",,,"-100,00 %",,,
B000JFVCK8,"Hama Adaptateur secteur (prise de voyage pour : Amérique, apon, Canada, Brésil, Thaïlande, ... adapté aux apparails avec fiche Euro) Blanc",Hama,,,"-100,00 %",,,"-100,00 %",,,"-100,00 %",,,"-100,00 %",,,"-100,00 %",,,
B0002VFOYY,"Hama Câble data USB pour NOKIA 3100 / 3200 / 3220 / 5100 / 5140 / 6100 / 6220 / 6610 / 6800 / 6810 / 6820/ 7200 / 7210 / 7250 / 7250i 00038416",Hama,,,"-100,00 %",,,"-100,00 %",,,,,,,,,,,,
B0CLD1CPZT,"Hama Support Mural TV 37 à 120 Pouces Inclinable Garantie 10ans (Fin, VESA 50 x 50 à 1100 x 600, jusqu'à 100 kg, écran de 94 à 305 cm, Faible Distance au Mur, avec Chevilles Fischer) Noir",Hama,,"-100,00 %",,,"-100,00 %",,,"-100,00 %",,,"-100,00 %",,,"-100,00 %",,,,
B08SF3HJ3W,"Hama Adaptateur Péritel (couplage péritel pour connexion TV spéciale Samsung port spécifique, péritel femelle - fiche mâle Samsung, Garantie 10 ans) Noir",Hama,,,,,,,,,,,,,,,,,,"-100,00 %"
B07DZYF6T7,"Nettoyant contacts, 400 ml",Hama,,"-100,00 %","-100,00 %",,"-100,00 %","-100,00 %",,"-100,00 %","-100,00 %",,"-100,00 %","-100,00 %",,"-100,00 %","-100,00 %",,,
B003TKJ6B2,"Hama Carte mémoire Photo (SDHC pour Photo/Classe 10, 16 GB - 22 MB/s) Bleu",Hama,,,"-100,00 %",,,"-100,00 %",,,"-100,00 %",,,"-100,00 %",,,"-100,00 %",,,
B000EW5338,"Hama Microphone (Jack 3,5mm, pour ordinateur portable, Col de cigne) Noir",Hama,,,"-100,00 %",,,"-100,00 %",,,"-100,00 %",,,"-100,00 %",,,"-100,00 %",,,"-100,00 %"
B00NCVRQK6,"Hama Support de barre de son pour téléviseur, universel pour tous les téléviseurs, tailles d'écran et barres de son (y compris Sonos Playbar), idéal en association avec les supports muraux pour téléviseurs, noir",Hama,,,"-100,00 %",,,"-100,00 %",,,"-100,00 %",,,"-100,00 %",,,"-100,00 %",,,
B011T76LXM,"Hama-câble d'antenne avec Prise coaxiale Femelle Blanc 3 m 90dB",Hama,,,"-100,00 %",,,"-100,00 %",,,"-100,00 %",,,"-100,00 %",,,"-100,00 %",,,
B0000AIS8J,"Hama Cadre photo en plastique ""Décor Sevilla"" (taille du Cadre de 24 x 30 cm avec bordure de 9 mm x 17 mm, pour une photo de 15 x 20 cm) Argent Mat",Hama,,,"-100,00 %",,,"-100,00 %",,,"-100,00 %",,,"-100,00 %",,,"-100,00 %",,,
B08R2JJ28Q,"Hama Câble Ethernet 5m Garantie 10ANS (Câble Réseau LAN, Cable RJ45, CAT8, 40 Gbit/s, S/FTP, blindé, contacts plaqués or, LSZH zéro halogène) noir",Hama,,,,,,,,,,,,,,,,,,"-100,00 %"
B0000AIS6A,"Hama - 63238 - Passe-partout Premium, blanc neige, 40 x 60 cm",Hama,,"-100,00 %",,,"-100,00 %",,,"-100,00 %",,,"-100,00 %",,,"-100,00 %",,,,
B01GKI0ES8,"Hama Support universel voiture ""Magnet Alu"" (pour tous les smartphones et tablettes, fente aération, poids de 52 g) Noir/Gris",Hama,,,"-100,00 %",,,"-100,00 %",,,"-100,00 %",,,"-100,00 %",,,"-100,00 %",,,
B002CU2WVQ,"Hama Boîtier de rangement mince ""SD Slim Box"" (pour carte mémoire SD, 1 carte) Transparent",Hama,,,"-100,00 %",,,"-100,00 %",,,"-100,00 %",,,"-100,00 %",,,"-100,00 %",,,
B00HE6BWH8,"Câble audio, Jack mâle 3,5 mm - Jack mâle 3,5 mm, mono, 1,5 m",Hama,,,,,,,,,,,,,,,,,,
B0CRZF12TM,"Hama Support TV sur Pied à roulettes avec Etagère Garantie 10ans (Pied TV Mobile, téléviseur 32"" à 75"" 40Kg, Hauteur Réglable, Support Mobile TV, Support de Sol, Compatible VESA jusqu'à 600x400) Noir",Hama,,"-100,00 %",,,"-100,00 %",,,"-100,00 %",,,"-100,00 %",,,"-100,00 %",,,,
B007929SC8,"Xavax Boîte en acier inoxydable (pour 1 kg de grains de café en poudre, pour le café, le thé, le cacao, une boîte de rangement à fermeture aromatique, étanche, 1000g) Argent",xavax,,"-100,00 %",,,"-100,00 %",,,"-100,00 %",,,"-100,00 %",,,"-100,00 %",,,,
B07NH4NX72,"Couvercle Pare-poussière pour écran, 30""/32"", transpar.",Hama,,,"-100,00 %",,,"-100,00 %",,,"-100,00 %",,,"-100,00 %",,,"-100,00 %",,,
B0BL1VJBJ4,"Hama MW-300 V2 Souris sans Fil - Technologie 2.4Ghz, Capteur 1600 dpi, Clics Silencieux, Ambidextre - Verte",Hama,,"-100,00 %",,,"-100,00 %",,,"-100,00 %",,,"-100,00 %",,,"-100,00 %",,,,
B0764L4DSY,"Hama Support mural pour Amazon Echo Dot (pour Echo Dot 2ème génération, support d'enceinte, montage mural) Blanc",Hama,,,,,,,,,,,,,,,,,,
B07RT5XDRY,"Coque de protec. ""Red Sensation No. 4"" pr Apple iPhone X/Xs, noir/rge",Hama,,,"-100,00 %",,,"-100,00 %",,,"-100,00 %",,,"-100,00 %",,,"-100,00 %",,,
B0BZDVTJ7S,"Hama ""Freedom Buddy Ecouteurs Bluetooth® sans Fil USB C -Technologie Bass Boost, 16H d'Autonomie, Touche Multifonctions, Assistants Vocaux Siri & Google - Bleu",Hama,,,"-100,00 %",,,"-100,00 %",,,"-100,00 %",,,"-100,00 %",,,"-100,00 %",,,
B078T67VPG,"Souris optique sans fil à 6 boutons ""MW-500"", noire",Hama,,,,,,,,,,,,,,,,,,
B07NH3HS75,"Couvercle Pare-poussière pour imprimante, Transparent",Hama,,"-100,00 %",,,"-100,00 %",,,"-100,00 %",,,"-100,00 %",,,"-100,00 %",,,,
B000V7MUQY,"Hama Album Photo Naissance 29x32cm Baby Feel (200 photos 10x15cm à coller, 60 pages blanches vierges, intercalaire Papier Cristal, Album Scrapbooking DIY Livre photo à Personnaliser, Motif Bébé) Beige",Hama,,"-100,00 %",,,"-100,00 %",,,"-100,00 %",,,"-100,00 %",,,"-100,00 %",,,,
B082WQS12G,"Hama Ampoule LED, E27, 1521lm rempl. 100W, amp. à incandes., BLC CHD, régl.",Hama,,"-100,00 %",,,"-100,00 %",,,"-100,00 %",,,"-100,00 %",,,"-100,00 %",,,,
B000EOVQQ4,"Hama Étui de Protection pour Samsung SGH-X660",Hama,,,,,,,,,,,,,,,,,,
B017JY4U5K,"Hama ""Fine Art"" Spiral Album, 24 x 17 cm, 50 Photos, kiwi",Hama,,,,,,,,,,,,,,,,,,"-100,00 %"
B07RLYK1T9,"Hama Trépied de Table Solid pour Smartphones et appareils Photos, 19B",Hama,,"-100,00 %",,,"-100,00 %",,,"-100,00 %",,,"-100,00 %",,,"-100,00 %",,,,
B005MIG87E,"Hama Support Mural TV Ultraslim Orientable (pour Diagonale d'écran de 25 à 66cm (10"" et 26""), pour Un Maximum de 25 kg, VESA jusqu'à 100 x 100, 5 étoiles) Noir",Hama,,"-100,00 %",,,"-100,00 %",,,"-100,00 %",,,"-100,00 %",,,"-100,00 %",,,,
B00194JG0Q,"Hama Cadre Photo Métallique Davos pour Portrait, Doré, 13 x 18 cm",Hama,,,"-100,00 %",,,"-100,00 %",,,"-100,00 %",,,"-100,00 %",,,"-100,00 %",,,
B07TPCMJSF,"Étui portefeuille ""Slim Pro"" pour Sony Xperia 1, noir",Hama,,"-100,00 %",,,"-100,00 %",,,"-100,00 %",,,"-100,00 %",,,"-100,00 %",,,,
B0002VFKYS,"Support pour ordinateur portable, 15,4'', 360°",Hama,,,"-100,00 %",,,"-100,00 %",,,"-100,00 %",,,"-100,00 %",,,"-100,00 %",,,
B001O18CDG,"Hama Antivol à combinaison (pour ordinateur portable, câble de 1,8 m, diamètre de 4 mm, sans clé, avec code) Argent",Hama,,,"-100,00 %",,,"-100,00 %",,,"-100,00 %",,,"-100,00 %",,,"-100,00 %",,,"-100,00 %"
B07N9H75PM,"Hama Étui Portefeuille Guard Pro pour Apple iPhone 6/6s, Noir",Hama,,,"-100,00 %",,,"-100,00 %",,,"-100,00 %",,,"-100,00 %",,,"-100,00 %",,,
B07P6CHN2G,"Hama Album photo vierge Minimax ""Brushstroke"" (Album photo traditionnel 13 x 16,5 cm , 100 pages pour 100 photos format 10 x 15 cm, protection idéale, artistique, élégant) Bleu/Jaune/Orange/Blanc",Hama,,,"-100,00 %",,,"-100,00 %",,,"-100,00 %",,,"-100,00 %",,,"-100,00 %",,,
