Programme=[Retail],Aperçu du distributeur.=[Fabrication],Afficher par=[ASIN],Pays=[FR],Entreprises=[~ Hama EURL (FR)],Local=[fr_FR],Devise=[EUR],Intervalle des rapports=[Mois],Champ de vision.=[01/05/2024 - 31/05/2024],Rapport mis à jour=[04/04/2025]
ASIN,"Nom du produit",Marque,"Chiffre d’affaires basé sur les commandes","Revenus basés sur les commandes – Période antérieure (%)","Revenus basés sur les commandes – Même période l'année dernière (%)","Unités commandées","Unités commandées – Période antérieure (%)","Unités commandées – Même période l'année dernière (%)","Chiffre d’affaires basé sur les expéditions","Revenus basés sur les expéditions – Période antérieure (%)","Revenus basés sur les expéditions – Même période l'année dernière (%)","COGS expédié","COGS expédié – Période antérieure (%)","COGS expédié – Même période l'année dernière (%)","Unités expédiées","Unités expédiées – Période antérieure (%)","Unités expédiées – Même période l'année dernière (%)","Retours client","Retours du client – Période antérieure (%)","Retours du client – Même période l'année dernière (%)"
B0000AI2SY,"Hama Cadre photo en plastique Sevilla (taille du Cadre de 40 x 60 cm avec bordure de 13 mm x 20 mm, pour une photo de 30 x 45 cm) Noir",Hama,"5 902,03 €","191,22 %","978,00 %",383,"230,17 %","1 176,67 %","5 824,98 €","172,39 %","1 000,61 %","3 496,50 €","209,84 %","1 345,67 %",378,"209,84 %","1 203,45 %",28,"0,00 %","833,33 %"
B00D2S92L0,"Xavax Hama Boîte de transport pour un gâteau (boîte rond, Ø 31,5 x 8cm, avec diviseur, capote et compartiments, partie de service et gâteau de gâteau) Anthracite/Transparent",xavax,"4 725,96 €","23,69 %","158,97 %",355,"23,69 %","228,70 %","4 646,04 €","21,80 %","147,50 %","2 502,33 €","22,46 %","219,18 %",349,"22,46 %","214,41 %",9,"125,00 %","350,00 %"
B00EUSMHE0,"THOMSON Kit Casque sans Fil TVWHP3203D (on-Ear, pour TV/HiFi, Circum-aural, supprimer Bruit Fond, 100 m) Noir",Thomson,"3 499,20 €","-8,71 %","5 432,33 %",60,"-7,69 %","5 900,00 %","3 732,48 €","1,89 %",,"4 491,52 €","3,23 %",,64,"3,23 %",,11,"120,00 %","266,67 %"
B00005QFCJ,"Hama Adaptateur Cassette VHS-C/VHS (Convertisseur Vidéo VHS C vers VHS, Cassette Adaptatrice Motorisée pour magnétoscope, 6 Mm, Non Compatible 8mm/MiniDV/Hi8) Noir",Hama,"2 829,05 €","-54,23 %","-42,99 %",91,"-56,46 %","-52,11 %","2 953,82 €","-55,21 %","-43,13 %","1 946,55 €","-57,38 %","-51,05 %",95,"-57,40 %","-52,26 %",59,"321,43 %","40,48 %"
B074JDHBXG,"Hama Cadre en Plastique Madrid (Taille de Cadre de 21 cm x 29,7 cm, Taille de la Photo de 15 cm x 20 cm, 1 Photo par Cadre, à accrocher, élégant, Simple, Classique) Noir",Hama,"2 747,63 €","61,29 %","93,93 %",678,"64,56 %","130,61 %","2 742,06 €","58,26 %","97,67 %","1 575,08 €","61,34 %","162,87 %",676,"61,34 %","137,19 %",5,"66,67 %","25,00 %"
B00006J4EP,"Hama Boîtier standard (pour CD et disques Blu-Ray, Étui protecteur pour CD, paquet de 10) Noir/Transparent",Hama,"2 715,62 €","-20,10 %","-29,78 %",228,"-22,45 %","-52,00 %","2 560,24 €","-26,43 %","-32,90 %","895,14 €","-33,33 %","-58,65 %",210,"-30,00 %","-55,13 %",8,"300,00 %","-20,00 %"
B003PFBLOQ,"Hama Horloge murale ""PP-245"" (radio-pilotée DCF, Pendule sans Tic Tac, Numérique, à led, sans fil, avec des piles, Format 24h, Calendrier, Jour, Thermomètre 0°C à +50°C, pause murale ou bureau) Plastique, Noir",Hama,"2 698,92 €","11,82 %","67,03 %",108,"12,50 %","107,69 %","2 748,90 €","16,02 %","68,65 %","1 970,65 €","17,98 %","130,60 %",110,"17,02 %","111,54 %",8,,"100,00 %"
B01N6NQ73J,"Thomson Casque TV avec câble extra long (Casque d'écoute ajustable et rembouré, Cordon 8m, Idéal pour regarder la télé, écouter la musique, contrôle du volume, prise jack 3,5mm+adaptat. 6,35mm) Noir",Thomson,"2 606,25 €","-29,74 %","-58,57 %",159,"-36,14 %","-63,53 %","2 617,69 €","-31,63 %","-51,14 %","1 743,71 €","-38,48 %","-52,95 %",160,"-37,74 %","-56,64 %",20,"185,71 %","11,11 %"
B0764LMPBN,"Hama Multiprise avec Interrupteur 10 Prises 16A (Rallonge multiprises 3m, Bloc 10 Prises Type F Schuko, 3500W Max, Idéal Bureau PC luminaires, Atelier, Meuble TV, Garage) Noir",Hama,"2 265,76 €","116,94 %","-39,01 %",136,"134,48 %","-39,01 %","2 232,44 €","114,88 %","-38,81 %","1 388,24 €","135,09 %","-33,56 %",134,"135,09 %","-38,81 %",6,"500,00 %","500,00 %"
B000EORX5W,"Hama 00033833 Pochette, Noir (pour 120 CD/DVD/Blu-ray, classeur de rangement, gain de place pour le bureau, le salon et la maison, étuis de transport)",Hama,"2 164,75 €","-12,06 %","35,89 %",135,"-14,56 %","32,35 %","2 196,07 €","-14,07 %","33,55 %","1 221,76 €","-16,95 %","38,43 %",137,"-16,46 %","30,48 %",6,"100,00 %",
B0032DAL6U,"Hama Album photo ''Catania'' (taille 22 x 22 cm pour 200 photos au format 10 x 15 cm, 100 pages, papier stratifié, thématique mariage/vacances, emplacement pour CD, personnalisable) Gris",Hama,"1 957,54 €","68,75 %","419,99 %",214,"71,20 %","590,32 %","1 948,38 €","69,30 %","402,96 %","1 058,61 €","71,70 %","541,54 %",213,"71,77 %","545,45 %",2,"100,00 %","-50,00 %"
B01N2RIZMU,"Xavax Socle universel ""Gigant"" (60 x 60 cm, augmentation de 50 cm, socle stable avec compartiment inférieur, pieds réglables en hauteur, socle pour lave-linge/sèche-linge) Blanc",xavax,"1 855,00 €","100,00 %","1 292,12 %",14,"100,00 %","1 300,00 %","1 722,50 €","85,71 %",,"1 227,33 €","93,66 %",,13,"85,71 %",,,"-100,00 %",
B01K47CMCM,"Hama Album photo vierge ""La Fleur"" (album photo traditionnel 22,5 cm x 22,5 cm, 100 pages, pour l'insertion de 200 photos au format 10 cm x 15 cm, motif de feuilles, pochette CD) Blanc",Hama,"1 847,79 €","-16,95 %","13 824,57 %",237,"-13,50 %","23 600,00 %","1 893,64 €","-12,98 %","7 116,62 %","1 486,91 €","-9,90 %","15 751,92 %",242,"-9,70 %","12 000,00 %",6,"50,00 %",
B00006JAXW,"Hama Plateau Universel Hama Rond (40 cm, Taille XL, Poids supporté 100 kg (idéal pour TV, Enceintes, écrans, appareils de Cuisine) Noir",Hama,"1 640,09 €","21,09 %",,66,"17,86 %",,"1 614,78 €","6,07 %","3 377,13 %","1 034,51 €","7,78 %","3 159,33 %",65,"3,17 %","3 150,00 %",1,"-88,89 %","-80,00 %"
B071ZVN9LP,"Hama Albums photos ""Designline"" (couverture souple, 24 pages pour 24 photos au format 10x15 cm par album, résistant, pour archiver avec des anecdotes, protège la photo, mini album) Multicolore",Hama,"1 581,00 €","33,93 %","205,02 %",1 275,"33,93 %","205,02 %","1 553,72 €","31,07 %","196,92 %","1 102,64 €","31,07 %","200,28 %",1 253,"31,07 %","196,92 %",30,"50,00 %","200,00 %"
B01MS2OU9J,"Hama Chambre à air de vélo (Taille de 26"", avec Valve Automatique, Schrader) Noir",Hama,"1 566,86 €","34,19 %","2 142,86 %",314,"34,19 %","2 142,86 %","1 611,77 €","41,05 %","3 488,89 %","1 149,88 €","41,05 %","3 807,17 %",323,"41,05 %","3 488,89 %",4,"300,00 %",
B07GLF5SMF,"Hama Album Photo ""Fine Art"" (format 30 x 30 cm, 100 pages noires, sans spirale) Noir",Hama,"1 523,93 €","-37,89 %","43,70 %",89,"-47,02 %","67,92 %","1 548,77 €","-38,06 %","58,25 %","902,70 €","-47,67 %","90,95 %",90,"-47,67 %","83,67 %",9,"800,00 %","28,57 %"
B0002W5WEU,"Hama Boîtier Slim (pour DVD, Convient également aux CD et disques Blu-Ray, Ultra Mince, avec Une Feuille pour la Couverture, Lot de 25) Noir/Transparent",Hama,"1 507,75 €","44,62 %","166,75 %",103,"56,06 %","194,29 %","1 536,07 €","55,80 %","163,93 %","1 098,84 €","69,00 %","193,76 %",105,"69,35 %","191,67 %",3,"50,00 %","200,00 %"
B00006JDEX,"Hama Plateau Universel Hama Rond (32 cm, Taille L, Poids supporté 80 kg (idéal pour TV, Enceintes, écrans, appareils de Cuisine) Noir",Hama,"1 505,26 €","-1,77 %","47,55 %",90,"5,88 %","52,54 %","1 471,94 €","-8,36 %","42,43 %","812,95 €","-17,40 %","20,78 %",88,"-1,12 %","46,67 %",16,"1 500,00 %","300,00 %"
B0083M13TY,"Hama Cadre photo en plastique Sevilla (taille du Cadre de 29,7 x 42 cm (DIN A3) avec bordure de 9 mm x 17 mm, pour une photo de 18 x 24 cm, verre en polystyrène) Noir",Hama,"1 504,34 €","105,31 %","-73,26 %",152,"123,53 %","-70,43 %","1 406,89 €","77,49 %","-65,20 %","860,65 €","91,02 %","-62,27 %",142,"91,89 %","-60,11 %",5,"400,00 %","25,00 %"
B00SL6I2WI,"Hama Album Photo Jumbo ""Fine Art"" (Album 30x30cm, 50 feuilles/100 pages blanches, pour coller 400 Photos de 10x15 cm, Look livre sans spirale, Couverture personnalisable, Idée cadeau) Noir",Hama,"1 321,26 €","2,33 %","696,13 %",78,"-4,88 %","680,00 %","1 320,56 €","-7,69 %","619,30 %","659,88 €","-11,58 %","647,99 %",78,"-13,33 %","609,09 %",3,"0,00 %","50,00 %"
B07CLVR52S,"Hama Album photo enfant ""Batzi"" (taille de l'album de 19 x 25 cm, format pour 200 photos 10 x 15 cm, avec 100 pages, papier stratifié, insertion latérale des photos, ours debout) Marron",Hama,"1 239,52 €","-12,88 %","102,99 %",106,"-19,70 %","135,56 %","1 188,39 €","-20,11 %","94,78 %","630,02 €","-28,91 %","138,89 %",99,"-28,78 %","120,00 %",,,
B0013IPAJY,"Hama Kit de Nettoyage et de réparation pour CD/DVD (25 ML de pâte de réparation, 45 ML de Liquide nettoyant, 1 Coque de Nettoyage, 5 Chiffons, 8 pièces) Blanc/Bleu/Rouge/Noir",Hama,"1 202,28 €","408,54 %","181,36 %",56,"409,09 %","194,74 %","1 202,25 €","459,26 %","167,29 %","808,08 €","460,00 %","180,00 %",56,"460,00 %","180,00 %",1,"0,00 %","0,00 %"
B00006J4DM,"Hama Adaptateur d'antenne (DIN mâle - ISO Femelle) Argent",Hama,"1 163,00 €","138,68 %","70,21 %",444,"124,24 %","39,62 %","1 192,28 €","153,06 %","73,01 %","831,54 €","111,77 %","31,61 %",456,"142,55 %","44,30 %",4,,"-33,33 %"
B00UV84E4O,"Hama Album photo vierge ""Anzio"" (album photo traditionnel format 22,8 cm x 22,3 cm, pour 200 photos 10 cm x 15 cm, 100 pages, instax, minimax, idéal pour un mariage) Beige/Noir",Hama,"1 132,52 €","-4,89 %","190,84 %",92,"-12,38 %","206,67 %","1 170,19 €","-3,61 %","183,53 %","612,51 €","-10,28 %","301,99 %",96,"-10,28 %","200,00 %",8,"700,00 %",
B0015NS8JQ,"Hama Chemin de câble (en PVC, semi-circulaire, 100 x 7 x 2,1 cm) Noir",Hama,"1 095,60 €","1 000,00 %",,55,"1 000,00 %",,"398,40 €","900,00 %",,"170,60 €","900,00 %",,20,"900,00 %",,,,
B0BNLLF6YV,"Hama iTuner Hi-FI DIT2105SBTX Dab+ Bluetooth (Tuner Internet Radio FM Dab, Tuner HiFi, Radio numérique, RX/TX, WiFi, Spotify Connect, Amazon Music, App UNDOCK, Port USB, télécommande) Noir",Hama,"1 057,53 €","1,56 %",,5,"0,00 %",,"1 057,53 €","-27,45 %",,"1 052,74 €","-31,55 %",,5,"-28,57 %",,1,"0,00 %",
B074HZZQN4,"Horloge murale ""Easy Learning"" (horloge d'apprentissage analogique, pour enfants, pour apprendre l'heure, cadran d'apprentissage de diamètre 30 cm, silencieu) Blanc",Hama,"1 050,78 €","257,08 %","10,65 %",59,"293,33 %","3,51 %","1 032,22 €","209,54 %","21,49 %","743,56 €","241,18 %","29,50 %",58,"241,18 %","13,73 %",,"-100,00 %","-100,00 %"
B0002W5WBS,"Hama Boîtier Slim (pour CD et disques Blu-Ray, Ultra Mince, avec Une Feuille pour la Couverture, Lot de 50) Noir/Transparent",Hama,"1 034,82 €","108,21 %","-1,61 %",44,"144,44 %","0,00 %","966,72 €","93,84 %","-10,18 %","512,50 €","127,78 %","-5,70 %",41,"127,78 %","-8,89 %",,,
B0BHZFGZ5Y,"Hama Casque Audio Shell (Casque Circum-Auriculaire Stéréo, 20 Hz-20 kHz, 32 ohms, 113 DB/MW, Jack 3.52mm mâle, Adaptateur Jack 6.35mm mâle Inclus, câble Extra Long 2 m) Noir",Hama,"1 011,69 €","15,71 %","1 520,00 %",81,"15,71 %","1 520,00 %","699,44 €","-20,00 %","1 020,00 %","587,44 €","-20,02 %","1 371,17 %",56,"-20,00 %","1 020,00 %",,"-100,00 %","-100,00 %"
B00006IVA9,"Hama CD de nettoyage (pour tête de lecture laser, pour éliminer la poussière dans les lecteurs de CD, CD de nettoyage au laser) Blanc/Bleu/Rouge",Hama,"1 004,77 €","-16,88 %","-8,80 %",90,"-25,62 %","-31,82 %","990,06 €","-18,09 %","-12,68 %","469,09 €","-26,54 %","-2,00 %",89,"-26,45 %","-34,56 %",6,"500,00 %","100,00 %"
B074WPJ7CV,"Hama Radio Internet DIR150BT (Radio Dab/Dab+/FM, Stéréo 90W, RMS, Bluetooth/USB/AUX, Spotify, Multiroom, UPnP, Ecran Couleur, Télécommande, App Gratuite, Radio-Réveil, Radio WiFi) Noir",Hama,"989,07 €","106,02 %",,4,"100,00 %",,"989,07 €","35,65 %",,"769,00 €","28,81 %",,4,"33,33 %",,,,
B0009V8WNW,"Hama Pochettes de Protection (en Papier pour CD/DVD/Blu-Ray, verrouillables, Lot de 100) Blanc/Transparent",Hama,"946,14 €","-19,28 %","-22,42 %",145,"-29,95 %","-40,82 %","954,26 €","-13,63 %","-18,83 %","418,31 €","-32,36 %","-42,09 %",138,"-31,34 %","-41,53 %",1,"-83,33 %","-50,00 %"
B00CRB69MI,"Hama Support de télécommande Major (pour 4 télécommandes au maximum, également pour rangement de lunettes, smartphones, contrôleurs, clés USB, porte-télécommande) Noir",Hama,"945,72 €","-4,05 %","-21,17 %",71,"-4,05 %","-21,11 %","985,68 €","-2,63 %","-22,97 %","716,28 €","16,25 %","-30,61 %",74,"-2,63 %","-22,92 %",3,,"200,00 %"
B07T4DM8JJ,"Hama Album photos enfant mémo ""Forest"" (livre photo 100 pages à pochettes, 200 photos 10x15 cm, album souvenirs 22,5 x 22 cm, Emplacement CD, Album Motif Renards) Marron/Beige/Vert/Orange/Blanc",Hama,"934,32 €","287,15 %","31,65 %",102,"343,48 %","50,00 %","906,84 €","290,59 %","27,31 %","609,24 €","347,61 %","45,08 %",99,"350,00 %","47,76 %",1,,"-75,00 %"
B08SFG3JH5,"Hama Album photo ""To The Moon"" (Album souvenirs Anniversaires, Baptême, Baby Shower, Idée cadeau, 22.5x22 cm, 100 pages blanches, Zone Mémo, 200 photos 10x15 cm, Insertion latérale) Multicolore",Hama,"918,52 €","-20,43 %","87,56 %",80,"-19,19 %","90,48 %","920,56 €","-24,09 %","97,38 %","702,36 €","-23,06 %","113,95 %",80,"-23,08 %","100,00 %",4,,"300,00 %"
B07CKR6PKL,"Hama Album photo enfant ""Batzi"" (taille de l'album de 19 x 25 cm, format pour 200 photos 10 x 15 cm, avec 100 pages, papier stratifié, insertion latérale des photos, ours assis) Marron",Hama,"871,51 €","92,39 %","123,33 %",81,"138,24 %","179,31 %","909,51 €","122,23 %","133,07 %","524,17 €","167,99 %","201,70 %",83,"167,74 %","186,21 %",1,,"0,00 %"
B09MQQM1ZJ,"Xavax Socle machine à laver avec étagère (Support Sèche Linge Lave Linge,Réhausseur de Machines, Base universelle avec Pieds Réglables en hauteur, charge 150 kg) Blanc",Xavax,"861,20 €","-42,89 %","-38,60 %",11,"-47,62 %","-38,89 %","861,20 €","-58,40 %","-44,74 %","572,00 €","-62,07 %","-48,52 %",11,"-62,07 %","-45,00 %",,"-100,00 %","-100,00 %"
B000EBFN70,"Hama Trépied Appareil Photo Vidéo 106.5cm Star 5"" avec Sac de Transport (Trépied Télescopique Aluminium 4 éléments, Tête 3 Voies 3D, Niveaux à Bulles intégrés, Attache Rapide) Beige",Hama,"803,90 €","43,24 %","475,37 %",58,"45,00 %","728,57 %","774,76 €","37,80 %","454,51 %","608,00 €","40,04 %","814,01 %",56,"40,00 %","700,00 %",3,"50,00 %","200,00 %"
B00006J4G7,"Hama Présentoir de Distributeur de pastilles adhésives (500 coins photos, diamètre de 10 mm, papier/viskose) Transparent",Hama,"796,80 €","101,68 %","93,55 %",240,"101,68 %","93,55 %","786,84 €","107,89 %","92,68 %","547,47 €","107,89 %","92,79 %",237,"107,89 %","92,68 %",5,"66,67 %",
B078T54CLX,"Hama Souris Optique à 3 Boutons MC-200, Filaire, Noire",Hama,"795,73 €","106,66 %","-85,81 %",175,"146,48 %","-82,23 %","795,73 €","98,92 %","-83,73 %","612,50 €","136,49 %","-77,83 %",175,"136,49 %","-79,53 %",1,"-91,67 %","-92,86 %"
B08GS8FVB5,"Hama Destructeur de Documents Basic S6 (Broyeur de Documents, Sécurité P-2, 6 Feuilles, Corbeille 8L, Découpe en Bandes 6mm, 70 DB, M/A Auto, Idéal Bureau & Maison) Noir",Hama,"793,12 €","52,97 %","775,70 %",28,"47,37 %","833,33 %","793,12 €","45,30 %","2 359,29 %","579,32 €","40,00 %","2 700,00 %",28,"40,00 %","2 700,00 %",2,"100,00 %","-33,33 %"
B08HQH5PSV,"Hama Horloge Murale Numérique Jumbo (Radio-pilotée DCF, Très Grand Format d’Affichage, Affichage XL Heure-Date-température int.-humidité, à Suspendre ou Poser) Noir",Hama,"785,12 €","14,56 %",,15,"7,14 %",,"730,96 €","6,66 %",,"587,10 €","-0,46 %",,14,"0,00 %",,2,,
B0BNLNC6KX,"Hama iTuner Hi-FI DIT2105SBTX Dab+ Bluetooth (Tuner Internet Radio FM Dab, Tuner HiFi, Radio numérique, RX/TX, WiFi, Spotify Connect, Amazon Music, App UNDOCK, Port USB, télécommande) Argenté",Hama,"768,95 €","235,65 %",,4,"300,00 %",,"768,95 €","235,65 %",,"840,00 €","311,76 %",,4,"300,00 %",,,,
B0000AHICV,"Hama Boîtier CD/DVD Slim (lot de 10 boitiers standards vierges pour CD/DVD et disques Blu-ray, ultra plat) Noir/Transparent",Hama,"767,76 €","950,00 %","24,76 %",168,"950,00 %","127,03 %","749,48 €","925,00 %","70,19 %","549,40 €","925,00 %","202,70 %",164,"925,00 %","203,70 %",,,"-100,00 %"
B0015IOV8S,"Hama Cadre photo en plastique ""Sevilla"" (taille du Cadre de 40 x 40 cm avec bordure de 13 mm x 17 mm, pour une photo de 28 x 28 cm) Noir",Hama,"743,54 €","69,39 %",,52,"67,74 %",,"686,90 €","61,70 %",,"474,24 €","60,00 %",,48,"60,00 %",,1,,
B00005QFAY,"Hama Étuis à négatifs, Papier Cristal, 7 Bandes de 6 négatifs, 24x36cm, 100 pièces",Hama,"731,99 €","159,74 %","-43,47 %",33,"175,00 %","-45,00 %","709,46 €","129,29 %","-45,21 %","502,63 €","146,15 %","-34,69 %",32,"146,15 %","-46,67 %",,,"-100,00 %"
B001F536RS,"THOMSON Microphone Dynamique M135 (Microphone Karaoké Filaire, Motif cardioïde, fiche Jack 3,52 mm, Longueur de câble 3 m, idéal Karaoké, Chant, Live, Conférence, Mariage) Noir",Thomson,"659,34 €","22,22 %","-77,63 %",66,"22,22 %","-77,63 %","669,33 €","9,84 %","-77,05 %","497,40 €","10,96 %","-76,92 %",67,"9,84 %","-77,05 %",7,"75,00 %","-46,15 %"
B0009V6Q30,"Hama Boîtier Slim (pour CD et disques Blu-ray, ultra mince, avec une feuille pour la couverture, lot de 25) Transparent/Bleu/Orange/Vert/Rouge/Violet",Hama,"659,34 €","-71,18 %","-37,74 %",66,"-71,18 %","-37,74 %","689,31 €","-71,25 %","-31,68 %","694,21 €","-68,41 %","-21,35 %",69,"-71,25 %","-31,68 %",1,"-66,67 %","0,00 %"
B0BRL62B16,"Hama Multiprise Etanche 2 Prises 16A avec Interrupteur (Multiprise Extérieur Rallonge 2m, Bloc 2 Prises étanches IP44 avec Couvercle, Type F Schuko, 3680W, Idéal Jardin Garage Atelier Chantier) Noir",Hama,"648,62 €","41,38 %",,41,"41,38 %",,"648,62 €","46,43 %",,"463,30 €","46,43 %",,41,"46,43 %",,3,,
B07RHGG3S7,"Hama Horloge murale radio-pilotée ""Extra"" (avec indicateur de date et température) Blanc et Argenté",Hama,"646,75 €","-40,51 %",,17,"-41,38 %",,"607,69 €","-49,27 %",,"470,08 €","-50,84 %",,16,"-50,00 %",,3,"200,00 %",
B06X9NRXV9,"Hama Album photo vierge ""Lazise"" (album photo traditionnel 29 cm x 32 cm, 50 pages blanches, pour 250 photos 10 cm x 15 cm, format maximum 28 cm x 31 cm) Doré/Blanc",Hama,"646,62 €","-16,05 %","185,56 %",39,"-27,78 %","129,41 %","646,62 €","-17,05 %","304,54 %","363,23 €","-28,98 %","240,77 %",39,"-29,09 %","225,00 %",2,"0,00 %",
B0002W5WE0,"Hama Boîtier Slim Double (pour DVD, Convient également aux CD et disques Blu-Ray, Ultra Mince, avec Une Feuille pour la Couverture, Lot de 25) Noir/Transparent",Hama,"645,06 €","39,84 %","81,14 %",48,"60,00 %","128,57 %","645,06 €","39,84 %","82,81 %","528,46 €","59,41 %","144,60 %",48,"60,00 %","128,57 %",,,
B0000AISCX,"Hama Cadre Photo Clip-Fixe (sans Bordure, 30 X 45 Cm, Anti-Reflex) Blanc",Hama,"640,64 €",,"1 965,91 %",77,,"2 466,67 %","590,72 €",,"1 328,93 %","316,66 €",,"1 675,00 %",71,,"1 675,00 %",11,,
B000EORX52,"Hama Boîtier Slim (pour CD et disques Blu-Ray, Ultra Mince, avec Une Feuille pour la Couverture, Lot de 25) Transparent",Hama,"626,04 €","34,29 %","291,67 %",47,"34,29 %","291,67 %","599,40 €","28,57 %","350,00 %","467,31 €","28,51 %","609,23 %",45,"28,57 %","350,00 %",,"-100,00 %",
B08YS1PZWL,"Hama Adaptateur Jack 6.35 vers 3.5 Garantie 10 Ans (Adaptateur Audio 6.35mm Mâle vers 3.5mm Femelle, Stéréo, Prise Casque, Audio Connecteur Stéréo pour Mélangeur Audio/Piano électrique/Clavier) Noir",Hama,"610,68 €","46,49 %",,115,"51,32 %",,"593,00 €","38,80 %",,"238,34 €","42,96 %",,111,"42,31 %",,6,"500,00 %",
B09YVGVBH1,"Hama AMW-200 Souris sans Fil - Technologie 2.4Ghz, Capteur 1600 dpi, Technologie Smart-Link, Ambidextre - Noire",Hama,"580,00 €","-31,66 %","1 560,94 %",109,"-31,87 %","5 350,00 %","536,72 €","-37,94 %","1 437,00 %","394,05 €","-38,35 %","4 591,07 %",101,"-38,04 %","4 950,00 %",3,"200,00 %",
B08GRRDVN9,"Hama Destructeur de Documents Mini S6 (Broyeur Documents 6 Feuilles 80g, Destructeur Papier, Déchiqueteur sécurité P1, 72 DB, M/A Auto, Fonction Retour, s'adapte sur des Corbeilles à Papier) Noir",Hama,"573,99 €","-33,72 %",,21,"-48,78 %",,"594,81 €","-34,41 %",,"339,02 €","-48,89 %",,22,"-48,84 %",,2,"0,00 %",
B01IW9057S,"Hama Album photo traditionnel ""Rustico"" (album mémo, album de 22,5 x 22,5 cm, 100 pages blanches, 200 photos au format 10x15, idéal pour le scrapbooking, insertion des photos) Love Key",Hama,"568,18 €","326,56 %","-60,74 %",43,"330,00 %","-69,29 %","568,18 €","287,78 %","-59,26 %","239,54 €","291,66 %","-68,40 %",43,"290,91 %","-68,38 %",1,,"0,00 %"
B07PSPRGMT,"THOMSON Casque TV HQ HED4508 (câble Extra Long de 8 m, Casque stéréo pour TV, réglage du Volume séparé, Embout Filaire, Prise 3,5 mm avec Adaptateur de 6,35 mm) Noir",Thomson,"565,75 €","46,20 %",,19,"46,15 %",,"565,75 €","18,73 %",,"567,53 €","18,71 %",,19,"18,75 %",,1,,
B00006JDGH,"Hama Filtre UV (anti-UV et protection, compensation 2X, traitement antireflet, pour objectifs d'appareils photo 58 mm, O-Haze, traité) Noir",Hama,"553,34 €","10,65 %","319,20 %",86,"13,16 %","473,33 %","527,02 €","0,12 %","403,07 %","380,59 €","-1,62 %","603,23 %",82,"2,50 %","583,33 %",1,"0,00 %",
B0000AISQ8,"Hama Anneaux autocollants pour cadres photo (en métal, 10 pièces, attaches triangulaires, pour coller sur du bois, plastique ou métal) Blanc/Doré",Hama,"551,99 €","40,84 %","623,07 %",146,"69,77 %","668,42 %","502,19 €","22,93 %","808,28 %","334,05 €","44,07 %","835,71 %",131,"43,96 %","835,71 %",,,
B00RLNCZ52,"Hama Album photo ""Moni"" (pour 200 photos au format 10 x 15 cm, album photo bébé de 100 pages blanches, ciel, élégant, pour filles, enfants, bébés) Rose, petit album de taille 22,5 x 22,5 cm",Hama,"531,97 €","38,39 %","88,96 %",50,"72,41 %","127,27 %","504,65 €","31,28 %","79,25 %","293,28 €","64,68 %","183,64 %",48,"65,52 %","118,18 %",2,"100,00 %",
B0000AIRY7,"Hama Cadre en plastique Madrid (taille de cadre de 30 cm x 40 cm, taille de la photo de 20 cm x 28 cm, 1 photo par cadre, à accrocher, élégant, simple, classique) Noir",Hama,"529,97 €","-84,81 %","-34,09 %",67,"-84,81 %","-9,46 %","553,70 €","-85,57 %","-26,74 %","291,90 €","-85,57 %","6,22 %",70,"-85,57 %","6,06 %",18,"-30,77 %","157,14 %"
B07TYWBSZN,"Hama Album photo Jumbo ""Forest"" (pour 400 photos au format 10 x 15 cm, album traditionnel enfant de 30 x 30 cm, 100 pages blanches, animaux, élégant) Marron/Beige/Vert/Orange/Jaune",Hama,"523,69 €","-35,54 %","-29,55 %",30,"-49,15 %","-37,50 %","501,57 €","-39,29 %","-23,30 %","248,69 €","-54,23 %","-26,67 %",29,"-51,67 %","-30,95 %",2,"100,00 %",
B0002W5WBI,"Hama Boîtier Slim (pour CD et disques Blu-Ray, Ultra Mince, avec Une Feuille pour la Couverture, Lot de 100) Noir/Transparent",Hama,"520,66 €","-30,43 %","-7,24 %",14,"-30,00 %","-6,67 %","520,66 €","-30,43 %","-7,24 %","362,92 €","-31,65 %","-3,99 %",14,"-30,00 %","-6,67 %",,,
B00006JAMU,"Hama Étuis à négatifs, polypropylène, 7 bandes de 6 négatifs, 24x36cm, 25 pièces",Hama,"519,96 €","3,52 %","301,02 %",37,"5,71 %","311,11 %","514,63 €","5,57 %","434,85 %","369,61 €","6,00 %","620,49 %",36,"5,88 %","500,00 %",,,"-100,00 %"
B000K985GC,"Hama Boîtier Standard (pour DVD, Convient également aux CD et aux Blu-Ray, avec Film pour l'insertion de la Jaquette, Lot de 30) Noir",Hama,"519,84 €","50,00 %","2 300,00 %",24,"50,00 %","2 300,00 %","519,84 €","33,33 %","2 300,00 %","336,48 €","33,33 %","2 564,13 %",24,"33,33 %","2 300,00 %",,,
B096YFPTBR,"Hama Kit de Nettoyage d'Appareil Photo 4 en 1 ""Optic Dry (Kit de Nettoyage à Sec avec Stylo Lenspen + Chiffon Microfibre + Poire, pour Objectif Photo, Filtre, APN, Caméra Reflex, Jumelle, écran)",Hama,"515,66 €","-7,56 %",,23,"-8,00 %",,"515,66 €","-3,69 %",,"438,81 €","-4,33 %",,23,"-4,17 %",,1,,
B001F4ZWDK,"Hama Pochettes en polypropylène pour CD/DVD, paquet de 75, Transparent",Hama,"513,64 €","37,55 %","100,00 %",67,"39,58 %","157,69 %","498,66 €","33,54 %","94,17 %","302,32 €","34,86 %","168,13 %",65,"35,42 %","150,00 %",1,,
B0000AI2JY,"Hama Cadre photo en plastique Sevilla (taille du Cadre de 50 x 60 cm avec bordure de 13 mm x 20 mm, pour une photo de 30 x 40 cm) Noir",Hama,"512,96 €","-3,45 %",,28,"-3,45 %",,"549,60 €","-3,23 %",,"324,90 €","-3,23 %",,30,"-3,23 %",,2,"-80,00 %",
