B084HZN6S4,"Hama Album Photo ""Fine Art"" (format 24 x 17 cm, 36 pages blanches, sans spirale) Sable",Hama,"8,07 €",,,"5,73 €",,,1,,,,,
B079PBY42T,"Hama Pochettes extérieures pour vinyles (pour 33 tours, 10 pièces, 32,7 x 0,07 x 32,5 cm) Transparent",Hama,"7,91 €",,"-73,82 %","5,96 €",,"-64,01 %",1,,"-66,67 %",,,
B0068QJHKE,"Rapoo Souris optique sans fil 2,4GHz ""1620"" (bluetooth, souris d'ordinateur, design, avec boutons et molette de défilement) Noir",Rapoo,"7,49 €",,,"6,21 €",,,1,,,,,
B00QRHG81K,"Hama Clé USB 3.0 ""Laeta Twin (FlashPen, OTG, Aluminium, USB 3.0, jusqu'à 40 Mo/s, 16GB) Noir",Hama,"7,49 €",,,"5,00 €",,,1,,,,,
B07CGZY714,"Hama Loupe de Lecture à LED Basic 90 LED (1 unité, grossissement x4, diamètre de 90 mm, Taille de 94 mm x 202 mm x 16 mm) Noir/Transparent",Hama,"7,49 €",,,"5,96 €",,,1,,,,,
B07Y4YGCS9,"Hama Coque iPhone 11 Crystal Clear (Etui Transparent TPU Souple, Housse de Protection Apple iPhone 11, Flexible, Surface Antidérapante, Compatible Chargement sans Fil) Transparent","White Diamonds","7,49 €",,,"7,99 €",,,1,,,,,
B0081JXIOW,"Hama Clé USB 2.0 ""Rotate, 32 GB (10 MB/s, Flashpen Rotate) Noir/Argenté",Hama,"7,49 €",,"-18,23 %","3,40 €",,"0,00 %",1,,"0,00 %",,"-100,00 %",
B0000AHIFI,"Hama Passe-partout Premium, blanc neige, 20 x 30 cm",Hama,"7,48 €",,"-50,00 %","3,36 €",,"-50,00 %",2,,"-50,00 %",,,
B00006JCZK,"Hama Filtre UV (Anti-UV Et Protection, Compensation 2X, Traitement Antireflet, pour Objectifs D'appareils Photo 62 Mm, O-Haze, Traité) Noir",Hama,"7,42 €",,"-75,73 %","7,63 €",,"-66,67 %",1,,"-66,67 %",,,
B00005QF9N,"Hama Attache Rapide pour Trépied, Click II (Plateau Rapide Tête de Trépied, Fixation Rapide pour Appareil Photo/Caméscope à Filetage 1/4"" 6.4mm, pour Trépieds Gamma) Noir",Hama,"7,42 €",,"-75,22 %","6,22 €",,"-73,28 %",1,,"-66,67 %",,,"-100,00 %"
B007WAYTLM,"Hama Tapis de Souris pour Souris Laser (Auto-adhésif, Amovible) Noir",Hama,"7,32 €","-81,57 %",,"4,57 €","-83,33 %",,1,"-83,33 %",,,,
B0043XSGYM,"Xavax Lames de rechange (pour racloir spécial tables de cuisson vitrocéramiques, 5 lames de rechange pour racloir en verre pour plaques de cuisson) Bronze/Gris",xavax,"7,31 €","-51,14 %","-80,42 %","2,15 €","-75,00 %","-88,06 %",1,"-75,00 %","-88,89 %",,,
B000JIA7YW,"Hama Boîtier Standard (pour 6 DVD, Convient également aux CD et disques Blu-Ray, avec Film pour l'insertion de la Jaquette, Lot de 3) Noir",Hama,"6,66 €","-95,24 %","0,00 %","4,80 €","-95,24 %","0,00 %",1,"-95,24 %","0,00 %",,,
B08YS25RDP,"Hama Répartiteur Satellite (2 Voies Fiche F, Totalement blindé, Distributeur Sat, Protection Totale, Garantie 10 Ans) Argent",Hama,"6,66 €","-75,00 %",,"5,92 €","-75,00 %",,1,"-75,00 %",,,,
B001EWQGTC,"Xavax Hama Xavax Racloir (spécialement pour plaques de cuisson vitrocéramique) Argent, 1 Unité (Lot de 1)",xavax,"6,24 €",,,"3,03 €",,,1,,,,,
B01A72KIHA,"Hama Cordon d’alimentation Euro (coudé à 90 degrés des deux côtés, fiche secteur vers prise double Euro 8 avec contact de protection de terre, coudé des deux côtés, 1,5 m) Noir",Hama,"6,24 €","-75,00 %","-89,80 %","4,14 €","-72,40 %","-87,35 %",1,"-75,00 %","-87,50 %",,,
B009X8SCV4,"Hama ""Fine Art"" Spiral Album, 24 x 17 cm, 50 Photos, pink",Hama,"6,24 €",,,"3,93 €",,,1,,,,,
B005DJXZSC,"Hama Album Photo Singo (Album minimax, 13 x 16,5 cm, 100 Pages, pour 100 Photos au Format 10 x 15 cm) Rose",Hama,"5,96 €","-67,40 %",,"2,97 €","-75,00 %",,1,"-75,00 %",,,,
B00006JAQ7,"Hama 007103 - Ruban photo transparent, Blanc, 1000 pièces (2 paquets de 500 pièces)",Hama,"5,72 €","12,82 %","-89,91 %","2,90 €","0,00 %","-91,62 %",1,"0,00 %","-90,00 %",,,
B07F82LSLN,"Hama Support Travel Pliable pour tablettes et Smartphones (Idéal pour Les déplacements, Solide et Pratique) Couleur aléatoire Parmi Blanc/Bleu/Gris/Jaune/Noir/Rouge/Vert",Hama,"5,67 €","-54,46 %","-72,71 %","3,34 €","-50,00 %","-60,00 %",2,"-50,00 %","-60,00 %",,,
B017IM48R8,"Hama Cadre Photo en Plastique Paris (Cadre de 15 cm x 20 cm, Bordures de 20 mm x 15 mm, pour Les Photo de Taille 10 cm x 15 cm, Verre Reflex, polystyrene (PS), avec Crochet et Pied) Cuivre",Hama,"5,41 €","-50,00 %",,"3,07 €","-50,00 %",,1,"-50,00 %",,1,,
B07NH3HKGK,"Hama Démarreur pour tubes LED",Hama,"4,99 €",,"0,00 %","3,75 €",,"13,29 %",1,,"0,00 %",,,
B06XJCDYHB,"Hama Microphone à clip (microphone à clipser compact, longueur de câble 2m, pour ordinateur/smartphone/tablette, prise 3,5 mm) Noir",Hama,"4,99 €",,,"3,14 €",,,1,,,,,
B0000AISOV,"Hama Cadre photo Clip-Fixe (sans bordure, 30 x 30 cm, Reflex) Blanc",Hama,"4,99 €",,"-91,67 %","3,11 €",,"-91,67 %",1,,"-91,67 %",1,,
B07NH31NL6,"Couvercle Pare-poussière pour Clavier, Transparent",Hama,"4,57 €","0,00 %",,"3,50 €","0,00 %",,1,"0,00 %",,,,
B07NH3HS75,"Couvercle Pare-poussière pour imprimante, Transparent",Hama,"4,57 €","-50,00 %",,"3,74 €","-50,00 %",,1,"-50,00 %",,,,
B07BGLLS26,"Chiffons pour écrans, 100 pièces, dans un distributeur",Hama,"4,16 €",,"0,00 %","5,04 €",,"0,00 %",1,,"0,00 %",,,
B07PD148G7,"Hama Mini-Album Photo à Pochettes Brushstroke (Album Photo Traditionnel 13 x 16,5 cm, 24 Pages pour 24 Photos Format 10 x 15 cm, Protection idéale, Artistique, élégant) Violet/Jaune/Orange/Blanc",Hama,"2,91 €",,,"1,93 €",,,1,,,,,
B08YS17LYT,"Hama Prises Antenne TV Garantie 10ans (2 Fiches d’antenne TV coaxiale, Fiche Coaxiales Mâle + Fiche Coaxiale Femelle, Diam 5-7mm, 2 pièces) Blanc",Hama,"2,91 €",,,"1,89 €",,,1,,,,,
B07H149QV2,"Hama Album photo 'Susi Pastell' (couverture souple, 24 pages pour 24 photos au format 10x15 cm, résistant, pour archiver avec des anecdotes, protège la photo, mini album) Couleurs pastel Aléatoires",Hama,"2,48 €","-92,59 %","-98,43 %","1,76 €","-92,59 %","-97,47 %",2,"-92,59 %","-97,70 %",,,
B01N4PN9J2,"Chargeur, USB Type-C, 3A, noir",Hama,,,"-100,00 %",,,"-100,00 %",,,"-100,00 %",,,
B001UBBJC6,"Hama Album Photo Fine Art (Format 24 x 17 cm, 50 Pages Noires, à Spirale) Gris",Hama,,"-100,00 %",,,"-100,00 %",,,"-100,00 %",,,,
B00U78QYHI,"Hama Clé USB 3.0 ""Laeta, 64 Go, 40 Mo/s, Marron",Hama,,"-100,00 %",,,"-100,00 %",,,"-100,00 %",,,,
B00006JAS7,"Hama lot de 2 Fiches d’antenne coaxiale TV (Diam 9.52mm, 1 Mâle+1 Femelle), Blanc",Hama,,,"-100,00 %",,,"-100,00 %",,,"-100,00 %",,,
B01DF1Y9Q6,"Hama Support mural TV fixe (pour une diagonale d’écran de 48 à 122 cm (19"" à 48"")) Noir",Hama,,,,,,,,,,,"-100,00 %",
B0000AISC4,"Hama Cadre photo en plastique ""Sevilla"" (taille du Cadre de 24 x 30 cm avec bordure de 9 mm x 17 mm, pour une photo de 15 x 20 cm) Bleu",Hama,,,"-100,00 %",,,"-100,00 %",,,"-100,00 %",,,
B004IYLMHE,"Hama Clé USB 2.0 ""Rotate, 8 GB (10 MB/s, Flashpen Rotate) Noir/Argenté",Hama,,"-100,00 %","-100,00 %",,"-100,00 %","-100,00 %",,"-100,00 %","-100,00 %",,,
B08SFFF4W8,"Hama Hub USB-C Multiport Data (USB 3.2 Gen2, 4 Ports, Vitesse de Transfert Super Speed 10Gbits/s, Boitier Aluminium Robuste, Garantie 10 Ans, Plug & Play, Compatible Thunderbolt-3/4) Anthracite",Hama,,,"-100,00 %",,,"-100,00 %",,,"-100,00 %",,,
B0009V6OBE,"Hama Pochettes de Protection (en Papier pour CD/DVD/Blu-Ray, Lot de 50) Blanc/Transparent",Hama,,,"-100,00 %",,,"-100,00 %",,,"-100,00 %",,,
B0000AISFX,"Hama Passe-Partout (Premium, Dimensions : Extérieur : 30 cm x 45 cm/Intérieur : 20 cm x 30 cm) Blanc Arctique",Hama,,,"-100,00 %",,,"-100,00 %",,,"-100,00 %",,,
B07JKXWSPY,"Plaque de fixation d’appareil photo/caméscope pour trépied ""Star 20""",Hama,,,"-100,00 %",,,"-100,00 %",,,"-100,00 %",,,
B08SFDTFS8,"Hama Câble USB pour iPhone/iPad (Connect. Lightning, USB 2.0, métal, 0,75m) Argenté, Noir",Hama,,"-100,00 %",,,"-100,00 %",,,"-100,00 %",,,,
B002MC62C4,"Xavax Raccord Y pour tuyau d' arrivée d'eau (à 2 voies pour tuyaux d'admission, 26,9 mm (3/4 "") en laiton, collecteur en Y) Dorée",xavax,,,"-100,00 %",,,"-100,00 %",,,"-100,00 %",,,
B00194NBGG,"Hama Cadre photo Davos en métal, 10 x 15 cm, couleur : argent, argent",Hama,,"-100,00 %","-100,00 %",,"-100,00 %","-100,00 %",,"-100,00 %","-100,00 %",,,
B00O4Y5RV0,"Hama 00057998 Cadre photo pour portrait Cape Coral, Blanc (taille de cadre 10x15 cm, photos format horizontal ou vertical, en métal, 1 photo par cadre, élégant, simple, classique)",Hama,,,"-100,00 %",,,"-100,00 %",,,"-100,00 %",,,
B0000AISOU,"Porte-tableaux Clip-Fix 28x35cm antireflet",Hama,,"-100,00 %",,,"-100,00 %",,,"-100,00 %",,,,
B00194JG0Q,"Hama Cadre Photo Métallique Davos pour Portrait, Doré, 13 x 18 cm",Hama,,,"-100,00 %",,,"-100,00 %",,,"-100,00 %",,,
B0764LMPBN,"Hama Multiprise avec Interrupteur 10 Prises 16A (Rallonge multiprises 3m, Bloc 10 Prises Type F Schuko, 3500W Max, Idéal Bureau PC luminaires, Atelier, Meuble TV, Garage) Noir",Hama,,"-100,00 %","-100,00 %",,"-100,00 %","-100,00 %",,"-100,00 %","-100,00 %",,"-100,00 %","-100,00 %"
B07CT5J7XF,"Hama Souris sans fil compacte ""Milano"" (souris sans fil avec piles, plage sans fil de 8 m, vitesse de rotation jusqu'à 4400 vitesses, jusqu'à 2400 ppp, boutonS avant/arrière, ergonomique) Blanc",Hama,,,"-100,00 %",,,"-100,00 %",,,"-100,00 %",,,
B00005YVIU,"Hama Distributeurs Coins photo (1000 coins, autocollants, distributeur pratique, sans acide, sans solvant, adapté albums, permet un archivage fiable, scrapbooking) Transparent",Hama,,,"-100,00 %",,,"-100,00 %",,,"-100,00 %",,,
B000EOVQI2,"Hama Boîtier CD Slim, Lot de 10, Transparent",Hama,,"-100,00 %","-100,00 %",,"-100,00 %","-100,00 %",,"-100,00 %","-100,00 %",,"-100,00 %","-100,00 %"
B001O18CDG,"Hama Antivol à combinaison (pour ordinateur portable, câble de 1,8 m, diamètre de 4 mm, sans clé, avec code) Argent",Hama,,,"-100,00 %",,,"-100,00 %",,,"-100,00 %",,,
B00397H0EU,"Ensemble de réparation de Disque Ultra pour Blu-Ray",Hama,,,"-100,00 %",,,"-100,00 %",,,"-100,00 %",,,
B0015IL6GS,"Hama Cadre photo en plastique ""Sevilla Dekor"" (taille du Cadre de 30 x 30 cm avec bordure de 13 mm x 17 mm, pour une photo de 20 x 20 cm) Argent Mat",Hama,,,,,,,,,,,"-100,00 %",
B0000AHIEL,"Hama Cadre Photo sans Cadre de 15 x 20 cm, Noir, 24 x 30 cm",Hama,,,"-100,00 %",,,"-100,00 %",,,"-100,00 %",,,"-100,00 %"
B01LXZAV7L,"Pêle-mêle de cadres photo pour portrait, 6 en 10 x 15 cm",Hama,,,"-100,00 %",,,"-100,00 %",,,"-100,00 %",,,
B07XM7M6TG,"Hama Support universel voiture ""Magnet Vent"" (pour tous les smartphones et tablettes, fente aération, poids de 36 g) Noir",Hama,,,"-100,00 %",,,"-100,00 %",,,"-100,00 %",,,
B017J9FOZA,"Xavax Thermomètre numérique pour rôtis (de torréfaction, numérique, 2 in 1, avec horloge de cuisine, sonde de température amovible, pour viande, -10°C à +250°C, avec minuteur, à câble) Noir/Argent",xavax,,"-100,00 %",,,"-100,00 %",,,"-100,00 %",,,,
B01AUBT1F8,"Cordon d’alimentation Euro pour Sonos PLAY:3/PLAY:5, droit, 5m, noir",Hama,,,"-100,00 %",,,"-100,00 %",,,"-100,00 %",,,
B0C2ZJ4LZ3,"Hama Hub USB-C Multiports (Adaptateur 6 en 1: 3 USB-A, 1 USB-C Power Delivery PD, 1 HDMI, 1 Ethernet, Station d'Acceuil PC Portable/Tablette MacBook Pro, MacBook Air, iPad Pro, Dell et XPS) Noir",Hama,,"-100,00 %",,,"-100,00 %",,,"-100,00 %",,,,
B00006JDF2,"Hama CD de nettoyage (pour tête de lecture laser, pour un nettoyage à sec en douceur de l'optique laser du lecteur CD, CD emballé individuellement) Blanc/Bleu/Rouge",Hama,,,"-100,00 %",,,"-100,00 %",,,"-100,00 %",,,
B018KHEJZ6,"Xavax Dosette Permanente Rechargeable Réutilisable pour Cafetière Senseo (lot de 2 capsules réutilisables pour machine Senseo ou similaire) Jaune",xavax,,,"-100,00 %",,,"-100,00 %",,,"-100,00 %",,"-100,00 %","-100,00 %"
B096YVXP2N,"Hama Hub USB-C Multiports (Adaptateur 5 en 1: 3 USB-A, 1 USB-C Power Delivery PD, 1 HDMI, Station d'Acceuil Ordinateur Portable/Tablette MacBook Pro, MacBook Air, iPad Pro, Dell et XPS) Noir",Hama,,"-100,00 %",,,"-100,00 %",,,"-100,00 %",,,,
B079175GWR,"Hama Souris Ergonomique sans Fil (Souris Verticale sans câble pour droitiers, Souris sans Fil sans Fil avec capteur Optique 1000/1400/1800 dpi) Noire, Prise USB Type-A, Pile AA Mignon",Hama,,"-100,00 %",,,"-100,00 %",,,"-100,00 %",,,,
B09R4TXJHV,"Hama Coque S22 (5G) Finest Feel pour Samsung (Coque de Protection Souple Galaxy S22, Robuste, Finition Soyeuse Caoutchouc, Compatible Chargement sans Fil) Rouge",Hama,,"-100,00 %",,,"-100,00 %",,,"-100,00 %",,,"-100,00 %",
B08GSRV3PB,"Hama Tête Thermostatique Connectée et Intelligente WiFi (pour Kit de Chauffage Connecté 00176592 Compatible Alexa Google Home, Robinet Intelligent pour Radiateur à Eau Chaude) Blanc",Hama,,"-100,00 %",,,"-100,00 %",,,"-100,00 %",,1,"-90,00 %",
B002IK75DA,"Xavax Thermomètre Mécanique Spécial Four et Viandes (2 en 1, en Acier Inoxydable, Mesure Simultanée du Four et de La Température du Four, va au Lave-vaisselle) Argent, -30°C/+50°C",xavax,,"-100,00 %","-100,00 %",,"-100,00 %","-100,00 %",,"-100,00 %","-100,00 %",,,
B0735YXVH6,"Hama Filtre UV 'Profi Line', 72 mm larg., nano, multi-coated (16 couches)",Hama,,,"-100,00 %",,,"-100,00 %",,,"-100,00 %",,,
B00006JB4Z,"Hama Antenne intérieur (antenne radio pour l'amplification du signal actif jusqu'à 30 dB, fiche coaxiale, puissance de l'amplificateur réglable, hauteur de 12,3 cm, AM/FM, en corne) Noir",Hama,,"-100,00 %","-100,00 %",,"-100,00 %","-100,00 %",,"-100,00 %","-100,00 %",,"-100,00 %","-100,00 %"
B0000AHIBX,"Hama Etui CD (pour 24 CD/DVD/Blu-ray, étui rigide et robuste) Transparent/Bleu",Hama,,"-100,00 %",,,"-100,00 %",,,"-100,00 %",,,"-100,00 %",
B00005QFCJ,"Hama Adaptateur Cassette VHS-C/VHS (Convertisseur Vidéo VHS C vers VHS, Cassette Adaptatrice Motorisée pour magnétoscope, 6 Mm, Non Compatible 8mm/MiniDV/Hi8) Noir",Hama,,,"-100,00 %",,,"-100,00 %",,,"-100,00 %",,,"-100,00 %"
B08H8D1Z7P,"Hama Film de protection d'écran Crystal Clear pour Apple iPad 10.8""",Hama,,"-100,00 %",,,"-100,00 %",,,"-100,00 %",,,,
B017JY56TY,"Hama Album Photo ""Fine Art"" (format 36 x 32 cm, 50 pages blanches, à spirale) Kiwi",Hama,,"-100,00 %",,,"-100,00 %",,,"-100,00 %",,,,
B08G1GX7N3,"Hama C-600 Webcam PC - Qualité Vidéo FHD 1080p, Microphone Intégré, Cache Lentille, Filetage 1/4, Auto Focus - Convient pour Les Appels Vidéos et Le Streaming - Noir",Hama,,"-100,00 %",,,"-100,00 %",,,"-100,00 %",,,,
B07RT5XDRY,"Coque de protec. ""Red Sensation No. 4"" pr Apple iPhone X/Xs, noir/rge",Hama,,,"-100,00 %",,,"-100,00 %",,,"-100,00 %",,,
B003KKVSYE,"Porte-étiquette à bagage, lot de 2, noir",Hama,,,"-100,00 %",,,"-100,00 %",,,"-100,00 %",,,
B009X8SEOO,"Hama ""Fine Art"" Spiral Album, 24 x 17 cm, 50 Photos, kiwi",Hama,,"-100,00 %","-100,00 %",,"-100,00 %","-100,00 %",,"-100,00 %","-100,00 %",,,
B000FNO03K,"THOMSON Microphone Dynamique M150 (fiche Jack 3,52 mm, Longueur de câble 3 m, Party) Noir",Thomson,,,"-100,00 %",,,"-100,00 %",,,"-100,00 %",,,"-100,00 %"
B0BL1V9R33,"Hama Câble Chargeur iPhone Extreme (Câble Lightning-USB 2.0, Certifié MFI, Cordon Charge Rapide/Transfert données, Nylon Tressé, 1.5m, iPad/iPhone 13/12/11/XS/XR/X/8/7/7+/6s/6/5/SE2020) Noir/Rouge",Hama,,"-100,00 %",,,"-100,00 %",,,"-100,00 %",,,,
B009TLAOA2,"Hama Album Photo ""Fine Art"" (format 28 x 24 cm, 50 pages noires, à spirale) Turquoise",Hama,,"-100,00 %",,,"-100,00 %",,,"-100,00 %",,,,
B00I07LU40,"Hama Multiprise, ""6+1"" (commutable individuellement, avec protection anti-surtension, montage mural, pivotée à 45°, longueur de douille XL, protection enfant, longueur de câble de 1,4 m) Noir",Hama,,"-100,00 %","-100,00 %",,"-100,00 %","-100,00 %",,"-100,00 %","-100,00 %",,,
B0B2RT4S7F,"Hama Album photo à spirale ""Relax"" (Album souvenirs vacances, anniversaire, 28x24 cm, 50 pages blanches à personnaliser et à coller, jusqu'à 100 photos de 10 x 15 cm) Multicolor/Breathe, 00007247",Hama,,,"-100,00 %",,,"-100,00 %",,,"-100,00 %",,,
B0000AISSN,"Hama Cadre photo en plastique ""Sevilla"" (taille du Cadre de 9 x 13 cm avec bordure de 9 mm x 17 mm, pour une photo de 5 x 7 cm) Noir",Hama,,,,,,,,,,,,"-100,00 %"
B00UYZ1O3I,"Hama Support Plafond (pour Diagonale d'écran de 81 à 165cm (32"" à 65""), pour Un Maximum de 50 kg, VESA jusqu'à 400 x 400) Noir",Hama,,"-100,00 %",,,"-100,00 %",,,"-100,00 %",,,,
B0BL2PTSJM,"Hama Chargeur Secteur USB (Bloc Secteur USB-A, 6W, 5V/ 1.2A, Adaptateur Secteur Universel, Chargeur Replacement pour iPhone 14/14 Pro Max, Samsung Galaxy, Sony, Xiaomi, Huawei, Wiko) Blanc",Hama,,"-100,00 %",,,"-100,00 %",,,"-100,00 %",,1,,
B00005QFB0,"Hama Étuis à négatifs, papier cristal, 7 bandes de 6 négatifs, 24x36cm, 25 pièces",Hama,,,"-100,00 %",,,"-100,00 %",,,"-100,00 %",,,
B0000AHID1,"Hama Cadre photo en plastique ""Sevilla"" (taille du Cadre de 10 x 15 cm avec bordure de 9 mm x 17 mm, pour une photo de 7 x 10 cm) Noir",Hama,,,"-100,00 %",,,"-100,00 %",,,"-100,00 %",,,"-100,00 %"
B08HCKZSMT,"Hama Camera surveillance WIFI exterieure sans fil (caméra étanche IP65, enregiste en FULL HD 1080p, stockage Mirco-SD, détect. de mouvement, vision nuit, Google/Alexa, App, audio bidirectionnel) 00176577 Noir/Argent",Hama,,"-100,00 %",,,"-100,00 %",,,"-100,00 %",,,,
B00283V7OA,"Hama 2 Accus (LR03, 700 mAh, rechargeables, 2 piles NiMH, 1,2 V, adapté aux téléphones sans fil) Vert/Blanc",Hama,,,"-100,00 %",,,"-100,00 %",,,"-100,00 %",,,
B0015LCK5G,"Système de Rangement Universel pour Voiture, Grand modèle, Noir",Hama,,"-100,00 %",,,"-100,00 %",,,"-100,00 %",,,,
B01DNW2Y3C,"Hama Bloc Multiprises (10 prises, 2 interrupteurs et protection contre surtensions, prises tournées à 45°, longueur de câble de 2 m) Blanc",Hama,,"-100,00 %",,,"-100,00 %",,,"-100,00 %",,,"-100,00 %",
B01KFLHB1E,"Hama Album photo vierge ""Bernd"" (album photo traditionnel format 22,5 cm x 22 cm, 100 pages, pour 200 photos 10 cm x 15 cm) Marron/Blanc/Noir",Hama,,,"-100,00 %",,,"-100,00 %",,,"-100,00 %",,,
B00006JCW9,"Hama Vis pour appareil photo (5 vis pour accessoires photographiques, longueur 11 mm, filetage A 1/4 "", plastique/métal) Noir/Argent",Hama,,"-100,00 %",,,"-100,00 %",,,"-100,00 %",,,,
B000L0X2R2,"Hama Adaptateur d'antenne (pour Audi/Seat/Volkswagen) Noir/Argent/Bleu",Hama,,"-100,00 %",,,"-100,00 %",,,"-100,00 %",,,,
B06XP9GV5Q,"Sac à dos de caméra/appareil photo ""Miami"", 150, noir/rouge",Hama,,"-100,00 %",,,"-100,00 %",,,"-100,00 %",,,,
B08SDVY3V6,"Hama Câble HDMI (Cable HMDI ultra haute vitesse, Certifié, Mâle-Mâle, Ultra HD, 8K@60 Hz /4K@120Hz, 2.0m, Garantie 30ans, résolution 7680x4320pixels, EARC supportant les formats audio) Gris Noir",Hama,,"-100,00 %",,,"-100,00 %",,,"-100,00 %",,,,
B0089CJP66,"Hama Support mural TV Inclinable (pour diagonale d'écran de 81 à 191cm (32 et 75""), pour un maximum de 35 kg, VESA jusqu'à 600 x 400, 3 étoiles) Noir",Hama,,,"-100,00 %",,,"-100,00 %",,,"-100,00 %",,,
B0090VYHOK,"Hama Pochette Felt (pour 48 disques, CD/DVD/Blu-Ray/Livres Audio, étui de Rangement, Gain de Place pour la Voiture, la Maison, étuis de Transport) Gris",Hama,,,"-100,00 %",,,"-100,00 %",,,"-100,00 %",,,
B01LZLUJHT,"Pêle-mêle de cadres photo pr portrt, 2 en 10 x 15 cm, 1 en 10 x 10 cm",Hama,,,"-100,00 %",,,"-100,00 %",,,"-100,00 %",,,
B078T73Z22,"Hama Souris sans Fil avec Mini Récepteur USB MW-110 (Résolution Capteur 1000 PPP, 2.4 Ghz, pour Droitiers & Gauchers, 3 Boutons, Ultra-Compacte, idéale PC, Mac, Ordinateur Portable, Tablette) Noir",Hama,,"-100,00 %",,,"-100,00 %",,,"-100,00 %",,,,
B07X557RB6,"Thomson Antenne Intérieure ""ANT1639"" (Design UHD ""Sculpture"", pour réception numérique DVB-T/DVB-T2 et HDTV, actif, 2 m, Performance 55) Noir/Gris",Thomson,,"-100,00 %",,,"-100,00 %",,,"-100,00 %",,,"-100,00 %",
B00G3BMZDA,"Xavax Minuteur de cuisine ""Countdown"" (avec minuterie et fonction chronomètre, fixation via un aimant, une pince, un support ou un support, à piles, numérique) Noir/Blanc",xavax,,,"-100,00 %",,,"-100,00 %",,,"-100,00 %",,,
B000EOVQIM,"Hama Pochette (pour 80 CD/DVD/Blu-Ray, classeur de Rangement, Gain de Place pour Le Bureau, Le Salon et la Maison, étuis de Transport) Noir",Hama,,"-100,00 %",,,"-100,00 %",,,"-100,00 %",,,,
B07F39Q5RV,"Thomson Antenne Intérieure HD Plate ANT1528BK (pour réception Radio/télévision numérique, DVB-T/-T2, Dab/Dab+, HD/3D, avec amplificateur, Filtre Anti-Bruit, Performance 45) Noir/Gris",Thomson,,"-100,00 %","-100,00 %",,"-100,00 %","-100,00 %",,"-100,00 %","-100,00 %",,"-100,00 %","-100,00 %"
B00006JB1T,"Hama Barrette porte-flash coudée à 90° (pliable pour appareils photo / vidéo avec vis de trépied, avec poignée et boucle, 34 mm x 190 mm) Noir",Hama,,"-100,00 %","-100,00 %",,"-100,00 %","-100,00 %",,"-100,00 %","-100,00 %",,,
B00006J6HP,"Hama Casier de rangement Spirit II (système de classement sur socle pour CD, pour 44 boîtiers CD, porte-CD pour le rangement, organisateur antidérapant) Noir",Hama,,,"-100,00 %",,,"-100,00 %",,,"-100,00 %",,"-100,00 %","-100,00 %"
B07MK5GLGH,"Hama Support mural TV FULLMOTION ""Ultraslim"" (Support ultraplat pivotant et inclinable pour écran de 81 à 165cm (32"" à 65""), poids max 30kg, VESA jusqu'à 400x400, avec Cache-Câbles) Noir",Hama,,,,,,,,,,,"-100,00 %",
B002C2UE1O,"Hama Colliers de serrage pour câbles (sans porte-étiquette, 300 mm, 50 pièces, autobloquant) Noir",Hama,,"-100,00 %",,,"-100,00 %",,,"-100,00 %",,,,"-100,00 %"
B07PKXPLM2,"Hama Étui portefeuille ""Smart Move - Rainbow "" (taille XL, de 4,7 à 5,1 pouces) Rouge",UNKNOWN,,,"-100,00 %",,,"-100,00 %",,,"-100,00 %",,,
B079J93N9Q,"Xavax Clapet anti-retour, avec 2 colliers de serrage, pour tuyaux jusqu'à 10 mm de diamètre",xavax,,,"-100,00 %",,,"-100,00 %",,,"-100,00 %",,,
B07BBGWQSC,"Trépied ""Flex"" pour smartphone et GoPro, 26 cm, noir",Hama,,"-100,00 %",,,"-100,00 %",,,"-100,00 %",,,,
B07GYJDYYF,"Chiffon de nettoyage universel, 20 x 20 cm, jaune",Hama,,"-100,00 %",,,"-100,00 %",,,"-100,00 %",,,,
B00005QFBX,"Classeur à négatifs, 4 anneaux, niv. rempl. 45mm, housse de protection",Hama,,"-100,00 %","-100,00 %",,"-100,00 %","-100,00 %",,"-100,00 %","-100,00 %",,"-100,00 %",
B06Y2BW35K,"Black Rock Coque de protection ""Material Real Carbon"" (pour Samsung Galaxy S8, design mince, protection idéale, en métal, polycarbonate, polyurethane termoplastique, protection à 180°) Noir",UNKNOWN,,,,,,,,,,,,"-100,00 %"
B0090VYHM2,"Hama Pochette Felt (pour 48 disques, CD/DVD/Blu-Ray/Livres Audio, étui de Rangement, Gain de Place pour la Voiture, la Maison, étuis de Transport) Bleu",Hama,,"-100,00 %",,,"-100,00 %",,,"-100,00 %",,,,
B0000AIRTH,"Hama Cadre photo en plastique ""Décor Sevilla"" (taille du Cadre de 30 x 45 cm avec bordure de 9 mm x 17 mm, pour une photo de 20 x 30 cm) Or Mat",Hama,,"-100,00 %","-100,00 %",,"-100,00 %","-100,00 %",,"-100,00 %","-100,00 %",,,
B0000AISPG,"Hama Cadre photo en plastique ""Sevilla"" (taille du Cadre de 13 x 18 cm avec bordure de 9 mm x 17 mm, pour une photo de 9 x 13 cm) Blanc",Hama,,,"-100,00 %",,,"-100,00 %",,,"-100,00 %",,,
B07CH5MF6F,"Hama Lampe col de Cygne pour Ordinateur (Lampe de Lecture/Bureau/Ordinateur, USB, 10 LED, capteur Tactile, Lampe à col de Cygne, Flexible, lumière pour éclairage de Bureau/Clavier) Argent",Hama,,,"-100,00 %",,,"-100,00 %",,,"-100,00 %",,,
B079NH8MDY,"Hama Lot de Protections de joysticks 8 en 1' pour Nintendo Switch, muticol.",Hama,,"-100,00 %",,,"-100,00 %",,,"-100,00 %",,,,
B07DNQZQKM,"Xavax Raccord double avec joint 1"" (pour tuyau de vidange pour lave-vaisselle, pour tuyaux avec dimension intérieure 19-23 mm, répartiteur à 2 voies avec joint / répartiteur en Y 1 pouce) Blanc",xavax,,"-100,00 %",,,"-100,00 %",,,"-100,00 %",,1,"-66,67 %",
B07PLLYTHY,"Hama 186305 Wake UP Early Bird (Reveil Radio piloté) Blanc",Hama,,"-100,00 %",,,"-100,00 %",,,"-100,00 %",,,,
B0015LCK38,"Hama Films pour plastifieuse à chaud, format carte de visite, 80µ, 100 pièces",Hama,,"-100,00 %",,,"-100,00 %",,,"-100,00 %",,,,
B01DNVQYYI,"Hama Bloc Multiprises (10 prises, 2 interrupteurs et protection contre surtensions, prises tournées à 45°,longueur de câble de 2 m) Bleu Glace/Noir",Hama,,,,,,,,,,,,"-100,00 %"
B0000AISEE,"Hama Cadre photo ""Clip-Fixe"" (sans bordure, 30 x 30 cm, Anti-Reflex) Blanc",Hama,,,"-100,00 %",,,"-100,00 %",,,"-100,00 %",,,
B002BDLHQK,"Hama Repose-Paume (avec Effet de Massage, pour Applications PC avec Stylet de Souris ou de Tablette, Ergonomique, utilisable avec Un Tapis de Souris, Remplissage avec des Billes en Plastique) Noir",Hama,,"-100,00 %",,,"-100,00 %",,,"-100,00 %",,,,
B07DHNSBP1,"Hama Mini souris sans fil 'Pesaro 2.4' (Souris optique résistant, idéal ordinateurs portables, léger et compact lors des déplacements) Anthracite",Hama,,"-100,00 %","-100,00 %",,"-100,00 %","-100,00 %",,"-100,00 %","-100,00 %",,,
B01KAD4TK8,"Hama Télécommande universelle ""Smart TV"" 4 en 1 (Contrôle 4 Appareils Préprogrammés, TV/DVD/STB/VCR, Télécommande de Remplacement pour Télécommande MultiFonction IR) Noir",Hama,,,,,,,,,,,,"-100,00 %"
B009HSQ3ES,"Hama Album Photo ""Fine Art"" (format 36 x 32 cm, 50 pages noires, à spirale) Turquoise",Hama,,,,,,,,,,,"-100,00 %",
B07PBXBL7G,"Hama Mini-Album Photo à Pochettes Brushstroke (Album Photo Traditionnel 13 x 16,5 cm, 24 Pages pour 24 Photos Format 10 x 15 cm, Protection idéale, Artistique, élégant) Vert/Jaune/Marron/Blanc",Hama,,"-100,00 %",,,"-100,00 %",,,"-100,00 %",,,,
