B000EOMQM2,"Hama Trépied photo/vidéo ""Star 75"" (Trépied d'entrée de gamme léger, tête à trois voies, 42-125 cm, 3D) Champagne",Hama,"39,19 €","96,05 %","-38,18 %",2,"100,00 %","-33,33 %","39,19 €","96,05 %","-7,09 %","21,50 €","100,00 %","-2,63 %",2,"100,00 %","0,00 %",1,,
B08SFDTFS8,"Hama Câble USB pour iPhone/iPad (Connect. Lightning, USB 2.0, métal, 0,75m) Argenté, Noir",Hama,"38,99 €",,,2,,,"38,99 €",,,"26,68 €",,,2,,,,,
B0000AIST8,"Porte-tableaux Clip-Fix 24x30cm antireflet",Hama,"38,87 €",,"3,82 %",5,,"-44,44 %","38,87 €",,"3,82 %","13,90 €",,"-38,95 %",5,,"-44,44 %",1,,
B014YVE3GC,"Hama Ventilateur d’ordinateur portable « Slim » (13,3 à 15,6 pouces, port USB, refroidissement rapide, design mince et mince, ventilateur pour ordinateur portable) Noir/Rouge",Hama,"38,32 €",,,2,,,"38,32 €","100,00 %",,"30,20 €","100,00 %",,2,"100,00 %",,,,
B0BL1T6XLZ,"Hama Câble Multi USB Lightning (Cable de charge multi, 3en1, USB-A/micro-USB/USB-C, Lightning, 1 m, Certifié MFI, Câble USB universel iPhones iPads iPods Samsung Galaxy, Huawei, Xiaomi) Blanc",Hama,"38,32 €",,,2,,,"38,32 €",,,"26,92 €",,,2,,,,,
B000L9MVP2,"Hama Chemin de câbles (bande en PVC/Aluminium pour montage mural TV ou au sol, cache-câble demi-rond, 100 x 7 x 2,1 cm, entrée de câble jusqu'à 8 câbles) Blanc",Hama,"38,32 €",,"-80,00 %",2,,"-80,00 %","19,16 €",,"-90,00 %","12,87 €",,"-90,00 %",1,,"-90,00 %",,,
B000VRANHM,"Hama Album, Bleu, 28 x 24 cm",Hama,"37,88 €","206,22 %","-44,85 %",3,"200,00 %","-57,14 %","37,88 €","206,22 %","-44,85 %","16,89 €","200,00 %","-53,54 %",3,"200,00 %","-57,14 %",,,
B0BL1TNWQ4,"Hama Câble Micro-USB Reflective (Câble de charge et transfert de données USB-A 2.0 mâle vers Micro-USB, Fiche Aluminium, Cordon Réflechissant Anti-torsion, Gaine en nylon tressé, 1.5 m) Bleu",Hama,"37,47 €","200,00 %",,3,"200,00 %",,"37,47 €","200,00 %",,"27,27 €","200,00 %",,3,"200,00 %",,,,
B0000AI2Y8,"Hama Cadre-galerie photo en plastique ""Madrid"" (taille de cadre de 25 cm x 55 cm, taille de la photo de 13 cm x 18 cm, 3 photos par cadre, à accrocher, élégant, simple, classique) Argent",Hama,"37,47 €","-57,14 %","-37,36 %",3,"-57,14 %","-25,00 %","37,47 €","-57,14 %","-37,36 %","24,35 €","-57,21 %","-22,25 %",3,"-57,14 %","-25,00 %",1,,
B01K47I1TK,"Hama Album Jumbo ""Skies"" (album grand format, 30 x 30 cm, 60 pages, pour 240 photos au format 10 x 15 cm) Gris",Hama,"37,37 €","-68,10 %","-72,92 %",3,"-66,67 %","-72,73 %","37,37 €","-68,10 %","-72,92 %","17,04 €","-66,67 %","-69,36 %",3,"-66,67 %","-72,73 %",,,
B00005K49X,"Hama Filtre UV (anti-UV et protection, compensation 4X, traitement antireflet, pour objectifs d'appareils photo 72 mm, O-Haze, traité) Noir",Hama,"37,26 €","50,00 %",,3,"50,00 %",,"49,68 €","300,00 %",,"78,56 €","300,00 %",,4,"300,00 %",,,"-100,00 %",
B00006JA0P,"Hama Bloc d'alimentation allume-cigares (2000 mAh, stabilisé, pour allume-cigare, maximum 14V, variations de tension minimales, universelle, 8 fiches différentes) Noir",Hama,"37,17 €",,"114,48 %",2,,"100,00 %","37,17 €",,"114,48 %","22,08 €",,"84,46 %",2,,"100,00 %",,,
B0CLD52FFP,"Hama Support Mural Magnétique pour Apple TV HD (4ème génération)/4K (1ère/2ème/3ème génération) (pour Fixer l'Apple TV Box sur Le Mur ou la TV, Garantie 10ans, Chevilles Fischer et vis VESA) Noir",Hama,"36,76 €","-75,46 %",,3,"-78,57 %",,"47,64 €","-65,71 %",,"26,84 €","-69,23 %",,4,"-69,23 %",,1,"0,00 %",
B01DZGI94O,"Hama Support mural TV Fullmotion (pour diagonale d'écran de 81 à 165cm (32"" à 65""), pour un maximum de 25 kg, VESA jusqu'à 400 x 400, 1 étoile) Noir",Hama,"36,66 €","0,00 %","-50,40 %",1,"0,00 %","-50,00 %","36,66 €","0,00 %","-50,40 %","34,88 €","0,00 %","-15,59 %",1,"0,00 %","-50,00 %",,,
B000LRIYF0,"Hama Cadre photo en plastique ""Décor Sevilla"" (taille du Cadre de 70 x 100 cm avec bordure de 13 mm x 20 mm, pour une photo de 50 x 70 cm) Argent Mat",Hama,"36,66 €","0,00 %",,1,"0,00 %",,,"-100,00 %",,,"-100,00 %",,,"-100,00 %",,2,,
B005DJXZSC,"Hama Album Photo Singo (Album minimax, 13 x 16,5 cm, 100 Pages, pour 100 Photos au Format 10 x 15 cm) Rose",Hama,"36,56 €","-20,00 %","13,40 %",8,"-20,00 %","100,00 %","36,56 €","-20,00 %","13,40 %","23,76 €","-20,00 %","120,00 %",8,"-20,00 %","100,00 %",,,
B0000AISFJ,"Hama Cadre photo en plastique Sevilla (taille du Cadre de 15 x 20 cm avec bordure de 9 mm x 17 mm, pour une photo de 10 x 15 cm) Blanc",Hama,"36,56 €","78,17 %","322,17 %",8,"300,00 %","700,00 %","36,56 €","78,17 %","322,17 %","31,44 €","300,00 %","700,00 %",8,"300,00 %","700,00 %",,,
B0019DPZPC,"Hama 29308 Présentoir de Distributeur de pastilles adhésives, Transparent (1 distributeurs, 1000 coins photos, 12 x 13 mm)",Hama,"36,52 €","175,00 %","10,00 %",11,"175,00 %","10,00 %","36,52 €","175,00 %","10,00 %","25,41 €","175,00 %","16,45 %",11,"175,00 %","10,00 %",,,
B00006JCX6,"Hama Anneaux brisés triangulaires, anguleux, 6 pièces",Hama,"36,12 €","128,03 %","20,88 %",7,"133,33 %","40,00 %","30,96 €","95,45 %","3,61 %","26,94 €","88,66 %","21,63 %",6,"100,00 %","20,00 %",,,
B09W5WFDND,"Hama HS-USB400 V2 Casque Micro - Casque USB, Microphone Intégré, Léger, Télécommande Intégrée, Fonction Mute - Noir",Hama,"36,03 €",,,1,,,"36,03 €",,,"26,64 €",,,1,,,,,
B08YRZT1RL,"Hama Hub USB, 4 Ports, USB 2.0, 480 Gbit/s, Métal, Noir",HAMA,"35,84 €","-46,15 %",,7,"-46,15 %",,"35,84 €","-46,15 %",,"37,80 €","-46,15 %",,7,"-46,15 %",,,,
B073622T6B,"Hama Filtre UV 67 mm Profi Line (Filtre pour Objectif, Nano Revêtement, Multi-Coated (16 Couches - NMC16), Monture Large Ultrafine 2.4mm, Verre de qualité supérieure)",Hama,"35,61 €",,,2,,,"17,32 €",,,"11,24 €",,,1,,,,,
B08NCJ814H,"Hama C-400 Webcam PC - Qualité Vidéo FHD 1080p, Microphone Intégré, Cache Lentille, Filetage 1/4 - Convient pour Les Appels Vidéos et Le Streaming - Noir",Hama,"35,41 €",,,1,,,"35,41 €",,,"28,32 €",,,1,,,1,,
B01AUBT1F8,"Cordon d’alimentation Euro pour Sonos PLAY:3/PLAY:5, droit, 5m, noir",Hama,"34,98 €",,"35,53 %",3,,"50,00 %","34,98 €",,"31,31 %","21,36 €",,"66,36 %",3,,"50,00 %",,,
B08BFFFTKJ,"Hama Album photo Jumbo ""Romance"" à personnaliser (Album Photo Livre de Mariage ou naissance bébé, Livre d'or ou cadeau, 30x30 cm, 80 pages, Motif cœur, Titre Love, 320 photos 10x15 cm) Beige/blanc",Hama,"34,98 €","-63,15 %","-62,50 %",3,"-50,00 %","-62,50 %","34,98 €","-63,15 %","-62,50 %","22,08 €","-50,00 %","-60,54 %",3,"-50,00 %","-62,50 %",,,
B07GX2V6JG,"Lecteur Multi-Cartes USB-2.0, SD/microSD/CF, Bleu",Hama,"34,92 €","-57,14 %","500,00 %",6,"-57,14 %","500,00 %","34,92 €","-57,14 %",,"21,90 €","-57,14 %",,6,"-57,14 %",,,,
B000L10VLQ,"Hama Vide-poche (format DIN) Noir",Hama,"34,91 €",,,2,,,"16,66 €",,,"10,98 €",,,1,,,,,
B0009V8WNM,"Hama Pochettes de protection (en papier pour CD/DVD/Blu-Ray, verrouillables, lot de 50) Blanc/Transparent",Hama,"34,68 €","-77,80 %","39,33 %",6,"-83,33 %","20,00 %","34,68 €","-78,38 %","39,33 %","14,16 €","-83,73 %","29,32 %",6,"-83,78 %","20,00 %",,,
B0C2ZJ4LZ3,"Hama Hub USB-C Multiports (Adaptateur 6 en 1: 3 USB-A, 1 USB-C Power Delivery PD, 1 HDMI, 1 Ethernet, Station d'Acceuil PC Portable/Tablette MacBook Pro, MacBook Air, iPad Pro, Dell et XPS) Noir",Hama,"34,46 €","-46,05 %",,1,"-50,00 %",,"68,95 €","134,68 %",,"47,10 €","100,00 %",,2,"100,00 %",,,,
B0002W5WB8,"Hama Pochettes de protection (pour CD/DVD/Blu-Ray, design étroit, pochette en plastique, lot de 50) Transparent",Hama,"34,37 €","48,66 %","-31,15 %",3,"50,00 %","-62,50 %","34,37 €","48,66 %","-31,15 %","14,52 €","50,00 %","-58,75 %",3,"50,00 %","-62,50 %",1,,
B000VRANI6,"Hama Fine Art Bordeaux 50 Pages Noires/à spirales090144, Bordeaux, 36 x 32 cm",Hama,"33,72 €","-59,03 %","-61,60 %",2,"-60,00 %","-66,67 %","33,72 €","-59,03 %","-61,60 %","17,10 €","-59,91 %","-64,84 %",2,"-60,00 %","-66,67 %",,,
B01K47G7VO,"Mini album photo à pochettes ""La Fleur"" pr 40 photos 10 x 15 cm, blc",Hama,"33,66 €","-18,18 %","-52,63 %",9,"-18,18 %","-52,63 %","29,92 €","-27,27 %","-60,00 %","19,92 €","-27,27 %","-56,88 %",8,"-27,27 %","-60,00 %",,,
B078T7GHFK,"Hama Souris Optique Filaire MC-100-3 Boutons - Ergonomique, Précise, USB Plug & Play - Compatible Windows, Mac, Linux - Idéale pour Bureautique, Droitiers et Gauchers - Noire",Hama,"33,66 €","341,73 %","-45,53 %",9,"800,00 %","-43,75 %","33,66 €","341,73 %","-45,53 %","22,59 €","800,00 %","-41,40 %",9,"800,00 %","-43,75 %",1,,
B001UBD17C,"Hama Album, Vert Pomme, 36 x 32 cm",Hama,"33,65 €","5,62 %","-56,55 %",2,"0,00 %","-60,00 %","33,65 €","5,62 %","-56,55 %","17,06 €","0,00 %","-56,54 %",2,"0,00 %","-60,00 %",1,,
B08FRKD2HT,"Hama Clé USB 3.0 ""Rotate"" (capacité de 256 GB, taux de transfert de 90 MB/s, avec accroche porte-clefs, flashpen clé usb) Bleu Pétrole",Hama,"33,54 €","-85,65 %",,2,"-88,24 %",,"33,54 €","-85,65 %",,"25,00 €","-88,24 %",,2,"-88,24 %",,,,
B07H149QV2,"Hama Album photo 'Susi Pastell' (couverture souple, 24 pages pour 24 photos au format 10x15 cm, résistant, pour archiver avec des anecdotes, protège la photo, mini album) Couleurs pastel Aléatoires",Hama,"33,48 €","-70,00 %","-78,74 %",27,"-70,00 %","-78,74 %","33,48 €","-70,00 %","-78,74 %","23,76 €","-70,00 %","-76,61 %",27,"-70,00 %","-78,74 %",,,"-100,00 %"
B00006JB4Z,"Hama Antenne intérieur (antenne radio pour l'amplification du signal actif jusqu'à 30 dB, fiche coaxiale, puissance de l'amplificateur réglable, hauteur de 12,3 cm, AM/FM, en corne) Noir",Hama,"33,32 €",,"-89,11 %",1,,"-90,00 %","33,32 €",,"-87,86 %","26,37 €",,"-88,66 %",1,,"-88,89 %",1,"0,00 %","-50,00 %"
B08YS25RDP,"Hama Répartiteur Satellite (2 Voies Fiche F, Totalement blindé, Distributeur Sat, Protection Totale, Garantie 10 Ans) Argent",Hama,"33,30 €","-75,00 %",,5,"-75,00 %",,"33,30 €","-76,19 %",,"29,60 €","-76,19 %",,5,"-76,19 %",,,"-100,00 %",
B00005QFAF,"Best Price Square Spirit Level,2 Bubble,Hot-Shoe Mount 5411 by HAMA",Hama,"32,72 €",,,2,,,"32,72 €",,,"21,86 €",,,2,,,,,
B00194JFVG,"Cadre métallique pour portrait ""Laval"", 2x 10x15 cm",Hama,"32,46 €","-88,89 %",,3,"-88,89 %",,"43,28 €","-84,62 %",,"30,52 €","-84,62 %",,4,"-84,62 %",,1,,
B0017UGOX4,"Hama Passe-Partout (Premium, Dimensions : Extérieur : 30 cm x 40 cm/Intérieur : 20 cm x 27 cm) Blanc Arctique",Hama,"32,46 €","-66,67 %","239,18 %",3,"-66,67 %","200,00 %","64,92 €","0,00 %","578,37 %","16,98 €","0,00 %","543,18 %",6,"0,00 %","500,00 %",2,,"100,00 %"
B000S8B51C,"Hama Pochettes-classeurs (pour CD/DVD, Couvre classeur à Anneaux, 2 par Pochette, Lot de 50) Blanc/Transparent",Hama,"32,38 €","-45,23 %","-34,90 %",3,"-50,00 %","-50,00 %","32,38 €","-45,23 %","-34,90 %","15,90 €","-50,00 %","-44,52 %",3,"-50,00 %","-50,00 %",4,,
B07ZDMHYMS,"Hama Clé USB C-Laeta (USB3.1/USB3.0 Type-C, 256GB, Double clé USB, pour Ordinateur Portable, téléphone Mobile, Tablette, OTG, 70 Mo/s, boîtier en métal, USB Type-C, clé de téléphone Portable) Argent",Hama,"32,31 €",,,1,,,"32,31 €",,,"19,40 €",,,1,,,,,
B0163ZHGCK,"Hama Carte mémoire Photo (SDHC pour Photo/Classe 10, 16 GB - 80 MB/s) Bleu",Hama,"32,28 €",,"181,18 %",4,,"100,00 %","32,28 €",,"181,18 %","20,00 €",,"59,62 %",4,,"100,00 %",,,
B009HSQ4JM,"Hama Album Photo ""Fine Art"" (format 36 x 32 cm, 50 pages noires, à spirale) Azur",Hama,"32,09 €","-57,96 %","-88,99 %",2,"-60,00 %","-90,00 %","32,09 €","-64,54 %","-89,51 %","16,90 €","-66,67 %","-90,00 %",2,"-66,67 %","-90,48 %",1,,
B0000AIRTH,"Hama Cadre photo en plastique ""Décor Sevilla"" (taille du Cadre de 30 x 45 cm avec bordure de 9 mm x 17 mm, pour une photo de 20 x 30 cm) Or Mat",Hama,"32,03 €","-49,44 %","-3,35 %",2,"-50,00 %","0,00 %","32,03 €","-49,44 %","-3,35 %","13,00 €","-50,00 %","9,98 %",2,"-50,00 %","0,00 %",,,
B07NH31NL6,"Couvercle Pare-poussière pour Clavier, Transparent",Hama,"31,99 €","-35,31 %","-12,50 %",7,"0,00 %","-12,50 %","27,42 €","-44,55 %","-25,00 %","21,00 €","-9,91 %","6,54 %",6,"-14,29 %","-25,00 %",,,
B005DJXYY2,"Hama Album Photo ""Singo"" (album minimax, 13 x 16,5 cm, 100 pages, pour 100 photos au format 10 x 15 cm) Aqua",Hama,"31,99 €","-66,64 %","250,00 %",7,"-63,16 %","250,00 %","31,99 €","-66,64 %","250,00 %","20,79 €","-63,15 %","285,00 %",7,"-63,16 %","250,00 %",,,
B009HSQ45G,"Hama Album Photo ""Fine Art"" (format 36 x 32 cm, 50 pages noires, à spirale) Kiwi",Hama,"31,95 €","-34,08 %","-78,07 %",2,"-33,33 %","-80,00 %","31,95 €","-34,08 %","-80,06 %","16,90 €","-33,33 %","-81,32 %",2,"-33,33 %","-81,82 %",1,,
B0000AI3DJ,"Hama Cadre photo en plastique ""Décor Sevilla"" (taille du Cadre de 50 x 70 cm avec bordure de 13 mm x 20 mm, pour une photo de 30 x 45 cm) Or Mat",Hama,"31,85 €",,,1,,,"31,85 €",,,"11,50 €",,,1,,,,,
B007205CJK,"Hama Tapis de Souris Ergonomique (Tapis de Souris Ergonomique, 210 x 255 x 21 mm, Repose-Poignet Confortable, Tapis antidérapant, Convient aux Ordinateurs) Noir",Hama,"31,36 €",,,2,,,"31,36 €",,,"13,42 €",,,2,,,,"-100,00 %",
B009X8SFSY,"Hama ""Fine Art"" Spiral Album, 24 x 17 cm, 50 Photos, azure",Hama,"31,20 €","0,00 %","66,67 %",5,"0,00 %","66,67 %","31,20 €","0,00 %","66,67 %","19,66 €","0,05 %","83,05 %",5,"0,00 %","66,67 %",,,"-100,00 %"
B00006JCWM,"Hama Casier de rangement ""Spirit II"" (système de classement sur socle pour CD, pour 22 boîtiers CD, porte-CD pour le rangement, organisateur antidérapant) Noir",Hama,"31,00 €","129,29 %","-75,16 %",3,"200,00 %","-80,00 %","31,00 €","129,29 %","-75,16 %","17,64 €","223,08 %","-78,50 %",3,"200,00 %","-80,00 %",,,
B0BL18RCQP,"Hama Power Bank 10000 mAh (Batterie Externe, 1 USB C+2 USB A, Power Pack PD Qualcomm Quick Charge 3.0, Batterie Smartphone Tablette Enceinte Bluetooth, Voyants LED, Chargeur Portable cable 0.25m) Gris",Hama,"30,87 €",,,1,,,"30,87 €",,,"26,24 €",,,1,,,,,
B00C2LVT28,"Hama Réveil radio-piloté ""RC 540"" (fonction de veilleuse commandée par capteur, fonction de répétition de la veille, affichage de la température, la date, 6,5 cm) Noir",Hama,"30,87 €",,"-67,53 %",1,,"-80,00 %","30,87 €",,"-67,53 %","13,75 €",,"-80,00 %",1,,"-80,00 %",,,
B00IZA0V4M,"Thomson Support Mural TV WAB846 (VESA 200x200, inclinable et orientable, avec 2 Bras, pour Une Diagonale d'écran de 25 à 117 cm (de 10"" à 46"")) Noir",Thomson,"30,75 €","-79,66 %",,1,"-80,00 %",,"30,75 €","-79,66 %",,"26,20 €","-80,00 %",,1,"-80,00 %",,2,"100,00 %","100,00 %"
B01M7PKUUC,"Hama Support mural (pour enceintes Bose SoundTouch 10/Bose SoundTouch 20, pivotantes, système Easy-Fix, support pour haut-parleur) Blanc",Hama,"30,41 €",,,1,,,"30,41 €",,,"23,07 €",,,1,,,,,
B094JJTMRP,"Hama Câble HDMI (Cable HDMI Haute Vitesse High Speed, Cordon HDMI, 1.5m, mâle-mâle) Noir",Hama,"29,94 €",,,6,,,"14,97 €",,,"6,15 €",,,3,,,,,
B002IK75DA,"Xavax Thermomètre Mécanique Spécial Four et Viandes (2 en 1, en Acier Inoxydable, Mesure Simultanée du Four et de La Température du Four, va au Lave-vaisselle) Argent, -30°C/+50°C",xavax,"29,80 €","-40,41 %","-0,60 %",2,"-33,33 %","0,00 %","29,80 €","-40,41 %","-0,60 %","18,72 €","-33,33 %","17,00 %",2,"-33,33 %","0,00 %",,,"-100,00 %"
B00006JB1T,"Hama Barrette porte-flash coudée à 90° (pliable pour appareils photo / vidéo avec vis de trépied, avec poignée et boucle, 34 mm x 190 mm) Noir",Hama,"29,15 €","-66,68 %","10,12 %",1,"-66,67 %","0,00 %","29,15 €","-66,68 %","10,12 %","14,59 €","-71,80 %","-24,44 %",1,"-66,67 %","0,00 %",,"-100,00 %",
B084HZNPS3,"Hama Album Photo ""Fine Art"" (format 24 x 17 cm, 36 pages blanches, sans spirale) Vert Tilleul",Hama,"28,95 €","28,84 %","-35,58 %",3,"0,00 %","-50,00 %","28,95 €","28,84 %","-35,58 %","17,19 €","0,00 %","-46,75 %",3,"0,00 %","-50,00 %",,,
B017JY5E7S,"Hama Album Photo ""Fine Art"" (format 28 x 24 cm, 50 pages noires, à spirale) Craie",Hama,"28,80 €","-41,01 %","-61,98 %",3,"-25,00 %","-57,14 %","28,80 €","-41,01 %","-61,98 %","16,95 €","-24,73 %","-52,71 %",3,"-25,00 %","-57,14 %",4,,
B0CN9L73W3,"Hama Porte-télécommande rotatif à 360° (Support de Rangement pour 6 télécommandes, 5 compartiments, Organiseur Multifonction bureau, salle de bain, table de chevet, stylos, téléphone, lunettes) Noir",Hama,"28,76 €","100,00 %",,2,"100,00 %",,"28,76 €","100,00 %",,"16,08 €","100,00 %",,2,"100,00 %",,,,
B0BL1WPKVV,"Hama MW-300 V2 Souris sans Fil - Technologie 2.4Ghz, Capteur 1600 dpi, Clics Silencieux, Ambidextre - Jaune",Hama,"28,72 €","0,00 %",,2,"0,00 %",,"28,72 €","0,00 %",,"15,82 €","1,15 %",,2,"0,00 %",,,,
B01NCQUYWP,"Répartiteur d’antenne AM/FM DAB SMB(f)",Hama,"28,49 €","-7,50 %",,1,"0,00 %",,"28,49 €","-7,50 %",,"23,81 €","0,00 %",,1,"0,00 %",,,,
B00GRP4GK2,"Hama Boîtier Pour Cbles ""Mini"" (boite Pour Cbles, 23 X 11,5 X 11,8 Cm, Avec Pieds En Caoutchouc) Noir",Hama,"28,34 €","-81,21 %","-89,47 %",2,"-81,82 %","-89,47 %","14,17 €","-90,61 %","-94,44 %","9,16 €","-89,63 %","-92,05 %",1,"-90,91 %","-94,44 %",1,,"0,00 %"
B0C7VK9TBD,"Hama Album photo Jumbo ""La Souris"" (livre photo album grand format 30x30cm, 80 pages blanches à personnaliser et à coller, album enfant pour 320 photos au format 10 x 15 cm, Motif Souris) Vert",Hama,"28,32 €",,,2,,,"28,32 €",,,"21,80 €",,,2,,,,,
B09GLCX9G9,"Hama Coque iPhone 13 Mini Étui Portefeuille Slim Pro pour Apple, Noir",Hama,"28,32 €","100,00 %",,2,"100,00 %",,"28,32 €","100,00 %",,"22,26 €","119,96 %",,2,"100,00 %",,,,
B075RH8PTF,"Hama Album Photo Fine Art (Format 24 x 17 cm, 50 Pages Blanches, à Spirale) Noir",Hama,"28,30 €",,"107,17 %",3,,"50,00 %","28,30 €",,"107,17 %","9,66 €",,"50,00 %",3,,"50,00 %",,,
B0CP86445V,"Black Rock Coque pour iPhone 15 Pro 360° Glass Double Face, Antichoc [Etui Housse 360 Degrés] [Coque iPhone Compatible Charge sans Fil] - Noir Carbon","Black Rock","27,74 €","12,04 %",,1,"0,00 %",,"27,74 €","12,04 %",,"20,74 €","0,00 %",,1,"0,00 %",,,,
B00NCVRQK6,"Hama Support de barre de son pour téléviseur, universel pour tous les téléviseurs, tailles d'écran et barres de son (y compris Sonos Playbar), idéal en association avec les supports muraux pour téléviseurs, noir",Hama,"27,49 €",,,1,,,"27,49 €",,,"18,76 €",,,1,,,,,
B005DJXZIM,"Hama Album Photo Singo (Album minimax, 13 x 16,5 cm, 100 Pages, pour 100 Photos au Format 10 x 15 cm) Vert",Hama,"27,42 €","-60,00 %",,6,"-60,00 %",,"27,42 €","-60,00 %",,"17,82 €","-60,00 %",,6,"-60,00 %",,,,"-100,00 %"
B001B4ROAS,"Hama Boîtier Slim (pour CD et disques Blu-ray, ultra mince, avec une feuille pour la couverture, lot de 20) Transparent",Hama,"27,40 €",,,2,,,"27,40 €",,,"16,79 €",,,2,,,,,
B00006JCT6,"Hama Clé de déverrouillage (pour autoradios ISO, 2 pièces) Gris",Hama,"27,05 €","150,00 %","-62,63 %",5,"150,00 %","-61,54 %","27,05 €","150,00 %","-65,41 %","17,20 €","150,00 %","-60,87 %",5,"150,00 %","-64,29 %",,,
B000L0X2R2,"Hama Adaptateur d'antenne (pour Audi/Seat/Volkswagen) Noir/Argent/Bleu",Hama,"26,72 €","-0,71 %","108,10 %",2,"0,00 %","100,00 %","26,72 €","-0,71 %","108,10 %","10,66 €","0,00 %","131,74 %",2,"0,00 %","100,00 %",1,,
B002U7TQOC,"Hama Chemin de câbles (en aluminiun, rectangulaire, 110 x 5 x 2,6 cm) Argent",Hama,"26,66 €","0,00 %","0,00 %",1,"0,00 %","0,00 %","26,66 €","0,00 %","0,00 %","16,19 €","-9,96 %","-9,96 %",1,"0,00 %","0,00 %",,,
B00AJJJMLU,"Hama 116200 Nettoyeur de Lentille Laser DVD ""Deluxe"", Bleu, 1,3 cm*22,5 cm*15,0 cm",Hama,"26,64 €","104,61 %","12,45 %",2,"100,00 %","0,00 %","13,32 €","-48,75 %","-43,77 %","7,00 €","-50,00 %","-23,25 %",1,"-50,00 %","-50,00 %",,"-100,00 %","-100,00 %"
B076Z59MZL,"Hama Filtre de polarisation (polarisant circulaire, verre supérieure, diamètre du filetage de 67 mm, Epaisseur de la monture de 4,5 mm, filetage avant, NMC16 (nano multi-coated 16 couches)) Noir",Hama,"26,64 €","18,88 %","23,96 %",1,"0,00 %","0,00 %","26,64 €","18,88 %","23,96 %","18,29 €","0,00 %","7,52 %",1,"0,00 %","0,00 %",,,
B001JQD33U,"Kit d'alimentation, 6mm²",Hama,"26,57 €","-8,88 %",,1,"0,00 %",,"26,57 €","-8,88 %",,"15,37 €","0,00 %",,1,"0,00 %",,,,
B00792A822,"Etui ""Vegas"" pour 5 clés USB, noir",Hama,"26,50 €","3,03 %","144,92 %",2,"0,00 %","100,00 %","26,50 €","3,03 %","144,92 %","14,98 €","0,00 %","128,35 %",2,"0,00 %","100,00 %",,,
B017JY56TY,"Hama Album Photo ""Fine Art"" (format 36 x 32 cm, 50 pages blanches, à spirale) Kiwi",Hama,"26,46 €","-10,61 %","107,20 %",2,"0,00 %","100,00 %","26,46 €","-10,61 %","107,20 %","14,52 €","0,00 %","122,02 %",2,"0,00 %","100,00 %",,,
B09W5XN9RQ,"Hama HS-USB300 V2 Casque Micro - Casque USB, Microphone Intégré, Léger, Télécommande Intégrée, Fonction Mute - Noir",Hama,"26,33 €","-51,77 %",,1,"-50,00 %",,"26,33 €","-51,77 %",,"19,35 €","-50,00 %",,1,"-50,00 %",,,,
B00006J4GF,"Hama Fiche d'antenne (DIN mâle, à visser, 1 pièce) Gris/Noir",Hama,"25,88 €","-73,24 %",,3,"-76,92 %",,"25,88 €","-74,76 %",,"8,97 €","-78,57 %",,3,"-78,57 %",,2,,
B002BDLHQK,"Hama Repose-Paume (avec Effet de Massage, pour Applications PC avec Stylet de Souris ou de Tablette, Ergonomique, utilisable avec Un Tapis de Souris, Remplissage avec des Billes en Plastique) Noir",Hama,"25,68 €",,"54,33 %",2,,"0,00 %","25,68 €",,"54,33 %","10,04 €",,"0,00 %",2,,"0,00 %",,,
B0000AISE1,"Hama Cadre photo ""Clip-Fixe"" (sans bordure, 29,7 x 42 cm, Anti-Reflex) Blanc",Hama,"25,52 €","26,02 %","-45,28 %",2,"0,00 %","-50,00 %","25,52 €","26,02 %",,"8,80 €","0,00 %",,2,"0,00 %",,,,"-100,00 %"
B00006JAS7,"Hama lot de 2 Fiches d’antenne coaxiale TV (Diam 9.52mm, 1 Mâle+1 Femelle), Blanc",Hama,"25,48 €","-0,27 %",,4,"-20,00 %",,"25,48 €","-0,27 %","581,28 %","9,32 €","-18,53 %","300,00 %",4,"-20,00 %","300,00 %",1,,
B00BTKA4V0,"Hama Barrette porte-flash ""V"" (pour appareils photo / vidéo avec sabot de flash, format V, largeur 16,4 cm, V) Noir",Hama,"25,23 €",,,1,,,,,,,,,,,,,,
B01DNW2Y3C,"Hama Bloc Multiprises (10 prises, 2 interrupteurs et protection contre surtensions, prises tournées à 45°, longueur de câble de 2 m) Blanc",Hama,"25,12 €","-52,04 %","-18,49 %",1,"-50,00 %","0,00 %","25,12 €","-52,04 %","-18,49 %","19,32 €","-50,00 %","10,97 %",1,"-50,00 %","0,00 %",1,,
B079P435JW,"Hama Pochettes intérieures pour vinyles (pour 33 tours, 10 pièces, 30,5 x 30,3 x 0,3) Blanc",Hama,"25,04 €","-0,79 %","-61,89 %",2,"0,00 %","-71,43 %","25,04 €","-0,79 %","-66,56 %","12,15 €","-0,49 %","-74,10 %",2,"0,00 %","-75,00 %",,"-100,00 %","-100,00 %"
B0000AIS6A,"Hama - 63238 - Passe-partout Premium, blanc neige, 40 x 60 cm",Hama,"24,98 €",,,2,,,"24,98 €",,,"8,90 €",,,2,,,,,
B06XCCRL72,"Hama Câble de charge et transfert de données ""Métal"" (USB-A mâle vers USB-C, USB 2.0, plaqué or, câble anti-torsion, longueur de câble de 1,5 m) Anthracite",Hama,"24,98 €",,"90,98 %",1,,"0,00 %","24,98 €",,"90,98 %","9,34 €",,"0,21 %",1,,"0,00 %",,,
B079PCTWYM,"Hama Brosse (en Fibre de Carbone, pour Le Nettoyage des disques, vinyles) Noir/Argent",Hama,"24,98 €","-33,33 %",,2,"-33,33 %",,"12,49 €","-66,67 %",,"9,28 €","-66,67 %",,1,"-66,67 %",,,,
B002N8SX4W,"Hama Support mural TV Ultraslim Fixe (pour diagonale d'écran de 48 à 94 cm (19"" et 37""), pour un maximum de 25 kg, VESA jusqu'à 200 x 200, 3 étoiles) Noir",Hama,"24,97 €",,,1,,,"24,97 €",,,"9,92 €",,,1,,,,,
B005DJKEY0,"Hama Album Photo Singo (Album Auto-adhésif, 28 x 31 cm, 20 Pages, pour 60 Photos au Format 10 x 15 cm) Orange",Hama,"24,96 €","-40,00 %","-79,19 %",3,"-40,00 %","-80,00 %","33,28 €","0,00 %","-70,18 %","18,20 €","0,00 %","-69,49 %",4,"0,00 %","-71,43 %",,,
B01A72KIHA,"Hama Cordon d’alimentation Euro (coudé à 90 degrés des deux côtés, fiche secteur vers prise double Euro 8 avec contact de protection de terre, coudé des deux côtés, 1,5 m) Noir",Hama,"24,96 €","100,00 %","-82,56 %",4,"100,00 %","-76,47 %","24,96 €","100,00 %","-81,49 %","15,00 €","90,11 %","-76,67 %",4,"100,00 %","-75,00 %",,,"-100,00 %"
B003LTSUL8,"Hama Chemin de câbles (en aluminiun, rectangulaire, 110 x 5 x 2,6 cm) Blanc",Hama,"24,92 €","-66,67 %","3,49 %",1,"-66,67 %","0,00 %","24,92 €","-66,67 %","3,49 %","17,81 €","-66,67 %","10,01 %",1,"-66,67 %","0,00 %",,"-100,00 %",
B00005KHTE,"Hama Filtre polarisant (circulaire, Traité, 77mm, 2 couches par face) Noir",Hama,"24,92 €",,,1,,,"24,92 €",,,"40,36 €",,,1,,,,,
B005GCMZLY,"Hama Album photo ""Singo"" (couverture souple, 36 pages pour 36 photos au format 10x15 cm par album, résistant, pour archiver avec des anecdotes, protège la photo, mini album) Multicolore",Hama,"24,84 €","-62,50 %","-9,90 %",12,"-62,50 %","100,00 %","24,84 €","-64,71 %","-9,90 %","16,08 €","-64,71 %","129,06 %",12,"-64,71 %","100,00 %",1,,
