B001E724P2,"Cadre photo métallique ""Nantes"" pour portrait, argenté, 13 x 18 cm",Hama,,,"-100,00 %",,,"-100,00 %",,,"-100,00 %",,,"-100,00 %",,,"-100,00 %",,,
B005JI3COY,"Hama Smartly Clé USB 2.0 - Flash Drive 32 Go, Vitesse jusqu'à 10 Mo/s, Clef avec connecteur USB A, pour PC/Mac - Noire",Hama,,,,,,,,,"-100,00 %",,,"-100,00 %",,,"-100,00 %",,,
B001AGFCZG,"Hama Kit d'alimentation (kit AMP avec câbles d'alimentation de 10 mm², câbles RCA, porte-fusible, fusible, cosse, attache de câble) Noir/Rouge/Bleu/Transparent",Hama,,"-100,00 %","-100,00 %",,"-100,00 %","-100,00 %",,"-100,00 %","-100,00 %",,"-100,00 %","-100,00 %",,"-100,00 %","-100,00 %",,,
B00006J9WX,"Hama Prise d' antenne coaxiale, enfichable",Hama,,,"-100,00 %",,,"-100,00 %",,,"-100,00 %",,,"-100,00 %",,,"-100,00 %",,,
B005MI4YVG,"Hama Spy Protect Webcam PC - Qualité Vidéo HD 720p, Microphone Intégré, Eclairage LED, Cache Lentille - Convient pour Les Appels Vidéos - Noir",Hama,,"-100,00 %",,,"-100,00 %",,,"-100,00 %",,,"-100,00 %",,,"-100,00 %",,,"-100,00 %",
B0002W6FP0,"Hama Etui universel ""Mini"" (pour cartes mémoire, pour cartes CF/SM/SD/MMC/xD/MStick, pour 10 cartes) Noir/Gris",Hama,,,"-100,00 %",,,"-100,00 %",,,"-100,00 %",,,"-100,00 %",,,"-100,00 %",,,
B00KYPWND8,"Hama Cadre Photo Davos pour Portrait, Titane, 13 x 18 cm",Hama,,"-100,00 %",,,"-100,00 %",,,"-100,00 %",,,"-100,00 %",,,"-100,00 %",,,,
B00DCNOEJK,"Hama Rotate Clé USB 2.0 - Flash Drive 128 Go, Vitesse jusqu'à 15 Mo/s, Clef avec connecteur USB A, pour PC/Mac - Noire/Argenté",Hama,,"-100,00 %",,,"-100,00 %",,,"-100,00 %",,,"-100,00 %",,,"-100,00 %",,,,
B0089CJZ4S,"Hama Support mural TV Fixe (Pour diagonale d’écran de 81 à 191cm (32"" à 75""), pour un maximum de 60 kg, VESA jusqu'à 800 x 400, 3 étoiles) Noir",Hama,,"-100,00 %",,,"-100,00 %",,,"-100,00 %",,,"-100,00 %",,,"-100,00 %",,,,
B00CKIQCBG,"Hama Multiprise 3 Prises 16A avec Interrupteur (Rallonge multiprises 3m, Bloc 3 prises Type F Schuko, Idéal Bureau PC luminaires, Atelier, Meuble TV, Garage )Noir",Hama,,,"-100,00 %",,,"-100,00 %",,,"-100,00 %",,,"-100,00 %",,,"-100,00 %",,,
B0000AIS8M,"Hama Cadre photo en plastique ""Décor Sevilla"" (taille du Cadre de 21 x 29,7 cm (DIN 4) avec bordure de 9 mm x 17 mm, pour une photo de 15 x 20 cm) Or Mat",Hama,,"-100,00 %",,,"-100,00 %",,,"-100,00 %",,,"-100,00 %",,,"-100,00 %",,,,
B0C7VHX9FG,"Hama Album photo Jumbo ""La Souris"" (livre photo album grand format 30x30cm, 80 pages blanches à personnaliser et à coller, album enfant pour 320 photos au format 10 x 15 cm, Motif Souris) Jaune",Hama,,"-100,00 %",,,"-100,00 %",,,"-100,00 %",,,"-100,00 %",,,"-100,00 %",,,,
B009Z53R8S,"Gilet de sécurité ""Automotive"" pour enfant, jaune fluo",Hama,,,"-100,00 %",,,"-100,00 %",,,"-100,00 %",,,"-100,00 %",,,"-100,00 %",,,
B078MNXNNS,"Hama Cadre Photo en Plastique Rio (Cadre de 15 cm x 20 cm, Bordures de 25 mm x 16 mm, pour les Photo de Taille 10 cm x 15 cm, Verre reflex, Bois-plastique (WPC), avec Crochet et Pied) Noir",UNKNOWN,,,"-100,00 %",,,"-100,00 %",,,,,,,,,,,,
B0000AIS5M,"Hama 00066224 Cadre en plastique Sevilla, Noir, 28 x 35 cm",Hama,,,"-100,00 %",,,"-100,00 %",,,"-100,00 %",,,"-100,00 %",,,"-100,00 %",,,
B0BL1RYFT8,"Hama MW-300 V2 Souris sans Fil - Technologie 2.4Ghz, Capteur 1600 dpi, Clics Silencieux, Ambidextre - Rouge",Hama,,"-100,00 %",,,"-100,00 %",,,"-100,00 %",,,"-100,00 %",,,"-100,00 %",,,,
B0000AISC8,"Hama Cadre photo en plastique ""Sevilla"" (taille du Cadre de 24 x 30 cm avec bordure de 9 mm x 17 mm, pour une photo de 15 x 20 cm) Noir",Hama,,,,,,,,,,,,,,,,,,
B005VNYX9U,"Hama Cadre pour Portrait Photo Philadelphia, 10 x 15 cm",Hama,,,,,,,,,"-100,00 %",,,"-100,00 %",,,"-100,00 %",,,
B00006IVSZ,"Hama Pochette ""Pare-soleil"" (pour véhicule, pour 12 CD/DVD/Blu-Ray) Noir",Hama,,"-100,00 %","-100,00 %",,"-100,00 %","-100,00 %",,"-100,00 %","-100,00 %",,"-100,00 %","-100,00 %",,"-100,00 %","-100,00 %",,,
B003TKJ6B2,"Hama Carte mémoire Photo (SDHC pour Photo/Classe 10, 16 GB - 22 MB/s) Bleu",Hama,,,"-100,00 %",,,"-100,00 %",,,"-100,00 %",,,"-100,00 %",,,"-100,00 %",,,
B00006JDHW,"Hama Répartiteur de câble large bande (4 voies, totalement blindé, répartiteur CATV, CATV, Coulée en F, Coulée en 4x) Argent",Hama,,"-100,00 %",,,"-100,00 %",,,"-100,00 %",,,"-100,00 %",,,"-100,00 %",,,,
B077GCGC3H,"Hama Convertisseur de souris/clavier (SpeedShot Ultimate, compatible avec Xbox One X, PlayStation 4 / SLIM / PRO, Xbox One, PlayStation 3, Xbox 360) Noir/Bleu",Hama,,,"-100,00 %",,,"-100,00 %",,,"-100,00 %",,,"-100,00 %",,,"-100,00 %",,,"-100,00 %"
B017IM670E,"Hama Cadre photo en plastique ""Paris"" (cadre de 10 cm x 15 cm, bordures de 20 mm x 15 mm, pour les photo de taille 7 cm x 10 cm, verre reflex, polystyrene (PS), avec crochet et pied) Noir",Hama,,,,,,,,,,,,,,,,,,
B08GSQQS81,"Hama 2 Têtes thermostatiques Connectées et intelligentes + base (Kit de démarrage, Contrôle du chauffage WiFi, Economie d'Energie, Compatible Alexa Google Siri) Blanc",Hama,,,,,,,,,,,,,,,,,,"-100,00 %"
B0BL1TH1PX,"Hama Kit Support Téléphone Voiture Universel (Ensemble Support téléphone pour Voiture, 2en1 Clip pour aération et Ventouse, pivotable 360°, pour Mobile de Largeur de 4 à 11 cm) Noir",Hama,,"-100,00 %",,,"-100,00 %",,,"-100,00 %",,,"-100,00 %",,,"-100,00 %",,,,
B015KFXENY,"Hama Convertisseur de souris/clavier pour PS4/PS3/Xbox One/Xbox360",Hama,,,,,,,,,,,,,,,,,,
B0002W6A6E,"Hama Supports d'enceintes (pour haut-parleur, hauteur réglable jusqu'à 123 cm, capacité de charge de 5 kg, guide-câble dissimulé, lot de 2) Argent",Hama,,"-100,00 %","-100,00 %",,"-100,00 %","-100,00 %",,"-100,00 %","-100,00 %",,"-100,00 %","-100,00 %",,"-100,00 %","-100,00 %",,,
B07F6SYKY3,"THOMSON Ecouteurs Filaire Jack EAR3008BK Piccolino (écouteurs Intra-Auriculaires filaires, Ultra-léger, Prise Jack 3.5 mm Plaqué Or, Micro et Fonction Télécommande) Blanc",Thomson,,,"-100,00 %",,,"-100,00 %",,,"-100,00 %",,,"-100,00 %",,,"-100,00 %",,,
B00006JDH7,"Hama Bague d'adaptation (en métal, pour monter un Filtre de 62 mm sur un Objectif de 55 mm) Noir",Hama,,,"-100,00 %",,,"-100,00 %",,,"-100,00 %",,,"-100,00 %",,,"-100,00 %",,,
B00194JG0Q,"Hama Cadre Photo Métallique Davos pour Portrait, Doré, 13 x 18 cm",Hama,,,"-100,00 %",,,"-100,00 %",,,"-100,00 %",,,"-100,00 %",,,"-100,00 %",,,
B01GKI0ES8,"Hama Support universel voiture ""Magnet Alu"" (pour tous les smartphones et tablettes, fente aération, poids de 52 g) Noir/Gris",Hama,,,"-100,00 %",,,"-100,00 %",,,"-100,00 %",,,"-100,00 %",,,"-100,00 %",,,"-100,00 %"
B09R4VFG6K,"Hama Coque S22+ (5G) Finest Feel pour Samsung (Coque Souple Galaxy S22 Plus, Protection Contre Chocs salissure Rayures, Finition Soyeuse Caoutchouc, Compatible Chargement sans Fil) Noir",Hama,,,,,,,,,,,,,,,,,,
B000V7MUQY,"Hama Album Photo Naissance 29x32cm Baby Feel (200 photos 10x15cm à coller, 60 pages blanches vierges, intercalaire Papier Cristal, Album Scrapbooking DIY Livre photo à Personnaliser, Motif Bébé) Beige",Hama,,"-100,00 %",,,"-100,00 %",,,"-100,00 %",,,"-100,00 %",,,"-100,00 %",,,,
B001E7251U,"Hama Clé USB 2.0 ""Laeta"", 8 GB (transfert de données à 10 Mo / s, clé USB avec anneau œillet, capuchon de verrouillage, pour Windows/Macbook, en métal) bleu",UNKNOWN,,,,,,,,,,,,,,,,,,
B07RT5XDRY,"Coque de protec. ""Red Sensation No. 4"" pr Apple iPhone X/Xs, noir/rge",Hama,,,"-100,00 %",,,"-100,00 %",,,"-100,00 %",,,"-100,00 %",,,"-100,00 %",,,
B0CNRNM52W,"Hama Montre connectée GPS Intégré 8900"" (Montre Sport, écran AMOLED 1,43"", Fonction Prise d’appels, contrôle Vocal Alexa, altimètre barométrique, IP68), Noire",Hama,,"-100,00 %",,,"-100,00 %",,,"-100,00 %",,,"-100,00 %",,,"-100,00 %",,,"-100,00 %",
B00NCX5GQU,"Hama Etui de protection photo/vidéo semi-rigide ""Hardcase Colour Style"" (80M, EVA, sacoche avec coque, anti-choc, pour le voyage, appareil petit format, ultra-compact, compact, MP3, MP4, iPod) Noir",UNKNOWN,,"-100,00 %","-100,00 %",,"-100,00 %","-100,00 %",,"-100,00 %","-100,00 %",,"-100,00 %","-100,00 %",,"-100,00 %","-100,00 %",,,
B000P3M79O,"Hama 20596 Tunnel souple pour cable 12 mm Gris",Hama,,,"-100,00 %",,,"-100,00 %",,,"-100,00 %",,,"-100,00 %",,,"-100,00 %",,,
B08BX81WZN,"Black Rock Coque pour iPhone 12/12 Pro Robust Real Carbon [Housse Technologie Active Air] [Coque Protection Moléculaire] - Noir","Black Rock",,"-100,00 %",,,"-100,00 %",,,"-100,00 %",,,"-100,00 %",,,"-100,00 %",,,,
B07NH3MBZC,"Ampoule LED, E14, 330lm remp. 30W, amp. réfl. R50, bl. chd., 2 p.",Hama,,"-100,00 %",,,"-100,00 %",,,"-100,00 %",,,"-100,00 %",,,"-100,00 %",,,,
B08XZCYYF3,"Hama Montre connectée Fit Watch 4900 étanche avec Protection IP68 pour la résistance à l'eau (6 Jours d'autonomie, podomètre, Tracker de fréquence Cardiaque et Mesure des dépenses de Calories) Bleu",Hama,,,,,,,,,,,,,,,,,"-100,00 %",
B0000AIRX2,"Hama Cadre photo en plastique ""Sevilla"" (taille du Cadre de 30 x 45 cm avec bordure de 9 mm x 17 mm, pour une photo de 20 x 30 cm) Bleu",Hama,,,"-100,00 %",,,"-100,00 %",,,"-100,00 %",,,"-100,00 %",,,"-100,00 %",,,
B0000AIS9R,"Hama Cadre photo en plastique ""Décor Sevilla"" (taille du Cadre de 20 x 30 cm avec bordure de 9 mm x 17 mm, pour une photo de 13 x 18 cm) Argent Mat",Hama,,,"-100,00 %",,,"-100,00 %",,,"-100,00 %",,,"-100,00 %",,,"-100,00 %",,,
B0000AIS8J,"Hama Cadre photo en plastique ""Décor Sevilla"" (taille du Cadre de 24 x 30 cm avec bordure de 9 mm x 17 mm, pour une photo de 15 x 20 cm) Argent Mat",Hama,,,,,,,,,,,,,,,,,,"-100,00 %"
B07BBHYNDF,"Hama - Stylet 2 en 1 pour tablettes et smartphones, avec adaptateur jack en Y - Coloris assortis",Hama,,,"-100,00 %",,,"-100,00 %",,,"-100,00 %",,,"-100,00 %",,,"-100,00 %",,,
B0000WXD0W,"Hama Trépied photo/vidéo ""Star 61"" (Trépied d'entrée de gamme léger, tête à trois voies, 60-153 cm, 3D) Champagne, 00004161",Hama,,,"-100,00 %",,,"-100,00 %",,,"-100,00 %",,,"-100,00 %",,,"-100,00 %",,,
B001SLCC7Y,"Hama Lecteur USB 2.0 ""8en1 de Cartes (USB, microSD/SDHC, SD/SDHC, MMC) Transparent",Hama,,"-100,00 %","-100,00 %",,"-100,00 %","-100,00 %",,"-100,00 %","-100,00 %",,"-100,00 %","-100,00 %",,"-100,00 %","-100,00 %",,,
B0000AITJE,"Hama Chevalet ""Clip-Fix"" (en fer, 24 x 30 cm) Argent",Hama,,,"-100,00 %",,,"-100,00 %",,,"-100,00 %",,,"-100,00 %",,,"-100,00 %",,,
B00006JBE9,"Hama Bague d'adaptation (en métal, pour monter un Filtre de 77 mm sur un Objectif de 67 mm) Noir",Hama,,,,,,,,,,,,,,,,,,
B00006JCRY,"Hama Liquide de Nettoyage de Rechange",Hama,,,"100,00 %",,,"100,00 %",,,,,,,,,,,,
B00005UPE1,"Hama Câble réseau RJ45 Droit Ethernet Cat 5e STP (câble de raccordement de 10 m, 1000 Mbit/s, plaqué Or, blindé) Gris",Hama,,"-100,00 %","-100,00 %",,"-100,00 %","-100,00 %",,"-100,00 %",,,"-100,00 %",,,"-100,00 %",,,,
B00006JCYL,"Hama 16772 boucle pour un filtre adapteur 67-72",Hama,,,,,,,,,,,,,,,,,,
B00006J6H0,"Hama Adaptateur d'antenne (fiche ISO mâle 90° - fiche DIN Femelle) Argent",Hama,,"-100,00 %","-100,00 %",,"-100,00 %","-100,00 %",,"-100,00 %","-100,00 %",,"-100,00 %","-100,00 %",,"-100,00 %","-100,00 %",,,
B000X9Z4AE,"Xavax Colliers de serrage (jeu de 2 colliers de serrage avec entraînement par vis sans fin, plage de serrage 110 - 130 mm, largeur de courroie 9 mm) Argent",xavax,,,"-100,00 %",,,"-100,00 %",,,"-100,00 %",,,"-100,00 %",,,"-100,00 %",,,
B0000AISCH,"Hama Cadre Photo Clip-Fixe (sans Bordure, 40 x 50 cm, Reflex) Blanc",Hama,,,"-100,00 %",,,"-100,00 %",,,"-100,00 %",,,"-100,00 %",,,"-100,00 %",,,
B07DHPZ3JB,"Mini souris ""Pesaro"", anthracite",Hama,,,"-100,00 %",,,"-100,00 %",,,"-100,00 %",,,"-100,00 %",,,"-100,00 %",,,
B00U78QOD2,"Hama Laeta Clé USB 3.0 - Flash Drive 16 Go, Vitesse jusqu'à 70 Mo/s, Clef avec connecteur USB A, pour PC/Mac - Bronze",Hama,,"-100,00 %",,,"-100,00 %",,,"-100,00 %",,,"-100,00 %",,,"-100,00 %",,,,
B07PCQGGBF,"Hama Album Photo Vierge Grand Format Brushstroke (Album Photo Traditionnel 30 x 30 cm, 80 Pages pour 320 Photos Format 10 x 15 cm, Protection idéale, Artistique, élégant) Bleu/Jaune/Orange/Blanc",Hama,,,,,,,,,,,,,,,,,,"-100,00 %"
B07F39Q8BX,"Sac pour Appareil Photo Monterey, 100, Noir",Hama,,,"-100,00 %",,,"-100,00 %",,,"-100,00 %",,,"-100,00 %",,,"-100,00 %",,,
B00006J9XX,"Hama Bloc 3 Prises Avec Terre 16A (Rallonge multiprises 1.4m, Prises Multiple Contact de Terre, Bloc Multiprise electrique Schuko, 3680W, ) Blanc",Hama,,,"-100,00 %",,,"-100,00 %",,,"-100,00 %",,,"-100,00 %",,,"-100,00 %",,,
B00C5FS74Y,"Hama Fiche de Voyage (pour la Chine/l´Australie, … Type F) Noir",Hama,,,,,,,,,,,,,,,,,,
B00006J6I7,"Adaptateur d'antenne, fiche mâle DIN - fiche femelle ISO",Hama,,"-100,00 %","-100,00 %",,"-100,00 %","-100,00 %",,"-100,00 %","-100,00 %",,"-100,00 %","-100,00 %",,"-100,00 %","-100,00 %",,,
B0002VFLQ0,"Hama Pochettes (pour CD/DVD/blu-Ray, 2 pièces par pochette, lot de 100) Transparent",UNKNOWN,,,"-100,00 %",,,"-100,00 %",,,,,,,,,,,,
B00006JA7O,"Hama - 5122 - Convertisseurs de pas B 1/4"" (6,4mm) => A 3/8"" (9,5mm)",Hama,,,"-100,00 %",,,"-100,00 %",,,"-100,00 %",,,"-100,00 %",,,"-100,00 %",,,
B0017233QI,"Hama Tissu de revêtement (insonorisant, autoadhésif) Noir",Hama,,,,,,,,,,,,,,,,,"-100,00 %",
B086M1S549,"Hama Prise de jardin avec piquet (2 prises avec couvercle individuel, programmateur minuterie mécanique, câble 2m type 3G 1.5 mm2, étanche, résistant aux intempéries, 3860W/16A, 230V) Noir",Hama,,,"-100,00 %",,,"-100,00 %",,,"-100,00 %",,,"-100,00 %",,,"-100,00 %",,,
B0791821RN,"Lecteur multi-cartes USB 3.0, SD/microSD/CF/MS, noir",Hama,,,"-100,00 %",,,"-100,00 %",,,"-100,00 %",,,"-100,00 %",,,"-100,00 %",,,
B0BKYL622V,"Hama Power Pack Slim 5HD (Batterie Externe 5 000 mAh, Batterie Portable Charge Rapide, USB 3.0, Power Bank Compatible avec iPhone 14 13 12 11 X Samsung Xiaomi Huawei iPad etc) Blanc",Hama,,"-100,00 %",,,"-100,00 %",,,"-100,00 %",,,"-100,00 %",,,"-100,00 %",,,,
B06XJD3CCP,"Hama Support Mural TV Tilt (VESA jusqu'à 600x400, pour Une Diagonale d’écran de 81 à 191cm (32"" à 75"")) Noir",Hama,,,"-100,00 %",,,"-100,00 %",,,"-100,00 %",,,"-100,00 %",,,"-100,00 %",,,
B00CMLYDF8,"Hama Bloc multiprises ""Colour"" (10 prises, longueur de câble 1,5 m, sécurité enfants, prise multiple) Blanc",Hama,,,"-100,00 %",,,"-100,00 %",,,"-100,00 %",,,"-100,00 %",,,"-100,00 %",,,
B00IA13HWE,"Hama Convertisseur HDMI™ pour VGA et audio (HDMI vers VGA, pour les anciens projecteurs avec entrée VGA, Full HD, comprenant la transmission audio (Line Out), connecteurs plaqués or) Noir",Hama,,,"-100,00 %",,,"-100,00 %",,,"-100,00 %",,,"-100,00 %",,,"-100,00 %",,,"-100,00 %"
B0015LAQ2K,"Hama Films pour plastifieuse à chaud, DIN A5, 80µ, 100 pièces",Hama,,,"-100,00 %",,,"-100,00 %",,,"-100,00 %",,,"-100,00 %",,,"-100,00 %",,,
B08C2DRXZK,"Hama Déclencheur à Distance Bluetooth BRS3 (Télécommande Bluetooth pour Appareil Photo de Smartphone et Tablette, portée 10m, idéal Selfies créatifs sur Instagram, TikTok, Youtube, Facebook) Noir",Hama,,"-100,00 %",,,"-100,00 %",,,"-100,00 %",,,"-100,00 %",,,"-100,00 %",,,,
B077CWDNM4,"Hama Câble de charge pour manette ""Basic"" (pour PS4, 1,50 m, câble extra-long, connexion microUSB) Noir",Hama,,"-100,00 %",,,"-100,00 %",,,"-100,00 %",,,"-100,00 %",,,"-100,00 %",,,,
B07B6PRXV4,"Xavax Ampoule LED (55 W, GU10, 400 lm, 30000 h, Blanc chaud, LED 230V, Remplacement Ampoule type PAR16 ou RA90) Mate",UNKNOWN,,,"-100,00 %",,,"-100,00 %",,,"-100,00 %",,,"-100,00 %",,,"-100,00 %",,,
B00A44ODKK,"Hama Bloc multiprises ""Colour"" (6 prises, longueur de câble 3 m, sécurité enfants, prise multiple) Noir",Hama,,,,,,,,,,,,,,,,,,
B003F3Q1Z2,"Hama Câble de liaison ""AluLine"" (fiche jack 3.5 mm mâle - mâle, stéréo, plastique, 1 m) Noir/Gris",Hama,,,"-100,00 %",,,"-100,00 %",,,"-100,00 %",,,"-100,00 %",,,"-100,00 %",,,
B083BB2V3C,"Hama Trépied Delta 160', 3D",Hama,,,"-100,00 %",,,"-100,00 %",,,"-100,00 %",,,"-100,00 %",,,"-100,00 %",,,
B0002W5WEK,"Hama Boîtier ""Slim"" (pour DVD, convient également aux CD et disques Blu-ray, ultra mince, avec une feuille pour la couverture, lot de 10) Noir/Transparent",Hama,,"-100,00 %",,,"-100,00 %",,,"-100,00 %",,,"-100,00 %",,,"-100,00 %",,,,
B00006IVT5,"Hama Convertisseurs de pas ""GS 5000"" (pas 1/4"" => 3/8"", ensemble de 10 pièces pour tête de trépied) Argent",Hama,,,,,,,,,,,,,,,,,,
B0CN9K1TYB,"Hama Porte-télécommande 'Major4' (Support de Rangement pour 4 télécommandes, 4 compartiments, Organiseur Multifonction bureau, salle de bain, table de chevet, stylos, téléphone, lunettes) Noir",Hama,,"100,00 %",,,,,,"-100,00 %",,,"-100,00 %",,,"-100,00 %",,,,
B00194HCBQ,"Cadre métallique pour portrait ""Laval"", 3x 10x15 cm",Hama,,,,,,,,,"-100,00 %",,,"-100,00 %",,,"-100,00 %",,"-100,00 %",
B083B7V3TR,"Hama Cadre photo en plastique ""Sierra"" (cadre de 30 cm x 40 cm, bordures de 25 mm x 19 mm, pour les photo de taille 20 cm x 28 cm, verre reflex, polystyrene (PS), avec crochet) Gris",Hama,,"-100,00 %",,,"-100,00 %",,,"-100,00 %",,,"-100,00 %",,,"-100,00 %",,,,
B00006J6K2,"Hama Répartiteur modulaire (connecteurs femelle 6p4c - 2 femelles 6p4c) Noir",Hama,,,"-100,00 %",,,"-100,00 %",,,"-100,00 %",,,"-100,00 %",,,"-100,00 %",,,
B000L9OBAA,"Hama Tube pour câbles (faisceau de câbles, forme en spirale, longueur 2,5 mètres, diamètre 20 mm) Noir",Hama,,,"-100,00 %",,,"-100,00 %",,,"-100,00 %",,,"-100,00 %",,,"-100,00 %",,,
B000X1BW0I,"Hama - Chargeur secteur 220v USB 5v / 500 ma livré avec câble pour mp3 créative - Noir",Hama,,,"-100,00 %",,,"-100,00 %",,,,,,,,,,,,
B01LY0M2GZ,"HAMA Cadre Photo en Bois Iowa, Noisette, 13 x 18 cm",Hama,,,"100,00 %",,,"100,00 %",,,,,,,,,,,,
B09GLC46PK,"Hama Coque iPhone 13 Pro Max Étui Portefeuille Slim Pro pour Apple, Noir",Hama,,"-100,00 %","-100,00 %",,"-100,00 %","-100,00 %",,"-100,00 %","-100,00 %",,"-100,00 %","-100,00 %",,"-100,00 %","-100,00 %",,,
B08YRZNGVQ,"Hama Coupleur RJ45 (Adaptateur d'extension Ethernet, Femelle/Femelle, Garantie 10ans, Coupleur Ethernet Connecteur LAN Compatible avec Les câbles LAN, Les câbles réseau, Les câbles Ethernet) Argenté",Hama,,,"-100,00 %",,,"-100,00 %",,,"-100,00 %",,,"-100,00 %",,,"-100,00 %",,,
B007HZBZKK,"Hama Antenne pour vitre DAB/DAB+ (Antenne adhésive) Noir",Hama,,,"-100,00 %",,,"-100,00 %",,,"-100,00 %",,,"-100,00 %",,,"-100,00 %",,,"-100,00 %"
B01M0ISAYY,"Hama Cadre photo en plastique ""Saragossa"" (taille de cadre 30x40 cm, taille de photos 20x28 cm, photos format vertical, en plastique, 1 photo par cadre, élégant, simple, classique) Blanc",Hama,,"-100,00 %","-100,00 %",,"-100,00 %","-100,00 %",,"-100,00 %","-100,00 %",,"-100,00 %","-100,00 %",,"-100,00 %","-100,00 %",,,
B00QRHG81K,"Hama Clé USB 3.0 ""Laeta Twin (FlashPen, OTG, Aluminium, USB 3.0, jusqu'à 40 Mo/s, 16GB) Noir",Hama,,"-100,00 %","-100,00 %",,"-100,00 %","-100,00 %",,"-100,00 %","-100,00 %",,"-100,00 %","-100,00 %",,"-100,00 %","-100,00 %",,,
B07361NQD4,"Hama Filtre Premium UV 390, 72 mm larg, Nano, Super-Coated (18 Couches)",Hama,,,"-100,00 %",,,"-100,00 %",,,"-100,00 %",,,"-100,00 %",,,"-100,00 %",,,
B00005YVG3,"Hama Pare-soleil caoutchouté pour objectifs standard, 46mm",Hama,,,"-100,00 %",,,"-100,00 %",,,"-100,00 %",,,"-100,00 %",,,"-100,00 %",,,
B009X8SDUO,"Hama ""Fine Art"" Spiral Album, 24 x 17 cm, 50 Photos, taupe",Hama,,"-100,00 %","-100,00 %",,"-100,00 %","-100,00 %",,"-100,00 %","-100,00 %",,"-100,00 %","-100,00 %",,"-100,00 %","-100,00 %",,,"-100,00 %"
B0000AHID1,"Hama Cadre photo en plastique ""Sevilla"" (taille du Cadre de 10 x 15 cm avec bordure de 9 mm x 17 mm, pour une photo de 7 x 10 cm) Noir",Hama,,,"-100,00 %",,,"-100,00 %",,,"-100,00 %",,,"-100,00 %",,,"-100,00 %",,,
B003YZ08OG,"Hama Etui universel (pour cartes mémoire, pour cartes SD/MMC, en simili cuir, pour 18 cartes) Noir",Hama,,,"-100,00 %",,,"-100,00 %",,,"-100,00 %",,,"-100,00 %",,,"-100,00 %",,,
B009JEQ1GK,"Hama Cadre photo pour portrait ""Cape Coral"" (taille de cadre 13x18 cm, taille de photos 13x18 cm, photos format horizontal ou vertical, en métal, 1 photo par cadre, élégant, simple, classique) Argent",Hama,,,"-100,00 %",,,"-100,00 %",,,"-100,00 %",,,"-100,00 %",,,"-100,00 %",,,
B000KZAV4U,"Hama Cadre photo en plastique ""Sevilla"" (taille du Cadre de 62 x 93 cm avec bordure de 13 mm x 20 mm, pour une photo de 42 x 60 cm) Noir",Hama,,,"100,00 %",,,"100,00 %",,,,,,,,,,,,
B00005KHSU,"Hama Filtre UV (anti-UV et protection, compensation 4X, traitement antireflet, pour objectifs d'appareils photo 46 mm, O-Haze, traité) Noir",Hama,,,,,,,,,,,,,,,,,,
B074HXVHWC,"Hama Réveil pour Enfant ""Jungle"", Silencieux",Hama,,,"-100,00 %",,,"-100,00 %",,,,,,,,,,,,
B01L8U0XXY,"Hama Étui portefeuille ""Smart Move"" (taille XXL, de 5,2 à 5,8 pouces) Noir",Hama,,"-100,00 %",,,"-100,00 %",,,"-100,00 %",,,"-100,00 %",,,"-100,00 %",,,,
B005VLI4QA,"Hama Filtre gris ""Vario"" (ND2-400, coated, 55 mm) Noir",Hama,,,"-100,00 %",,,"-100,00 %",,,"-100,00 %",,,"-100,00 %",,,"-100,00 %",,,
B00G3BMWQA,"Xavax Minuteur à œuf (avec fonction minuterie, sablier, en acier inoxydable) Argent",xavax,,,,,,,,"-100,00 %",,,"-100,00 %",,,"-100,00 %",,,,
B01AUBT8OW,"Cor. alim. Euro pr Sonos PLAY:1/PLAY:5/One, coudé aux extrém., 5m, blc",Hama,,,"-100,00 %",,,"-100,00 %",,,"-100,00 %",,,"-100,00 %",,,"-100,00 %",,,
B0000AISCW,"Hama Cadre photo en plastique ""Sevilla"" (taille du Cadre de 20 x 30 cm avec bordure de 9 mm x 17 mm, pour une photo de 13 x 18 cm) Blanc",Hama,,,"-100,00 %",,,"-100,00 %",,,"-100,00 %",,,"-100,00 %",,,"-100,00 %",,,
B009X8SBUQ,"Hama ""Fine Art"" Spiral Album, 24 x 17 cm, 50 Photos, turquoise",Hama,,"-100,00 %","-100,00 %",,"-100,00 %","-100,00 %",,"-100,00 %","-100,00 %",,"-100,00 %","-100,00 %",,"-100,00 %","-100,00 %",,,
B00NM75WBK,"Hama Album photo 2 en 1 Isny - Rouge - 24 x 18/40 cm",Hama,,,,,,,,,,,,,,,,,,
B0C5JP8CX2,"Hama Rotate Pro Clé USB 3.0 - Flash Drive 512 Go, Vitesse jusqu'à 100 Mo/s, Clef avec connecteur USB A, pour PC/Mac - Argenté",Hama,,"-100,00 %",,,"-100,00 %",,,"-100,00 %",,,"-100,00 %",,,"-100,00 %",,,,
B086XRXHK2,"Hama Station météo sans fil ""Black Line"" (avec capteur extérieur, affichage heure, date, température, humidité et prévision météo), noire",Hama,,,,,,,,"-100,00 %",,,"-100,00 %",,,"-100,00 %",,,,"-100,00 %"
B07LCGZCM6,"Hama Kit Charge Secteur, Lightning, 2,4 A, Blanc",Hama,,,"-100,00 %",,,"-100,00 %",,,"-100,00 %",,,"-100,00 %",,,"-100,00 %",,,
B0016LXV26,"Thomson - Câble 2 rca-m / 2 rca-m - Stereo - 1,2 m",Thomson,,"-100,00 %",,,"-100,00 %",,,,,,,,,,,,,
B01LZLUJHT,"Pêle-mêle de cadres photo pr portrt, 2 en 10 x 15 cm, 1 en 10 x 10 cm",Hama,,,"-100,00 %",,,"-100,00 %",,,"-100,00 %",,,"-100,00 %",,,"-100,00 %",,,
B0015NS8JQ,"Hama Chemin de câble (en PVC, semi-circulaire, 100 x 7 x 2,1 cm) Noir",Hama,,"-100,00 %","-100,00 %",,"-100,00 %","-100,00 %",,"-100,00 %","-100,00 %",,"-100,00 %","-100,00 %",,"-100,00 %","-100,00 %",,,
B00U78QXOM,"Hama Cadre Photo métallique Davos pour Portrait, argenté, 10 x 20 cm",Hama,,,"-100,00 %",,,"-100,00 %",,,"-100,00 %",,,"-100,00 %",,,"-100,00 %",,,
B01KFLAYCC,"Hama Multiprise (rotatif, protection contre les surtensions, prises tournées à 45°, montage mural, sécurité enfant, longueur de câble de 1,4 m, 6 prises) Noir",Hama,,,"-100,00 %",,,"-100,00 %",,,"-100,00 %",,,"-100,00 %",,,"-100,00 %",,,
B07PD6WYDC,"Hama Mini-Album Photo à Pochettes Brushstroke (Album Photo Traditionnel 13 x 16,5 cm, 24 Pages pour 24 Photos Format 10 x 15 cm, Protection idéale, Artistique, élégant) Bleu/Jaune/Orange/Blanc",Hama,,,"-100,00 %",,,"-100,00 %",,,"-100,00 %",,,"-100,00 %",,,"-100,00 %",,,
B000LY7332,"Hama Repose-Poignets (avec Rembourrage en Mousse/Mains pour Ordinateur avec Stylet ou Souris, 105 x 75 x 25 mm, Ergonomique, utilisable avec Un Tapis de Souris) Anthracite",Hama,,,"-100,00 %",,,"-100,00 %",,,"-100,00 %",,,"-100,00 %",,,"-100,00 %",,,
B00006JE9G,"Hama Cosse (10 mm², 10 pièces, Câble d'anneau) Noir/Rouge",Hama,,,"-100,00 %",,,"-100,00 %",,,"-100,00 %",,,"-100,00 %",,,"-100,00 %",,,
B01DNVQYYI,"Hama Bloc Multiprises (10 prises, 2 interrupteurs et protection contre surtensions, prises tournées à 45°,longueur de câble de 2 m) Bleu Glace/Noir",Hama,,"-100,00 %","-100,00 %",,"-100,00 %","-100,00 %",,"-100,00 %","-100,00 %",,"-100,00 %","-100,00 %",,"-100,00 %","-100,00 %",,,
B002L4OBLC,"Hama Smartly Clé USB 2.0 - Flash Drive 16 Go, Vitesse jusqu'à 10 Mo/s, Clef avec connecteur USB A, pour PC/Mac - Noire",Hama,,,"-100,00 %",,,"-100,00 %",,,"-100,00 %",,,"-100,00 %",,,"-100,00 %",,,
B07NKM3V9Q,"Étui à Rabat Smart Case pour Huawei P30, Noir",Hama,,"-100,00 %",,,"-100,00 %",,,"-100,00 %",,,"-100,00 %",,,"-100,00 %",,,,
B07BGLLS26,"Chiffons pour écrans, 100 pièces, dans un distributeur",Hama,,,"-100,00 %",,,"-100,00 %",,,,,,,,,,,,
B00005KHTD,"Hama Filtre Polarisant Circulaire 67mm, Traité Double Couche par Face, Monture Métalique Noir Epaisseur 6mm",Hama,,,"-100,00 %",,,"-100,00 %",,,"-100,00 %",,,"-100,00 %",,,"-100,00 %",,,
B08YS3XVDK,"Hama Câble HDMI 4K Garantie 10 ans (Cable HDMI High Speed avec Ethernet, Cordon HDMI 4k, 5m, mâle-mâle, Câble Ethernet HEC, Retour Audio, HDR, 18 Gbit/s, 600MHz, Résolution 4096x2160, Blindé) Noir",Hama,,,"-100,00 %",,,"-100,00 %",,,"-100,00 %",,,"-100,00 %",,,"-100,00 %",,,
