B0BL1XTCSC,"Hama Câble iPhone Lightning USB-C (Câble de charge/transfert de données/Data, USB-C mâle vers Lightning, 1m, Certifié MFI, 480 MBit/s, iPad/iPhone 13/12/11/XS/XR/X/8/7/7+/6s/6/5/SE2020) Blanc",Hama,"0,00 %",0,-4647
B09GBCMVVG,"Black Rock Coque pour iPhone 13 ""Robust Real Carbon [Housse Technologie Active Air] [Coque Protection Moléculaire] - Noir","Black Rock","0,00 %",-4724,0
B09GLC46PK,"Hama Coque iPhone 13 Pro Max Étui Portefeuille Slim Pro pour Apple, Noir",Hama,"0,00 %",0,-4031
B0000WXD1G,"Hama Trépied Photo/vidéo Star 63"" (Trépied d'entrée de Gamme léger, tête à Trois Voies, 66-166 cm, 3D) Champagne",Hama,"0,00 %",-4551,-5473
B002XISUDG,"Hama Sangle d’appareil photo ""2in1 130"" (pour appareil photo, en néoprène, longueur réglable (100 - 130 cm), ergonomique, avec dragonne intégrée) Noir",Hama,"0,00 %",0,-4563
B07623M7YQ,"Hama Multiprise 4 Prises 16A avec Interrupteur individuel (Rallonge multiprises 1.4m, Bloc 4 prises Type F Schuko, Idéal Bureau PC luminaires, Atelier, Meuble TV, Garage )Noir",Hama,"0,00 %",-5399,-5191
B09FBSXVBX,"Hama Commutateurs KVM Connect2Switch, avec câble, 4 Ports, Garantie 10 Ans, Gris",HAMA,"0,00 %",-3476,0
B08M391XW9,"Hama Album Photo Couverture Rigide Tissu 30x30cm (Album Livre, 400 photos 10 x 15cm à coller, 100 pages blanches separées par Papier Cristal, Album Scrapbooking DIY Livre photo à Personnaliser) Gris",Hama,"0,00 %",0,-4907
B0CNRNVF1Y,"Hama Montre connectée GPS Intégré 8900"" (Montre Sport, écran AMOLED 1,32"", Fonction Prise d’appels, contrôle Vocal Alexa, altimètre barométrique, IP68), dorée",Hama,"0,00 %",-3703,0
B0BG5G1HST,"Hama Montre Connectée Fit Watch 4910 (Montre Sport, Etanche IP68, Montre Fitness 15 Sports Fréq. Cardiaque Oxymètre Podomètre Compatible Google Fit Apple Health Strava) Gris",Hama,"0,00 %",0,-4859
B00006JBEA,"Hama Bague d'adaptation (en métal, pour monter un Filtre de 77 mm sur un Objectif de 72 mm) Noir",Hama,"0,00 %",0,-3678
B005I49EH8,"Thomson Casque Sans Fil TV ""WHP3001BK"" (Over-Ear, Avec Station De Recharge Système, PLL, Portée 100 M, 863 MHz, Sans Fil) Noir",Thomson,"0,00 %",0,-2994
B00L47JPUO,"Hama Support mural TV Fixe (pour diagonale d'écran de 48 à 117 cm (19 - 46 pouces), pour un maximum de 25 kg, VESA jusqu'à 200 x 200, 5 étoiles) Noir/Blanc",Hama,"0,00 %",-4674,0
B00006JA7P,"Hama Vis pour appareil photo (5 vis pour accessoires photographiques, longueur 8 mm, filetage A 1/4 "", plastique/métal) Argent",Hama,"0,00 %",0,-4777
B0000AIST8,"Porte-tableaux Clip-Fix 24x30cm antireflet",Hama,"0,00 %",0,-8086
B07917FSW7,"Hama Lecteur de Carte SD USB 3.0 (Lecteur USB 3.0 4en1, Adaptateur de carte SD/microSD/CF/MS, 5 Gbps, Card Reader) Blanc",Hama,"0,00 %",0,-5718
B00OBSTTMM,"Chargeur allume-cigare USB",Hama,"0,00 %",0,-10000
B002XL2OOY,"Hama Clé USB 2.0 ""Rotate, 16 GB (10 MB/s, Flashpen Rotate) Noir/Argenté",Hama,"0,00 %",0,-5276
B0BKYKCXQ4,"Hama Destructeur de Documents Premium M10+ (Broyeur Documents 10 Feuilles 80g, Destructeur Papier Professionnel, Déchiqueteur Sécurité P5 T5 E4, 62 DB, M/A Auto, 20L, Fonction Retour) Noir",Hama,"0,00 %",0,-3408
B01JUBADME,"Hama Support magnétique ""Flex"" (pour GoPro, aimant extra fort, 13,5 cm) Noir",Hama,"0,00 %",0,-4177
B0017UEPNA,"Hama Etui de protection photo/vidéo semi-rigide ""Hardcase Carbon Style"" (60L, EVA, sacoche avec coque, anti-choc, pour le voyage, appareil petit format, ultra-compact, compact, MP3, MP4, iPod) Noir",Hama,"0,00 %",-5628,-5563
B00005KHTD,"Hama Filtre Polarisant Circulaire 67mm, Traité Double Couche par Face, Monture Métalique Noir Epaisseur 6mm",Hama,"0,00 %",-3579,0
B003583GFU,"Hama Câble de liaison ""AluLine"" (fiche jack 3,5mm, mâle - mâle, stéréo, gaine en tissu, 2 m) Argent",Hama,"0,00 %",0,-5414
B0015LCKBU,"Hama Carte son USB ""7.1 Surround"" Noir",Hama,"0,00 %",0,-4466
B00005KHU1,"Hama Pare-soleil caoutchouté pour objectifs standard, 49mm",Hama,"0,00 %",0,-6028
B07PBXBL7G,"Hama Mini-Album Photo à Pochettes Brushstroke (Album Photo Traditionnel 13 x 16,5 cm, 24 Pages pour 24 Photos Format 10 x 15 cm, Protection idéale, Artistique, élégant) Vert/Jaune/Marron/Blanc",Hama,"0,00 %",0,-5283
B01LRD4FYA,"Black Rock Coque de protection 'Ultra Thin Iced' (pour Apple iPhone 7 Plus/8 Plus, protection à 180°, designe mince, en polypropylène) Transparent","Black Rock","0,00 %",0,-4811
B00HD6MXYU,"Hama Dragonne universelle (pour appareil photo, appareils photo reflex et appareils photo standard, textile, réglable, longueur de 65 cm) Noir",Hama,"0,00 %",0,-4506
B00005QFA3,"Hama Bague d'adaptation pour monter un filtre de 52mm sur un objectif de 49mm",Hama,"0,00 %",-5119,0
B000FNO044,"Thomson Microphone dynamique M152 (avec connecteur XLR, fiche jack 6,35 mm, longueur de câble 3 m, Vocal) Noir",Thomson,"0,00 %",0,-3732
B005F3BS76,"Hama Paire de Jumelles Optec 10 x 50 compacte (pour Une Vision Nette, grossissement 10x, diamètre de la lentill 50 mm, Forme de Bordure de Toit) Noir",Hama,"0,00 %",-4432,0
B07VSGLH2M,"Black Rock Coque 'Air Robust' (pour Apple iPhone 11 Pro Max, protection parfaite, design mince, en polycarbonate, polyurethane termoplastique (PUT)) Noir","Black Rock","0,00 %",0,-5033
B001JTTAQ6,"Hama Boîtier ""Slim"" double (pour DVD, convient également aux CD et disques Blu-ray, ultra mince, avec une feuille pour la couverture, lot de 5) Transparent",Hama,"0,00 %",-4351,-4362
B01AELPONM,"Cor. alim. Euro pr Sonos PLAY:1/PLAY:5/One, coudé aux extrém., 3m, blc",Hama,"0,00 %",0,-4915
B073RM3BYT,"Hama Album photo à pochettes ""Melons"" (format album de 11,7 cm x 12,7 cm, pour 28 instantanés, photos jusqu'à 8,9 cm x 10,8 cm, 28 pages, élégant, insertion latérale) Multicolore",Hama,"0,00 %",0,-6326
B0002W6E74,"Hama Écran de projection sur pied (125 cm x 125 cm) Blanc",Hama,"0,00 %",0,-5716
B000JIA828,"Hama Pochettes de protection (en papier pour CD/DVD/Blu-Ray, lot de 100) Bleu/Vert/Orange/Rouge/Jaune",Hama,"0,00 %",0,-6206
B009X8SEOO,"Hama ""Fine Art"" Spiral Album, 24 x 17 cm, 50 Photos, kiwi",Hama,"0,00 %",-5346,-7445
B01L8V95R8,"Hama Étui portefeuille ""Smart Move"" (taille XL, de 4,7 à 5,1 pouces) Noir",Hama,"0,00 %",-4912,0
B0015L5HCE,"Hama Passe-partout Premium, blanc neige, 30 x 40, numérique",Hama,"0,00 %",0,-6196
B08KDSBYG9,"Hama Support de Smartphone pour trépied et Perche à Selfie (Tête de trépied pour Mobile, Pince Universelle pour téléphone Portable iPhone et Android, Pas de vis 1/4"", Largeur de 5,5 à 8,2 cm) Noir",Hama,"0,00 %",0,-4281
B011T76LXM,"Hama-câble d'antenne avec Prise coaxiale Femelle Blanc 3 m 90dB",Hama,"0,00 %",0,-6722
B00IZA0V4M,"Thomson Support Mural TV WAB846 (VESA 200x200, inclinable et orientable, avec 2 Bras, pour Une Diagonale d'écran de 25 à 117 cm (de 10"" à 46"")) Noir",Thomson,"0,00 %",-3871,-3845
B01LGPHEYC,"Hama 00173671 Chargeur pour Voiture, Micro-USB, 1 A, Noir",UNKNOWN,"0,00 %",0,-3402
B09GLCX9G9,"Hama Coque iPhone 13 Mini Étui Portefeuille Slim Pro pour Apple, Noir",Hama,"0,00 %",-4192,0
B01DZGI94O,"Hama Support mural TV Fullmotion (pour diagonale d'écran de 81 à 165cm (32"" à 65""), pour un maximum de 25 kg, VESA jusqu'à 400 x 400, 1 étoile) Noir",Hama,"0,00 %",0,-5123
B001E724P2,"Cadre photo métallique ""Nantes"" pour portrait, argenté, 13 x 18 cm",Hama,"0,00 %",0,-4796
B09NYH572M,"Hama Clé USB C 64 Go 'C-Laeta (Flash Drive Double connecteurs USB C-USB A, USB 3.1/3.0, Stockage de données Universel en Aluminium, Digital Storage pour Smarthphone Tablette PC) Argent",Hama,"0,00 %",0,-3107
B07KWC3KMG,"Rapoo Souris optique sans fil Multi mode 2,4GHz/BT 3.0/BT 4.0 ""M500"" (bluetooth, souris d'ordinateur, design, avec boutons et molette de défilement) Noir",Rapoo,"0,00 %",0,-3112
B01K47I1TK,"Hama Album Jumbo ""Skies"" (album grand format, 30 x 30 cm, 60 pages, pour 240 photos au format 10 x 15 cm) Gris",Hama,"0,00 %",0,-6528
B01M1SACZG,"Hama Cadre photo en plastique ""Saragossa"" (taille de cadre 10x15 cm, taille de photos 7x10 cm, photos format vertical, en plastique, 1 photo par cadre, élégant, simple, classique) Blanc",Hama,"0,00 %",0,-6212
B00O9ZPVRO,"Hama Veilleuse nocturne ""Basic"" (LED avec capteur crépusculaire, lampe d'orientation économique pour prise de courant, seulement 0,8 W) Rouge",Hama,"0,00 %",0,-4677
B07MFZ6N7M,"Perche à Selfies Fun 70"", Bluetooth, Noir",Hama,"0,00 %",-2738,0
B08M3L2Z9P,"Hama Album Photo Couverture Rigide Tissu 30x30cm (Livre Photo, 400 photos 10 x 15cm à coller, 100 pages blanches separées par Papier Cristal, Album Scrapbooking DIY à Personnaliser) Vert",Hama,"0,00 %",0,-5103
B078T7PTYB,"Hama Souris Optique à 3 Boutons MC-300, Filaire, Noire",Hama,"0,00 %",0,-4569
B01EYP0TY8,"Sac pour appareil photo ""Fancy Urban"", 80 M, gris",Hama,"0,00 %",-5860,0
B01M6WSII7,"Hama Support mural (pour enceintes Bose SoundTouch 10/Bose SoundTouch 20, pivotantes, système Easy-Fix, support pour haut-parleur) Noir",Hama,"0,00 %",0,-4230
B00005UP69,"Hama Câble d'enceinte (2x 2,5 mm², 10 m (rouleau), avec marquage de polarité) transparent",Hama,"0,00 %",0,-5327
B07LBFMZ88,"Hama Support Universel Voiture Magnet (pour Tous Les Smartphones et tablettes, à Coller, Poids de 59 g) Noir/Gris",Hama,"0,00 %",-4428,0
B07GW11VFH,"Support Mural pour Sonos One/One SL, Noir",Hama,"0,00 %",0,-4122
B00006J4IM,"Hama Préamplificateur phono stéréo ""PA 506"" (avec alimentation secteur 230V/50 Hz, pour platines, 3000mA, câble Cinch 0,9 m) Noir",Hama,"0,00 %",0,-4507
B0009V8WNM,"Hama Pochettes de protection (en papier pour CD/DVD/Blu-Ray, verrouillables, lot de 50) Blanc/Transparent",Hama,"0,00 %",0,-6432
B096XK8FJ3,"Hama Ecouteurs Bluetooth sans Fil Freedom Light (Ecouteurs TWS, Micro, Ecouteurs Intra Auriculaire, Station de Charge, Grande Autonomie, USB-C, Charge Rapide, Controle Vocale+Tactile) Blanc",Hama,"0,00 %",0,-1444
B0BXPLPKZD,"Hama Classeur à négatifs (4 anneaux, niveau de remplissage 39 mm, feuilles rectangulaires, album à négatifs d'une pellicule photo) Rose",Hama,"0,00 %",-4531,0
B003TQZQT2,"Hama Pochette Up To Fashion (pour 24 disques, CD/DVD/Blu-ray/livres audio, étui de rangement, gain de place pour la voiture, la maison, avec motif bambou) Vert",Hama,"0,00 %",0,-5380
B07BRNCRMN,"Hama Souris sans fil compacte ""Milano"" (souris sans fil avec piles, plage sans fil de 8 m, vitesse de rotation jusqu'à 4400 vitesses, jusqu'à 2400 ppp, boutonS avant/arrière, ergonomique) Noir",Hama,"0,00 %",0,-5113
B003QQBDUG,"Hama Goulotte Passe-Câbles Aluminium Anodisé (Cache-Câble Mural ou au Sol, Moulure Décorative en Demi-Rond, Rangement de Câbles Design, Protection de Câble, 1.8x3.3x110cm, pour 5 câbles) Blanc",Hama,"0,00 %",-6223,0
B07FPZLB75,"Hama Tapis de Souris (fabriqué en Aluminium, Tapis de Souris élégant pour Souris Laser/Optique, antidérapant, Dur, Fin, effaçable, 22 x 0,3 x 18 cm) Argent",Hama,"0,00 %",-3533,-4282
B007C3B8ZO,"Hama Veilleuse nocturne ""Amber"" (LED pour la chambre d'enfants, économie d'énergie, seulement 0,2 W, lampe d'orientation pour couloir et cave, éclairage d'ambiance, lampe de nuit, fiche Euro) Ambre",Hama,"0,00 %",-3755,0
B096XM5NMX,"Hama ""Freedom Light Ecouteurs Bluetooth® sans Fil USB C - 7H d'Autonomie, Assistant Vocaux Siri & Google, Microphone Intégré, Commande Tactile - Rouge",Hama,"0,00 %",-1128,-2407
B0000AIRSP,"Hama Boîtier ""Slim"" quadruple (pour CD et disques Blu-ray, ultra mince, avec une feuille pour la couverture, pour 4 CD, lot de 10) Transparent",Hama,"0,00 %",-3802,-6433
B00N9SW6RA,"Hama Rossano USB Argent, Blanc - Claviers (Standard, Avec fil, USB, Argent, Blanc)",Hama,"0,00 %",-3841,0
B00IZA0RSM,"Thomson Support Mural TV WAB546 (VESA jusqu'à 200x200, Fixe, pour Une Diagonale d´écran de 25 à 117 cm (de 10' à 46')) Noir",Thomson,"0,00 %",-4386,-4834
B00005UX2R,"Hama Adaptateur multiprises (à 3 Voies (multiprise 2X Prise Euro / 1x à Contact de Terre, Prise Multiple) Blanc",Hama,"0,00 %",0,-5978
B007C3BG5Q,"Hama Tapis de souris aspect cuir (22 x 18 cm, Tapis de souris Office aspect cuir, glisse optimale, dessous antidérapant) Noir",Hama,"0,00 %",0,-4300
B00397CX7O,"Hama Support mural TV Ultraslim Fixe (pour diagonale d'écran de 81 à 142 cm (32'' et 56""), pour un maximum de 50 kg, VESA jusqu'à 400 x 400, 3 étoiles) Blanc",Hama,"0,00 %",0,-5021
B09W5WBSGL,"Hama HS-P200 V2 Casque Micro - Casque Jack, Microphone Intégré, Léger, Télécommande Intégrée, Fonction Mute - Noir",Hama,"0,00 %",0,-5015
B000FNO03U,"Thomson Microphone dynamique M151 (avec connecteur XLR, fiche jack 6,35 mm, longueur de câble 3 m, Karaoké) Gris",Thomson,"0,00 %",0,-4918
B00005KHTA,"Hama Filtre polarisant (circulaire, Traité, 52mm, 2 couches par face) Noir",Hama,"0,00 %",-1674,-4479
B08SDR48Q1,"Hama Câble Optique Audio (Câble Audio à Fibres Optiques ODT Toslink, 1.5m, Garantie 30ans, Idéal Home Cinema, Barre de Son, TV, Samsung, Bose, LG, Sony, Sonos, PS4, Xbox) Noir",Hama,"0,00 %",-3754,0
B000PGIK6K,"Hama Adaptateur de prise de courant (adaptateur de contact, jusqu'à 3500 watts, protection enfant, avec interrupteur marche/arrêt) Blanc",Hama,"0,00 %",0,-7798
B00006JCOK,"Hama Support mural tubulaire pour fixation de parabole/antenne en aluminium",Hama,"0,00 %",0,-4387
B075V1NGDZ,"Hama Trépied Delta Duo 170', 3D",Hama,"0,00 %",-5911,0
B07Y4YGCS9,"Hama Coque iPhone 11 Crystal Clear (Etui Transparent TPU Souple, Housse de Protection Apple iPhone 11, Flexible, Surface Antidérapante, Compatible Chargement sans Fil) Transparent","White Diamonds","0,00 %",-2127,0
B06XJCDYHB,"Hama Microphone à clip (microphone à clipser compact, longueur de câble 2m, pour ordinateur/smartphone/tablette, prise 3,5 mm) Noir",Hama,"0,00 %",-5350,0
B00I07LU5Y,"Hama Jeu de tournevis (universels, également adapté aux appareils Apple, 10 inserts amovibles (Phillips, Torx, Pentalob), ensemble d'outils, 12 pièces) Noir/Argent",Hama,"0,00 %",0,-5593
B00EZJQWYA,"Hama Etui de rangement pour objectif ""Rexton"", 8 x 6,5 cm",UNKNOWN,"0,00 %",0,-4295
B08R2K1WQG,"Hama Câble Audio USB-C vers RCA mâle (Cable Audio Adaptateur USB C vers RCA, Garantie 10 Ans, stéréo, 1,50 m) Noir",Hama,"0,00 %",-5930,-4831
B000LRHKP0,"Hama Cadre photo ""Clip-Fixe"" (sans bordure, 62 x 93 cm, Reflex) Blanc",Hama,"0,00 %",-7558,0
B0009V8XRW,"Hama Câble d' alimentation (prise non-coudée, câble d'alimentation pour PC, moniteur, imprimante, PS3, fiche de contact de protection moulée, 3 broches, 5 m) Blanc",Hama,"0,00 %",0,-3554
B00194G3UW,"Hama Cadre photo métallique ""Davos"" pour portrait, argenté, 13 x 18 cm",Hama,"0,00 %",0,-6098
B00006JB1T,"Hama Barrette porte-flash coudée à 90° (pliable pour appareils photo / vidéo avec vis de trépied, avec poignée et boucle, 34 mm x 190 mm) Noir",Hama,"0,00 %",-6400,-6134
B0000AI2TB,"Hama Cadre photo ""Clip-Fixe"" (sans bordure, 50 x 75 cm, Anti-Reflex) Blanc",Hama,"0,00 %",-5336,-5149
B01K47G2W8,"Hama Album Jumbo ""Skies"" (album grand format, 30 x 30 cm, 60 pages, pour 240 photos au format 10 x 15 cm) Beige",Hama,"0,00 %",-7232,-6512
B07B93BSF8,"Hama Trépied ""FlexPro"" (pour smartphone, GoPro et appareils photo, avec pieds articulés, hauteur de 27 cm) Noir/Rouge",Hama,"0,00 %",0,-5691
B0BL1SLJPB,"Hama Support Téléphone Voiture Flipper (Fixation sur Grille aération, pivotable 360°, pour Smartphone de 6 à 8 cm, compacte) Noir",Hama,"0,00 %",-4471,0
B079P435JW,"Hama Pochettes intérieures pour vinyles (pour 33 tours, 10 pièces, 30,5 x 30,3 x 0,3) Blanc",Hama,"0,00 %",-6672,-5471
B0C8SXMV3R,"Rapoo Clavier Souris sans Fil Multi-Mode Rechargeable Blade 9600M (Pack Kit Clavier+ Souris, Clavier Rechargeable AZERTY, Souris 3 Boutons, Bluetooth+ WiFi, Idéal PC, Laptop, Mac) Anthracite",Rapoo,"0,00 %",-3939,0
B08YRZD315,"Hama Adaptateur USB vers RJ45 (Adaptateur réseau USB 3.0 vers Gigabit Ethernet LAN 10/100/1 000 Mbit/s, Garantie 10 Ans, pour PC Portable, Tablette, MacBook, USB A vers routeur, Switch, Hub) Noir",Hama,"0,00 %",0,-4966
B0000AI2UP,"Hama Cadre photo Clip-Fixe (sans bordure, 50 x 70 cm, Anti-Reflex) Blanc",Hama,"0,00 %",-5894,-5644
B0BL1WML6W,"Hama Support Téléphone Voiture Magnet (Support téléphone pour Voiture aimanté, Fixation à Ventouse, pivotable 360°, Inclus 2 plaques métaliques) Noir",Hama,"0,00 %",-4259,0
B00194HCI4,"Hama Cadre Photo métallique Davos pour Portrait, doré, 10 x 15 cm",Hama,"0,00 %",0,-7595
B01HPB96GK,"Hama Clé USB 3.0 ""Laeta"", 256 GB, 40 MB/s, marron",Hama,"0,00 %",0,-4005
B0BL19JS13,"Hama Câble iPhone USB-A Lightning (Câble de charge/transfert de données/Data, USB-A 2.0 mâle vers Lightning, 1.5m, Certifié MFI, 480 MBit/s, iPad/iPhone 13/12/11/XS/XR/X/8/7/7+/6s/6/5/SE2020) Noir",Hama,"0,00 %",-4979,0
B001UBGT08,"Hama Plateau tournant pour téléviseur (jusqu'à 60 kg, pivotable à 360°, 60 x 40 cm, verre) Transparent",Hama,"0,00 %",0,-5075
B0015KAVRQ,"Hama Détartrant Premium pour cafetières de haute qualité",Hama,"0,00 %",-825,0
B00006JAOU,"Hama Fusibles en verre (fusible voiture, 60A, , AGU, 10 x 38mm, plaqué or, 2 pièces) Or/Transparent",Hama,"0,00 %",-8000,-7871
B00006J4GF,"Hama Fiche d'antenne (DIN mâle, à visser, 1 pièce) Gris/Noir",Hama,"0,00 %",0,-6293
B0000AISOU,"Porte-tableaux Clip-Fix 28x35cm antireflet",Hama,"0,00 %",-5322,-7531
B017JY55K4,"Hama Carte mémoire Photo (Micro SDXC pour Photo/Classe 10, 64 GB - 80 MB/s, Adaptateur Photo) Noir",Hama,"0,00 %",-4451,0
B002GQOTTY,"Hama Clé USB 2.0 ""Laeta, 16 GB (Transfert de données à 10 Mo/s, clé USB avec Anneau œillet, Capuchon de Verrouillage, pour Windows/Macbook, en métal) Gris",Hama,"0,00 %",-7148,-6921
B07XYC6YWQ,"Hama Support TV Design en Forme de chevalet pour téléviseur de 37 à 75"" - 94 à 191cm (Hauteur réglable, Acier Moderne laqué, Compact et Moderne, Compatible VESA) Noir",Hama,"0,00 %",0,-2797
B07PGGWWJX,"Hama Chambre à air de vélo (taille de 27,5"", avec valve automatique Dunlop) Noir",Hama,"0,00 %",0,-5577
B08BFMYCJ2,"Hama Album photo Jumbo ""Romance"" à personnaliser (Album Photo Livre de Mariage ou naissance bébé, Livre d'or ou cadeau, 22,5x22 cm, 100 pages, Motif cœur, Titre Love, 200 photos 10x15 cm) Beige/Blanc",Hama,"0,00 %",-6469,-6563
B09GLD1KB9,"Hama Coque iPhone 13 Pro Étui Portefeuille Slim Pro pour Apple, Noir",Hama,"0,00 %",-3878,0
B01LXZAV7L,"Pêle-mêle de cadres photo pour portrait, 6 en 10 x 15 cm",Hama,"0,00 %",0,-5724
B0BZDS8G7R,"Hama Enceinte Bluetooth Pocket 3.0"" (Mini Enceinte sans Fil Portable Légère, Basses intenses, Style Tendance, Étanche Eau et Poussière IP67, Autonomie 14h, USB-C, Prise Jack, 3.5W) Noir",Hama,"0,00 %",-3871,0
B0032D8WP2,"Hama Câble connectique iPod, Jack 3,5mm 2RCA MM",Hama,"0,00 %",0,-10000
B07TPCMJSF,"Étui portefeuille ""Slim Pro"" pour Sony Xperia 1, noir",Hama,"0,00 %",0,-4717
B00006JBE9,"Hama Bague d'adaptation (en métal, pour monter un Filtre de 77 mm sur un Objectif de 67 mm) Noir",Hama,"0,00 %",0,-4584
B006WYJADG,"Hama 2 Clés de desserrage pour filtres photo (pour filtres de 49 à 58mm) Noir",Hama,"0,00 %",0,-4387
B00006IVX3,"Hama Câble réseau (RJ11, modulaire, connecteurs mâles 6p4c, 3m) Blanc",Hama,"0,00 %",-7528,-6976
B000NRTREU,"Hama Rallonge pour Allume-Cigare (1,5m, fusible 8A, 12-24 V, Convient également pour Les camions) Noir",Hama,"0,00 %",-6342,-6221
B07FN9BL7N,"Support de vélo universel pr smartphone jusq. 6-8cm larg. et 13-15cm haut.",Hama,"0,00 %",0,3555
B017IM43VY,"Hama Cadre Photo en Plastique Paris (Cadre de 10 cm x 15 cm, Bordures de 20 mm x 15 mm, pour Les Photo de Taille 7 cm x 10 cm, Verre Reflex, polystyrene (PS), avec Crochet et Pied) Argent",Hama,"0,00 %",-5068,0
B0BL1V2G7Y,"Hama MW-400 V2 Souris sans Fil - Technologie 2.4Ghz, Capteur 1600 dpi, Technologie Smart-Link, Droitier/e - Rouge",Hama,"0,00 %",-4955,0
B092CWY1H7,"Hama Album photo ""Checks"" (Album photo souvenirs mariage anniversaire, 22,5 x 22 cm, 100 pages avec pochettes pour 200 photos 10 x 15 cm, Zone Mémo et pochette carte SD) Quadrillé Turquoise",Hama,"0,00 %",0,-5289
B003KKVSYE,"Porte-étiquette à bagage, lot de 2, noir",Hama,"0,00 %",0,-6900
B005VNYX9U,"Hama Cadre pour Portrait Photo Philadelphia, 10 x 15 cm",Hama,"0,00 %",0,-4629
B00005KHTE,"Hama Filtre polarisant (circulaire, Traité, 77mm, 2 couches par face) Noir",Hama,"0,00 %",-3025,0
B07TSQJ5W1,"Hama Casque Micro PC Tour de Cou NHS-P100 (Casque Micro de Bureau Tour de Nuque, Stéréo, Casque Micro Filaire, réglage Volume, Casque Micro Perche Flexible, idéal télétravail, Bureau) Noir",Hama,"0,00 %",-5684,0
B00U78QPT0,"Hama Adaptateur secteur (prise de voyage pour : Afrique du Sud, Botswana, Namibie, Lesotho, Eswatini, … Type F) Noir",Hama,"0,00 %",-6635,-7047
B0BL18SWQC,"Hama Chargeur Rapide USB-A (Chargeur Secteur Quick Charge 3.0 19.5 W, certifié Qualcomm® Quick Charge™ 3.0, Chargeur Mural pour Samsung Galaxy S21/S20/S10/S10E/S9/Note 10 LG Huawei Xiaomi) Noir",Hama,"0,00 %",-4286,0
B006H3MKXO,"Hama Adaptateur MHL (Mobile High-Definition Link, Mobile/Smartphone vers téléviseur/projecteur avec entrée HDMI, qualité Full HD) Noir",Hama,"0,00 %",0,-4972
B0749PHPX4,"Thomson Casque sans fil TV ""WHP5327"" (Over-Ear, pour TV/Hifi/Smartphone/Tablette/Ordinateur portable, avec station de charge, portée sans fil 20 m) Noir",Thomson,"0,00 %",0,-2450
B0000AIRXC,"Hama Cadre photo en plastique ""Sevilla"" (taille du Cadre de 30 x 45 cm avec bordure de 9 mm x 17 mm, pour une photo de 20 x 30 cm) Blanc",Hama,"0,00 %",0,-5318
B076Z59MZL,"Hama Filtre de polarisation (polarisant circulaire, verre supérieure, diamètre du filetage de 67 mm, Epaisseur de la monture de 4,5 mm, filetage avant, NMC16 (nano multi-coated 16 couches)) Noir",Hama,"0,00 %",-6484,0
B0BG4ZM16C,"Hama Multiprise 3+1 Prises 16A avec Interrupteur (Rallonge multiprises 1.4m, Bloc 3 Prises +1 sur Le connecteur, Type F Schuko, 3680W Max, Idéal Bureau PC luminaires Atelier Meuble TV Garage) Blanc",Hama,"0,00 %",-4509,0
B000L9MVPM,"Hama Chemin de câbles (Bande en PVC/Aluminium pour Montage Mural TV ou au Sol, Cache-câble Demi-Rond, 100 x 3,5 x 0,9 cm, entrée de câble jusqu'à 2 câbles) Blanc",Hama,"0,00 %",0,-6309
B001N592WI,"Hama Plateau tournant pour téléviseur (jusqu'à 60 kg, pivotable à 360°, 80 x 40 cm, verre) Transparent",Hama,"0,00 %",0,-4571
B00006JA36,"Hama - 46040H - Micro monophonique, finition argent, jack de 3,5mm et adaptateur 3,5/6,35 mm, prise XLR, interrupteur marche/arrêt sur le micro, 600 Ohms, dynamique et unidirectionnel - Cordon 3.00m",Hama,"0,00 %",0,-4058
B01DZGI4I0,"Hama Chiffon de nettoyage ""Pocket"" (pour le nettoyage, en microfibre, pour appareil photo/objectif/filtre/lunettes, 15 x 15 cm, dans une pochette pratique en néoprène avec mousqueton) Noir/Gris",Hama,"0,00 %",0,-5561
B08R2KQ1JM,"Hama Câble Ethernet 1.5m Garantie 10ANS (Câble Réseau LAN, Cable RJ45, CAT8, 40 Gbit/s, S/FTP, blindé, contacts plaqués or, LSZH zéro halogène) noir",Hama,"0,00 %",0,-7166
B00U78QXOM,"Hama Cadre Photo métallique Davos pour Portrait, argenté, 10 x 20 cm",Hama,"0,00 %",0,-4557
B002U7TQOC,"Hama Chemin de câbles (en aluminiun, rectangulaire, 110 x 5 x 2,6 cm) Argent",Hama,"0,00 %",0,-5759
B0BL1TWBNY,"Hama Support Téléphone Voiture Move (Support téléphone pour Voiture à Ventouse, pivotable 360°, Support de Voiture pour Smartphones de 5,5 à 8,5 cm de Largeur) Noir",Hama,"0,00 %",-4414,0
B00NCVRVGK,"Hama Support pour smartphone (pour trépied et selfie, largeur 5,5 cm - 8,2 cm, filetage de trépied 1/4"", adaptateur de téléphone portable universel pour iPhone et téléphones Android) Noir/Argent",Hama,"0,00 %",-4930,-4075
B0BL1SQ8YK,"Hama Chargeur Allume Cigare USB (Chargeur de Voiture, 6 W, pour Samsung Galaxy S21 S22, Xiaomi, Sony, iPhone XR/XS Max/ 8 Plus, Huawei, LG, Wiko) Noir",Hama,"0,00 %",-4542,0
B009H1U9X6,"Xavax Pot à lait en inox (en acier inoxydable, 400 ml, cuiseur à lait à mousser, bord large pour verser en coulant, convient pour les cafetières ou pour la cuisson au four) Argent",xavax,"0,00 %",-6182,-6063
B0BG5GJNDL,"Hama Montre Connectée Femme Fit Watch 4910 (Montre Sport, Etanche IP68, Ecran Tactile 1,09"", Montre Fitness 15 Sports Fréq. Cardiaque Oxymètre Podomètre Compatible Google Fit Apple Health Strava) Rose",Hama,"0,00 %",-1875,0
B08SDZW18F,"Hama Coque iPhone 12 Mini Compatible MagSafe MagCase Finest Feel pour Apple (Etui magnétique pour Recharge Induction, Housse Protection Chocs Rayures et saleté, en TPU Mate Soyeuse) Noir",Hama,"0,00 %",-4517,0
B08SDYPYPK,"Lecteur de Cartes USB All in One, USB-A, USB 3.0",Hama,"0,00 %",-3886,0
B00006J4FD,"Hama Multiprise 6 Prises 16A avec Interrupteur (Rallonge multiprises 1.4m, Bloc 6 Prises Type F Schuko, 3680W Max, Idéal Bureau PC luminaires, Atelier, Meuble TV, Garage) Blanc",Hama,"0,00 %",-6057,-5447
B000JFVCK8,"Hama Adaptateur secteur (prise de voyage pour : Amérique, apon, Canada, Brésil, Thaïlande, ... adapté aux apparails avec fiche Euro) Blanc",Hama,"0,00 %",-5850,-8211
B0054RDOL6,"Thomson Télécommande universelle 4 en 1 ""ROC 4411"" (Télécommande avec fonction d'apprentissage, convient pour quatre appareils, pour plus de 1 000 marques) Noir",Thomson,"0,00 %",0,-4862
B00006JAMZ,"Hama Câble d'alimentation secteur 3 pôles terre (pour connecter divers appareils tels les appareils froids, mâle avec contact de protectection femelle 3 pôles, câble de longueur 2,5 m) Noir",Hama,"0,00 %",0,-6050
B08SDR49RS,"Hama Radio Internet Dab/Dab+/FM, Bluetooth RX+TX DIR3510SCBTX (Radio numérique avec Lecteur CD, Compatible Spotify Connect, UNDOK App Control pr Smartphone ou Tablette, Télécommande, Réveil) Noir",Hama,"0,00 %",0,-2925
B0000AI3IQ,"Hama Cadre photo en plastique Sevilla (taille du Cadre de 50 x 70 cm avec bordure de 13 mm x 20 mm, pour une photo de 30 x 45 cm) Noir",Hama,"0,00 %",0,-7480
