B01BBTCVOQ,"Hama Album Photo Fine Art (Format 30 x 30 cm, 100 Pages Blanches, sans Spirale) Kiwi",Hama,"54,72 %",-675,125
B01KHD5GUS,"Hama Multiprise, ""6+1"" (commutable individuellement, avec protection anti-surtension, montage mural, pivotée à 90°, longueur de douille XL, protection enfant, longueur de câble de 1,4 m) Blanc",Hama,"54,71 %",178,594
B0054RDOCA,"Thomson Télécommande Universelle 2 en 1 ""ROC 2411"" (Télécommande avec Fonction d'apprentissage, Convient pour Deux appareils, pour Plus de 1 000 Marques) Noir",Thomson,"54,71 %",164,477
B0050GRN2W,"Hama Pochette Up To Fashion (pour 48 disques, CD/DVD/Blu-ray/livres audio, étui de rangement, gain de place pour la voiture, la maison, avec motif papillon) Rose",Hama,"54,71 %",3,-569
B09RGWV4NB,"Hama Casque-Micro pour téléphones sans Fil (Intra-Auriculaire, Contour d'oreille Réglable, Bras de Micro Flexible, Jack 2.5 mm, Qualité Audio Cristaline, 32 Ω, 1.2m, Garantie 10ans) Noir",Hama,"54,59 %",5459,1462
B08BFPTVPR,"Hama Album photo à spirale ""Romance"" à personnaliser (Album Photo de Mariage ou naissance bébé, Livre d'or ou cadeau, 28 x 24 cm, 40 pages, Motif cœur, Titre Love, 80 photos 10 x 15 cm) Beige/blanc",Hama,"54,59 %",-514,443
B01KFL3C26,"Hama Multiprise, ""6+1"" (commutable individuellement, avec protection anti-surtension, montage mural, pivotée à 90°, longueur de douille XL, protection enfant, longueur de câble de 1,4 m) Noir",Hama,"54,54 %",90,21
B00T7MB37Q,"Hama Album photo à pochettes ""New York City"" (pour 300 photos au format 10 cm x 15cm, taille de l'album de 19 cm x 34,5 cm, 100 pages, en cuir, protège les photos et les documents) Noir",Hama,"54,50 %",1,-43
B0BKYXBXNK,"Hama Support Téléphone Voiture Magnet (Support téléphone Portable pour Voiture aimanté, pivotable 360°, Fixation Clip Grille Ventilation, Inclus 2 plaques métaliques) Noir",Hama,"54,41 %",500,5441
B06XB2Y8KR,"Hama Album traditionnel ""Lazise"" (taille de l'album de 22,5 x 22 cm, pour 200 photos au format 10 cm x 15 cm, 100 pages, avec pochette CD, élégant) Blanc/Noir/Rose",Hama,"54,39 %",276,-1389
B0C5JMXBV6,"Hama Multiprise Parasurtenseur avec Interrupteur Lumineux (Bloc 5 Prises 16A, Rallonge 1.5m, Prise Multiple économie d'énergie, Prises 45°, Prise Male Plate, 3680W, Cable H05VV-F3G1.5) Noir",Hama,"54,37 %",-2,5436
B01KFLENPQ,"Hama Réveil Radio Piloté, Blanc, 9,5",Hama,"54,36 %",5435,5435
B0009V6OD2,"Hama Boîtier Slim Double (pour CD et disques Blu-Ray, Ultra Mince, avec Une Feuille pour la Couverture, Lot de 25) Transparent",Hama,"54,32 %",1015,380
B0CLYJQ3YY,"Hama Bras articulé de Telephone (Support articulé, Bras Flexible Smartphone Webcam Mirco Tablette eclairage annulaire, Support Universel Inclus, Fixation de Table à vis, Filetage 1/4"", 70cm Max) Noir",Hama,"54,09 %",5409,5409
B07Q8VBZ5M,"Hama X-Pointer 6in1 Télécommande Pointeur Laser - 6 en 1, Laser Rouge, Fonction Air Mouse, Technologie Smart-Link, sans Fil 2.4 GHz - pour présentation Powerpoint - Noir",Hama,"53,97 %",868,5396
B002L4O6RG,"Hama Etui de protection photo/vidéo semi-rigide ""Colour Style"" (60L, EVA, sacoche avec coque, anti-choc, pour le voyage, appareil petit format, ultra-compact, compact, MP3, MP4, iPod) Noir",Hama,"53,96 %",431,5396
B002QPTDTQ,"Hama Cadre photo ""Bristol"" pour portrait (taille de cadre 15x20 cm, taille de photos 15x20 cm, photos format horizontal ou vertical, en métal, 1 photo par cadre, élégant, simple, classique) Argent",Hama,"53,95 %",149,-573
B01DZGIJ26,"Hama Support mural TV FULLMOTION inclinable et pivotant pour TV écran plat entre 48 cm et 122 cm (19"" à 48""), jusqu'à 20 kg de charge supportée, VESA 200x200, Noir",Hama,"53,92 %",85,5392
B078T54CLX,"Hama Souris Optique à 3 Boutons MC-200, Filaire, Noire",Hama,"53,89 %",-1071,-847
B00NBLSLXS,"Hama Adaptateur secteur (prise de voyage pour : USA, anada, Japon, Brésil, … à utiliser pour les prises de : Allemagne, Espagne, France, Turquie, … Type A/B) Blanc",Hama,"53,87 %",5387,5387
B00005YVIU,"Hama Distributeurs Coins photo (1000 coins, autocollants, distributeur pratique, sans acide, sans solvant, adapté albums, permet un archivage fiable, scrapbooking) Transparent",Hama,"53,83 %",-107,-646
B07PHQ17NW,"Hama Album à Spirale 'Watercolor Moments', 28 x 24 cm, 50 Pages Blanches",Hama,"53,83 %",0,-1695
B07ZR6Q57K,"Hama Casque Micro de Bureau 'HS-P 300' (Casque Micro Perche Flexible, Filaire, pour PC, réunion en visio, confcall, stéréo, 2 connexions Jack 3.5mm) Noir",Hama,"53,82 %",5382,1090
B0BKZ1C59D,"Hama Support Téléphone Voiture Compact (pour Smartphones Largeur de 5.5 à 8.5 cm, Fixation Clip Grille aération, pivotable 360°) Noir",Hama,"53,77 %",-4,-145
B005MIGBDU,"Hama Support mural TV Ultraslim Orientable (pour diagonale d'écran de 25 à 66cm (10"" et 26""), pour un maximum de 25 kg, VESA jusqu'à 100 x 100, 5 étoiles) Blanc",Hama,"53,76 %",-794,1933
B00BYCGMEG,"Hama Album photo vierge ""Livorno"" (album photo traditionnel format 22 cm x 22 cm, pour 200 photos 10 cm x 15 cm, 100 pages, emplacement CD) Bleu/Blanc/Jaune",Hama,"53,74 %",2,-269
B0000AHIBX,"Hama Etui CD (pour 24 CD/DVD/Blu-ray, étui rigide et robuste) Transparent/Bleu",Hama,"53,73 %",5373,5373
B00005YVGK,"Pochettes pour 20 Diapositives encadrées de Format 5x5 cm, 25 pièces",Hama,"53,70 %",3,365
B072Q7YFFT,"Hama Album photo ""Designline"" (Album photo souvenirs mariage anniversaire, 22,5x22cm, 100 pages avec pochettes pour 200 photos 10 x 15 cm, Zone Mémo et pochette CD) Bleu Turquoise Blanc, Stripes",Hama,"53,68 %",-377,835
B08SDYYDL2,"Hama Album mémo « Stamps » à personnaliser (Album souvenirs de famille ou de voyage, idéal cadeau et scrapbooking, 22x22,5 cm, album livre 100 Pages, Max : 200 Photos 10x15 cm) Multicolore",Hama,"53,62 %",101,1032
B071YB8MFM,"Xavax Boîte de transport pour un gâteau (rectangulaire munie d'une poignée transparente, va au lave-vaisselle, boîte à gâteaux, maître d'hôtel) Anthracite/Transparent",xavax,"53,59 %",3,-175
B0000AIS82,"Hama Cadre photo ""Clip-Fixe"" (sans bordure, 40 x 60 cm, Reflex) Blanc",Hama,"53,57 %",5357,182
B000FNO03K,"THOMSON Microphone Dynamique M150 (fiche Jack 3,52 mm, Longueur de câble 3 m, Party) Noir",Thomson,"53,50 %",193,1005
B0009V8WNW,"Hama Pochettes de Protection (en Papier pour CD/DVD/Blu-Ray, verrouillables, Lot de 100) Blanc/Transparent",Hama,"53,50 %",-574,-1708
B07QNSQBCR,"Rapoo Souris laser sans fil Multi-Mode ""MT750s"" (bluetooth, souris d'ordinateur, design, avec boutons et molette de défilement) Noir",Rapoo,"53,49 %",1270,3251
B0071BIZG2,"Hama Support mural TV Fixe (Pour diagonale d’écran de 81 à 165cm (32"" à 65""), pour un maximum de 30 kg, VESA jusqu'à 400 x 400, 3 étoiles) Noir",Hama,"53,46 %",5,5346
B000EOVQIM,"Hama Pochette (pour 80 CD/DVD/Blu-Ray, classeur de Rangement, Gain de Place pour Le Bureau, Le Salon et la Maison, étuis de Transport) Noir",Hama,"53,46 %",-344,-167
B0CN9J2CSF,"Hama Télécommande Universelle, Remplacement de Télécommande TV LG/Samsung/Sony/Hitachi/TCL/Philips/Panasonic Smart TV, Infrarouge, controlez jusqu'à 8 appareils, Touche App Noir",Hama,"53,42 %",-5,5342
B06XB72BS3,"Hama Album traditionnel ""Lazise"" (taille de l'album de 22,5 x 22 cm, pour 200 photos au format 10 cm x 15 cm, 100 pages, avec pochette CD, élégant) Blanc/Doré",Hama,"53,27 %",-419,-475
B08SDTGG5L,"Hama Album Photo bébé ""Our Baby"" à personnaliser (Album photo de naissance, baptême, Cadeau d'anniversaire enfant, Idéal scrapbooking, 29 x32 cm, 60 Pages, Max. 300 Photos 10x15 cm) Multicolore",Hama,"53,23 %",-646,1055
B00T7M8ET6,"Hama Album photo à pochettes ""New York City"" (pour 200 photos au format 10 cm x 15cm, taille de l'album de 19 cm x 23,5 cm, 100 pages, en cuir, protège les photos et les documents) Noir",Hama,"53,22 %",-571,-899
B0163ZHE0O,"Hama Carte mémoire Photo (SDHC pour Photo/Classe 10, 32 GB - 80 MB/s) Bleu",Hama,"53,21 %",2187,5321
B07N6HRNMP,"Hama Album photo ""Summerly"" (couverture souple, 24 pages pour 24 photos au format 10x15 cm, résistant, pour archiver avec des anecdotes, protège la photo, mini album) Motifs Aléatoires",Hama,"53,13 %",32,-12
B00T7M8Y6E,"Hama Album photo à pochette minimax ""New York City"" (pour 100 photos au format 10 cm x 15cm, taille de l'album de 13,5 cm x 17 cm, 100 pages, en cuir, protège les photos et les documents) Noir",Hama,"53,02 %",-887,-1771
B0BL1SK5FK,"Hama Support Téléphone Voiture Move (pour Smartphones Largeur de 4.5 à 9 cm, Fixation Clip Grille aération, pivotable 360°) Noir",Hama,"53,02 %",5302,5302
B00AJJJNE6,"Hama Blu-Ray de nettoyage (pour tête de lecture, pour éliminer la poussière dans les lecteurs de Blu-Ray, Blu-Ray de nettoyage, emballage sans frustation) Blanc/Bleu/Rouge",Hama,"52,91 %",48,-187
B000Y13DPE,"Hama Boîtier CD Slim en polypropylène, Lot de 20, Assortiment de Couleurs",Hama,"52,88 %",-46,-520
B00I07LU40,"Hama Multiprise, ""6+1"" (commutable individuellement, avec protection anti-surtension, montage mural, pivotée à 45°, longueur de douille XL, protection enfant, longueur de câble de 1,4 m) Noir",Hama,"52,88 %",5287,5287
B079PN72PJ,"Hama Souris Optique sans Fil Riano (Souris Gauche sans Fil, avec récepteur Nano USB, Vertical, 800-1600 dpi, Interrupteur de Marche/arrêt, 3 Boutons, 2,4 GHz) Noir",Hama,"52,82 %",-304,-74
B0002VFL1U,"Hama Pochettes pour CD-ROM/DVD-ROM (Pochettes CD Plastique, Pochette de Protection colorées, Lot de 100, Multicolore) Bleu/Orange/Violet/Rose/Vert",Hama,"52,64 %",293,5637
B000K985GC,"Hama Boîtier Standard (pour DVD, Convient également aux CD et aux Blu-Ray, avec Film pour l'insertion de la Jaquette, Lot de 30) Noir",Hama,"52,60 %",-392,-737
B00006JAKM,"Hama Rack de bureau ""Nexus"" (pour 20 boîtiers de CD, support de CD pour le bureau ou les enfants, support de CD de haute qualité) Argent",Hama,"52,59 %",4,-16
B00F2BNE82,"Hama Album Photo ""Fine Art"" (format 22,5 x 22 cm, 80 pages blanches, sans spirale) Gris",Hama,"52,52 %",-997,-576
B074HZZQN4,"Horloge murale ""Easy Learning"" (horloge d'apprentissage analogique, pour enfants, pour apprendre l'heure, cadran d'apprentissage de diamètre 30 cm, silencieu) Blanc",Hama,"52,47 %",159,558
B00SL6I214,"Hama Album, Bleu, 30 x 30 cm",Hama,"52,47 %",-444,-1116
B0015NLFFA,"Hama Chemin de câble (en PVC, Semi-Circulaire, 100 x 7 x 2,1 cm) Blanc",Hama,"52,46 %",-1,254
B0187XDXPA,"Hama Casque Essential HS 300"" avec Microphone (Ultra-léger, Oreillettes rembourrées, Casque stéréo, chaîne stéréo, réglage du Volume sur Le câble, Longueur de câble de 2 m, Prise Jack 3,5 mm) Noir",Hama,"52,41 %",5240,-1208
B0C5JQPC2P,"Classeur avec mécanisme à 4 anneaux, larg. 70 mm, avec étui, noir/gris",Hama,"52,41 %",0,5240
B0BJKBCMNY,"Hama Station d'accueil USB-C 3 Ecrans (Docking Station USB-C, 12 en 1, Adaptateur Multiport, 3 USB-C, 2 HDMI, Displayport, PD, 1 Jack/Aux, 100W, pour Dell, HP, Lenovo, ASUS, Microsoft) Gris",Hama,"52,36 %",5235,5235
B08SDTHMQB,"Hama Album Photo bébé ""Our Baby"" personnalisable Scrapbooking (Album photo naissance, baptême, Cadeau d'anniversaire enfant, Style Mémo, 22,5 x 22 cm, 100 Pages, Max. 200 Photos 10x15 cm) Multicolore",Hama,"52,30 %",-6,-1252
B0CNRYZR3R,"Hama Boîte pour câbles Maxi (Boite Rangement pour Cables chargeurs et multiprises, boitier Cache câbles 40x15,5x13,5cm, Pieds en Caoutchouc) Noir",Hama,"52,21 %",0,5221
B001JTTAPW,"Hama Boîtier double (pour DVD, convient également aux CD et disques Blu-ray, avec film pour l'insertion de la jaquette, lot de 5) Transparent",Hama,"52,20 %",-59,84
B08YS17LYT,"Hama Prises Antenne TV Garantie 10ans (2 Fiches d’antenne TV coaxiale, Fiche Coaxiales Mâle + Fiche Coaxiale Femelle, Diam 5-7mm, 2 pièces) Blanc",Hama,"52,17 %",562,5216
B00006JAMU,"Hama Étuis à négatifs, polypropylène, 7 bandes de 6 négatifs, 24x36cm, 25 pièces",Hama,"52,07 %",-121,743
B078T7GHFK,"Hama Souris Optique Filaire MC-100-3 Boutons - Ergonomique, Précise, USB Plug & Play - Compatible Windows, Mac, Linux - Idéale pour Bureautique, Droitiers et Gauchers - Noire",Hama,"52,05 %",297,5204
B002QPPBME,"Hama Cadre photo ""Bristol"" pour portrait (taille de cadre 13x18 cm, taille de photos 13x18 cm, photos format horizontal ou vertical, en métal, 1 photo par cadre, élégant, simple, classique) Argent",Hama,"51,99 %",11,-223
B000NRU88E,"Hama Jeu de tournevis (pour appareils electroniques, montre, Lunettes, Maquettisme, Téléphone, Ordinateur, 12 inserts amovibles (Phillips, Torx, Pentalob), ensemble d'outils, 14 pièces) Noir/Argent",Hama,"51,91 %",5190,-589
B0000AI2Y8,"Hama Cadre-galerie photo en plastique ""Madrid"" (taille de cadre de 25 cm x 55 cm, taille de la photo de 13 cm x 18 cm, 3 photos par cadre, à accrocher, élégant, simple, classique) Argent",Hama,"51,90 %",-2,-93
B00G3BMZDA,"Xavax Minuteur de cuisine ""Countdown"" (avec minuterie et fonction chronomètre, fixation via un aimant, une pince, un support ou un support, à piles, numérique) Noir/Blanc",xavax,"51,90 %",-208,-338
B003LTSUL8,"Hama Chemin de câbles (en aluminiun, rectangulaire, 110 x 5 x 2,6 cm) Blanc",Hama,"51,87 %",396,263
B006L9T90G,"Ventilateur USB avec LEDs de couleur",Hama,"51,71 %",168,235
B00006JABA,"Hama Adhésif Cinekett (pour films Super 8, 100 pièces, S8, 1 piste audio libre) Blanc/Rouge",Hama,"51,66 %",79,346
B00006J4GV,"Hama Multiprise 3 Prises 16A avec Interrupteur (Rallonge multiprises 3m, Bloc 3 Prises Type F Schuko, Idéal Bureau PC luminaires, Atelier, Meuble TV, Garage) Blanc",Hama,"51,42 %",-2112,-392
B00UYZ1O3I,"Hama Support Plafond (pour Diagonale d'écran de 81 à 165cm (32"" à 65""), pour Un Maximum de 50 kg, VESA jusqu'à 400 x 400) Noir",Hama,"51,39 %",-462,1157
B0BLZ1RZKG,"Hama Multiprise avec Interrupteur (Bloc 4 Prises Schuko 16A, Interrupteur Individuel éclairé, idéal économie d'énergie, Prises à 90°, œillet Suspension integré, 3680W, Cable 1.4m H05VV-F) Blanc",Hama,"51,29 %",5128,2325
B01KAD4TK8,"Hama Télécommande universelle ""Smart TV"" 4 en 1 (Contrôle 4 Appareils Préprogrammés, TV/DVD/STB/VCR, Télécommande de Remplacement pour Télécommande MultiFonction IR) Noir",Hama,"51,24 %",-404,-878
B0002W6FOQ,"Hama Etui Universel (pour Cartes mémoire, pour Cartes CF/SM/SD/MMC/xD/MStick, pour 20 Cartes) Noir/Gris",Hama,"51,17 %",5116,5116
B0CLD4V1MR,"Hama Support Mural TV Garantie 10ans (TV 37"" à 120"", VESA jusqu'à 1100 x 600, jusqu'à 100 kg, écran de 94 à 305 cm, Support Plat, Distance au Mur 2.8cm, avec Chevilles Fischer) Noir",Hama,"51,12 %",5112,5112
B01K47G7VO,"Mini album photo à pochettes ""La Fleur"" pr 40 photos 10 x 15 cm, blc",Hama,"50,99 %",30,-2323
B0792TCS2C,"Hama Pochette Up to Fashion (pour 24 disques, CD/DVD/Blu-Ray/Livres Audio, étui de Rangement, Gain de Place pour la Voiture, la Maison) Bleu",Hama,"50,96 %",-534,147
B0000AISCF,"Hama Cadre photo en plastique Sevilla (taille du Cadre de 21 x 29,7 cm (DIN 4) avec bordure de 9 mm x 17 mm, pour une photo de 15 x 20 cm) Noir",Hama,"50,96 %",80,-1578
B0163ZHGCK,"Hama Carte mémoire Photo (SDHC pour Photo/Classe 10, 16 GB - 80 MB/s) Bleu",Hama,"50,81 %",-266,5142
B00005QFCJ,"Hama Adaptateur Cassette VHS-C/VHS (Convertisseur Vidéo VHS C vers VHS, Cassette Adaptatrice Motorisée pour magnétoscope, 6 Mm, Non Compatible 8mm/MiniDV/Hi8) Noir",Hama,"50,80 %",44,354
B08GS8FVB5,"Hama Destructeur de Documents Basic S6 (Broyeur de Documents, Sécurité P-2, 6 Feuilles, Corbeille 8L, Découpe en Bandes 6mm, 70 DB, M/A Auto, Idéal Bureau & Maison) Noir",Hama,"50,71 %",136,152
B00475DSKS,"Xavax Siphon (pour évier, lave-linge et lave-vaisselle, 1,5"", 2 ports pour siphon 1"" (2,54 cm) et 2 pièges à odeurs, flexible) Blanc/Noir",xavax,"50,65 %",408,-52
B0BL1VD923,"Hama Power Bank 20000 mAh (Batterie Externe, 1 USB C+2 USB A, Power Pack PD Qualcomm Quick Charge 3.0, Batterie Smartphone Tablette Enceinte Bluetooth, Voyants LED, Chargeur Portable cable 0.25m) Gris",Hama,"50,56 %",2575,5055
B09MQQM1ZJ,"Xavax Socle machine à laver avec étagère (Support Sèche Linge Lave Linge,Réhausseur de Machines, Base universelle avec Pieds Réglables en hauteur, charge 150 kg) Blanc",Xavax,"50,53 %",-781,878
B01J54Z1RS,"Xavax Cuillère doseuse à café en acier inoxydable (pour environ 6 g de poudre de café, cuillère à mesurer en acier inoxydable, longueur de 16,8 cm, lavable au lave-vaisselle) Argent",xavax,"50,50 %",-1122,191
B00BVWJ5RU,"Hama Réveil numérique radio-piloté, Noir, 9,5 cm Breite",Hama,"50,50 %",0,-818
B00KA4516Y,"Hama Ventilateur USB avec affichage de la température",Hama,"50,47 %",219,730
B0013IPAJY,"Hama Kit de Nettoyage et de réparation pour CD/DVD (25 ML de pâte de réparation, 45 ML de Liquide nettoyant, 1 Coque de Nettoyage, 5 Chiffons, 8 pièces) Blanc/Bleu/Rouge/Noir",Hama,"50,45 %",4,280
B07F3RRLG6,"Sac pour Appareil Photo Monterey, 100 Colt, Noir",Hama,"50,38 %",5038,5038
B00005UPC8,"Hama Boîtier standard double (pour CD et disques Blu-Ray, Étui protecteur pour CD, paquet de 10) Transparent",Hama,"50,37 %",-231,-1534
B078T73Z22,"Hama Souris sans Fil avec Mini Récepteur USB MW-110 (Résolution Capteur 1000 PPP, 2.4 Ghz, pour Droitiers & Gauchers, 3 Boutons, Ultra-Compacte, idéale PC, Mac, Ordinateur Portable, Tablette) Noir",Hama,"50,34 %",5034,5034
B00006JBG4,"Hama Boîtier Standard (pour CD et disques Blu-Ray, Étui Protecteur pour CD, Paquet de 5) Noir/Transparent",Hama,"50,27 %",0,-121
B002YGS7L2,"Hama Tube pour câbles (faisceau de câbles, forme en spirale, longueur 2 mètres, diamètre 25 mm) Noir",Hama,"50,25 %",5025,5025
B00A44MUY6,"Hama Chemin de câble (bande en PVC/Aluminium pour montage mural TV ou au sol, cache-câble demi-rond, 100 x 1,1 x 1 cm, entrée de câble jusqu'à 2 câbles, 4 pièces, matériel de montage compris) Blanc",Hama,"50,25 %",268,84
B00006JA8E,"Hama Étuis à négatifs (Lot de 25 Pochettes Rangement Diapos/Negatifs pour Classeurs à Anneaux, 40 Negatifs par Feuille, Polypropylène)",Hama,"50,21 %",5020,-272
B00006JDF0,"Hama DVD de nettoyage (pour tête de lecture laser, pour enlever la saleté dans les lecteurs de DVD, DVD de nettoyage au laser) Blanc/Bleu/Rouge",Hama,"50,21 %",-460,464
B09RC45SFJ,"Hama Album photo Livre ""Relax"" avec Mémo (Album souvenirs vacances, anniversaire, 22x22.5 cm, 100 pages avec pochettes pour 200 photos 10x15 cm, Zone Mémo et pochette carte SD) Multicolore/Breathe",Hama,"50,12 %",5012,-267
B0B2RQBJSG,"Hama Album photo Livre ""Relax"" avec Mémo (Album souvenirs vacances, anniversaire, 22x22.5cm, 100 pages à pochettes 200 photos 10x15cm, Zone Mémo et pochette carte SD) Multicolore/Just Relax 00007252",Hama,"50,12 %",5012,5012
B0009V6OBE,"Hama Pochettes de Protection (en Papier pour CD/DVD/Blu-Ray, Lot de 50) Blanc/Transparent",Hama,"50,09 %",124,390
B00EYVW7TI,"Hama Multiprise 6 Prises 16A avec Interrupteur (Rallonge multiprises 3m, Bloc 6 Prises Type F Schuko, 3680W Max, Idéal Bureau PC luminaires, Atelier, Meuble TV, Garage, sécurité Enfants) Noir",Hama,"50,08 %",687,87
B07RTMTF2D,"Gamepad Vendetta 100""",Hama,"50,05 %",5005,5005
B00194HCBG,"Cadre métallique pour portrait ""Laval"", 2x 13x18 cm",Hama,"50,00 %",381,247
B084HZNPS3,"Hama Album Photo ""Fine Art"" (format 24 x 17 cm, 36 pages blanches, sans spirale) Vert Tilleul",Hama,"49,95 %",648,-137
B0009V8VAQ,"Hama Etui pour Lecteur et CD (pour Lecteur CD, pour Discman, 3 CD, avec Sortie de câble et Boucle de Ceinture) Noir/Bleu",Hama,"49,89 %",314,-998
B0CP7YT6FV,"Hama Protection Coque pour Samsung Galaxy Tab S8 Ultra/S9 Ultra 14,9"" - Housse Fonction Chevalet, Matériaux 100% Recyclé, Compartiment pour Stylet, Protection Fermeture Magnétique - Noir",Hama,"49,85 %",4984,4984
B000TCQPWG,"Hama Boîtier Slim (pour CD et disques Blu-ray, ultra mince, avec une feuille pour la couverture, lot de 20) Noir/Transparent",Hama,"49,81 %",76,267
B0002W5WBI,"Hama Boîtier Slim (pour CD et disques Blu-Ray, Ultra Mince, avec Une Feuille pour la Couverture, Lot de 100) Noir/Transparent",Hama,"49,78 %",-63,40
B0BL1RHLQD,"Hama Câble iPhone USB-A Lightning (Câble de charge/transfert de données/Data, USB-A 2.0 mâle vers Lightning, 1.5m, Certifié MFI, 480 MBit/s, iPad/iPhone 13/12/11/XS/XR/X/8/7/7+/6s/6/5/SE2020) Blanc",Hama,"49,77 %",2808,4976
B009TLAPLK,"Hama Album Photo ""Fine Art"" (format 28 x 24 cm, 50 pages noires, à spirale) Kiwi",Hama,"49,68 %",-42,-1723
B00AJKQ4YC,"Hama 2 Pieds Enceintes Universels (Supports Haut-Parleur, Hauteur réglable Max. 123 cm, antidérapant, Charge Max. 5 kg/Pied, câbles cachés, Haut-parleurs Hi-FI/Stéréo/Home Cinema) Noir",Hama,"49,62 %",97,-125
B002ZX98MG,"Hama Boîtier Slim (pour DVD, Convient également aux CD et disques Blu-Ray, Ultra Mince, avec Une Feuille pour la Couverture, Lot de 10) Transparent",Hama,"49,60 %",28,1446
B005DJKIKK,"Hama Album Photo ""Singo"" (album grand format, 30 x 30 cm, 100 pages, pour 400 photos au format 10 x 15 cm) Orange",Hama,"49,58 %",-57,-1716
B0BHWL9GGB,"Hama Multiprise Euro 3 Prises (Distribution Alimentation Slim, Extra Plat, 3 Prises 'Euro' Femelles, 16A, 230V, Max 1700W, câble 2.5m) Blanc",Hama,"49,46 %",-96,-197
B08GSCS399,"Hama Destructeur de Documents Basic S8CD (Broyeur Documents 8 Feuilles 80g, Destructeur CD/CB, Niveaux de sécurité P2 T1, Découpe en Bandes 6mm, 70 DB, M/A Auto, Corbeil 11L) Noir",Hama,"49,38 %",-251,-11
B00006JDGH,"Hama Filtre UV (anti-UV et protection, compensation 2X, traitement antireflet, pour objectifs d'appareils photo 58 mm, O-Haze, traité) Noir",Hama,"49,34 %",586,-1338
B0CLD3CC7D,"Hama Support TV Mural Fixe Ultrafin Garantie 10 Ans (Support TV Mural Extra-Plat, 80kg Max, Robuste, pour écrans LCD/LED/OLED/Plasma de 94 à 229 cm (37"" à 90"") VESA Max 600x400) Gris",Hama,"49,33 %",1950,4932
B0CKJ46BFN,"Xavax Porte-capsules de café pour Tassimo (Distributeur de capsules à café, Support Rangement pour 26 capsules, Présentoir à Capsules Tassimo) Noir mat",Xavax,"49,27 %",4926,4926
B00GRP4EYA,"Hama Boîtier pour câbles ""Mini"" (boite pour câbles, 23 x 11,5 x 11,8 cm, avec pieds en caoutchouc) Blanc",Hama,"49,25 %",251,-866
B001EKGRK2,"Hama Boîtier double (pour Blu-ray, convient également aux CD et DVD, avec film pour l'insertion de la jaquette, lot de 3) Bleu",Hama,"49,02 %",-4,-1578
B00005QFAY,"Hama Étuis à négatifs, Papier Cristal, 7 Bandes de 6 négatifs, 24x36cm, 100 pièces",Hama,"49,02 %",116,17
B00X3NTCIC,"Hama Laeta Twin Clé USB 3.0 - Flash Drive 128 Go, Vitesse jusqu'à 40 Mo/s, Clef avec connecteurs USB A & Micro USB, pour PC/Mac/Tablette et Smartphone - Grise",Hama,"48,96 %",4895,4895
B00FQFYOM4,"Lecteur USB 3.0 de Cartes SD/microSD, argenté",Hama,"48,92 %",87,-374
B084J1VGPD,"Hama Album Photo ""Fine Art"" (format 30 x 30 cm, 80 pages blanches, sans spirale) Gris",Hama,"48,89 %",-703,-907
B00792A822,"Etui ""Vegas"" pour 5 clés USB, noir",Hama,"48,85 %",103,-180
B003TQY5YY,"Hama Pochette Up To Fashion (pour 24 disques, CD/DVD/Blu-ray/livres audio, étui de rangement, gain de place pour la voiture, la maison, avec motif rond) Rouge",Hama,"48,84 %",-746,-364
B07F82LSLN,"Hama Support Travel Pliable pour tablettes et Smartphones (Idéal pour Les déplacements, Solide et Pratique) Couleur aléatoire Parmi Blanc/Bleu/Gris/Jaune/Noir/Rouge/Vert",Hama,"48,83 %",489,-2641
B0C2PDLY43,"Hama MW-500 Recharge Souris sans Fil - Technologie 2.4Ghz, Rechargeable en USB C, Capteur Blue Wave 1600 dpi, Technologie Smart-Link, Clics Silencieux, Droitier/e - Noire",Hama,"48,82 %",89,4881
B07TM7WRZY,"Hama Elegance Horloge Murale à Quartz Cercle Gris, Argent - Horloges murales (AA Mignon, Gris, Argent, Plastique, Verre, 45 mm, 495 g)",Hama,"48,73 %",195,4873
B017JY4WEY,"Hama ""Fine Art"" Spiral Album, 24 x 17cm, 50 Photos, chalk",Hama,"48,68 %",1,4867
B001UBEUZE,"Coque de Protection Crystal Clear pr Samsung Galaxy S20, transpar.",Hama,"48,66 %",126,-1626
B0BL1RD6VH,"Hama Testeur de piles Universel (Testeur de batterie Universel pour piles AA/AAA/C/D/N/E/CR123A/CR2/CR-V3/1,5V/3V/2CR5/CR P2, piles boutons, Afficheur LCD) Gris",Hama,"48,66 %",878,4865
B0019DPZPC,"Hama 29308 Présentoir de Distributeur de pastilles adhésives, Transparent (1 distributeurs, 1000 coins photos, 12 x 13 mm)",Hama,"48,59 %",272,-11
B0BL1TH1PX,"Hama Kit Support Téléphone Voiture Universel (Ensemble Support téléphone pour Voiture, 2en1 Clip pour aération et Ventouse, pivotable 360°, pour Mobile de Largeur de 4 à 11 cm) Noir",Hama,"48,54 %",81,4854
B00006JAQ7,"Hama 007103 - Ruban photo transparent, Blanc, 1000 pièces (2 paquets de 500 pièces)",Hama,"48,48 %",-593,-1063
B07CLVR52S,"Hama Album photo enfant ""Batzi"" (taille de l'album de 19 x 25 cm, format pour 200 photos 10 x 15 cm, avec 100 pages, papier stratifié, insertion latérale des photos, ours debout) Marron",Hama,"48,45 %",-21,-1787
B0015IOV8S,"Hama Cadre photo en plastique ""Sevilla"" (taille du Cadre de 40 x 40 cm avec bordure de 13 mm x 17 mm, pour une photo de 28 x 28 cm) Noir",Hama,"48,44 %",0,4844
B00006JDJU,"Hama - 46020H - Micro monophonique, finition noire métal, jack de 3,5mm et adaptateur 3,5/6,35 mm, interrupteur marche/arrêt sur le micro, 600 Ohms, dynamique et unidirectionnel - Cordon 3.00m",Hama,"48,42 %",-960,-721
B000EOVQCS,"Hama Pochettes de Protection Doubles (en Plastique, pour CD/DVD/Blu-Ray, 2 CD par Pochette, Lot de 50) Blanc/Transparent",Hama,"48,38 %",42,-1169
B0949HMZB1,"Hama Chiffon Antistatique Antipoussière (Chiffon de Nettoyage pour Lunettes ou Appareil Photo, Objectif, Filtre, écrans PC Smartphone ou Tablette, négatifs, Diapositives, Jumelles, 23 x 25 cm) Orange",Hama,"48,36 %",-104,-191
B000EOVQIW,"Hama Pochette (pour 160 CD/DVD/Blu-ray, classeur de rangement, gain de place pour le bureau, le salon et la maison, étuis de transport) Noir",Hama,"48,28 %",-22,-159
B001JQF4ZU,"Hama Kit d'alimentation, 25mm²",Hama,"48,27 %",4827,4827
