B0BL1RL5YW,"Hama Chargeur Rapide 33W 4 Ports USB (Chargeur Qualcomm Quick Charge 3.0, Chargeur USB, Adaptateur Secteur Charge Rapide, 1 USB-A QC, 3 USB-A) Noir",Hama,"38,62 %",3861,3861
B00005QF9N,"Hama Attache Rapide pour Trépied, Click II (Plateau Rapide Tête de Trépied, Fixation Rapide pour Appareil Photo/Caméscope à Filetage 1/4"" 6.4mm, pour Trépieds Gamma) Noir",Hama,"38,60 %",52,229
B0002W5W8Q,"Hama Pochettes de protection (pour CD/DVD/Blu-Ray, design étroit, pochette en plastique, lot de 100) Transparent",Hama,"38,59 %",-404,-1515
B08YS2W9DG,"Hama Adaptateur Audio, fiche USB-C - Jack Femelle 3,5 mm, stéréo, Métal, Garantie 10 Ans, Noir",HAMA,"38,58 %",3858,3858
B0BL1RZ3GH,"Hama Power Bank 10000 mAh (Batterie Externe, 1 USB C + 2 USB A, Power Pack Fast Charge, Batterie pour Smartphone, Tablette, Haut-Parleur Bluetooth, Voyants LED, Chargeur Portable + Cable 0.25m) Gris",Hama,"38,53 %",3853,-921
B08SFFNZ4D,"Rapoo Clavier et Souris sans Fil X 1800s"" (Pack Kit Clavier Souris sans Fil 2.4GHz, Dongle Nano USB, Autonomie 12mois, Souris Optique 1000DPI, Clavier AZERTY FR, Pavé Numérique, pour PC, Laptop) Noir",Rapoo,"38,41 %",-272,3840
B00005QFAZ,"Hama Étuis à négatifs (Lot de 25 Pochettes Rangement Diapos/Negatifs Photo, pour Classeurs à Anneaux, 4 Bandes/Feuille, en Papier Cristal)",Hama,"38,34 %",-44,-2092
B000CZ2LQE,"Hama Gel de nettoyage (pour écran LCD / TFT avec chiffon en microfibre, 200 ml) Gris/Bleu",Hama,"38,24 %",-1486,-1808
B08YRYZVVY,"Hama Plastifieuse jusqu'à A3 (Plastifieuse à chaud/à froid, Kit de Plastification avec Feuilles Films Laminage Thermique ep. Max 80-125 Microns) Noir",Hama,"38,02 %",83,1970
B00C1C2J2M,"Hama Support mural TV inclinable ultra plat pour TV écran plat entre 117 cm et 229 cm (46"" à 90""), jusqu'à 75 kg de charge supportée, VESA 800x600, Noir",Hama,"37,21 %",-913,-1359
B0BZDSJGGH,"Hama Enceinte Bluetooth Etanche (Enceinte Nomade Bluetooth, TWS, IPX5, pour Smartphone, PC Portable, Haut-Parleur PC sans Fil Portable, Rechargeable USB-C, Batterie 12h, 20W) Noir",Hama,"37,19 %",3719,3719
B00006IVE7,"Hama Étuis à négatifs, papier cristal, 10 bandes de 4 négatifs, 24x36cm, 25 pièces",Hama,"37,16 %",-8,-2226
B096YFPTBR,"Hama Kit de Nettoyage d'Appareil Photo 4 en 1 ""Optic Dry (Kit de Nettoyage à Sec avec Stylo Lenspen + Chiffon Microfibre + Poire, pour Objectif Photo, Filtre, APN, Caméra Reflex, Jumelle, écran)",Hama,"37,05 %",-390,-218
B01DF1YLXM,"Hama Ventilateur de table USB (Mini Ventilateur de bureau 10 cm (4""), Bouton ON/OFF, inclinable, idéal aussi pour Chambre, Voiture, Camping) Noir",Hama,"37,02 %",-381,-1778
B09GLCFQWQ,"Hama Clé USB 128 Go (USB C 3.1, Stockage de données avec taux de Transfert de données de 100 Mo/s et Capuchon pour Windows/MacBook), Anthracite, compacte",Hama,"36,60 %",3659,1721
B001E725JM,"Hama Blu-Ray de Nettoyage (pour tête de Lecture, pour éliminer la poussière dans Les lecteurs de Blu-Ray, Blu-Ray de Nettoyage) Blanc/Bleu/Rouge",Hama,"36,55 %",149,-2719
B081S4YTDT,"Tige pour Selfie Funstand 57"", avec déclench. à dist. Bluetooth, Noir",Hama,"36,15 %",-252,3614
B08SF7DZLY,"Hama Hub USB multiport Data (4 ports, USB 2.0, Vitesse de Transfert de Données 480 Mbit/s, Interrupteur Marche/Arrêt, Témoin de fonctionnement à LED,Garantie 10 ans,Plug et Play,Compact, Robuste) Noir",Hama,"35,95 %",-2024,3595
B00006JB4M,"Hama Filtre UV (anti-UV et protection, compensation 2X, traitement antireflet, pour objectifs d'appareils photo 77 mm, O-Haze, traité) Noir",Hama,"35,89 %",0,-1680
B08YS25RDP,"Hama Répartiteur Satellite (2 Voies Fiche F, Totalement blindé, Distributeur Sat, Protection Totale, Garantie 10 Ans) Argent",Hama,"35,69 %",137,3569
B001K9LNA6,"Hama Support Télécommande TV Commander (porte-télécommande TV Chaine Hifi DVD Blue-Ray, 3 grands compartiments, Boite de Rangement organiseur lunettes, smartphones, contrôleurs) Noir",Hama,"35,46 %",-2113,-78
B07QPVX3JL,"Hama Laeta Twin Clé USB 3.0 - Flash Drive 256 Go, Vitesse jusqu'à 40 Mo/s, Clef avec connecteurs USB A & Micro USB, pour PC/Mac/Tablette et Smartphone - Grise",UNKNOWN,"35,33 %",3533,3533
B0BL1SS1WK,"Hama MW-300 V2 Souris sans Fil - Technologie 2.4Ghz, Capteur 1600 dpi, Clics Silencieux, Ambidextre - Noire",Hama,"35,20 %",-335,3519
B078MQ5X7S,"Hama Cadre photo en plastique ""Rio"" (cadre de 15 cm x 20 cm, bordures de 25 mm x 16 mm, pour les photo de taille 10 cm x 15 cm, verre reflex, bois-plastique (WPC), avec crochet et pied) Naturel",UNKNOWN,"35,10 %",3509,3509
B08NCYZ4BV,"Hama Câble Antenne TV Coudé Garantie 10ans (Cable Coaxial TV, M/F, 2x coudé 90°, 3m, triple blindage 90db, Anneau Ferrite, Cable Coaxial Satellite, Connexion TV vers Fiche TV Murale ou Décodeur) Blanc",Hama,"34,96 %",-499,3496
B005430MOM,"Best Price Square HAMA MICROSDHC 16GB Class 10 108088 by HAMA",Hama,"34,86 %",3486,3486
B0CP86Q49Q,"Hama Antenne intérieure (Antenne Réception Radio Numérique (Dab/Dab+) et Analogique FM, Amplification du Signal Actif jusqu'à 30 DB, Cäble 1.5m, Fiche F mâle, Alim Secteur) Noir",Hama,"34,55 %",740,3454
B0BL1V9R33,"Hama Câble Chargeur iPhone Extreme (Câble Lightning-USB 2.0, Certifié MFI, Cordon Charge Rapide/Transfert données, Nylon Tressé, 1.5m, iPad/iPhone 13/12/11/XS/XR/X/8/7/7+/6s/6/5/SE2020) Noir/Rouge",Hama,"34,51 %",-2544,-715
B07BGLLS26,"Chiffons pour écrans, 100 pièces, dans un distributeur",Hama,"34,47 %",678,3447
B09RQY25LH,"Hama Adaptateur Bluetooth 5.0 (Dongle Bluetooth USB, Clé Bluetooth Plug&Play pour PC, Casque, Souris, Manette, Clavier, Imprimantes, Smartphone, Tablette, Compatible avec Windows 10/8.1/7) Noir",Hama,"33,20 %",3320,3320
B0009V6Q30,"Hama Boîtier Slim (pour CD et disques Blu-ray, ultra mince, avec une feuille pour la couverture, lot de 25) Transparent/Bleu/Orange/Vert/Rouge/Violet",Hama,"33,09 %",-727,570
B01KJER734,"Hama 24 Albums photos ""Skies"" (couverture souple, 24 pages pour 24 photos au format 10x15 cm par album, résistant, pour archiver avec des anecdotes, protège la photo, mini album) Multicolore",Hama,"32,99 %",1265,157
B00006JDN5,"Hama Bague d'adaptation (en métal, pour monter un Filtre de 52 mm sur un Objectif de 55 mm) Noir",Hama,"32,91 %",3290,3290
B0186D2GQS,"Hama Album Photo ""Fine Art"" (format 29 x 32 cm, 50 pages blanches, sans spirale) Gris",Hama,"32,54 %",10,-1535
B09TRG96K2,"Hama Caméra Surveillance WiFi (Camera de Surveillance Interieur, Caméra Connectée, Micro, App. Mobile, Détection Mouvements 355°, Vision Nuit, Enregistre sur Carte SD, Alexa, Google Assistant) Noir",Hama,"32,53 %",3253,3253
B0BRYDB26C,"Hama Canosa V2 Souris sans Fil - Technologie Bluetooth® 5.0, Capteur 1600 dpi, Clics Silencieux, Ambidextre - Grise Anthracite",Hama,"32,43 %",19,3242
B00006JCX6,"Hama Anneaux brisés triangulaires, anguleux, 6 pièces",Hama,"32,14 %",-12,-1366
B00QPXRFXG,"Hama Laeta Twin Clé USB 3.0 - Flash Drive 32 Go, Vitesse jusqu'à 40 Mo/s, Clef avec connecteurs USB A & Micro USB, pour PC/Mac/Tablette et Smartphone - Grise",Hama,"31,80 %",3179,-2266
B079PDDSBK,"Hama Mallette (LP 50, Aspect alu, en Aluminium, pour Stocker 50 disques, verrouillable, Boîte de Rangement pour Vinyle, boîtier pour Disque) Noire",Hama,"31,71 %",-1283,3171
B097HN8V5V,"Hama Câble d'Antenne TV (Cable TV Coaxial Mâle - Coaxial Femelle, 85 db, 1.5m, Connexion d'un Téléviseur vers une Fiche TV Murale ou vers un Décodeur) Blanc",Hama,"31,12 %",156,-453
B00006JCUF,"Hama 00030392 Bloc Multiprises à 3 Sorties avec Interrupteur, 1,4 m, Noir",Hama,"30,97 %",-18,-342
B00005KHTC,"Hama Filtre polarisant (circulaire, Traité, 62mm, 2 couches par face) Noir",Hama,"30,78 %",3077,3077
B00005QFA6,"Hama Bague d'adaptation (en métal, pour monter un Filtre de 58 mm sur un Objectif de 52 mm) Noir",Hama,"30,63 %",-311,3063
B0BG5F6PK3,"Hama Montre Connectée Fit Watch 6910 (GPS Montre Sport Etanche IP68 Montre Fitness 14 Sports, Montre Multifonctions Compatible Google Fit Apple Health Strava) Noir",Hama,"30,07 %",-132,3007
B00194JFVG,"Cadre métallique pour portrait ""Laval"", 2x 10x15 cm",Hama,"29,48 %",-3044,-3194
B0BNLLF6YV,"Hama iTuner Hi-FI DIT2105SBTX Dab+ Bluetooth (Tuner Internet Radio FM Dab, Tuner HiFi, Radio numérique, RX/TX, WiFi, Spotify Connect, Amazon Music, App UNDOCK, Port USB, télécommande) Noir",Hama,"29,26 %",-24,165
B00GS5N4D6,"Hama Support Mural TV FULLMOTION inclinable et pivotant pour TV écran Plat Entre 119 cm et 229 cm (47"" à 90""), jusqu'à 75 kg de Charge supportée, VESA 800x600, Noir",Hama,"28,55 %",2854,2854
B000XA2YLU,"Xavax Rallonge de tuyau d' arrivée d' eau à fils armés, 3 m",Hama,"28,20 %",2820,2820
B0CYN3KRY6,"Hama Casque Bluetooth avec Micro pour Enfant 'Teens Guard II' (Casque Bluetooth pour Enfant, Supra-aural, Volume limité à 85 DB, Cable USB-C) Bleu",Hama,"27,60 %",2760,2760
B003KKWLJA,"Xavax Raccord de tuyau d' arrivée d'eau en laiton (pour tuyaux d’arrivée de lavage et de lave-vaisselle, embout de tuyau d’admission) Dorée",xavax,"26,55 %",-3022,-3659
B079P3WD2X,"Thomson Antenne intérieure ANT1538 (pour réception Radio/télévision numérique, HDTV/3D, DVB-T/T2, avec Amplification du Signal, Performance 45) Noir/Bleu",Thomson,"26,23 %",-1029,2622
B0083K5F68,"Hama Déclencheur Souple Appareil Photo (Déclencheur Souple Mécanique 40cm pour Appareils Fujifilm, Leica Canon Nikon Sony, Déclencheur à Filetage Femelle, Fonction Pause) Noir",Hama,"26,07 %",-355,-1906
B0BG5JM42B,"Hama Montre Connectée Fit Track 3910 (Montre Sport, Etanche IP68, Montre Fitness 14 Sports Fréq. Cardiaque Oxymètre Podomètre Compatible Google Fit Apple Health Strava) Gris",Hama,"25,06 %",2505,2505
B09GLDKNFM,"Hama Clé USB 128 Go USB-C 3.1 (Support de Stockage de données amovible; Compact; Taux de Transfert de données 70 Mo/s; Capuchon de Fermeture; Flash Drive Ideal pour Windows/MacBook) Anthracite",Hama,"24,66 %",2466,2466
B000EOQT48,"Hama Monopode Star 78 Mono (unidirectionnel léger à tête à Trois Voies, 61-176 cm, 3D) Champagne",Hama,"24,63 %",6,-323
B07PSPRGMT,"THOMSON Casque TV HQ HED4508 (câble Extra Long de 8 m, Casque stéréo pour TV, réglage du Volume séparé, Embout Filaire, Prise 3,5 mm avec Adaptateur de 6,35 mm) Noir",Thomson,"24,51 %",-8,2451
B096XM2WGL,"Hama Ecouteurs Bluetooth sans Fil Freedom Light (Ecouteurs TWS, Micro, Ecouteurs Intra Auriculaire, Station de Charge, Grande Autonomie, USB-C, Charge Rapide, Controle Vocale+Tactile) Vert",Hama,"24,09 %",2408,2408
B07QT6GZ6W,"Hama C-Laeta Clé USB 3.1 Gen 1 - Flash Drive 128 Go, Vitesse jusqu'à 40 Mo/s, Clef avec connecteurs USB A & USB C, pour PC/Mac/Tablette et Smartphone - Argentée",UNKNOWN,"24,06 %",-2444,2405
B08SF57MNJ,"Hama Adapt. Audio, Jack mâle 3,5 mm 2X 3 br. - Casque Micro Jack 3,5 mm 4 br., Métal, Garantie 10 Ans, Noir",HAMA,"23,76 %",2375,2375
B07RKXDK8S,"Hama Verre de protection (Full-Screen, pour Huawei P30 Lite) Noir/Transparent",Hama,"23,75 %",2375,2375
B071JHW779,"Clé USB WLAN Nano N150, 2,4 GHz",Hama,"21,75 %",2175,2175
B0BKYL622V,"Hama Power Pack Slim 5HD (Batterie Externe 5 000 mAh, Batterie Portable Charge Rapide, USB 3.0, Power Bank Compatible avec iPhone 14 13 12 11 X Samsung Xiaomi Huawei iPad etc) Blanc",Hama,"21,68 %",-2020,-1815
B07HY9LK8J,"Rapoo Clavier multimédia USB Filaire ""N2400"" (filaire, clavier d'ordinateur AZERTY, design, idéal pour les maladroits) Noir",Rapoo,"21,44 %",-111,2144
B08FRKD2HT,"Hama Clé USB 3.0 ""Rotate"" (capacité de 256 GB, taux de transfert de 90 MB/s, avec accroche porte-clefs, flashpen clé usb) Bleu Pétrole",Hama,"21,36 %",-2908,-1375
B0B59G9QZ5,"Hama Film de protection d'écran pour Apple iPad Air 10,9"" (2020/2022) 'Crystal Clear' (Excellente reproduction des couleurs, protège des rayures et des traces de doigts) Transparent",Hama,"21,08 %",2107,2107
B00JQJWPN6,"Hama Film protecteur d'écran universel Easy-On ""Premium"" (écran de 14cm (5,5"") maximum)",UNKNOWN,"19,85 %",1985,1985
B000L0W12E,"Adaptateur automobile pour CD/MD/MP3, Noir",Hama,"19,82 %",-231,-419
B00006JCZK,"Hama Filtre UV (Anti-UV Et Protection, Compensation 2X, Traitement Antireflet, pour Objectifs D'appareils Photo 62 Mm, O-Haze, Traité) Noir",Hama,"18,83 %",-36,-1792
B08YRY2LQJ,"Hama Câble Jack 3.5 Male Male (Câble Auxiliaire Stéréo Jack 3.5mm, Cable Audio Garantie 10ans, 1.5m, compatible iPhone, iPod, iPad, Voiture, Casque, Autoradio, Smartphones, MP3) Noir",Hama,"18,47 %",-1257,1847
B096XNCQNL,"Hama Ecouteurs Bluetooth sans Fil Freedom Light (Ecouteurs TWS, Micro, Ecouteurs Intra Auriculaire, Station de Charge, Grande Autonomie, USB-C, Charge Rapide, Controle Vocale+Tactile) Rose",Hama,"18,44 %",1843,1843
B0BPDBR7QH,"Hama Tapis de Souris (Tapis Souris Mousepad 22.3 x 18.3 cm, Ultra Mince, Idéal Bureau ou Jeux Vidéo, Dessous antidérapant, Résistant) Rouge",Hama,"18,39 %",0,1839
B0BPD65GR9,"Hama Tapis de Souris (Tapis Souris Mousepad 22.3 x 18.3 cm, Ultra Mince, Idéal Bureau ou Jeux Vidéo, Dessous antidérapant, Résistant) Noir",Hama,"18,32 %",-138,2
B079175GWR,"Hama Souris Ergonomique sans Fil (Souris Verticale sans câble pour droitiers, Souris sans Fil sans Fil avec capteur Optique 1000/1400/1800 dpi) Noire, Prise USB Type-A, Pile AA Mignon",Hama,"17,99 %",-1411,-2491
B0C6CK8KFG,"Hama Câble Enceinte HiFi (Cable pour enceinte, 10m, Câble Audio pour Enceinte, Câble HP de Haut Parleur en Cuivre pour Hifi et Hifi embarquée, 2 x 0.75 mm²) Transparent",Hama,"17,02 %",-3,1702
B0BL1TWRL8,"Hama Ecouteurs sans Fil Tour du Cou Freedom Neck (Casque de Sport Bluetooth Intra-Auriculaires Tour d'oreille avec Micro, 10h d'autonomie, Idéal Course, Vélo, Gym, Contrôle Vocal) Noir",Hama,"16,03 %",-584,-1278
B0CYNMRQH6,"Hama Color 10 - Batterie Externe [Power Bank 10 000mAh] [Batterie Portable USB C Fast Charge], Compatible avec iPhones Samsung et Bien Plus - Violet",Hama,"14,41 %",1440,1440
B08B1K2X76,"Hama 45W Chargeur Rapide Universel pour PC Portable 15-19V - [8 Adaptateurs] [Protection Contre la surchauffe & sur-tensions] Noir",Hama,"12,89 %",1288,1288
B00006J9WQ,"Hama Coins Adhésifs Photos (Distributeur de 200 Coins Photos, diamètre de 10 mm, PP Anti Statique) Transparent",Hama,"11,79 %",-61,-280
B00EUSMHE0,"THOMSON Kit Casque sans Fil TVWHP3203D (on-Ear, pour TV/HiFi, Circum-aural, supprimer Bruit Fond, 100 m) Noir",Thomson,"10,59 %",-47,-732
B0C5JMQJ2G,"Hama C-Rotate Pro Clé USB 3.1 - Flash Drive 256 Go, Vitesse jusqu'à 100 Mo/s, Clef avec connecteurs USB A & USB C, pour PC/Mac/Tablette et Smartphone - Argentée",Hama,"8,72 %",-266,872
B08YS2336Y,"Hama Arezzo Coque pour Kindle WiFi/Paperwhite & Kobo Touch/Glo - Housse Fermeture Magnétique, Doublure Intérieure Douce - Noir",Hama,"7,80 %",779,828
B0BL1H5S5W,"Hama Ecouteurs sans Fil Tour du Cou Freedom Run (Casque Bluetooth Intra-Auriculaires Tour d'oreille avec Micro, 6h d'autonomie, Idéal Sport, Course, Vélo, Gym, Contrôle Vocal) Noir",Hama,"6,12 %",-581,611
B00F2KA71K,"Hama Support mural TV FULLMOTION inclinable et pivotant pour TV écran plat entre 117 cm et 229 cm (46"" à 90""), jusqu'à 75 kg de charge supportée, VESA 800x600, Blanc",Hama,"5,11 %",-2307,510
B00006IVJJ,"Hama Nettoyeur de contacts en fibre de verre ""Glass Fibre"" (gomme à effacer, en fibre de verre pour contacts électriques, fibre de verre) Noir/Blanc",Hama,"4,66 %",-1004,-5747
B0163ZHC38,"Hama Carte SDXC Classe 10 - Carte SD 64 Go, Vitesse jusqu'à 90 Mo/s, Carte Mémoire Compatible UHS-I, pour Ordinateur/Appareil Photo/Smartphone - Bleu",Hama,"0,18 %",1322,17
B08YS2LN2T,"Hama Câble Cordon d'alimentation Bipolaire 2.5m Garantie 10ANS (Type C Fiche Européenne vers Prise Femelle C7 Euro 8, pour PC Petit Appareil TV Blu-Ray Récepteur DVD Alimentations Électriques) Noir",Hama,"0,01 %",1,1
B01NCPU8XY,"Hama Boîtier ""Slim"" double pour DVD, lot de 5, Transparent",UNKNOWN,"0,00 %",0,-7763
B07NH4NX72,"Couvercle Pare-poussière pour écran, 30""/32"", transpar.",Hama,"0,00 %",0,-3557
B00T9GY0H0,"THOMSON Support Mural TV WAB175 (VESA jusqu'à 600x400, inclinable, pour Une Diagonale d´écran comprise Entre 94 et 191 cm (de 37"" à 75"")) Noir",Thomson,"0,00 %",0,-5781
B07GW1R5DT,"Hama Détecteur de Mouvement WiFi (Fonction Alarme, lumière, capteur Infrarouge, Notification d'alarme sur Le Mobile, Compatible Alexa/Google Home, sur Secteur/Batterie, sans concentrateur, A +) Blanc",Hama,"0,00 %",0,-4449
B079P3WHJ5,"Hama Kit de Nettoyage pour disques Vinyles (Nettoyage et Entretien de Disque Vinyle, Solution Spray pour Vinyl et Brosse de Nettoyage) Noir",Hama,"0,00 %",-4682,-4554
B079PBY42T,"Hama Pochettes extérieures pour vinyles (pour 33 tours, 10 pièces, 32,7 x 0,07 x 32,5 cm) Transparent",Hama,"0,00 %",-4442,-5676
B07NH3MBZC,"Ampoule LED, E14, 330lm remp. 30W, amp. réfl. R50, bl. chd., 2 p.",Hama,"0,00 %",-6221,0
B000NRVR7A,"Hama Répartiteur double pour prise allume-cigare (180°, 12V, avec écran à LED)",Hama,"0,00 %",0,-5362
B007C3CB00,"Hama Tapis de souris ""Ergonomique"" (tapis de souris ergonomique, 200 x 230 x 21 mm, repose-poignet confortable, tapis antidérapant, convient aux ordinateurs, taille mini) Bleu",UNKNOWN,"0,00 %",0,-4606
B08M3X6PFG,"Hama Album Photo Couverture Rigide Tissu 30x30cm (Livre Photo, 400 photos 10 x 15cm à coller, 100 pages blanches separées par Papier Cristal, Album Scrapbooking DIY à Personnaliser) Bordeaux",Hama,"0,00 %",0,-4628
B07BZXVZWD,"Hama Câble de charge/données ""Magnetic"" (câble USB-A vers micro-USB-C, compatible avec Samsung, Huawei, LG, Sony, Xiaomi, Wiko, haute résistant, longueur de 1 m) Noir",Hama,"0,00 %",0,-4790
B00A44MVZ4,"Hama Chemin de câble (bande en PVC/Aluminium pour montage mural TV ou au sol, cache-câble rectangle, 100 x 2,1 x 1 cm, entrée de câble jusqu'à 3 câbles, 3 pièces, matériel de montage compris) Blanc",Hama,"0,00 %",-6662,0
B09GLCG91X,"Hama Coque iPhone 13 Mini Crystal Clear pour Apple (Coque Transparente iPhone 13 Mini en TPU, Coque de Protection Souple, Protection téléphone Portable avec Surface antidérapante) Transparent",Hama,"0,00 %",0,-3557
B00FOQ24SG,"Hama Clé USB 2.0 ""Laeta Twin (FlashPen, OTG, Aluminium, USB 2.0, jusqu'à 10 Mo/s, 16GB) Gris",Hama,"0,00 %",0,-6007
B00TR8YW6E,"Hama Présentoir de Support ""Travel"" (20 pièces, pour tablettes et smartphones, hauteur de 1 cm à 20 cm, Largeur de 5,5 cm à 20 cm, poids de 300 g, en plastique) Blanc/Bleu/Jaune/Noir/Rouge/Vert",Hama,"0,00 %",0,-5728
B096XH84CL,"Hama Ecouteurs Bluetooth sans Fil Freedom Light (Ecouteurs TWS, Micro, Ecouteurs Intra Auriculaire, Station de Charge, Grande Autonomie, USB-C, Charge Rapide, Controle Vocale+Tactile) Noir",Hama,"0,00 %",-2205,-1404
B0000AHIEL,"Hama Cadre Photo sans Cadre de 15 x 20 cm, Noir, 24 x 30 cm",Hama,"0,00 %",0,-5232
B01LGPHP82,"Hama Chargeur, 2 ports USB, 2,4 A, noir",UNKNOWN,"0,00 %",-4530,0
B01KACNV80,"Hama Télécommande universelle ""Smart TV"" 8 en 1 (Contrôle 8 Appareils Préprogrammés, TV/DVD/STB/VCR, Télécommande de Remplacement pour Télécommande MultiFonction IR) Noir",Hama,"0,00 %",0,1384
B003589J1A,"Hama Câble de liaison ""AluLine"" (fiche jack 3,5 mm, mâle - mâle, stéréo, gaine en tissu, 0,5 m) Argent",Hama,"0,00 %",0,-6838
B07F39Q5RV,"Thomson Antenne Intérieure HD Plate ANT1528BK (pour réception Radio/télévision numérique, DVB-T/-T2, Dab/Dab+, HD/3D, avec amplificateur, Filtre Anti-Bruit, Performance 45) Noir/Gris",Thomson,"0,00 %",-3615,-3278
B07JHD8X2Q,"Hama Microphone de Table 'CS-461' (pour Utilisation de Discours ou réunion publique) Noir",Hama,"0,00 %",0,-5222
B07Q4FLFQZ,"Hama X-Pointer Télécommande Pointeur Laser - Laser Rouge, Technologie Smart-Link, sans Fil 2.4 GHz - pour présentation Powerpoint - Noir",Hama,"0,00 %",-4938,0
B0C8SXXW86,"Rapoo Clavier Souris sans Fil Multi-Mode Rechargeable Blade 9700M (Pack Kit Clavier et Souris, Clavier Rechargeable 99 Touches AZERTY, Souris 5 Boutons autonomie 12 Mois, Idéal PC Laptop) Anthracite",Rapoo,"0,00 %",-4450,0
B00GRP4FSK,"Hama Boîte pour câbles ""Maxi"" (Boite Rangement pour cables chargeurs et multiprises, boitier cache câbles 40x15,5x13,5cm, pieds en caoutchouc) Blanc 20662",Hama,"0,00 %",0,-5252
B0002VFL1K,"Hama Pochettes pour CD-ROM/DVD-ROM (Pochettes CD plastique, pochette de protection colorées, lot de 50, Multicolore) Bleu/Orange/Violet/Rose/Vert",Hama,"0,00 %",-4935,-4623
B015U4FUD2,"Hama Support mural (pour enceinte, support d'enceinte, pour un alignement et une présentation optimaux de l'enceinte, montage mural) Noir",Hama,"0,00 %",-4144,0
B09W5X4Y2T,"Hama HS-P100 V2 Casque Micro - Casque Jack, Microphone Intégré, Ultra léger, Télécommande Intégrée - Noir",Hama,"0,00 %",0,-5853
B01AUBT6IU,"Cor. alim. Euro pr Sonos PLAY:1/PLAY:5/One, coudé aux extrém., 3 m, nr",Hama,"0,00 %",0,-5392
B0BL1CFWRT,"Hama Ecouteurs Lightning Glow (Ecouteurs Intra-Auriculaires filaires, Micro et Contrôle du Volume, Ecouteurs pour iPhone, Certifiés MFi, Compatibles Apple iPhone iPad iPod) Blanc",Hama,"0,00 %",-4076,0
B0000AISQG,"Hama Passe-partout Premium, ivoire, 30 x 40 cm",Hama,"0,00 %",-6127,-6151
B07F6Q3314,"THOMSON Ecouteurs Filaire Jack EAR3008BK Piccolino (écouteurs Intra-Auriculaires filaires, Ultra-léger, Prise Jack 3.5 mm Plaqué Or, Micro et Fonction Télécommande) Noir",Thomson,"0,00 %",0,-6298
B002XLRC82,"Hama Adaptateur Péritel (pour TV LED Samsung, LG et TechniSat, Péritel Femelle vers connecteur mâle, couplage Péritel pour la Connexion Spéciale Samsung TV EXT RGB, Non-HDMI, Gamme supérieure) Noir",Hama,"0,00 %",0,-3419
B000EOW78A,"Hama Tissu de recouvrement acoustique (laisse passer le son, perméable) Noir",Hama,"0,00 %",0,-5243
B00IZA0RPU,"Thomson Support Mural TV WAB156 (VESA jusqu'à 400x400, Inclinable, pour Une Diagonale d´écran de 58 à 142 cm (de 23"" à 56"")) Noir",Thomson,"0,00 %",0,-4826
B07P8FSN9D,"Hama Album Photo Vierge Minimax Brushstroke (Album Photo Traditionnel 13 x 16,5 cm, 100 Pages pour 100 Photos Format 10 x 15 cm, Protection idéale, Artistique, élégant) Vert/Jaune/Marron/Blanc",Hama,"0,00 %",0,-6238
B00F955SDU,"Hama Antenne intérieure (antenne radio pour l'amplification du signal actif jusqu'à 30 dB, puissance de l'amplificateur réglable, hauteur de 31 cm, DAB/DAB+, en long) Noir",Hama,"0,00 %",-5587,-4697
B07C86D6WP,"Hama Mousse nettoyante pour téléviseurs, 400 ML, avec Chiffon",Hama,"0,00 %",0,-4840
B0002VFLQ0,"Hama Pochettes (pour CD/DVD/blu-Ray, 2 pièces par pochette, lot de 100) Transparent",UNKNOWN,"0,00 %",0,-4551
B07N9GQKD5,"Hama Étui Portefeuille Guard Pro pour Apple iPhone 5/5s/SE, Noir",Hama,"0,00 %",-6037,0
B01A72KIHA,"Hama Cordon d’alimentation Euro (coudé à 90 degrés des deux côtés, fiche secteur vers prise double Euro 8 avec contact de protection de terre, coudé des deux côtés, 1,5 m) Noir",Hama,"0,00 %",0,-6315
B009X8SCV4,"Hama ""Fine Art"" Spiral Album, 24 x 17 cm, 50 Photos, pink",Hama,"0,00 %",-5485,0
B0C5JP8CX2,"Hama Rotate Pro Clé USB 3.0 - Flash Drive 512 Go, Vitesse jusqu'à 100 Mo/s, Clef avec connecteur USB A, pour PC/Mac - Argenté",Hama,"0,00 %",-470,0
B000LRHKOQ,"Hama Cadre photo ""Clip-Fixe"" (sans bordure, 60 x 84 cm, Reflex) Blanc",Hama,"0,00 %",0,-6060
B0069MD6LI,"THOMSON Casque sans Fil TV WHP3311W (sur l'oreille, avec Station de Recharge système, PLL, Circum-auriculaire, portée 100 m, 863 MHz, sans Fil) Blanc/Gris",Thomson,"0,00 %",0,-2485
B0C7DPSPNN,"Hama Coque de Protection Apple iPad 10.9"" (10e Gén. 2022) Housse Etui de Protection Bords Anti-Choc avec Rabat pour Tablette 27.7cm/ 10.9"", Fonction Chevalet, Porte Stylet, Dos Transp. Noir",Hama,"0,00 %",-4314,0
B01L1LUAIS,"Protection d’écran en verre véritable pour iPhone 6 Pl/6s Pl/7 Pl/8 Pl",Hama,"0,00 %",-2050,0
B018KHEJZ6,"Xavax Dosette Permanente Rechargeable Réutilisable pour Cafetière Senseo (lot de 2 capsules réutilisables pour machine Senseo ou similaire) Jaune",xavax,"0,00 %",0,-6966
B073CPQYY9,"Thomson Télécommande de rechange ""ROC1117GRU"" (Télécommande de remplacement pour les téléviseurs Grundig, prête à l'emploi, adaptative, mode SIMPLE, touches lumineuses, infrarouge) Noir",Thomson,"0,00 %",-4942,0
B00EYVW7QQ,"Hama Bloc multiprises, 3 prises, avec interrupteur, 3m, Blanc",Hama,"0,00 %",0,-6067
B01LN1SUZ6,"Hama Étui à rabat ""Smart Case"" pour Apple iPhone 7/8, noir",UNKNOWN,"0,00 %",0,-2175
B07CH2QZ83,"Hama Album photo grand format ""Decori II"" (album de 30 x 30 cm, à coller de 400 photos format 10 x 15 cm, 100 pages (4 photos/page), pas d'inscription) Bleu",Hama,"0,00 %",0,-4598
B000L9MBGQ,"Hama Album CD/DVD/Blu-Ray (pour 28 CD/DVD/Blu-ray, construction stable avec panneaux latéraux en bois) Noir/Marron",Hama,"0,00 %",0,-5511
B000L0X2R2,"Hama Adaptateur d'antenne (pour Audi/Seat/Volkswagen) Noir/Argent/Bleu",Hama,"0,00 %",0,-7462
B000VRCKRI,"Hama Album, Bordeaux, 24 x 17 cm",Hama,"0,00 %",-7054,-6043
B0079R5LL0,"Hub USB 2.0, 1:4, alimenté par Bus, Noir",Hama,"0,00 %",0,-4239
B000WE12RY,"Hama Câble d'antenne, Coax mâle - Coax femelle, 85dB, Blanc, 3,00m",Hama,"0,00 %",0,-4542
B08SFHC4PD,"Hama Câble HDMI (Cable HMDI ultra haute vitesse, Certifié, Mâle-Mâle, Ultra HD, 8K@60 Hz /4K@120Hz, 3.0m, Garantie 30ans, résolution 7680x4320pixels, EARC supportant les formats audio) Gris Noir",Hama,"0,00 %",0,-5286
B0000AIS8O,"Hama Cadre photo en plastique ""Décor Sevilla"" (taille du Cadre de 21 x 29,7 cm (DIN 4) avec bordure de 9 mm x 17 mm, pour une photo de 15 x 20 cm) Gris Mat",Hama,"0,00 %",0,-3575
B00005K49X,"Hama Filtre UV (anti-UV et protection, compensation 4X, traitement antireflet, pour objectifs d'appareils photo 72 mm, O-Haze, traité) Noir",Hama,"0,00 %",0,-815
B001AGKZWQ,"Hama Kit d'alimentation (kit AMP avec câbles d'alimentation de 16 mm², câbles RCA, porte-fusible, fusible, cosse, attache de câble) Noir/Rouge/Bleu/Transparent",Hama,"0,00 %",0,-5427
