Aperçu du distributeur.=[Fabrication],Afficher par=[ASIN],Pays=[FR],Entreprises=[~ Hama EURL (FR)],Local=[fr_FR],Intervalle des rapports=[Mois],Champ de vision.=[01/08/2024 - 31/08/2024],Rapport mis à jour=[04/04/2025]
ASIN,"Nom du produit",Marque,"PPM nette","PPM nette – Période précédente (bps)","PPM nette – Même période l'année dernière (bps)"
B000S8B51M,"Hama Pochettes-classeurs (pour CD/DVD, Couvre classeur à Anneaux, 2 par Pochette, Lot de 50) Noir/Transparent",Hama,"100,00 %",10000,10000
B000OS1ETO,"Câble d'antenne, Coax mâle - Coax Femelle, 75dB, Blanc, 3,00m",Hama,"88,08 %",420,259
B07H149QV2,"Hama Album photo 'Susi Pastell' (couverture souple, 24 pages pour 24 photos au format 10x15 cm, résistant, pour archiver avec des anecdotes, protège la photo, mini album) Couleurs pastel Aléatoires",Hama,"87,12 %",612,-43
B00006J9WK,"Hama - 30455 - Câble 2 RCA M / 1 Jack 3,52mm M. 2m. Noir",Hama,"85,72 %",8571,8571
B0000AISOV,"Hama Cadre photo Clip-Fixe (sans bordure, 30 x 30 cm, Reflex) Blanc",Hama,"82,53 %",2325,2720
B005GCMZLY,"Hama Album photo ""Singo"" (couverture souple, 36 pages pour 36 photos au format 10x15 cm par album, résistant, pour archiver avec des anecdotes, protège la photo, mini album) Multicolore",Hama,"82,36 %",110,2904
B0000AISDL,"Hama Passe-partout Premium, blanc neige, 40 x 50 cm",Hama,"81,02 %",8101,2095
B00006JCUB,"Hama Multiprise 3 Prises 16A avec Interrupteur (Rallonge multiprises 1.4m, Bloc 3 Prises Type F Schuko, Idéal Bureau PC luminaires, Atelier, Meuble TV, Garage) Blanc",Hama,"80,64 %",8064,3528
B0000AHIED,"Hama Cadre Photo Clip-Fixe (sans Bordure, 20 x 20 cm, Reflex) Blanc",Hama,"80,64 %",873,2707
B0000AISDG,"Hama Passe-partout (premium, dimensions : Extérieur : 40 cm x 50 cm / Intérieur : 28 cm x 35 cm) Blanc Arctique",Hama,"80,01 %",8001,8001
B0000AHIF7,"Hama Cadre portrait (taille de cadre 10x15 cm, taille de photos 10x15 cm, acrylique, format vertical, en plastique, 1 photo par cadre, élégant, simple, classique) Gris",Hama,"78,99 %",744,112
B00006J4HS,"Hama Présentoir de Distributeur de pastilles adhésives (10 distributeurs, 500 coins photos, diamètre de 10 mm, PP anti statique) Transparent",Hama,"78,84 %",-489,7883
B0000AISEE,"Hama Cadre photo ""Clip-Fixe"" (sans bordure, 30 x 30 cm, Anti-Reflex) Blanc",Hama,"78,50 %",7849,7849
B01I0ZHZ1I,"Hama Support mural TV TILT inclinable pour TV écran plat entre 48 cm et 122 cm (19"" à 48""), jusqu'à 25 kg de charge supportée, VESA 200x200, Noir",Hama,"78,27 %",2293,2591
B06XCCRL72,"Hama Câble de charge et transfert de données ""Métal"" (USB-A mâle vers USB-C, USB 2.0, plaqué or, câble anti-torsion, longueur de câble de 1,5 m) Anthracite",Hama,"77,83 %",719,7782
B075RH8PTF,"Hama Album Photo Fine Art (Format 24 x 17 cm, 50 Pages Blanches, à Spirale) Noir",Hama,"77,83 %",7782,118
B0000AIS0W,"Hama Cadre photo en plastique Sevilla (taille du Cadre de 30 x 40 cm avec bordure de 9 mm x 17 mm, pour une photo de 20 x 28 cm) Blanc",Hama,"77,45 %",786,2224
B0000AIRRQ,"Hama Cadre photo ""Clip-Fixe"" (sans bordure, 50 x 70 cm, Reflex) Blanc",Hama,"77,33 %",1263,1320
B0000AIRVB,"Hama Cadre photo ""Clip-Fixe"" (sans bordure, 40 x 50 cm, Anti-Reflex) Blanc",Hama,"76,44 %",7643,-45
B005VNYY2Q,"Hama Cadre pour Portrait Photo Philadelphia, 15 x 20 cm",Hama,"76,26 %",7625,7625
B0BYZ93TFL,"Hama Coque pour Samsung Galaxy A34 5G Slim Pro [Housse de Protection avec Rangement Carte] [Etui à Rabat] - Noir",Hama,"76,26 %",355,1769
B00006J9W5,"Ruban isolant, 2 rouleaux",Hama,"75,93 %",63,1812
B0017UGOX4,"Hama Passe-Partout (Premium, Dimensions : Extérieur : 30 cm x 40 cm/Intérieur : 20 cm x 27 cm) Blanc Arctique",Hama,"75,67 %",-541,655
B01LZXLX9Z,"Pêle-mêle de cadres photo pr portrt, 2 en 10 x 15 cm, 1 en 10 x 10 cm",Hama,"75,42 %",212,2140
B0036NQG7O,"hama Réveil radiopiloté à projecteur intégré ""RCR 110"" (sans fil, avec thermomètre, calendrier, radio-réveil à projection, réglage automatique de l'heure, projecteur pivotant à 180 degrés) Blanc/Gris",Hama,"75,39 %",63,1660
B007205CJK,"Hama Tapis de Souris Ergonomique (Tapis de Souris Ergonomique, 210 x 255 x 21 mm, Repose-Poignet Confortable, Tapis antidérapant, Convient aux Ordinateurs) Noir",Hama,"74,77 %",7477,7477
B000V8QPQ4,"hama hama Câble d'antenne, prise coaxiale 75 db - prise coaxiale 10,0 m",Hama,"74,74 %",54,400
B0000AHIEM,"Hama Passe-partout, blanc arctique, 24 x 30 cm",Hama,"74,70 %",-523,1771
B00006J4EP,"Hama Boîtier standard (pour CD et disques Blu-Ray, Étui protecteur pour CD, paquet de 10) Noir/Transparent",Hama,"74,29 %",25,1243
B074JDHBXG,"Hama Cadre en Plastique Madrid (Taille de Cadre de 21 cm x 29,7 cm, Taille de la Photo de 15 cm x 20 cm, 1 Photo par Cadre, à accrocher, élégant, Simple, Classique) Noir",Hama,"74,19 %",618,1210
B0000AI3G4,"Hama Cadre en plastique Madrid (taille de cadre de 50 cm x 70 cm, taille de la photo de 30 cm x 45 cm, 1 photo par cadre, à accrocher, élégant, simple, classique) Noir",Hama,"74,16 %",7415,1478
B009X8SDUO,"Hama ""Fine Art"" Spiral Album, 24 x 17 cm, 50 Photos, taupe",Hama,"74,10 %",7410,0
B00006IVSE,"Hama Feuillets pour CD (avec 60 fiches pour étiquetage, archivage, 10 étuis pour 6 CD/DVD/Blu-Ray, adaptés aux dossiers A4, Format A4, pour Le Rangement) Transparent",Hama,"73,99 %",1062,-95
B0000AISE1,"Hama Cadre photo ""Clip-Fixe"" (sans bordure, 29,7 x 42 cm, Anti-Reflex) Blanc",Hama,"73,94 %",7393,-153
B0000AISF4,"Cadre tableau sans bordure Clip-Fix 30x40 antireflet",Hama,"73,90 %",66,2170
B0000AIRTH,"Hama Cadre photo en plastique ""Décor Sevilla"" (taille du Cadre de 30 x 45 cm avec bordure de 9 mm x 17 mm, pour une photo de 20 x 30 cm) Or Mat",Hama,"73,80 %",2405,2327
B0000AHIH7,"Hama Cadre pour portrait, acrylique, format vertical, 9cm x 13cm",Hama,"73,53 %",7352,7352
B00292AZN4,"Hama Cadre photo Clip-Fixe (sans bordure, 30 x 40 cm, Reflex) Blanc",Hama,"73,47 %",-139,-876
B00006J9WN,"Hama Boîtier Multipack (pour 4 CD/DVD/Blu-Ray, Multipack, 4 in 1, étui de Protection pour CD) Noir/Transparent",Hama,"73,46 %",152,2463
B0000AIS8M,"Hama Cadre photo en plastique ""Décor Sevilla"" (taille du Cadre de 21 x 29,7 cm (DIN 4) avec bordure de 9 mm x 17 mm, pour une photo de 15 x 20 cm) Or Mat",Hama,"73,22 %",78,3609
B00006J6P8,"Hama Boîtier standard (pour DVD, convient également aux CD et aux Blu-ray, avec film pour l'insertion de la jaquette, lot de 5) Noir",Hama,"72,98 %",-46,-366
B0000AHICV,"Hama Boîtier CD/DVD Slim (lot de 10 boitiers standards vierges pour CD/DVD et disques Blu-ray, ultra plat) Noir/Transparent",Hama,"72,90 %",2416,2602
B005DJXYY2,"Hama Album Photo ""Singo"" (album minimax, 13 x 16,5 cm, 100 pages, pour 100 photos au format 10 x 15 cm) Aqua",Hama,"72,84 %",-52,-342
B005DJXZIM,"Hama Album Photo Singo (Album minimax, 13 x 16,5 cm, 100 Pages, pour 100 Photos au Format 10 x 15 cm) Vert",Hama,"72,83 %",185,1526
B001UBBJC6,"Hama Album Photo Fine Art (Format 24 x 17 cm, 50 Pages Noires, à Spirale) Gris",Hama,"72,79 %",7279,1155
B000VRANHW,"Hama Album Photo ""Fine Art"" (format 28 x 24 cm, 50 pages noires, à spirale) Noir 00090145",Hama,"72,49 %",244,438
B00QPXQ5IW,"Hama Clé USB 3.0 ""Laeta Twin (FlashPen, OTG, Aluminium, USB 3.0, jusqu'à 40 Mo/s, 64GB) Noir",Hama,"72,43 %",7242,7242
B005DJKF5I,"Hama Album Photo Singo (Album Auto-adhésif, 28 x 31 cm, 20 Pages, pour 60 Photos au Format 10 x 15 cm) Vert",Hama,"72,34 %",0,-116
B0015NS8JQ,"Hama Chemin de câble (en PVC, semi-circulaire, 100 x 7 x 2,1 cm) Noir",Hama,"71,99 %",84,2223
B08YS1PZWL,"Hama Adaptateur Jack 6.35 vers 3.5 Garantie 10 Ans (Adaptateur Audio 6.35mm Mâle vers 3.5mm Femelle, Stéréo, Prise Casque, Audio Connecteur Stéréo pour Mélangeur Audio/Piano électrique/Clavier) Noir",Hama,"71,78 %",22,5181
B07SZ3FCZH,"Hama Album photo mémo ""Forest"" (pour 200 photos au format 10 x 15 cm, album traditionnel enfant de 22,5 x 22 cm, 100 pages blanches, animaux, élégant, emplacement CD) Marron/Beige/Vert/Orange/Jaune",Hama,"71,50 %",60,571
B00DY5BLYW,"Hama Cadre portrait (taille de cadre 21x29,7 cm, taille de photos 21x29,7 cm, acrylique, format vertical, en plastique, 1 photo par cadre, élégant, simple, classique) Gris",Hama,"71,21 %",1460,278
B005DJKFIU,"Hama Album Photo Singo (Album Auto-adhésif, 28 x 31 cm, 20 Pages, pour 60 Photos au Format 10 x 15 cm) Rose",Hama,"71,20 %",700,-250
B005DJKGWA,"Hama Album Photo Singo (Album Auto-adhésif, 28 x 31 cm, 20 Pages, pour 60 Photos au Format 10 x 15 cm) Aqua",Hama,"71,19 %",0,1347
B005DJXZSC,"Hama Album Photo Singo (Album minimax, 13 x 16,5 cm, 100 Pages, pour 100 Photos au Format 10 x 15 cm) Rose",Hama,"71,15 %",-215,1782
B01K47GUKC,"Hama Album photo vierge ""La Fleur"" (album photo traditionnel 30 cm x 30 cm, 100 pages noires, de 400 photos au format 10 cm x 15 cm, motif de feuilles) Blanc",Hama,"71,10 %",4,-125
B003LSETI2,"Hama Sangle pour Bagages (Sangle simple pour la Fermeture Sécurisée de la Valise lors d'un Voyage, 5 x 200 cm) Noir",Hama,"71,08 %",261,2584
B0032DAL6U,"Hama Album photo ''Catania'' (taille 22 x 22 cm pour 200 photos au format 10 x 15 cm, 100 pages, papier stratifié, thématique mariage/vacances, emplacement pour CD, personnalisable) Gris",Hama,"71,04 %",-85,1182
B005DJKEY0,"Hama Album Photo Singo (Album Auto-adhésif, 28 x 31 cm, 20 Pages, pour 60 Photos au Format 10 x 15 cm) Orange",Hama,"70,94 %",7094,-146
B00IYX10YA,"Hama Cadre photo en plastique Sevilla (taille du Cadre de 29,7 x 42 cm (DIN A3) avec bordure de 9 mm x 17 mm, pour une photo de 18 x 24 cm, verre en polystyrène) Bleu",Hama,"70,69 %",289,2200
B0000AI2XV,"Hama Cadre-galerie photo en plastique Madrid (taille de cadre de 25 cm x 55 cm, taille de la photo de 13 cm x 18 cm, 3 photos par cadre, à accrocher, élégant, simple, classique) Noir",Hama,"70,46 %",-10,400
B001UBBJD0,"Hama Album Photo Fine Art (Format 28 x 24 cm, 50 Pages Noires, à Spirale) Lilas",Hama,"70,43 %",0,-130
B07B9NPHCZ,"Hama Album photo minimax ""Designline"" (album de 13 x 16,5 cm, insertion par le haut de 100 photos format 10 x 15 cm, 100 pages (1 photo/page), pas d'inscription) Feathers",Hama,"70,09 %",-629,-687
B01CV1RPVM,"Hama Horloge murale radio-pilotée DCF ""Bahnhof"" (horloge radio DCF, mise à l'heure automatique, diamètre de 30 cm) Argent/Blanc",Hama,"70,05 %",1064,2403
B0002W6B90,"Hama Interrupteur pour véhicules (Interrupteur de voiture, rond, 10 A, 12 V, interrupteur à bascule) Noir",Hama,"69,96 %",78,669
B00006IVSZ,"Hama Pochette ""Pare-soleil"" (pour véhicule, pour 12 CD/DVD/Blu-Ray) Noir",Hama,"69,96 %",1147,6996
B005DJKJIQ,"Hama Album Photo ""Singo"" (album grand format, 30 x 30 cm, 100 pages, pour 400 photos au format 10 x 15 cm) Rose",Hama,"69,68 %",0,994
B0032D8WCA,"Hama Album Photo Catania (Taille de l'album 29 x 32 cm pour 300 Photos au Format 10 x 15 cm, 60 Pages, Papier stratifié, thématique Mariage/Vacances, Personnalisable) Gris",Hama,"69,53 %",6952,492
B08YRXWRWT,"Hama Adaptateur USB C vers USB 3.2 Garantie 10 Ans (Adaptateur USB-C Male vers USB-OTG Femelle) Noir",Hama,"69,52 %",6951,2422
B0000AIRXA,"Hama Cadre photo en plastique Décor Sevilla (taille du Cadre de 30 x 40 cm avec bordure de 9 mm x 17 mm, pour une photo de 20 x 28 cm) Argent Mat",Hama,"69,36 %",2708,2232
B001F4ZWDK,"Hama Pochettes en polypropylène pour CD/DVD, paquet de 75, Transparent",Hama,"69,33 %",1511,-72
B00006J4DM,"Hama Adaptateur d'antenne (DIN mâle - ISO Femelle) Argent",Hama,"69,30 %",-608,5813
B01K47HIEY,"Hama Album photo ""Skies"" (album grand format, 22,5 x 22 cm, 100 pages, pour 200 photos au format 10 x 15 cm) Gris",Hama,"69,28 %",-48,960
B000Z1UORI,"Hama Album Photo Fine Art (Format 24 x 17 cm, 50 Pages Noires, à Spirale) Noir",Hama,"69,23 %",446,-349
B005DJKJ2C,"Hama Album, Vert, 30x30 cm",Hama,"69,22 %",2093,-13
B075RHN1M4,"Hama Album Photo Fine Art (Format 28 x 24 cm, 50 Pages Blanches, à Spirale) Bordeaux",Hama,"68,92 %",6891,271
B000S8B51C,"Hama Pochettes-classeurs (pour CD/DVD, Couvre classeur à Anneaux, 2 par Pochette, Lot de 50) Blanc/Transparent",Hama,"68,84 %",696,2209
B07GX2V6JG,"Lecteur Multi-Cartes USB-2.0, SD/microSD/CF, Bleu",Hama,"68,71 %",1508,1510
B07622NTQ1,"Hama Album Photo Fine Art (Format 28 x 24 cm, 50 Pages Blanches, à Spirale) Noir",Hama,"68,70 %",726,223
B0000AI3G6,"Hama Cadre en plastique ""Madrid"" (taille de cadre de 50 cm x 70 cm, taille de la photo de 30 cm x 45 cm, 1 photo par cadre, à accrocher, élégant, simple, classique) Argent",Hama,"68,68 %",177,-106
B001F536FK,"THOMSON Casque Audio Filaire (Casque Stéréo Filaire Jack, Réglable, Supra-aural, Ultra-léger, 54g, Coussinets 27mm, 95dB, Cable 1.3m, idéal PC Smartphone Mac Tablette Ordinateur) Noir",Thomson,"68,58 %",-303,-193
B0002W5WB8,"Hama Pochettes de protection (pour CD/DVD/Blu-Ray, design étroit, pochette en plastique, lot de 50) Transparent",Hama,"68,55 %",0,-13
B001UBD140,"Hama Album Photo Fine Art (Format 24 x 17 cm, 50 Pages Noires, à Spirale) Lilas",Hama,"68,47 %",956,-436
B07CQCWLFL,"Hama “Fine Art"" Spiral Album, 24 x 17 cm, 50 Photos, flamingo",Hama,"68,45 %",6844,6844
B017JY580G,"Hama ""Fine Art"" Spiral Album, 24 x 17 cm, 50 Photos, grey",Hama,"68,35 %",-416,2245
B004IYLMHE,"Hama Clé USB 2.0 ""Rotate, 8 GB (10 MB/s, Flashpen Rotate) Noir/Argenté",Hama,"68,30 %",6830,2637
B001SLCC7Y,"Hama Lecteur USB 2.0 ""8en1 de Cartes (USB, microSD/SDHC, SD/SDHC, MMC) Transparent",Hama,"68,30 %",76,26987
B005DJKFUS,"Hama Album Photo Singo (Album Grand Format, 30 x 30 cm, 100 Pages, pour 400 Photos au Format 10 x 15 cm) Aqua",Hama,"67,94 %",724,-375
B005DJXZ7I,"Hama Album Photo Singo (Album minimax, 13 x 16,5 cm, 100 Pages, pour 100 Photos au Format 10 x 15 cm) Orange",Hama,"67,91 %",1032,1486
B009X8SBUQ,"Hama ""Fine Art"" Spiral Album, 24 x 17 cm, 50 Photos, turquoise",Hama,"67,89 %",1344,-505
B005SS65GW,"Hama Chiffon 3 en 1 (pour ordinateur portable avec écran de 40 cm (15,6""), tapis de souris, en microfibre, film de protection, chiffon de nettoyage) Anthracite",Hama,"67,87 %",1832,2260
B06XB6RY6Q,"Hama Album photo ""Joana"" (pour 100 photos au format 10 x 15 cm, album traditionnel enfant de 25 x 25 cm, 50 pages blanches, château, licorne, élégant) Rose/Blanc",Hama,"67,64 %",1585,125
B00006JCXV,"Hama Barrette de connexion (adaptateur de câble, standard européen, 2,5 mm²) Blanc/Noir",Hama,"67,61 %",6761,6761
B07T4DM8JJ,"Hama Album photos enfant mémo ""Forest"" (livre photo 100 pages à pochettes, 200 photos 10x15 cm, album souvenirs 22,5 x 22 cm, Emplacement CD, Album Motif Renards) Marron/Beige/Vert/Orange/Blanc",Hama,"67,44 %",-16,894
B000XA2YGK,"Xavax Hama Thermomètre analogique (à suspendre au réfrigérateur, congélateur, cave à vin, minibar, minimum -35 degrés, maximum 40 degrés) Blanc",xavax,"67,09 %",576,-93
B01DZGID9K,"Hama Support Mural TV FIX pour TV écran entre 81 cm et 165 cm (32"" à 65""), VESA 400 x 400, jusqu'à 35 kg de charge supportée, Noir",Hama,"66,94 %",128,576
B07GCHTZ3B,"Hama Radio numérique DR40BT-PlugIn (Dab/Dab + / FM/Bluetooth/AUX, Radio-réveil intégré, écran rétro-éclairé) Blanc",Hama,"66,93 %",6692,2795
B09N9TH54H,"Xavax Égouttoir Porte Bouteilles (Support d'égouttage jusqu'à 6 Bouteilles, Pots, biberons Verres Tasses ou Mugs, Egouttoir Compact et Design, idéal sodastream, air-up, Avent, Philips) Noir",Xavax,"66,85 %",928,991
B01KFLHB1E,"Hama Album photo vierge ""Bernd"" (album photo traditionnel format 22,5 cm x 22 cm, 100 pages, pour 200 photos 10 cm x 15 cm) Marron/Blanc/Noir",Hama,"66,73 %",-7,-145
B001UBD14U,"Hama Album Photo Fine Art (Format 28 x 24 cm, 50 Pages Noires, à Spirale) Vert Pomme",Hama,"66,61 %",6661,-347
B002IK2SNM,"Hama - 20563 - Colliers de serrage pour câbles, Champ inscriptible, 98mm, 25 pces, Naturel",Hama,"66,50 %",-54,232
B01K47GSQS,"Hama Album photo ""Skies"" (album grand format, 22,5 x 22 cm, 100 pages, pour 200 photos au format 10 x 15 cm) Beige",Hama,"66,45 %",0,935
B005DJKH1A,"Hama Album Photo ""Singo"" (album minimax, 22 x 22,5 cm, 100 pages, pour 200 photos au format 10 x 15 cm) Aqua",Hama,"66,39 %",998,-62
B005DJKG0C,"Hama Album Photos Mémo Singo (Livre Photo 100 Pages Blanches avec Pochettes pour 200 Photos 10x15 cm, Album Photos Souvenirs 22,5x22 cm, Range CD, Zone Mémo, Album Traditionnel Motif Fleurs) Orange",Hama,"66,35 %",0,1387
B00006JAXW,"Hama Plateau Universel Hama Rond (40 cm, Taille XL, Poids supporté 100 kg (idéal pour TV, Enceintes, écrans, appareils de Cuisine) Noir",Hama,"66,19 %",587,1307
B005DJKGO8,"Hama Album, Rose, 22 x 22,5",Hama,"66,19 %",550,1372
B0000AHIJ2,"Hama Cadre photo ""Clip-Fixe"" (sans bordure, 13 x 18 cm, Anti-Reflex) Blanc",Hama,"66,16 %",374,-9
B07NH31NL6,"Couvercle Pare-poussière pour Clavier, Transparent",Hama,"66,15 %",-1483,470
B079J94XKT,"Xavax Filtre permanent pour machine à café et thé (Ø 12 cm, hauteur 10 cm, maillage en acier inoxydable, réutilisable, va au lave-vaisselle, rechange pour taille 4) Noir",xavax,"66,14 %",-41,138
B0019DK6CY,"Hama Câble de liaison (RCA, 2 fiches mâles - 2 fiches mâles, avec lignee remote intégrée, 5 m) Bleu",Hama,"66,13 %",152,107
B071WFLJ94,"Hama Album photo minimax ""Designline"" (album de 22,5 x 22 cm, insertion latéral de 200 photos format 10 x 15 cm, emplacement CD, 100 pages (2 photos/page), inscription possible) Triangle",Hama,"65,82 %",-1,1930
B00006JEAY,"Hama Filtre UV (anti-UV Et Protection, Compensation 2X, Traitement Antireflet, Pour Objectifs D'appareils Photo 49 Mm, O-Haze, Traité) Noir",Hama,"65,81 %",42,1977
B01GOEOVDM,"Hama Présentoir de Distributeur de pastilles adhésives (1 distributeurs, 300 coins photos, diamètre de 6 mm) Transparent",Hama,"65,69 %",6569,0
B00RLNCZ52,"Hama Album photo ""Moni"" (pour 200 photos au format 10 x 15 cm, album photo bébé de 100 pages blanches, ciel, élégant, pour filles, enfants, bébés) Rose, petit album de taille 22,5 x 22,5 cm",Hama,"65,69 %",98,548
B08YS1ZZ99,"Hama Hub USB Garantie 10ans '00200119' (4 Ports USB 2.0, 480Mbit/s, Plug&Play, Idéal PC, Ordinateur Portable, Tablette, MacBook) Noir",Hama,"65,62 %",1007,1693
B0000AHIFI,"Hama Passe-partout Premium, blanc neige, 20 x 30 cm",Hama,"65,62 %",0,86
B00SL6I2WI,"Hama Album Photo Jumbo ""Fine Art"" (Album 30x30cm, 50 feuilles/100 pages blanches, pour coller 400 Photos de 10x15 cm, Look livre sans spirale, Couverture personnalisable, Idée cadeau) Noir",Hama,"65,55 %",57,1305
B0002W5WDQ,"Hama Boîtier ""Slim"" double (pour DVD, convient également aux CD et disques Blu-ray, ultra mince, avec une feuille pour la couverture, lot de 10) Noir/Transparent",Hama,"65,52 %",-308,-21
B0CLD52FFP,"Hama Support Mural Magnétique pour Apple TV HD (4ème génération)/4K (1ère/2ème/3ème génération) (pour Fixer l'Apple TV Box sur Le Mur ou la TV, Garantie 10ans, Chevilles Fischer et vis VESA) Noir",Hama,"65,52 %",-761,6551
B000NRS8OK,"Hama Alimentation secteur (Transformateur de tension d'alimentation CA/CC (230V à 12V / 1000mAh, Adaptateur de charge pour allume-cigare, 1A) Noir",Hama,"65,45 %",6544,898
B0000AISQ8,"Hama Anneaux autocollants pour cadres photo (en métal, 10 pièces, attaches triangulaires, pour coller sur du bois, plastique ou métal) Blanc/Doré",Hama,"65,42 %",1520,847
B00RLNC8UY,"Hama Album photo ""Tim"" (pour 200 photos au format 10 x 15 cm, petit album de taille 22,5 x 22,5 cm, album photo bébé de 100 pages blanches, ciel, élégant, pour garçons, enfants, bébés) Bleu",Hama,"65,38 %",88,72
B01BBTCVKA,"Hama Album Photo ""Fine Art"" (format 30 x 30 cm, 100 pages blanches, sans spirale) Malibu",Hama,"65,17 %",508,93
B000EOVQI2,"Hama Boîtier CD Slim, Lot de 10, Transparent",Hama,"64,99 %",-1489,-1016
B0CYQC52BQ,"Hama Album Photo ""Singo II"" 30x30cm (400 photos 10x15cm, 100 pages blanches avec intercalaires Papier Cristal, Album Scrapbooking DIY Livre photo à Personnaliser et à Coller) Terracotta",Hama,"64,97 %",6497,6497
B0009V6OCS,"Hama Boîtier Slim (pour CD et disques Blu-ray, ultra mince, avec une feuille pour la couverture, lot de 25) Noir/Transparent",Hama,"64,90 %",344,825
B07TYWBSZN,"Hama Album photo Jumbo ""Forest"" (pour 400 photos au format 10 x 15 cm, album traditionnel enfant de 30 x 30 cm, 100 pages blanches, animaux, élégant) Marron/Beige/Vert/Orange/Jaune",Hama,"64,79 %",218,741
B009X8SIV8,"Hama Album Photo ""Fine Art"" (format 28 x 24 cm, 50 pages noires, à spirale) Taupe",Hama,"64,71 %",1467,-199
B0015NLFGE,"Hama Chemin de câbles (Bande en PVC/Aluminium pour Montage Mural TV ou au Sol, Cache-câble Demi-Rond, 100 x 7 x 2,1 cm, entrée de câble jusqu'à 8 câbles) Gris",Hama,"64,66 %",2376,1638
B000EOMQM2,"Hama Trépied photo/vidéo ""Star 75"" (Trépied d'entrée de gamme léger, tête à trois voies, 42-125 cm, 3D) Champagne",Hama,"64,52 %",-316,-426
B00DY5BLZQ,"Hama Cadre Portrait (Taille de Cadre 21x29,7 cm, Taille de Photos 21x29,7 cm, Acrylique, Format Horizontal, en Plastique, 1 Photo par Cadre, élégant, Simple, Classique) Gris",Hama,"64,48 %",-231,1565
B00FON28DK,"Hama Clé USB 2.0 ""Hook-Style"", 64 GB, 15 MB/s, gris",Hama,"64,47 %",-670,324
B000N8UX88,"Hama Trépied Appareil Photo Star 20""",Hama,"64,45 %",61,-1276
B000N94K22,"Hama Pochette (pour 64 CD/DVD/Blu-ray, classeur de rangement, gain de place pour le bureau, le salon et la maison, étuis de transport) Noir",Hama,"64,23 %",10,311
B009TLAOA2,"Hama Album Photo ""Fine Art"" (format 28 x 24 cm, 50 pages noires, à spirale) Turquoise",Hama,"64,20 %",-145,-141
B01K47GW46,"Hama Album photo Jumbo ""La Fleur"" 30 x 30 cm (livre photo de 100 pages blanches, album photos souvenirs pour 400 photos au format 10x15 cm, à personnaliser- à coller, Idée Cadeau, motif Feuilles) Noir",Hama,"64,09 %",413,-124
B08BFFFTKJ,"Hama Album photo Jumbo ""Romance"" à personnaliser (Album Photo Livre de Mariage ou naissance bébé, Livre d'or ou cadeau, 30x30 cm, 80 pages, Motif cœur, Titre Love, 320 photos 10x15 cm) Beige/blanc",Hama,"64,03 %",-587,-7
B000VRE3T6,"Hama Album Photo Fine Art (Format 28 x 24 cm, 50 Pages Noires, à Spirale) Bordeaux",Hama,"63,93 %",6393,-616
B0000AHIKN,"Hama Cadre photo ""Clip-Fixe"" (sans bordure, 10,5 x 15 cm, Reflex) Blanc",Hama,"63,84 %",153,1557
B01IW9057S,"Hama Album photo traditionnel ""Rustico"" (album mémo, album de 22,5 x 22,5 cm, 100 pages blanches, 200 photos au format 10x15, idéal pour le scrapbooking, insertion des photos) Love Key",Hama,"63,81 %",570,-338
B0015LCK5G,"Système de Rangement Universel pour Voiture, Grand modèle, Noir",Hama,"63,75 %",173,3461
B07BB2FQR1,"Hama Album photo traditionnel ""Rustico"" (grand format, album de 30 x 30 cm, 100 pages blanches, 400 photos au format 10x15, idéal pour le scrapbooking, photos à coller) Love Key",Hama,"63,69 %",-196,5
B075RGXBTD,"Hama Album Photo Fine Art (Format 36 x 32 cm, 50 Pages Blanches, à Spirale) Noir",Hama,"63,61 %",-38,-148
B07T4DLJ4Y,"Hama Album photo Jumbo ""Forest"" (pour 400 photos au format 10 x 15 cm, album traditionnel enfant de 30 x 30 cm, 100 pages blanches, renards, élégant) Marron/Beige/Vert/Orange/Blanc",Hama,"63,45 %",589,852
B000GIGR4O,"Hama Mini microphone pour ordinateur portable (seulement 23 x 32 mm, métal précieux) Argent",Hama,"63,45 %",6344,6344
B00T7M9IU0,"Hama Album photo à pochettes ""New York City"" (pour 200 photos au format 9 cm x 13 cm, taille de l'album de 16,5 cm x 21 cm, 100 pages, en cuir, protège les photos et les documents) Noir",Hama,"63,41 %",646,62
B096YDY67K,"Hama Chiffon de Nettoyage en Microfibres Pocket (Chiffon avec Sac de Rangement et Mousqueton, idéal pour Appareil Photo Objectif Écran Caméra Smartphone Ipad Bijoux Filtre Lunette)",Hama,"63,35 %",-7,6335
B000VRCKS2,"Hama Album Photo Fine Art (Format 24 x 17 cm, 50 Pages Noires, à Spirale) Bleu",Hama,"63,32 %",6331,-1150
B000EOPSRM,"Hama Pochette (pour 40 CD/DVD/Blu-Ray, classeur de Rangement, Gain de Place pour Le Bureau, Le Salon et la Maison, étuis de Transport) Noir",Hama,"63,28 %",245,1128
B000EORX5W,"Hama 00033833 Pochette, Noir (pour 120 CD/DVD/Blu-ray, classeur de rangement, gain de place pour le bureau, le salon et la maison, étuis de transport)",Hama,"63,15 %",188,228
B01K47EVSK,"Hama Album photo vierge ""La Fleur"" (album photo traditionnel 22,5 cm x 22,5 cm, 100 pages, pour l'insertion de 200 photos au format 10 cm x 15 cm, motif de feuilles, pochette CD) Noir",Hama,"63,00 %",-195,-355
B001UBEV4O,"Hama Album, Gris, 36 x 32 cm",Hama,"62,89 %",6289,-184
B00D2S92L0,"Xavax Hama Boîte de transport pour un gâteau (boîte rond, Ø 31,5 x 8cm, avec diviseur, capote et compartiments, partie de service et gâteau de gâteau) Anthracite/Transparent",xavax,"62,83 %",-359,-798
B001UBD17C,"Hama Album, Vert Pomme, 36 x 32 cm",Hama,"62,79 %",6279,-38
B000VRFBM4,"Hama Album Photo ""Fine Art"" (format 36 x 32 cm, 50 pages noires, à spirale) Noir",Hama,"62,78 %",266,-117
B0002W5WBS,"Hama Boîtier Slim (pour CD et disques Blu-Ray, Ultra Mince, avec Une Feuille pour la Couverture, Lot de 50) Noir/Transparent",Hama,"62,78 %",80,-27
B00UIET4NC,"THOMSON Support Mural TV WAB075 (VESA jusqu'à 600x400, Fixe, pour Une Diagonale d´écran comprise Entre 94 et 191 cm (de 37"" à 75"")) Noir",Thomson,"62,74 %",-66,736
B08XZF84G7,"Hama Montre connectée Fit Watch 5910 étanche avec Protection IP68 et GPS intégré (6 Jours d'autonomie, podomètre Marche, Mesure de la fréquence Cardiaque et des dépenses de Calories) Rose",Hama,"62,69 %",6268,6268
B007M6NBAQ,"Hama Adaptateur audio (2 fiches mâles RCA - fiche femelle jack 3,5 mm, stéréo, 10 cm) Noir/Rouge",Hama,"62,55 %",6255,6255
B000EOPSRC,"Hama Pochette (pour 20 CD/DVD/Blu-ray, classeur de rangement, gain de place pour le bureau, le salon et la maison, étuis de transport) Noir",Hama,"62,53 %",-482,-520
